Rank,Title,Citations,Year,URL,Description
27,Let's play! Mobile health games for adults,220,2010,https://scholar.google.com/citations?view_op=view_citation&hl=en&user=PNalJ58AAAAJ&pagesize=50&citation_for_view=PNalJ58AAAAJ:JV2RwH3_ST0C,"Researchers have designed a variety of systems that promote wellness. However, little work has been done to examine how casual mobile games can help adults learn how to live healthfully. To explore this design space, we created OrderUP!, a game in which players learn how to make healthier meal choices. Through our field study, we found that playing OrderUP! helped participants engage in four processes of change identified by a well-established health behavior theory, the Transtheoretical Model: they improved their understanding of how to eat healthfully and engaged in nutrition-related analytical thinking, reevaluated the healthiness of their real life habits, formed helping relationships by discussing nutrition with others and started replacing unhealthy meals with more nutritious foods. Our research shows the promise of using casual mobile games to encourage adults to live healthier lifestyles."
28,In search of usable security: Five lessons from the field,211,2004,https://scholar.google.com/citations?view_op=view_citation&hl=en&user=PNalJ58AAAAJ&pagesize=50&citation_for_view=PNalJ58AAAAJ:0EnyYjriUFMC,"A new system reduces the time to enroll in a secure wireless network by two orders of magnitude, and it also gets high marks for usability and user satisfaction. This article provides a real-world example revealing five general lessons for usable, secure system design."
29,Domestic robot ecology: An initial framework to unpack long-term acceptance of robots at home,208,2010,https://scholar.google.com/citations?view_op=view_citation&hl=en&user=PNalJ58AAAAJ&pagesize=50&citation_for_view=PNalJ58AAAAJ:BqipwSGYUEgC,"It has been recognized that long-term effects exist in the interaction with robotic technologies. Despite this recognition, we still know little about how the temporal effects are associated with domestic robots. To bridge this gap, we undertook a long-term field study. We distributed Roomba vacuuming robots to 30 households, and observed the use over six months. During this study, which spans over 149 home visits, we identified how householders accepted robots as a part of the households via four temporal stages of pre-adoption, adoption, adaptation, and use/retention. With these findings, we took the first step toward establishing a framework, Domestic Robot Ecology (DRE). It shows a holistic view on the relationships that robots shape in the home. Further, it articulates how those relationships change over time. We suggest that DRE can become a useful tool to help design toward long-term acceptance of robotic …"
30,Putting it all together: Towards a pattern language for interaction design: A CHI 97 workshop,203,1998,https://scholar.google.com/citations?view_op=view_citation&hl=en&user=PNalJ58AAAAJ&pagesize=50&citation_for_view=PNalJ58AAAAJ:4fKUyHm3Qg0C,"Pattern languages are representations that have been used in architecture and urban designer about twenty years. They J~ cus on the interaction between physical j@ m and social behavior, and express design solutions in an understandable and generalizable j@ m. But pattern languages are not simptv set of patterns intended to be universally applied; instead, they are actually meta-languages which, when used in a particular situations, generate situated design languages. This report describes a CHI97 workshop which explored the utility of partern languages J~ r interaction design. PPb discuss the workshofi rationale, the structure and process of the workshop, and some of the workshops results. In particular, we describe some patterns developed as part of the workshop, and our consequent reflections on the use of patterns and pattern languages as lingua Jganca r interaction design. This report concludes …"
31,System and method for sharing and controlling multiple audio and video streams,190,2009,https://scholar.google.com/citations?view_op=view_citation&hl=en&user=PNalJ58AAAAJ&pagesize=50&citation_for_view=PNalJ58AAAAJ:P5F9QuxV20EC,"At least one multimedia presentation is selected by a user of a first device, accessed from a storage source, and presented to the user. Simultaneously, information is transmitted to at least a second device to cause the selected multimedia pre sentation to be presented by the at least second device without the at least second device receiving input from a second user. Continuous media streams from the first user may be captured and transmitted to the second device. The presenting of the multimedia presentation on the first device is coordinated with the presenting of the multimedia presentation on the second device. The presenting of the captured media streams on the second device is coordinated with the capturing of those streams and the presenting of the multimedia presenta tion on the second device. Users may individually control the multimedia presentations and the captured media streams."
32,Share and share alike: exploring the user interface affordances of file sharing,190,2006,https://scholar.google.com/citations?view_op=view_citation&hl=en&user=PNalJ58AAAAJ&pagesize=50&citation_for_view=PNalJ58AAAAJ:8k81kl-MbHgC,"With the rapid growth of personal computer networks and the Internet, sharing files has become a central activity in computer use. The ways in which users control the what, how, and with whom of sharing are dictated by the tools they use for sharing; there are a wide range of sharing practices, and hence a wide range of tools to support these practices. In practice, users' requirements for certain sharing features may dictate their choice of tool, even though the other affordances available through that tool may not be an ideal match to the desired manner of sharing.In this paper, we explore users' current practices in file sharing and examine the tools used to share files. Based on our findings, we unpack the features and affordances of these tools into a set of dimensions along which sharing tools can be characterized. Then, we present the set of user interface features we have prototyped in an interface called a sharing …"
33,Chatting with teenagers: Considering the place of chat technologies in teen life,181,2006,https://scholar.google.com/citations?view_op=view_citation&hl=en&user=PNalJ58AAAAJ&pagesize=50&citation_for_view=PNalJ58AAAAJ:kNdYIx-mwKoC,"In the last few years, teenagers have been on the forefront of adopting short message service (SMS), a mobile phone-based text messaging system, and instant messaging (IM), a computer-based text chat system. However, while teenage adoption of SMS had led to a series of studies examining the reasons for its popularity, IM use in the teenage population remains understudied. This omission becomes significant given the increasing interest in domestic computing among human-computer interaction (HCI) and computer-supported cooperative work (CSCW) researchers. Further, because of the dearth of empirical work on teenage use of IM, we find that IM and SMS are sometimes incorrectly assumed to share the same features of use. To address these concerns, we revisit our own studies of SMS and IM use and reexamine them in tandem with other published studies on teenage chat. We consider similarities and …"
34,Supporting articulation work using software configuration management systems,165,1996,https://scholar.google.com/citations?view_op=view_citation&hl=en&user=PNalJ58AAAAJ&pagesize=50&citation_for_view=PNalJ58AAAAJ:_FxGoFyzp5QC,"Software product development is a highly collaborative activity, where teams of developers need to collaborate to produce a system. It is also a domain where systems are used to try to help the developers coordinate their work. This paper describes the results of an empirical study of the use of one such system, a configuration management tool. Specifically it describes three aspects of the support that the tool provides: the challenges of representing the work, the need to support both individuals and groups working together, and how the assumptions about software development built into the tool interact with others in the organization. The study suggests that long after the initial adoption the tool and the organization continue to interact with each other. It also opens up questions for empirical studies of the organizational context behind the tool usage."
35,Moving from the design of usable security technologies to the design of useful secure applications,164,2002,https://scholar.google.com/citations?view_op=view_citation&hl=en&user=PNalJ58AAAAJ&pagesize=50&citation_for_view=PNalJ58AAAAJ:LkGwnXOMwfcC,"Recent results from usability studies of security systems have shown that end-users find them difficult to adopt and use. In this paper we argue that improving the usability of security technology is only one part of the problem, and that what is missed is the need to design usable and useful systems that provide security to end-users in terms of the applications that they use and the tasks they want to achieve. We propose alternate ways of building and integrating security technologies into applications and usability methods for evaluating how successful our prototypes are. We believe that the end results of designing usable and useful (from the end-user perspective) systems will be secure applications which will reflect the needs of users who are increasingly using computers away from the office and in a wider variety of networked configurations."
36,Housewives or technophiles? Understanding domestic robot owners,154,2008,https://scholar.google.com/citations?view_op=view_citation&hl=en&user=PNalJ58AAAAJ&pagesize=50&citation_for_view=PNalJ58AAAAJ:qxL8FJ1GzNcC,"Despite the growing body of Human-Robot Interaction (HRI) research focused on domestic robots, surprisingly little is known about the demographic profile of robot owners and their influence on usage patterns. In this paper, we present the results of a survey of 379 iRobot's Roombao wners, that identified their demographic and usage trends. The outcome of the survey suggests that Roomba users are equally likely to be men or women, and they tend to be younger with high levels of education and technical backgrounds. Their adoption and use patterns illustrate the important role that gift exchange plays in adoption, and how the robot changes cleaning routines and creates non-cleaning activities. More generally, we argue that domestic robot adoption is growing, and suggest some of the factors that lead to a positive experience."
37,Using a configuration management tool to coordinate software development,152,1995,https://scholar.google.com/citations?view_op=view_citation&hl=en&user=PNalJ58AAAAJ&pagesize=50&citation_for_view=PNalJ58AAAAJ:Se3iqnhoufwC,"I describe a naturalistic study of one organization's use of a configuration management tool to coordinate the development of a software product. In this organization, the developers use the tool routinely to reduce the complexities of coordinating their development efforts. I examine how the tool provides mechanisms of interaction that let the developers work with each other. I identify four aspects of these mechanisms: difficulties of representing work, the multiple levels that they operate at, the possibilities for coordination they provide, and their role in supporting a model of work."
38,More than meets the eye: transforming the user experience of home network management,147,2008,https://scholar.google.com/citations?view_op=view_citation&hl=en&user=PNalJ58AAAAJ&pagesize=50&citation_for_view=PNalJ58AAAAJ:Wp0gIr-vW9MC,"As computing migrates from the workplace to the home, householders must tackle problems of home network maintenance. Often they lack the technical knowledge or motivation to complete these tasks, making the user experience of home network maintenance frustrating. In response to these difficulties, many householders rely on handwritten reminders or interactive networking tools that are ill-suited for the home environment. In this paper, we seek to understand how to design better home network management tools through a study of sketches created by 40 people in 18 households. In our study, we obtained information about householders' knowledge, practices and needs with respect to home networking. Based on our results, we present guidelines for transforming the user experience of home network management."
39,Technology in spiritual formation: an exploratory study of computer mediated religious communications,145,2006,https://scholar.google.com/citations?view_op=view_citation&hl=en&user=PNalJ58AAAAJ&pagesize=50&citation_for_view=PNalJ58AAAAJ:aqlVkmm33-oC,"In this paper, we report findings from a study of American Christian ministers' uses of technologies in religious practices. We focus on the use of technologies for spiritual purposes as opposed to pragmatic and logistical, but report on all. We present results about the uses of technologies in three aspects of religious work: religious study and reflection, church services, and pastoral care. We end by examining how the collaborative religious uses of technologies cross and blend work and personal life."
40,Introduction to the special issue of “The Turn to The Wild”,139,2013,https://scholar.google.com/citations?view_op=view_citation&hl=en&user=PNalJ58AAAAJ&pagesize=50&citation_for_view=PNalJ58AAAAJ:1qzjygNMrQYC,"The phrase “in-the-wild” is becoming popular again in the field of human-computer interaction (HCI), describing approaches to HCI research and accounts of user experience phenomena that differ from those derived from other lab-based methods. It first came to the fore 20–25 years ago when anthropologists Jean Lave [1988], Lucy Suchman [1987], and Ed Hutchins [1995] began writing about cognition being in-the-wild. Then, they took the fledgling field of cognitive science apart, eloquently explaining how cognition observed in everyday practice is distributed and situated in the moment–in sharp contrast to the accepted theorizing at the time of models in the head and knowledge divided among mind, body, activity, and culturally organized settings. Today, it is used more broadly to refer to research that seeks to understand and shape new technology interventions within everyday living. A reason for its resurgence …"
41,Method and apparatus for using a secure credential infrastructure to access vehicle components,135,2010,https://scholar.google.com/citations?view_op=view_citation&hl=en&user=PNalJ58AAAAJ&pagesize=50&citation_for_view=PNalJ58AAAAJ:nb7KW1ujOQ8C,"2. Background Adoption of public key cryptography has been tremen dously limited by the “key management problem” that is, the problem of allowing users to reliably identify the public keys of their intended communication partners. One approach used to address this problem is to construct a Public Key Infrastructure (PKI). This approach designates one or more trusted public keys known by the members of the PKI. The computer system that has the trusted public keys can sign digital certificates containing the public keys of users and devices in the PKI. This process authenticates the public keys of the PKI members.The primary difficulty addressed by PKI is the problem of key management and distribution. That is, of deciding how to get authenticated copies of particular individuals or devices public keys to those individuals and devices that need to rely on these keys. A PKI is a system of well-known trusted public …"
42,"Method, apparatus, and program product for automatically provisioning secure network elements",135,2009,https://scholar.google.com/citations?view_op=view_citation&hl=en&user=PNalJ58AAAAJ&pagesize=50&citation_for_view=PNalJ58AAAAJ:fPk4N6BV_jEC,"51) Int. C We present technology that allows layman computer users to (51) hL o/32(2006.01) simply create, provision, and maintain secured infrastruc ture—an instant PKI. This technology can be used in a wide (52) US Cl........................ 7.1. 3.276. 5S variety of applications including wired and wireless net (58) Field of Classification Search s 713 fi 68. 171 works, secure sensor networks (such as medical networks), 713/150, 155, 156, 175: 380/258. 255, 270 emergency alert networks, as well as simply and automati"
43,Computer help at home: methods and motivations for informal technical support,134,2009,https://scholar.google.com/citations?view_op=view_citation&hl=en&user=PNalJ58AAAAJ&pagesize=50&citation_for_view=PNalJ58AAAAJ:RHpTSmoSYBkC,"Prior research suggests that people may ask their family and friends for computer help. But what influences whether and how a ""helper"" will provide help? To answer this question, we conducted a qualitative investigation of people who participated in computer support activities with family and friends in the past year. We describe how factors including maintenance of one's personal identity as a computer expert and accountability to one's social network determine who receives help and the quality of help provided. We also discuss the complex, fractured relationship between the numerous stakeholders involved in the upkeep of home computing infrastructures. Based on our findings, we provide implications for the design of systems to support informal help-giving in residential settings."
44,A multi-modal natural language interface to an information visualization environment,133,2001,https://scholar.google.com/citations?view_op=view_citation&hl=en&user=PNalJ58AAAAJ&pagesize=50&citation_for_view=PNalJ58AAAAJ:GnPB-g6toBAC,"Domain experts frequently know what questions they want to ask about a data set, but they do not necessarily know the mechanisms of using an information visualization (infoVis) system for investigating these inquiries of interest. In our work, we are researching the addition of a natural language (NL) interface for bridging this gap between NL questions and data exploration within an infoVis environment. In this paper, we present our approach to integrating an NL interface into an existing infoVis system. We illustrate the power of combining direct manipulation with NL interfaces, and we provide a real-life example of applying our approach to the analysis of a large, complex data set."
45,The ins and outs of home networking: The case for useful and usable domestic networking,131,2009,https://scholar.google.com/citations?view_op=view_citation&hl=en&user=PNalJ58AAAAJ&pagesize=50&citation_for_view=PNalJ58AAAAJ:R3hNpaxXUhUC,"Householders are increasingly adopting home networking as a solution to the demands created by the presence of multiple computers, devices, and the desire to access the Internet. However, current network solutions are derived from the world of work (and initially the military) and provide poor support for the needs of the home. We present the key findings to emerge from empirical studies of home networks in the UK and US. The studies reveal two key kinds of work that effective home networking relies upon: one, the technical work of setting up and maintaining the home network, and the other, the collaborative and socially organized work of the home which the network is embedded in and supports. The two are thoroughly intertwined and rely upon one another for their realization, yet neither is adequately supported by current networking technologies and applications. Explication of the “work to make the home …"
46,Historical analysis: Using the past to design the future,126,2006,https://scholar.google.com/citations?view_op=view_citation&hl=en&user=PNalJ58AAAAJ&pagesize=50&citation_for_view=PNalJ58AAAAJ:mB3voiENLucC,"Ubicomp developers are increasingly borrowing from other disciplines, such as anthropology and creative design, to inform their design process. In this paper, we demonstrate that the discipline of history similarly has much to offer ubicomp research. Specifically, we describe a historically-grounded approach to designing ubicomp systems and applications for the home. We present findings from a study examining aging and housework that demonstrate how our approach can be useful to sensitize ubicomp developers to the impact of cultural values on household technology, to reunderstand the home space, and to spur development of new design spaces. Our findings suggest that historically-grounded research approaches may be useful in more deeply understanding and designing for context both in and outside of the home."
47,Health promotion as activism: building community capacity to effect social change,124,2012,https://scholar.google.com/citations?view_op=view_citation&hl=en&user=PNalJ58AAAAJ&pagesize=50&citation_for_view=PNalJ58AAAAJ:LPZeul_q3PIC,"As HCI researchers have designed tools to promote wellness, disease has often been approached as a general problem. In contrast, public health research argues for an activist approach focused on how certain groups disproportionately experience disease and eliminating these disparities. Taking this activist stance, we examine how technology can reduce health inequalities by disrupting power relationships and helping communities pursue social change. We discuss our tool, Community Mosaic (CM), which allows individuals to share their healthy eating ideas with one another as a means of advocating behavior change. Our results characterize how CM helped facilitate activism (i.e., collective efforts to counter local challenges to healthy living) and shift users' attitudes regarding their role as advocates for health. We contribute to the field of HCI by using our findings to present a set of recommendations for future …"
48,Recomposition: Putting it all back together again,124,1998,https://scholar.google.com/citations?view_op=view_citation&hl=en&user=PNalJ58AAAAJ&pagesize=50&citation_for_view=PNalJ58AAAAJ:roLk4NBRz8UC,"This paper follows the tradition of examiniig the collaborative aspects of developing sotiare. Development work includes design activities, because the process of shaping software never ends during development. However, thii study differs from many other investigations of development work to date, that have focused on work that occurs in meetings [4, 18], or how individuals reflect on the problem [Za. It is* O different from the sma~ er pool of studies of coding work the development of the sofivare i= elf [7]. Finally, it does not take the broader perspective of those studies that examine the oveti project organization of development work [S, 12].~ ls paper takes a different perspective, one that looks at the process from its conclusio% a reassembled artifact. Specifically, I examine the process of designing and permixion tomakedi~ tal orhardcopiesofall mP~ offis~~ orkfor personal or cl= oom use is~ ted without fee protided …"
49,""" Pimp My Roomba"" designing for personalization",123,2009,https://scholar.google.com/citations?view_op=view_citation&hl=en&user=PNalJ58AAAAJ&pagesize=50&citation_for_view=PNalJ58AAAAJ:4JMBOYKVnBMC,"We present a study of how householders personalize their domestic vacuuming robot, iRobot's Roomba"". In particular, we build on Blom and Monk's [3] theory of personalization that argues that personalization does not only occur naturally but can also be induced by design choices. In this study, we created a personalization toolkit, which allowed people to customize their Roomba's appearance and distributed it to 15 households. Our observations of these households provide empirical support that personalization can facilitate positive experiences with a Roomba, and having materials to hand can increase the odds of customization. We conclude by discussing design implications for personalization."
50,Network-in-a-Box: How to Set Up a Secure Wireless Network in Under a Minute.,117,2004,https://scholar.google.com/citations?view_op=view_citation&hl=en&user=PNalJ58AAAAJ&pagesize=50&citation_for_view=PNalJ58AAAAJ:hqOjcs7Dif8C,"Combining effective security and usability is often considered impossible. For example, deploying effective security for wireless networks is a difficult task, even for skilled systems administrators-a fact that is impeding the deployment of many mobile systems."
