Rank,Title,Citations,Year,URL,Description
1,Postcolonial computing: a lens on design and development,1082,2010,https://scholar.google.com/citations?view_op=view_citation&hl=en&user=PNalJ58AAAAJ&pagesize=50&citation_for_view=PNalJ58AAAAJ:dhFuZR0502QC,"As our technologies travel to new cultural contexts and our designs and methods engage new constituencies, both our design and analytical practices face significant challenges. We offer postcolonial computing as an analytical orientation to better understand these challenges. This analytic orientation inspires four key shifts in our approach to HCI4D efforts: generative models of culture, development as a historical program, uneven economic relations, and cultural epistemologies. Then, through reconsideration of the practices of engagement, articulation and translation in other contexts, we offer designers and researchers ways of understanding use and design practice to respond to global connectivity and movement."
2,At Home with Ubiquitous Computing: Seven Challenges,945,2001,https://scholar.google.com/citations?view_op=view_citation&hl=en&user=PNalJ58AAAAJ&pagesize=50&citation_for_view=PNalJ58AAAAJ:2P1L_qKh6hAC,"The smart home offers a new opportunity to augment people’s lives with ubiquitous computing technology that provides increased communications, awareness, and functionality. Recently, a number of trends have increased the likelihood that the aware home can soon become a reality. We examine a number of challenges from the technical, social, and pragmatic domains that we feel must be overcome before the vision of the smart home, posited by ubiquitous computing research, can become a reality. Our hope in raising these issues is to create a conversation among researchers in the varied disciplines that make up ubiquitous computing. In particular, we hope to raise awareness of the existing literature on the adoption, use, and history of domestic technologies, as well as the use of situated studies, and the benefits that these can bring to bear on the design and evaluation of technologies for the home"
3,Instant messaging in teen life,787,2002,https://scholar.google.com/citations?view_op=view_citation&hl=en&user=PNalJ58AAAAJ&pagesize=50&citation_for_view=PNalJ58AAAAJ:u5HHmVD_uO8C,"Instant Messaging (IM) is being widely adopted by teenagers. In a study of 16 teenage IM users, we explore IM as an emerging feature of teen life, focusing our questions on its support of interpersonal communication and its role and salience in everyday life. We qualitatively describe the teens' IM use interpersonally, as well as its place in the domestic ecology. We also identify technology adoption conditions and discuss behaviors around privacy management. In this initial investigation, we found differences in the nature of use between high school and college teens, differences we propose are accounted for by teens' degree of autonomy as a function of domestic and scholastic obligations, the development of independent work practices, Internet connectivity access, and even transportation access. Moreover, while teen IM use is in part characterized as an optimizing choice between multiple communications …"
4,y do tngrs luv 2 txt msg?,679,2001,https://scholar.google.com/citations?view_op=view_citation&hl=en&user=PNalJ58AAAAJ&pagesize=50&citation_for_view=PNalJ58AAAAJ:d1gkVwhDpl0C,""" Text messaging""—using a mobile phone to send a message—has changed how teenagers use wireless phones to communicate and coordinate. While the media reports rapid growth in text messaging, less is known about why teenagers have adopted it. In this paper, we report findings from a study of teenagers’ text messaging practices. Specifically, we show that teenagers use text messages to: arrange and adjust times to talk, coordinate with friends and family, and chat. Moreover, we argue that the reasons teenagers find text messaging quick, cheap, and easy to use, are grounded in their social context. Finally, we show that teenagers encounter three problems when text messaging: understanding evolving language, determining intent from content, and addressing messages."
5,Splitting the organization and integrating the code: Conway's law revisited,676,1999,https://scholar.google.com/citations?view_op=view_citation&hl=en&user=PNalJ58AAAAJ&pagesize=50&citation_for_view=PNalJ58AAAAJ:9yKSN-GCB0IC,"It is widely acknowledged that coordination of large scale software development is an extremely difficult and persistent problem. Since the structure of the code mirrors the structure of the organization, one might expect that splitting the organization across time zones, cultures, and (natural) languages would make it difficult to assemble the components. This paper presents a case study of what indeed turned out to be the most difficult part of a geographically distributed software project, ie, integration. Coordination problems were greatly exaggerated across sites, largely because of the breakdown of informal communication channels. The results imply that multi-site development can benefit to some extent ti-om stable plans, processes, and specifications. The inherently unpredictable aspects of projects, however, require communication channels that can be invoked spontaneously, by developers, as needed. These …"
6,An empirical study of global software development: distance and speed,603,2001,https://scholar.google.com/citations?view_op=view_citation&hl=en&user=PNalJ58AAAAJ&pagesize=50&citation_for_view=PNalJ58AAAAJ:2osOgNQ5qMEC,"Global software development is rapidly becoming the norm for technology companies. Previous qualitative research suggests that multi-site development may increase the development cycle time. We use both survey data and data from the source code change management system to model the extent of delay in a multi-site software development organization, and explore several possible mechanisms for this delay. We also measure differences in same-site and cross-site communication patterns, and analyze the relationship of these variables to delay. Our results show that, compared to same-site work, cross-site work takes much longer and requires more people for work of equal size and complexity. We also report a strong relationship between delay in cross-site work and the degree to which remote colleagues are perceived to help out when workloads are heavy. We discuss the implications of our findings for …"
7,"Distance, dependencies, and delay in a global collaboration",591,2000,https://scholar.google.com/citations?view_op=view_citation&hl=en&user=PNalJ58AAAAJ&pagesize=50&citation_for_view=PNalJ58AAAAJ:UeHWp8X0CEIC,"Collaborations over distance must contend with the loss of the rich, subtle interactions that co-located teams use to coordinate their work. Previous research has suggested that one consequence of this loss is that cross-site work will take longer than comparable single-site work. We use both survey data and data from the change management system to measure the extent of delay in a multi-site software development organization. We also measure site interdependence, differences in same-site and cross-site communication patterns, and analyze the relationship of these variables to delay. Our results show a significant relationship between delay in cross-site work and the degree to which remote colleagues are perceived to help out when workloads are heavy. This result is particularly troubling in light of the finding that workers generally believed they were as helpful to their remote colleagues as to their local …"
8,"Intersectional HCI: Engaging identity through gender, race, and class",589,2017,https://scholar.google.com/citations?view_op=view_citation&hl=en&user=PNalJ58AAAAJ&pagesize=50&citation_for_view=PNalJ58AAAAJ:_Ybze24A_UAC,"Understanding users becomes increasingly complicated when we grapple with various overlapping attributes of an individual's identity. In this paper we introduce intersectionality as a framework for engaging with the complexity of users' ""and authors"" ""identities"", and situating these identities in relation to their contextual surroundings. We conducted a meta-review of identity representation in the CHI proceedings, collecting a corpus of 140 manuscripts on gender, ethnicity, race, class, and sexuality published between 1982-2016. Drawing on this corpus, we analyze how identity is constructed and represented in CHI research to examine intersectionality in a human-computer interaction (HCI) context. We find that previous identity-focused research tends to analyze one facet of identity at a time. Further, research on ethnicity and race lags behind research on gender and socio-economic class. We conclude this paper …"
9,The geography of coordination: Dealing with distance in R&D work,568,1999,https://scholar.google.com/citations?view_op=view_citation&hl=en&user=PNalJ58AAAAJ&pagesize=50&citation_for_view=PNalJ58AAAAJ:qjMakFHDy7sC,"Geographically distributed development creates new questions about how to coordinate multi-site work. In this paper, we present four methods product development organizations used to coordinate their work: functional areas of expertise, product structure, process steps, and customization. We describe the benefits and difficulties with each model. Finally, we discuss two difficulties that occur irrespective of the model used: consequences of unequal distribution of project mass, and finding expertise."
10,"Architectures, coordination, and distance: Conway's law and beyond",561,2002,https://scholar.google.com/citations?view_op=view_citation&hl=en&user=PNalJ58AAAAJ&pagesize=50&citation_for_view=PNalJ58AAAAJ:zYLM7Y9cAGgC,"Geographically distributed development teams face extraordinary communication and coordination problems. The authors' case study clearly demonstrates how common but unanticipated events can stretch project communication to the breaking point. Project schedules can fall apart, particularly during integration. Modular design is necessary, but not sufficient to avoid this fate."
11,"Security in the wild: user strategies for managing security as an everyday, practical problem",545,2004,https://scholar.google.com/citations?view_op=view_citation&hl=en&user=PNalJ58AAAAJ&pagesize=50&citation_for_view=PNalJ58AAAAJ:Y0pCki6q_DkC,"Ubiquitous and mobile technologies create new challenges for system security. Effective security solutions depend not only on the mathematical and technical properties of those solutions, but also on people’s ability to understand them and use them as part of their work. As a step towards solving this problem, we have been examining how people experience security as a facet of their daily life, and how they routinely answer the question, “is this system secure enough for what I want to do?” We present a number of findings concerning the scope of security, attitudes towards security, and the social and organizational contexts within which security concerns arise, and point towards emerging technical solutions."
12,Making sense of sensing systems: five questions for designers and researchers,531,2002,https://scholar.google.com/citations?view_op=view_citation&hl=en&user=PNalJ58AAAAJ&pagesize=50&citation_for_view=PNalJ58AAAAJ:IjCSPb-OGe4C,"This paper borrows ideas from social science to inform the design of novel ""sensing"" user-interfaces for computing technology. Specifically, we present five design challenges inspired by analysis of human-human communication that are mundanely addressed by traditional graphical user interface designs (GUIs). Although classic GUI conventions allow us to finesse these questions, recent research into innovative interaction techniques such as 'Ubiquitous Computing' and 'Tangible Interfaces' has begun to expose the interaction challenges and problems they pose. By making them explicit we open a discourse on how an approach similar to that used by social scientists in studying human-human interaction might inform the design of novel interaction mechanisms that can be used to handle human-computer communication accomplishments"
13,“My Roomba is Rambo”: intimate home appliances,477,2007,https://scholar.google.com/citations?view_op=view_citation&hl=en&user=PNalJ58AAAAJ&pagesize=50&citation_for_view=PNalJ58AAAAJ:ULOm3_A8WrAC,"Robots have entered our domestic lives, but yet, little is known about their impact on the home. This paper takes steps towards addressing this omission, by reporting results from an empirical study of iRobot’s RoombaTM, a vacuuming robot. Our findings suggest that, by developing intimacy to the robot, our participants were able to derive increased pleasure from cleaning, and expended effort to fit Roomba into their homes, and shared it with others. These findings lead us to propose four design implications that we argue could increase people’s enthusiasm for smart home technologies."
14,Wan2tlk? Everyday text messaging,391,2003,https://scholar.google.com/citations?view_op=view_citation&hl=en&user=PNalJ58AAAAJ&pagesize=50&citation_for_view=PNalJ58AAAAJ:Tyk-4Ss8FVUC,"Texting--using a mobile phone to send text messages--has become a form of mass communication. Building on studies that described how British teenagers have incorporated text messaging into their lives, we examine the purposes and nature of the conversations themselves. We also present findings that suggest that teenagers do not have many simultaneous multiple conversations via text messaging; end most text messaging conversations by switching to another medium; and, that, despite popular beliefs, communicate with surprisingly few friends via their mobile phones. Finally we describe how and what words they shorten in their text messages."
15,User interface for translating natural language inquiries into database queries and data presentations,380,2004,https://scholar.google.com/citations?view_op=view_citation&hl=en&user=PNalJ58AAAAJ&pagesize=50&citation_for_view=PNalJ58AAAAJ:mVmsd5A6BfQC,"A natural language-based interface data presentation System interfaces, for example, information visualization System interfaces, is realized by employing So-called open-ended natural language inquiries to the interface that translates them into database queries and a set of information to be provided to a user. More Specifically, a natural language inquiry is translated to database queries by determining if any complete database queries can be formulated based on the natural language inquiry and, if So, Specifying which complete database queries are to be made. In accordance with one aspect of the invention, knowledge of the infor mation visualization presentation is advantageously employed in the interface to guide a user in response to the user's natural language inquiries. In accordance with another aspect of the invention, knowledge of the database and knowledge of the information visualization …"
16,Getting to green: understanding resource consumption in the home,340,2008,https://scholar.google.com/citations?view_op=view_citation&hl=en&user=PNalJ58AAAAJ&pagesize=50&citation_for_view=PNalJ58AAAAJ:UebtZRa9Y70C,"Rising global energy demands, increasing costs and limited natural resources mean that householders are more conscious about managing their domestic resource consumption. Yet, the question of what tools Ubicomp researchers can create for residential resource management remains open. To begin to address this omission, we present a qualitative study of 15 households and their current management practices around the water, electricity and natural gas systems in the home. We find that in-the-moment resource consumption is mostly invisible to householders and that they desire more real-time information to help them save money, keep their homes comfortable and be environmentally friendly. Designing for domestic sustainability therefore turns on improving the visibility of resource production and consumption costs as well as supporting both individuals and collectives in behavior change. Domestic …"
17,Quality versus quantity: E-mail-centric task management and its relation with overload,334,2005,https://scholar.google.com/citations?view_op=view_citation&hl=en&user=PNalJ58AAAAJ&pagesize=50&citation_for_view=PNalJ58AAAAJ:ufrVoPGSRksC,"It is widely acknowledged that many professionals suffer from ""e-mail overload."" This article presents findings from in-depth fieldwork that examined this phenomenon, uncovering six key challenges of task management in e-mail. Analysis of qualitative and quantitative data suggests that it is not simply the quantity but also the collaborative quality of e-mail task and project management that causes this overload. We describe how e-mail becomes especially overwhelming when people use it for tasks that involve participation of others; tasks cannot be completed until a response is obtained and so they are interleaved. Interleaving means that the e-mail user must somehow simultaneously keep track of multiple incomplete tasks, often with the only reminder for each one being an e-mail message somewhere in the inbox or a folder. This and other insights from our fieldwork led us to a new design philosophy for e-mail in …"
18,Sotto voce: exploring the interplay of conversation and mobile audio spaces,318,2002,https://scholar.google.com/citations?view_op=view_citation&hl=en&user=PNalJ58AAAAJ&pagesize=50&citation_for_view=PNalJ58AAAAJ:W7OEmFMy1HYC,"In addition to providing information to individual visitors, electronic guidebooks have the potential to facilitate social interaction between visitors and their companions. However, many systems impede visitor interaction. By contrast, our electronic guidebook, Sotto Voce, has social interaction as a primary design goal. The system enables visitors to share audio information - specifically, they can hear each other's guidebook activity using a technologically mediated audio eavesdropping mechanism. We conducted a study of visitors using Sotto Voce while touring a historic house. The results indicate that visitors are able to use the system effectively, both as a conversational resource and as an information appliance. More surprisingly, our results suggest that the technologically mediated audio often cohered the visitors' conversation and activity to a far greater degree than audio delivered through the open air"
19,Evaluating human-robot interaction: Focusing on the holistic interaction experience,315,2011,https://scholar.google.com/citations?view_op=view_citation&hl=en&user=PNalJ58AAAAJ&pagesize=50&citation_for_view=PNalJ58AAAAJ:lSLTfruPkqcC,"The experience of interacting with a robot has been shown to be very different in comparison to people’s interaction experience with other technologies and artifacts, and often has a strong social or emotional component—a difference that poses potential challenges related to the design and evaluation of HRI. In this paper we explore this difference, and its implications on evaluating HRI. We outline how this difference is due in part to the general complexity of robots’ overall context of interaction, related to their dynamic presence in the real world and their tendency to invoke a sense of agency.We suggest that due to these differences HCI evaluation methods should be applied to HRI with care, and we present a survey of select HCI evaluation techniques from the perspective of the unique challenges of robots. We propose a view on social interaction with robots that we call the holistic interaction experience, and …"
20,Revisiting the visit: Understanding how technology can shape the museum visit,312,2002,https://scholar.google.com/citations?view_op=view_citation&hl=en&user=PNalJ58AAAAJ&pagesize=50&citation_for_view=PNalJ58AAAAJ:YsMSGLbcyi4C,"This paper reports findings from a study of how a guidebook was used by pairs of visitors touring a historic house. We describe how the guidebook was incorporated into their visit in four ways: shared listening, independent use, following one another, and checking in on each other. We discuss how individual and groupware features were adopted in support of different visiting experiences, and illustrate how that adoption was influenced by social relationships, the nature of the current visit, and any museum visiting strategies that the couples had. Finally, we describe how the guidebook facilitated awareness between couples, and how awareness of non-guidebook users (strangers) influenced use."
21,The work to make a home network work,290,2005,https://scholar.google.com/citations?view_op=view_citation&hl=en&user=PNalJ58AAAAJ&pagesize=50&citation_for_view=PNalJ58AAAAJ:WF5omc3nYNoC,"Recently, households have begun to adopt networking technologies to interconnect devices within the home. Yet little is known about the consequences for households of setting up and living with these complex networks, nor the impact of such technologies on the routines of the home. In this paper, we report findings from an empirical study of households containing complex networks of computer and audio/visual technologies. Our study finds that home networks require significant household effort not just to coordinate their use, but also their set up and maintenance. We also show how the coordination around networking has to be worked into the routines of the home and the householders."
22,Apparatus and method for use in collaboration services,267,2007,https://scholar.google.com/citations?view_op=view_citation&hl=en&user=PNalJ58AAAAJ&pagesize=50&citation_for_view=PNalJ58AAAAJ:IWHjjKOFINEC,"A ConnectIcon View is employed to establish collaborative communications between a plurality of participants in a group. Speci? cally, it is a dynamic visual representation of the participants of a group being invited to communicate together with their presence information, lists of documents and URLs (Uniform Resource Locators) to be examined, and a set of mechanisms (email, chat, voice, and the like) to initiate communication, each of which can be billed to the originator or otherwise as desired. The available presence information allows a user to employ the best mode of communicating for the instant purpose, namely, either asyn chronous communication or synchronous communication."
23,Robots in the wild: understanding long-term use,266,2009,https://scholar.google.com/citations?view_op=view_citation&hl=en&user=PNalJ58AAAAJ&pagesize=50&citation_for_view=PNalJ58AAAAJ:r0BpntZqJG4C,"It has long been recognized that novelty effects exist in the interaction with technologies. Despite this recognition, we still know little about the novelty effects associated with domestic robotic appliances and more importantly, what occurs after the novelty wears off. To address this gap, we undertook a longitudinal field study with 30 households to which we gave Roomba vacuuming robots and then observed use over six months. During this study, which spans over 149 home visits, we encountered methodological challenges in understanding households' usage patterns. In this paper we report on our longitudinal research, focusing particularly on the methods that we used 1) to understand human-robot interaction over time despite the constraints of privacy and temporality in the home, and 2) to uncover information when routines became less conscious to the participants themselves."
24,Method and apparatus for establishing and using a secure credential infrastructure,240,2007,https://scholar.google.com/citations?view_op=view_citation&hl=en&user=PNalJ58AAAAJ&pagesize=50&citation_for_view=PNalJ58AAAAJ:Zph67rFs4hoC,"We present technology that allows layman computer users to simply create, provision, and maintain secured infrastruc tureian instant PKI. This technology can be used in a wide variety of applications including wired and wireless net works, secure sensor networks (such as medical networks), emergency alert networks, as well as simply and automati cally provisioning network devices whether secure or not."
25,Listening in: practices surrounding iTunes music sharing,234,2005,https://scholar.google.com/citations?view_op=view_citation&hl=en&user=PNalJ58AAAAJ&pagesize=50&citation_for_view=PNalJ58AAAAJ:eQOLeE2rZwMC,"This paper presents a descriptive account of the social practices surrounding the iTunes music sharing of 13 participants in one organizational setting. Specifically, we characterize adoption, critical mass, and privacy; impression management and access control; the musical impressions of others that are created as a result of music sharing; the ways in which participants attempted to make sense of the dynamic system; and implications of the overlaid technical, musical, and corporate topologies. We interleave design implications throughout our results and relate those results to broader themes in a music sharing design space."
26,EatWell: sharing nutrition-related memories in a low-income community,226,2008,https://scholar.google.com/citations?view_op=view_citation&hl=en&user=PNalJ58AAAAJ&pagesize=50&citation_for_view=PNalJ58AAAAJ:M3ejUd6NZC8C,"Low-income African American communities face a disproportionate amount of diet-related health problems in the United States. To address this issue, we developed EatWell, a system that allows people to use their cell phones to create voice memories describing how they have tried to eat healthfully in their neighborhoods (e.g., at local restaurants) and listen to the memories that others have created. In this paper, we describe the results of our field trial of EatWell, specifically characterizing how our participants were able to craft stories that were both emotive and culturally-relevant, the challenges that arose in creating these memories and finally how sharing these stories facilitated a sense of community empowerment. We conclude by presenting implications for the design of future applications that facilitate the sharing of health-related experiences."
