Rank,Title,Citations,Year,URL,Description
23,Using targeted betweenness centrality to identify bridges to neglected users in the Twitter conversation on veteran suicide,6,2021,https://scholar.google.com/citations?view_op=view_citation&hl=en&user=cQPdjdgAAAAJ&pagesize=50&citation_for_view=cQPdjdgAAAAJ:9ZlFYXVOiuMC,"There are many real-world contexts in which it would be invaluable to identify intermediaries who serve as bridges for specified dyads. For instance, with respect to suicide prevention among military veterans, mental health organizations play an important role in providing information, social support, and other resources to veterans, particularly on social media, where anonymous and pseudonymous interactions may help to counteract the stigma associated with suicide and mental health. However, many at-risk individuals are overlooked in the large-scale conversations on social media and are thus less likely to benefit from those interactions. Intermediaries who can integrate those peripheral actors into the conversation, or at least deliver essential information to them, could help to resolve this issue. The critical question, then, is how to identify those potentially useful intermediaries who are well positioned to act as …"
24,Study of Twitter communications on cardiovascular disease by state health departments,6,2019,https://scholar.google.com/citations?view_op=view_citation&hl=en&user=cQPdjdgAAAAJ&pagesize=50&citation_for_view=cQPdjdgAAAAJ:5nxA0vEk-isC,"The present study examines Twitter conversations around cardiovascular health in order to assess the topical foci of these conversations as well as the role of various state departments of health. After scraping tweets containing relevant keywords, Latent Dirichlet Allocation (LDA) was used to identify the most important topics discussed around the issue, while PageRank was used to determine the relative prominence of different users. The results indicate that a small number of state departments of health play an especially significant role in these conversations. Furthermore, irregular events like ebola outbreaks also exert a strong influence over the volume of tweets made in general by state departments of health."
25,Litmus: Towards multilingual reporting of landslides,6,2017,https://scholar.google.com/citations?view_op=view_citation&hl=en&user=cQPdjdgAAAAJ&pagesize=50&citation_for_view=cQPdjdgAAAAJ:WF5omc3nYNoC,"LITMUS is a real-time online and openly accessible service that collects high quality information on landslide events from social media. This service uses disaster related keywords, such as ""landslide"" and ""mudslide"", to analyze messages posted by English speaking users. However, comprehensive coverage of disasters must include multilingual support as there are events that are reported in languages other than English. We discuss and evaluate possible implementations of such support using ""native"" and ""translated"" approaches. ""Native"" approach involves a complete reimplementation of the existing infrastructure in another language whereas in the ""translated"" approach the existing infrastructure can be used without modification. As an illustration, we present a demo that extends LITMUS to implement a ""native"" approach for multilingual reporting of landslide events."
26,Nimbus: tuning filters service on Tweet streams,5,2015,https://scholar.google.com/citations?view_op=view_citation&hl=en&user=cQPdjdgAAAAJ&pagesize=50&citation_for_view=cQPdjdgAAAAJ:qjMakFHDy7sC,"With hundreds of millions of tweets being generated by Twitter users every day, tweet analysis has drawn considerable attention for event detection and trending sentiment indication. The problem is finding the few important tweets in this huge volume of traffic. A number of systems provide applications the ability to filter a complete or partial Twitter stream based on keywords and/or text properties to try to separate the relevant tweets from all of the noise. Designing a filter to produce useful results can be extremely difficult. For instance, consider the problem of finding tweets related to the Target Corporation or Guess USA. Just scanning the text of tweets for ""target"" or ""guess"" is likely to generate lots of hits, but few really relevant tweets. Nimbus is a service that can be used to tune filters on tweet streams. The Nimbus service builds a database of tweets from a Twitter stream (it does not have to be a full Twitter fire hose …"
27,Investigating personally identifiable information posted on Twitter before and after disasters,4,2019,https://scholar.google.com/citations?view_op=view_citation&hl=en&user=cQPdjdgAAAAJ&pagesize=50&citation_for_view=cQPdjdgAAAAJ:8k81kl-MbHgC,"Through social media, users may consciously reveal information about their personality; however, they could also unintentionally disclose private information related to the locations of where they live/work, car license plates, signatures or even their identification documents. Any disclosed information can endanger an individual’s privacy, possibly resulting in burglaries or identity theft. To the best of our knowledge, this paper is the first to claim and demonstrate that people may reveal information when they are vulnerable and actively seek help; evidently, in the event of a natural disaster, people change their behavior and become more inclined to share their personal information. To examine this phenomenon, we investigate two hurricane events (Harvey and Maria) and one earthquake (Mexico City) using datasets obtained from Twitter. Our findings show a significant change in people’s behavioral pattern in the …"
28,Mining Twitter Data for Landslide Events Reported Worldwide,4,2018,https://scholar.google.com/citations?view_op=view_citation&hl=en&user=cQPdjdgAAAAJ&pagesize=50&citation_for_view=cQPdjdgAAAAJ:kNdYIx-mwKoC,"The explosion of user generated content in social media published from mobile devices has led to the concept known as “citizen sensing.” Although English has been adopted by many as a de facto standard international language, reports about events, such as disasters, are frequently provided by citizens in their local language in addition to English. Attempting to integrate citizen reports from many languages is a significant challenge. This article describes the tools that address this challenge to enable the support of citizen-sensing of landslide events reported worldwide. Multilingual support is based on the first unified cross-lingual dataset of word vectors for representing texts in multiple languages. The classification model based on the proposed cross-lingual word vectors outperforms the “native” and “translated” approaches based on monolingual word vectors. Furthermore, it does not require the creation of a …"
29,Multi-hazard detection by integrating social media and physical sensors,4,2016,https://scholar.google.com/citations?view_op=view_citation&hl=en&user=cQPdjdgAAAAJ&pagesize=50&citation_for_view=cQPdjdgAAAAJ:9yKSN-GCB0IC,"Disaster Management is one of the most important functions of the government. FEMA and CDC are two examples of government agencies directly charged with handling disasters, whereas USGS is a scientific agency oriented towards disaster research. But regardless of the type or purpose, each of the mentioned agencies utilizes Social Media as part of its activities. One of the uses of Social Media is in detection of disasters, such as earthquakes. But disasters may lead to other kinds of disasters, forming multi-hazards such as landslides. Effective detection and management of multi-hazards cannot rely only on one information source. In this chapter, we describe and evaluate a prototype implementation of a landslide detection system LITMUS, which combines multiple physical sensors and Social Media to handle the inherent varied origins and composition of multi-hazards. Our results demonstrate that LITMUS …"
30,Evolution of Knowledge in Social Media and Their Relationship to an Evolving Real World,2,2023,https://scholar.google.com/citations?view_op=view_citation&hl=en&user=cQPdjdgAAAAJ&pagesize=50&citation_for_view=cQPdjdgAAAAJ:IWHjjKOFINEC,"The physical world evolves. The cyber world evolves and grows with big data, with social media as a major component of information growth. Classic ML models are limited by their static training data with implicit Complete and Timeless Knowledge assumptions. In an evolving world, static training data suffer from knowledge obsolescence due to truly novel timely information. Knowledge obsolescence introduces a widening distance between static ML models and the evolving world, called cyber-physical gap. Periodic retraining of new models may restore their accuracy temporarily, but subsequently their performance will deteriorate with widening cyber-physical gap. Knowledge obsolescence affects statically trained models of any size, including LLMs. Two major research challenges arise from cyber-physical gap: (1) collection and incorporation of space-time aware ground truth training data, and (2) understanding …"
31,Preliminary feedback on learning in advance courses to prepare engineering students for gateway courses,2,2020,https://scholar.google.com/citations?view_op=view_citation&hl=en&user=cQPdjdgAAAAJ&pagesize=50&citation_for_view=cQPdjdgAAAAJ:mB3voiENLucC,"The University of Alabama is exploring Learning in Advance (LIA) courses to introduce engineering students to concepts and correct common misconceptions prior to encountering the complex theories and concepts in three different gateway courses. These gateway courses are circuit analysis, statics, and data-structures/algorithms. The courses were identified based on analysis of institutional data. Data indicated that greater than 90% of UA students who succeed in the three courses went on to complete their undergraduate degree. Yet, each course has individually high rates of failure and/or withdrawals. The objective and intended learning outcomes of each of the three courses is to provide students with knowledge of key concepts that will strengthen the student’s critical thinking skills and establish a strong technical foundation. In this work an overview of the LIA courses is provided along with summaries of collected student feedback and the plans for future assessment to track the effectiveness of this intervention to improve student outcomes in the gateway courses."
32,A Social Media-Machine Learning Approach to Detect Public Perception of Transportation Systems,2,2019,https://scholar.google.com/citations?view_op=view_citation&hl=en&user=cQPdjdgAAAAJ&pagesize=50&citation_for_view=cQPdjdgAAAAJ:0EnyYjriUFMC,"Social sensors such as Facebook and Twitter are used by the public to express their perceptions and circumstances in various aspects of their lives. People publish tweets and post Facebook messages related to transportation systems to report what they have seen on the road, especially when an unusual or unsafe situation (e.g., pothole, traffic crash) occurs. Some messages directly refer to a public agency’s account (e.g., State Department of Transportation), expecting the public agency to respond to these posts. Many posts contain real-time urgent incident information (e.g., broken traffic lights, flooding) or other inquiries, comments, requests, suggestions, and complaints about transportation systems. However, many of such posts fail to get a timely response from related agencies, perhaps because public agencies do not have an efficient way to identify the public’s perception of the transportation system in their …"
33,A Comparative Study of Increasing Automation in the Integration of Multilingual Social Media Information,2,2017,https://scholar.google.com/citations?view_op=view_citation&hl=en&user=cQPdjdgAAAAJ&pagesize=50&citation_for_view=cQPdjdgAAAAJ:LkGwnXOMwfcC,"Multilingual support in global applications that integrate and filter social media data is a significant challenge due to the cost of manually developing such social media filters for each language. Using LITMUS landslide information system as an experimental platform, we compared six design alternatives with varied combinations of manually developed filters and automatically translated filters for integrating and filtering social media data. Our experiments on Japanese tweets show that automatically translated filtering produces comparable or better results than manually created filters, achieving similar result quality: in false positives, false negatives, and F-1 scores. Compared to manual development, our results suggest automated translation may be a faster and cheaper approach to the integration of non-English languages, without sacrificing data quality. These results are encouraging for reducing the development …"
34,Integrating Professional Identity Development into Large-Scale CS First Year Seminar Courses,0,2026,https://scholar.google.com/citations?view_op=view_citation&hl=en&user=cQPdjdgAAAAJ&pagesize=50&citation_for_view=cQPdjdgAAAAJ:HDshCWvjkbEC,"This lightning talk presents an initiative to integrate professional identity development activities into a large enrollment undergraduate CS First Year Seminar course. This CS majors only, required, one-credit hour course is an opportunity to excite students about computing as a profession. In fall 2024, inspired by Fink's Significant Learning Theory, where multiple dimensions contribute to changing how a student lives their personal and professional life, we added a reflection assignment and an external engagement requirement to foster professional identity. This experiential learning required three different types of campus activities outside the classroom: resume and interview preparation, networking with professionals, and student presentations. The first month students participate in a Career Services workshop for resumes, interviewing, or decoding job postings. The following month, students participate in one of …"
35,Adaptive Skill-Mastery Feedback Loops in AI-Generated Courses,0,2026,https://scholar.google.com/citations?view_op=view_citation&hl=en&user=cQPdjdgAAAAJ&pagesize=50&citation_for_view=cQPdjdgAAAAJ:hFOr9nPyWt4C,"This demo presents the next-generation version of KimBilet.com, an educational platform that leverages generative AI to create adaptive, mastery-driven learning experiences. Building on last year's personalized course generation, the new system introduces a fine-grained skill taxonomy and a feedback loop that evaluates and responds to learner performance in real time. The adaptive algorithm begins with a user's prompt to generate a topic and a taxonomy of skills needed to master that topic. For each skill, the system creates a focused lesson and a quiz. At the end of the course, learners receive a mastery profile displaying their performance across all skills. Based on these results, the system dynamically adapts: skills mastered with high accuracy are marked complete, while weaker areas trigger the generation of additional remedial lessons and quizzes until mastery is achieved. This feedback loop transforms …"
36,Leveraging Generative AI for Personalized Learning Experiences,0,2025,https://scholar.google.com/citations?view_op=view_citation&hl=en&user=cQPdjdgAAAAJ&pagesize=50&citation_for_view=cQPdjdgAAAAJ:hC7cP41nSMkC,"This demo presents KimBilet.com, an educational platform that utilizes generative AI to create personalized educational content on demand. Catering to high-school and college students, instructors, job seekers, and lifelong learners, the system generates customized courses based on user prompts, covering any topic of interest. Each course may include a sequence of AI-created lessons and quizzes, providing detailed feedback for every quiz option to enhance understanding. The platform supports intuitive navigation through keyboard shortcuts and allows users to jump between course items seamlessly. It also maintains a history of completed quizzes to help users track their learning progress. Future enhancements include topic suggestions based on past interests, support for coding exercises, and multilingual support. This demo will showcase how KimBilet.com leverages AI to offer adaptive learning …"
37,Learning Cross-Lingual Word Embeddings With Universal Concepts,0,2019,https://scholar.google.com/citations?view_op=view_citation&hl=en&user=cQPdjdgAAAAJ&pagesize=50&citation_for_view=cQPdjdgAAAAJ:Zph67rFs4hoC,"Recent advances in generating monolingual word embeddings based on word co-occurrence for universal languages inspired new efforts to extend the model to support diversified languages. State-of-the-art methods for learning cross-lingual word embeddings rely on the alignment of monolingual word embedding spaces. Our goal is to implement a word co-occurrence across languages with the universal concepts' method. Such concepts are notions that are fundamental to humankind and are thus persistent across languages, eg, a man or woman, war or peace, etc. Given bilingual lexicons, we built universal concepts as undirected graphs of connected nodes and then replaced the words belonging to the same graph with a unique graph ID. This intuitive design makes use of universal concepts in monolingual corpora which will help generate meaningful word embeddings across languages via the word cooccurrence concept. Standardized benchmarks demonstrate how this underutilized approach competes SOTA on bilingual word sematic similarity and word similarity relatedness tasks."
38,"Services Computing–SCC 2019: 16th International Conference, held as part of the Services Conference Federation, SCF 2019",0,2019,https://scholar.google.com/citations?view_op=view_citation&hl=en&user=cQPdjdgAAAAJ&pagesize=50&citation_for_view=cQPdjdgAAAAJ:L8Ckcad2t8MC,"ReP USP - Detalhe do registro: Services Computing – SCC 2019: 16th International Conference, held as part of the Services Conference Federation, SCF 2019 Home About USP Schools USP Schools Escola de Artes, Ciências e Humanidades (EACH) Escola de Comunicações e Artes (ECA) Escola de Enfermagem (EE) Escola de Enfermagem de Ribeirão Preto (EERP) Escola de Educação Física e Esporte (EEFE) Escola de Educação Física e Esporte de Ribeirão Preto (EEFERP) Escola de Engenharia de Lorena (EEL) Escola de Engenharia de São Carlos (EESC) Escola Politécnica (EP) Escola Superior de Agricultura Luiz de Queiroz (ESALQ) Faculdade de Arquitetura e Urbanismo (FAU) Faculdade de Ciências Farmacêuticas (FCF) Faculdade de Ciências Farmacêuticas de Ribeirão Preto (FCFRP) Faculdade de Direito (FD) Faculdade de Direito de Ribeirão Preto (FDRP) Faculdade de Economia, …"
39,Services Computing–SCC 2019,0,2019,https://scholar.google.com/citations?view_op=view_citation&hl=en&user=cQPdjdgAAAAJ&pagesize=50&citation_for_view=cQPdjdgAAAAJ:dhFuZR0502QC,"Services account for a major part of the IT industry today. Companies increasingly like to focus on their core expertise area and use IT services to address all their peripheral needs. Services computing is a new science that aims to study and better understand the foundations of this highly popular industry. It covers the science and technology of leveraging computing and information technology to model, create, operate, and manage business services. The 2019 International Conference on Services Computing (SCC 2019) contributed to building the pillars of this important science and shaping the future of services computing.SCC 2019 was part of the Services Conference Federation (SCF). SCF 2019 had the following ten collocated service-oriented sister conferences: 2019 International conference on Web Services (ICWS 2019), 2019 International Conference on Cloud Computing (CLOUD 2019), 2019 …"
40,of Road Infrastructure Using Social,0,2018,https://scholar.google.com/citations?view_op=view_citation&hl=en&user=cQPdjdgAAAAJ&pagesize=50&citation_for_view=cQPdjdgAAAAJ:-f6ydRqryjwC,"We study the problem of estimating the state of road infrastructure, which is the backbone of transportation system. Road infrastructure can suffer from various issues, including structural failures, such as potholes, and non-structural issues, such as broken traffic lights. How-ever, it is infeasible to cover all roads with physical sensors for monitoring purposes. Instead, we propose to use social sensor big data to detect and estimate these issues based on the public's activity. As a demonstration, we generate a map of detected road problems based on tweets. The map displays the currently detected hotspots, where for each hotspot we compute the overall sentiment provided by the public. In addition, we identify the peak of public activity during the evaluation period and investigate the key drivers of that peak. Finally, we analyze the most influential users using an extension of PageRank. The proposed approach adds a novel perspective on the state of road infrastructure and may be used to help guide decisions related to road infrastructure funding."
41,ICDCSW 2017,0,2017,https://scholar.google.com/citations?view_op=view_citation&hl=en&user=cQPdjdgAAAAJ&pagesize=50&citation_for_view=cQPdjdgAAAAJ:M3ejUd6NZC8C,Description not available
42,IEEE 37th International Conference on Distributed Computing Systems Workshops,0,2017,https://scholar.google.com/citations?view_op=view_citation&hl=en&user=cQPdjdgAAAAJ&pagesize=50&citation_for_view=cQPdjdgAAAAJ:YOwf2qJgpHMC,"[Title page iii] Toggle navigation IEEE Computer Society Digital Library Jobs Tech News Resource Center Press Room Advertising About Us IEEE IEEE Computer Society IEEE Computer Society Digital Library My Subscriptions Magazines Journals Conference Proceedings Institutional Subscriptions IEEE IEEE Computer Society More Jobs Tech News Resource Center Press Room Advertising About Us Cart All Advanced Search Conference Cover Image Download 1.Home 2.Proceedings 3.icdcsw 2017 [Title page iii] 2017, pp. iii-iii, DOI Bookmark: 10.1109/ICDCSW.2017.2 Keywords Authors Abstract Presents the title page of the proceedings record. Proceedings IEEE 37th International Conference on Distributed Computing Systems Workshops 5 June 2017 Atlanta, Georgia Editors Dr. Aibek Musaev University of Alabama, USA Dr. Joao E. Ferreira University of Sao Paulo, Brazil Dr. Teruo Higashino University of …"
43,"International Conference on Distributed Computing Systems Workshops, 37: proceedings",0,2017,https://scholar.google.com/citations?view_op=view_citation&hl=en&user=cQPdjdgAAAAJ&pagesize=50&citation_for_view=cQPdjdgAAAAJ:7PzlFSSx8tAC,"ReP USP - Detalhe do registro: International Conference on Distributed Computing Systems Workshops, 37: proceedings Home About USP Schools USP Schools Escola de Artes, Ciências e Humanidades (EACH) Escola de Comunicações e Artes (ECA) Escola de Enfermagem (EE) Escola de Enfermagem de Ribeirão Preto (EERP) Escola de Educação Física e Esporte (EEFE) Escola de Educação Física e Esporte de Ribeirão Preto (EEFERP) Escola de Engenharia de Lorena (EEL) Escola de Engenharia de São Carlos (EESC) Escola Politécnica (EP) Escola Superior de Agricultura Luiz de Queiroz (ESALQ) Faculdade de Arquitetura e Urbanismo (FAU) Faculdade de Ciências Farmacêuticas (FCF) Faculdade de Ciências Farmacêuticas de Ribeirão Preto (FCFRP) Faculdade de Direito (FD) Faculdade de Direito de Ribeirão Preto (FDRP) Faculdade de Economia, Administração, Contabilidade e Atuária (FEA) …"
44,Tutorials [2016 IEEE 2nd International Conference on Collaboration and Internet Computing (CIC)]-2 abstracts,0,2016,https://scholar.google.com/citations?view_op=view_citation&hl=en&user=cQPdjdgAAAAJ&pagesize=50&citation_for_view=cQPdjdgAAAAJ:eQOLeE2rZwMC,Provides an abstract of the 2 tutorial presentation and may include a brief professional biography of the presenter. The complete presentation was not made available for publication as part of the conference proceedings.
45,Tutorials,0,2016,https://scholar.google.com/citations?view_op=view_citation&hl=en&user=cQPdjdgAAAAJ&pagesize=50&citation_for_view=cQPdjdgAAAAJ:Tyk-4Ss8FVUC,Provides an abstract for each of the tutorial presentations and a brief professional biography of each presenter. The complete presentations were not made available for publication as part of the conference proceedings.
46,Landslide information service based on composition of physical and social information services,0,2016,https://scholar.google.com/citations?view_op=view_citation&hl=en&user=cQPdjdgAAAAJ&pagesize=50&citation_for_view=cQPdjdgAAAAJ:zYLM7Y9cAGgC,"Modern world data come from an increasing number of sources, including data from physical sources like satellites and seismic sensors as well as social networks and web logs. While progress has been made in the filtering of individual social networks, there are significant advantages in the integration of big data from multiple sources. For physical events, the integration of physical sensors and social network data can improve filtering efficiency and quality of results beyond what is feasible in each individual data stream. Disasters are representative physical events with real world impact. In this dissertation, I present the LITMUS system that combines data from both physical sensors and social networks to provide information about physical events in near real-time."
