Rank,Title,Citations,Year,URL,Description
1,Effects of the autonomous vehicle crashes on public perception of the technology,129,2021,https://scholar.google.com/citations?view_op=view_citation&hl=en&user=cQPdjdgAAAAJ&pagesize=50&citation_for_view=cQPdjdgAAAAJ:QIV2ME_5wuYC,"In March 2018, an Uber-pedestrian crash and a Tesla's Model X crash attracted a lot of media attention because the vehicles were operating under self-driving and autopilot mode respectively at the time of the crash. This study aims to conduct before-and-after sentiment analysis to examine how these two fatal crashes have affected people's perceptions of self-driving and autonomous vehicle technology using Twitter data. Five different and relevant keywords were used to extract tweets. Over 1.7 million tweets were found within 15 days before and after the incidents with the specific keywords, which were eventually analyzed in this study. The results indicate that after the two incidents, the negative tweets on “self-driving/autonomous” technology increased by 32 percentage points (from 14% to 46%). The compound scores of “pedestrian crash”, “Uber”, and “Tesla” keywords saw a 6% decrease while “self-driving …"
2,LITMUS: a multi-service composition system for landslide detection,68,2014,https://scholar.google.com/citations?view_op=view_citation&hl=en&user=cQPdjdgAAAAJ&pagesize=50&citation_for_view=cQPdjdgAAAAJ:u-x6o8ySG0sC,"Landslides are an illustrative example of multi-hazards, which can be caused by earthquakes, rainfalls and human activity among other reasons. Detection of landslides presents a significant challenge, since there are no physical sensors that would detect landslides directly. A more recent approach in detection of natural hazards, such as earthquakes, involves the use of social media. We propose a multi-service composition approach and describe LITMUS, which is a landslide detection service that combines data from both physical and social information services by filtering and then joining the information flow from those services based on their spatiotemporal features. Our results show that with such approach LITMUS detects 25 out of 27 landslides reported by USGS in December 2013 and 40 more landslide locations unreported by USGS during this period. LITMUS is a prototype tool that is used to investigate …"
3,LITMUS: Landslide detection by integrating multiple sources.,57,2014,https://scholar.google.com/citations?view_op=view_citation&hl=en&user=cQPdjdgAAAAJ&pagesize=50&citation_for_view=cQPdjdgAAAAJ:u5HHmVD_uO8C,"Disasters often lead to other kinds of disasters, forming multi-hazards such as landslides, which may be caused by earthquakes, rainfalls, water erosion, among other reasons. Effective detection and management of multihazards cannot rely only on one information source. In this paper, we evaluate a landslide detection system LITMUS, which combines multiple physical sensors and social media to handle the inherent varied origins and composition of multi-hazards. LITMUS integrates near real-time data from USGS seismic network, NASA TRMM rainfall network, Twitter, YouTube, and Instagram. The landslide detection process consists of several stages of social media filtering and integration with physical sensor data, with a final ranking of relevance by integrated signal strength. Applying LITMUS to data collected in October 2013, we analyzed and filtered 34.5 k tweets, 2.5 k video descriptions and 1.6 k image captions containing landslide keywords followed by integration with physical sources based on a Bayesian model strategy. It resulted in detection of all 11 landslides reported by USGS and 31 more landslides unreported by USGS. An illustrative example is provided to demonstrate how LITMUS’functionality can be used to determine landslides related to the recent Typhoon Haiyan."
4,Detection of Damage and Failure Events of Critical Public Infrastructure using Social Sensor Big Data.,36,2016,https://scholar.google.com/citations?view_op=view_citation&hl=en&user=cQPdjdgAAAAJ&pagesize=50&citation_for_view=cQPdjdgAAAAJ:IjCSPb-OGe4C,"1School of Civil and Environmental Engineering, Georgia Institute of Technology, 790 Atlantic Drive, 30332-0355, Atlanta, GA, USA 2School of Computer Science, Georgia Institute of Technology, Atlanta, GA, USA 3Sam Nunn School of International Affairs, Georgia Institute of Technology, Atlanta, GA, USA"
5,Towards detection of abnormal vehicle behavior using traffic cameras,28,2019,https://scholar.google.com/citations?view_op=view_citation&hl=en&user=cQPdjdgAAAAJ&pagesize=50&citation_for_view=cQPdjdgAAAAJ:3fE2CSJIrl8C,"Throughout the world, many surveillance cameras are being installed every month. For example, there are over 18,000 publicly accessible traffic cameras in 200 cities and metropolitan areas in the United States alone. Live video streams provide real-time big data about behavior happening in the present, such as traffic information. However, until now, extracting intelligence from video content has been mostly manual, i.e. through human observation. The development of smart real-time tools that can detect abnormal vehicle behaviors may alert law enforcement and transportation agencies of possible violators and can potentially avoid traffic accidents. In this study, we address this problem by developing an application for detection of abnormal driving behavior using traffic video streams. Evaluation is performed using real videos from traffic cameras to detect stalled vehicles and possible abnormal vehicle behavior."
6,Landslide detection service based on composition of physical and social information services,22,2014,https://scholar.google.com/citations?view_op=view_citation&hl=en&user=cQPdjdgAAAAJ&pagesize=50&citation_for_view=cQPdjdgAAAAJ:d1gkVwhDpl0C,"Social media have been used in the detection and management of natural hazards such as earthquakes. However, disasters often lead to other kinds of disasters, forming multi-hazards. Landslide is an illustrative example of a multi-hazard, which may be caused by earthquakes, rainfalls, water erosion, among other reasons. Detecting such multi-hazards is a significant challenge, since physical sensors designed for specific disasters are insufficient for multi-hazards. We describe LITMUS -- a landslide detection service based on a multi-service composition approach that combines data from both physical and social information services by filtering and then joining the information flow from those services based on their spatiotemporal features. Our results show that with such approach LITMUS detects 25 out of 27 landslides reported by USGS in December and 40 more landslides unreported by USGS. Also, LITMUS …"
7,Oral healthcare implications of dedicated online communities: A computational content analysis of the r/Dentistry subreddit,20,2021,https://scholar.google.com/citations?view_op=view_citation&hl=en&user=cQPdjdgAAAAJ&pagesize=50&citation_for_view=cQPdjdgAAAAJ:aqlVkmm33-oC,"The current study explores communication expressed by participants in a subreddit surrounding oral health care, moderated by dentists and dental hygienists. The corpus was analyzed through Leximancer, a computer-assisted program used for computational content analyses of large data sets. Users’ personal disclosures about ongoing dental concerns, advice about others’ self-care, and the role of interpersonal communication with and among health care providers emerged as dominant themes. The findings suggest that online communities may serve an important role that dentists are unable to fill in their limited interactions with individual patients. Such interaction spaces may therefore offer a fertile environment for future interventions to promote beneficial practices and achieve positive health-related outcomes."
8,Toward a real-time service for landslide detection: Augmented explicit semantic analysis and clustering composition approaches,18,2015,https://scholar.google.com/citations?view_op=view_citation&hl=en&user=cQPdjdgAAAAJ&pagesize=50&citation_for_view=cQPdjdgAAAAJ:UeHWp8X0CEIC,"The use of Social Media for event detection, such as detection of natural disasters, has gained a booming interest from research community as Social Media has become an immensely important source of real-time information. However, it poses a number of challenges with respect to high volume, noisy information and lack of geo-tagged data. Extraction of high quality information (e.g., Accurate locations of events) while maintaining good performance (e.g., Low latency) are the major problems. In this paper, we propose two approaches for tackling these issues: an augmented Explicit Semantic Analysis approach for rapid classification and a composition of clustering algorithms for location estimation. Our experiments demonstrate over 98% in precision, recall and F-measure when classifying Social Media data while producing a 20% improvement in location estimation due to clustering composition approach. We …"
9,Preliminary research on thesaurus-based query expansion for Twitter data extraction,16,2018,https://scholar.google.com/citations?view_op=view_citation&hl=en&user=cQPdjdgAAAAJ&pagesize=50&citation_for_view=cQPdjdgAAAAJ:Se3iqnhoufwC,"With the increasing popularity of microblogging and social media platforms like Twitter, researchers are trying to make use of the massive amount of user-created data to explore new applications/tools. Success of research in data science is highly dependent on the amount and type of data collected. For this effort, a thesaurus-based query expansion technique from information retrieval will be used to extract additional Twitter data. Though there has been research in this general area, our effort concentrates on applying a thesaurus-based query expansion for Twitter retrieval. Experiments are performed to collect Twitter data using the proposed approach for query terms related to disaster situations like hurricanes and shootings. We observed an increase of 32% in tweets received for the Hurricane Harvey event, and a 131% increase in the volume of tweets for a query related to the Vegas shooting incidence using …"
10,Fast text classification using randomized explicit semantic analysis,16,2015,https://scholar.google.com/citations?view_op=view_citation&hl=en&user=cQPdjdgAAAAJ&pagesize=50&citation_for_view=cQPdjdgAAAAJ:2osOgNQ5qMEC,"Document classification or document categorization is one of the most studied areas in computer science due to its importance. The problem is to assign a document using its text to one or more classes or categories from a predefined set. We propose a new approach for fast text classification using randomized explicit semantic analysis (RS-ESA). It is based on a state of the art approach for word sense disambiguation based on Wikipedia, the largest encyclopedia in existence. Our method reduces Wikipedia repository using a random sample approach resulting in a throughput, which is an order of magnitude faster than the original explicit semantic analysis. RS-ESA approach has been implemented as part of the LITMUS project due to a need in classifying data from Social Media into relevant and irrelevant items with respect to landslide as a natural disaster. We demonstrate that our approach achieves 96 …"
11,Preliminary research on vehicle speed detection using traffic cameras,15,2019,https://scholar.google.com/citations?view_op=view_citation&hl=en&user=cQPdjdgAAAAJ&pagesize=50&citation_for_view=cQPdjdgAAAAJ:qxL8FJ1GzNcC,"Recently, research on detection of abnormal vehicle behavior is getting increasing attention through various approaches, including interval speed measurement using radars, binocular surveillance cameras, and infrared speed sensors. In most areas in the U.S., such detection is still performed manually by the highway patrol. This paper presents a novel approach for detecting abnormal vehicle behavior using the traditional traffic surveillance cameras. Once the vehicle is within the camera field of view (FOV), its estimated speed is automatically detected based on designated references with respect to dashed white lines on roads, such that the speed of the vehicle is computed using techniques. The proposed method, if validated and facilitated, can largely reduce the cost of upgrading surveillance infrastructure as well as the extra human administrative burden."
12,Using twitter data to determine hurricane category: An experiment,14,2023,https://scholar.google.com/citations?view_op=view_citation&hl=en&user=cQPdjdgAAAAJ&pagesize=50&citation_for_view=cQPdjdgAAAAJ:ZeXyd9-uunAC,"Social media posts contain an abundant amount of information about public opinion on major events, especially natural disasters such as hurricanes. Posts related to an event, are usually published by the users who live near the place of the event at the time of the event. Special correlation between the social media data and the events can be obtained using data mining approaches. This paper presents research work to find the mappings between social media data and the severity level of a disaster. Specifically, we have investigated the Twitter data posted during hurricanes Harvey and Irma, and attempted to find the correlation between the Twitter data of a specific area and the hurricane level in that area. Our experimental results indicate a positive correlation between them. We also present a method to predict the hurricane category for a specific area using relevant Twitter data."
13,Concept drift adaptive physical event detection for social media streams,14,2019,https://scholar.google.com/citations?view_op=view_citation&hl=en&user=cQPdjdgAAAAJ&pagesize=50&citation_for_view=cQPdjdgAAAAJ:MXK_kJrjxJIC,"Event detection has long been the domain of physical sensors operating in a static dataset assumption. The prevalence of social media and web access has led to the emergence of social, or human sensors who report on events globally. This warrants development of event detectors that can take advantage of the truly dense and high spatial and temporal resolution data provided by more than 3 billion social users. The phenomenon of concept drift, which causes terms and signals associated with a topic to change over time, renders static machine learning ineffective. Towards this end, we present an application for physical event detection on social sensors that improves traditional physical event detection with concept drift adaptation. Our approach continuously updates its machine learning classifiers automatically, without the need for human intervention. It integrates data from heterogeneous sources and is …"
14,Gathering high quality information on landslides from twitter by relevance ranking of users and tweets,14,2016,https://scholar.google.com/citations?view_op=view_citation&hl=en&user=cQPdjdgAAAAJ&pagesize=50&citation_for_view=cQPdjdgAAAAJ:Y0pCki6q_DkC,"Social networking platforms are increasingly used to report or pass along news and other valuable information. Their use rises especially during emergency situations and can be monitored for the analysis of adverse events, such as disasters. In this paper, we provide an overview of a comprehensive disaster information system using social networks with landslides serving as an illustrative example. We briefly describe each of the steps involved and focus on the classification and ranking steps that determine the relevance of individual messages and groups of messages to landslides. We introduce the concept of ""relevant"" and ""irrelevant"" virtual communities of users and compute their influence in each of them. This allows us to improve the existing relevance ranking formula by taking into account not only the semantics of the messages posted by users, but also the users' influence and the amount of their activity in …"
15,Beyond artificial reality: Finding and monitoring live events from social sensors,13,2020,https://scholar.google.com/citations?view_op=view_citation&hl=en&user=cQPdjdgAAAAJ&pagesize=50&citation_for_view=cQPdjdgAAAAJ:4DMP91E08xMC,"With billions of active social media accounts and millions of live video cameras, live new big data offer many opportunities for smart applications. However, the main consumers of the new big data have been humans. We envision the research on live knowledge, to automatically acquire real-time, validated, and actionable information. Live knowledge presents two significant and diverging technical challenges: big noise and concept drift. We describe the EBKA (evidence-based knowledge acquisition) approach, illustrated by the LITMUS landslide information system. LITMUS achieves both high accuracy and wide coverage, demonstrating the feasibility and promise of EBKA approach to achieve live knowledge."
16,Detection of damage and failure events of road infrastructure using social media,12,2018,https://scholar.google.com/citations?view_op=view_citation&hl=en&user=cQPdjdgAAAAJ&pagesize=50&citation_for_view=cQPdjdgAAAAJ:hqOjcs7Dif8C,"We study the problem of estimating the state of road infrastructure, which is the backbone of transportation system. Road infrastructure can suffer from various issues, including structural failures, such as potholes, and non-structural issues, such as broken traffic lights. However, it is infeasible to cover all roads with physical sensors for monitoring purposes. Instead, we propose to use social sensor big data to detect and estimate these issues based on the public’s activity. As a demonstration, we generate a map of detected road problems based on tweets. The map displays the currently detected hotspots, where for each hotspot we compute the overall sentiment provided by the public. In addition, we identify the peak of public activity during the evaluation period and investigate the key drivers of that peak. Finally, we analyze the most influential users using an extension of PageRank. The proposed approach adds a …"
17,Landslide information service based on composition of physical and social sensors,9,2017,https://scholar.google.com/citations?view_op=view_citation&hl=en&user=cQPdjdgAAAAJ&pagesize=50&citation_for_view=cQPdjdgAAAAJ:YsMSGLbcyi4C,"Modern world data come from an increasing number of sources, including data from physical sensors like weather satellites and seismographs as well as social networks and web logs. While progress has been made in the filtering of individual social networks, there are significant advantages in the integration of big data from multiple sources. For physical events, the integration of physical sensors and social network data can improve filtering efficiency and quality of results beyond what is feasible in each individual data stream. Disasters are representative physical events with real world impact. As illustration and demonstration, we have built the LITMUS landslide information service that combines data from both physical sensors and social networks in real-time. LITMUS filters and combines reliable but indirect physical data with direct report social media data on landslides to achieve high quality and wide …"
18,Towards in-store multi-person tracking using head detection and track heatmaps,8,2020,https://scholar.google.com/citations?view_op=view_citation&hl=en&user=cQPdjdgAAAAJ&pagesize=50&citation_for_view=cQPdjdgAAAAJ:Wp0gIr-vW9MC,"Computer vision algorithms are being implemented across a breadth of industries to enable technological innovations. In this paper, we study the problem of computer vision based customer tracking in retail industry. To this end, we introduce a dataset collected from a camera in an office environment where participants mimic various behaviors of customers in a supermarket. In addition, we describe an illustrative example of the use of this dataset for tracking participants based on a head tracking model in an effort to minimize errors due to occlusion. Furthermore, we propose a model for recognizing customers and staff based on their movement patterns. The model is evaluated using a real-world dataset collected in a supermarket over a 24-hour period that achieves 98% accuracy during training and 93% accuracy during evaluation."
19,Information diffusion analysis of rumor dynamics over a social-interaction based model,8,2016,https://scholar.google.com/citations?view_op=view_citation&hl=en&user=cQPdjdgAAAAJ&pagesize=50&citation_for_view=cQPdjdgAAAAJ:W7OEmFMy1HYC,"Rumors may potentially cause undesirable effect such as the widespread panic in the general public. Especially, with the unprecedented growth of different types of social and enterprise networks, rumors could reach a larger audience than before. Many researchers have proposed different approaches to analyze and detect rumors in social networks. However, most of them either study on theoretical models without real data experiments or use content-based analysis and limited information diffusion analysis without fully considering social interactions. In this paper, we propose a social interaction based model FAST by taking four major properties of social interactions into account including familiarity, activeness, similarity, and trustworthiness. Also, we evaluate our model on real data from Sina Weibo (Twitter-like social network in China), which contains around 200 million tweets and 14 million Weibo users. Based …"
20,Harnessing Data to Create an Effective Drought Management System.,7,2018,https://scholar.google.com/citations?view_op=view_citation&hl=en&user=cQPdjdgAAAAJ&pagesize=50&citation_for_view=cQPdjdgAAAAJ:UebtZRa9Y70C,"Drought is a billion-dollar weather and climate disaster. It is a complex climate phenomenon that slowly emerges and quickly vanishes, making it hard for local stakeholders and the public to respond in a timely manner. To reduce the vulnerability of our society to future drought, a better understanding of how society responds to drought is critical. Here, we propose a pilot study about social response to a recent California drought through social media. In this study, we identify the most important users in the collected dataset using an extension of PageRank, the algorithm developed for Google Search. We investigate the key drivers of the peak of the Twitter activities in February, 2014, during the California drought. We also create a word cloud from the top 2,000 most retweeted tweets. Lastly, we specify the information sources from those tweets. The findings of this study show that big data can help us to improve current drought response plans through fundamental understanding of social response to drought."
21,Rex: Rapid ensemble classification system for landslide detection using social media,7,2017,https://scholar.google.com/citations?view_op=view_citation&hl=en&user=cQPdjdgAAAAJ&pagesize=50&citation_for_view=cQPdjdgAAAAJ:_FxGoFyzp5QC,"We study the problem of using Social Media to detect natural disasters, of which we are interested in a special kind, namely landslides. Employing information from Social Media presents unique research challenges, as there exists a considerable amount of noise due to multiple meanings of the search keywords, such as ""landslide"" and ""mudslide"". To tackle these challenges, we propose REX, a rapid ensemble classification system which can filter out noisy information by implementing two key ideas: (I) a new method for constructing independent classifiers that can be used for rapid ensemble classification of Social Media texts, where each classifier is built using randomized Explicit Semantic Analysis; and (II) a self-correction approach which takes advantage of the observation that the majority label assigned to Social Media texts belonging to a large event is highly accurate. We perform experiments using real data …"
22,Towards multilingual automated classification systems,7,2017,https://scholar.google.com/citations?view_op=view_citation&hl=en&user=cQPdjdgAAAAJ&pagesize=50&citation_for_view=cQPdjdgAAAAJ:ufrVoPGSRksC,"In this paper we propose and evaluate three approaches for automated classification of texts in over 60 languages without the need for a manually annotated dataset in those languages. All approaches are based on the randomized Explicit Semantic Analysis method using multilingual Wikipedia articles as their knowledge repository. We evaluate the proposed approaches by classifying a Twitter dataset in English and Portuguese into relevant and irrelevant items with respect to landslide as a natural disaster, where the highest achieved F1-score is 0.93. These approaches can be used in various applications where multilingual classification is needed, including multilingual disaster reporting using Social Media to improve coverage and increase confidence. As illustration, we present a demonstration that combines data from physical sensors and social networks to detect landslide events reported in English and …"
