Rank,Title,Citations,Year,URL,Description
44,Perovskite-supported Pt single atoms for methane activation,44,2020,https://scholar.google.com/citations?view_op=view_citation&hl=en&user=2QsddMIAAAAJ&pagesize=50&citation_for_view=2QsddMIAAAAJ:JoZmwDi-zQgC,"ABO3 perovskites are increasingly being explored as catalysts, but it is unclear how they behave as supports for single atoms and how the subsequent single-atom catalysts can be employed for important reactions such as methane activation. Here we examine the stability of Pt single atoms (Pt1) on the commonly exposed (100) surfaces of SrBO3 perovskites (B = 3d transition metals) and their methane-adsorption properties by first principles density functional theory. We find that the stability and charge state of Pt1 on the SrBO3(100) surfaces are termination-sensitive. Due to polar compensation, Pt1 is negatively charged on the A termination but positively charged on the B termination. This charge state greatly impacts methane adsorption: negatively charged Pt1 on the A-termination chemisorbs methane (in some cases, dissociatively), but positively charged Pt1 on the B-termination adsorbs methane physically …"
45,Promotion of catalytic selectivity on transition metal oxide through restructuring surface lattice,39,2018,https://scholar.google.com/citations?view_op=view_citation&hl=en&user=2QsddMIAAAAJ&pagesize=50&citation_for_view=2QsddMIAAAAJ:5Ul4iDaHHb8C,"Pursuit of high catalytic selectivity is paramount in the design of catalysts for green chemical processes towards minimizing the production of undesired products. We demonstrated that catalytic selectivity for production of alkene through oxidative dehydrogenation of alkane on transition metal oxides can be promoted through tailoring the surface lattice of the oxide catalyst. Selectivity for production of ethylene through oxidative dehydrogenation (ODH) of ethane on Co3O4 nanocrystals can be substantially increased by 30%–35% via temperature-mediated reconstruction of surface lattice of Co3O4. Co3O4 nanocrystals formed at 800 °C leads to smooth, flat crystal plane with predominantly exposed (111) facet in contrast to high Miller index (311) facet of Co3O4 formed at ≤700 °C, revealed by environmental transmission electron microscopy. Isotope-labelled experiments suggest that the higher catalytic selectivity …"
46,New insights into the bulk and surface defect structures of ceria nanocrystals from neutron scattering study,38,2021,https://scholar.google.com/citations?view_op=view_citation&hl=en&user=2QsddMIAAAAJ&pagesize=50&citation_for_view=2QsddMIAAAAJ:kzcrU_BdoSEC,"Neutron diffraction and pair distribution function studies coupled with Raman spectroscopy have successfully unraveled the detailed oxygen defect structures of ceria nanocubes and nanorods. Two types of defect sites are revealed for the ceria nanocrystals: surface and bulk defects. It is proposed that the surface oxygen defects in both types of CeO2 nanocrystals are predominantly the partially reduced Ce3O5+x, with the bulk defect structures dominated by interstitial Frenkel-type oxygen vacancies. Ceria nanorods possess much higher concentration of surface oxygen defects relative to the nanocubes, albeit with only slightly higher concentration of bulk Frenkel-type oxygen vacancies. Upon annealing the nanorod sample at 600 °C under vacuum (∼10–4 to 10–5 mbar), a partially reduced ceria phase with long-range oxygen vacancy ordering (Ce3O5+x) has been observed experimentally for the first time. This …"
47,Superior electrocatalytic hydrogen evolution at engineered non-stoichiometric two-dimensional transition metal dichalcogenide edges,37,2019,https://scholar.google.com/citations?view_op=view_citation&hl=en&user=2QsddMIAAAAJ&pagesize=50&citation_for_view=2QsddMIAAAAJ:t6usbXjVLHcC,"Two-dimensional transition metal dichalcogenide (TMDC) edges show activity for the catalytic hydrogen evolution reaction (HER), but further improvements require extrinsic doping, usually performed in an Edisonian manner. Herein we investigate if tuning the non-stoichiometric degree of the edges itself can improve HER activities. Using first-principles density functional theory (DFT), we study six non-stoichiometric MoSe2 edges that have been recently synthesized under a scanning transmission electron microscope (STEM). We find that non-stoichiometric edges can have near optimal HER activity over conventional stoichiometric edges. More excitingly, we find a strong linear correlation between Bader charges on H and the Gibbs free energy of hydrogen adsorption (ΔGH) at these edges, providing a design principle for discovering better HER catalytic edges. In general, HER activity is not only influenced by the …"
48,"Trends of alkane activation on doped cobalt (II, III) oxide from first principles",32,2018,https://scholar.google.com/citations?view_op=view_citation&hl=en&user=2QsddMIAAAAJ&pagesize=50&citation_for_view=2QsddMIAAAAJ:Tiz5es2fbqcC,"The surface doping of a metal oxide can tune its catalytic performance, but it remains unclear how the tuning depends on the dopant type and the surface facet. Herein we study doped Co3O4 (1 1 1) and (3 1 1) surface facets using first‐principles density functional theory (DFT) to obtain general descriptors for oxygen reactivity (which include vacancy formation energy and hydrogen adsorption energy) and correlate them to ethane C−H activation energy as a measure of the catalytic performance. The periodic trends of the dopants are investigated for a total of 20 dopants, namely, the elements from K to Ge. We find strong linear correlations between the oxygen reactivity descriptors and the computed energy barriers. We also discover a strong surface facet sensitivity among certain dopants such that different surface orientations and sites lead to different or even the opposite dopant performance. This work …"
49,Predicting synthesizable multi-functional edge reconstructions in two-dimensional transition metal dichalcogenides,29,2020,https://scholar.google.com/citations?view_op=view_citation&hl=en&user=2QsddMIAAAAJ&pagesize=50&citation_for_view=2QsddMIAAAAJ:PELIpwtuRlgC,"Two-dimensional (2D) transition metal dichalcogenides (TMDCs) have attracted tremendous interest as functional materials due to their exceptionally diverse and tunable properties, especially in their edges. In addition to the conventional armchair and zigzag edges common to hexagonal 2D materials, more complex edge reconstructions can be realized through careful control over the synthesis conditions. However, the whole family of synthesizable, reconstructed edges remains poorly studied. Here, we develop a computational approach integrating ensemble-generation, force-relaxation, and electronic-structure calculations to systematically and efficiently discover additional reconstructed edges and screen their functional properties. Using MoS2 as a model system, we screened hundreds of edge-reconstruction to discover over 160 reconstructed edges to be more stable than the conventional ones. More …"
50,Methane Chemisorption on Oxide‐Supported Pt Single Atom,29,2019,https://scholar.google.com/citations?view_op=view_citation&hl=en&user=2QsddMIAAAAJ&pagesize=50&citation_for_view=2QsddMIAAAAJ:HE397vMXCloC,"Methane chemisorption has been recently demonstrated on the rutile IrO2(110) surface. However, it remains unclear how the general requirements are for methane chemisorption or complexation with a single atom on an oxide surface. By exploring methane adsorption on Pt1 substitutionally doped on many rutile‐type oxides using hybrid density functional theory, we show that the occupancy of the Pt dz2 orbital is the key to methane chemisorption. Pt single atom on the semiconducting or wide‐gap oxides such as TiO2 and GeO2 strongly chemisorbs methane, because the empty Pt dz2 orbital is located in the gap and can effectively accept σ‐electron donation from the methane C−H bond. In contrast, Pt single atom on metallic oxides such as IrO2 and RuO2 does not chemisorb methane, because the Pt dz2 orbital strongly mixes with the support‐oxide electronic states and become more occupied, losing its ability …"
