Rank,Title,Citations,Year,URL,Description
1,Golden single-atomic-site platinum electrocatalysts,393,2018,https://scholar.google.com/citations?view_op=view_citation&hl=en&user=2QsddMIAAAAJ&pagesize=50&citation_for_view=2QsddMIAAAAJ:q3oQSFYPqjQC,"Bimetallic nanoparticles with tailored structures constitute a desirable model system for catalysts, as crucial factors such as geometric and electronic effects can be readily controlled by tailoring the structure and alloy bonding of the catalytic site. Here we report a facile colloidal method to prepare a series of platinum–gold (PtAu) nanoparticles with tailored surface structures and particle diameters on the order of 7 nm. Samples with low Pt content, particularly Pt4Au96, exhibited unprecedented electrocatalytic activity for the oxidation of formic acid. A high forward current density of 3.77 A mgPt−1 was observed for Pt4Au96, a value two orders of magnitude greater than those observed for core–shell structured Pt78Au22 and a commercial Pt nanocatalyst. Extensive structural characterization and theoretical density functional theory simulations of the best-performing catalysts revealed densely packed single-atom Pt …"
2,"Insights into interfaces, stability, electronic properties, and catalytic activities of atomically precise metal nanoclusters from first principles",334,2018,https://scholar.google.com/citations?view_op=view_citation&hl=en&user=2QsddMIAAAAJ&pagesize=50&citation_for_view=2QsddMIAAAAJ:V3AGJWp-ZtQC,"ConspectusAtomically precise, ligand-protected metal nanoclusters are of great interest for their well-defined structures, intriguing physicochemical properties, and potential applications in catalysis, biology, and nanotechnology. Their structure precision provides many opportunities to correlate their geometries, stability, electronic properties, and catalytic activities by closely integrating theory and experiment. In this Account, we highlight recent theoretical advances from our efforts to understand the metal–ligand interfaces, the energy landscape, the electronic structure and optical absorption, and the catalytic applications of atomically precise metal nanoclusters. We mainly focus on gold nanoclusters.The bonding motifs and energetics at the gold–ligand interfaces are two main interests from a computational perspective. For the gold–thiolate interface, the −RS–Au–SR– staple motif is not always preferred; in fact, the …"
3,Benchmarking graph neural networks for materials chemistry,325,2021,https://scholar.google.com/citations?view_op=view_citation&hl=en&user=2QsddMIAAAAJ&pagesize=50&citation_for_view=2QsddMIAAAAJ:dQ2og3OwTAUC,"Graph neural networks (GNNs) have received intense interest as a rapidly expanding class of machine learning models remarkably well-suited for materials applications. To date, a number of successful GNNs have been proposed and demonstrated for systems ranging from crystal stability to electronic property prediction and to surface chemistry and heterogeneous catalysis. However, a consistent benchmark of these models remains lacking, hindering the development and consistent evaluation of new models in the materials field. Here, we present a workflow and testing platform, MatDeepLearn, for quickly and reproducibly assessing and comparing GNNs and other machine learning models. We use this platform to optimize and evaluate a selection of top performing GNNs on several representative datasets in computational materials chemistry. From our investigations we note the importance of hyperparameter …"
4,Single rhodium atoms anchored in micropores for efficient transformation of methane under mild conditions,323,2018,https://scholar.google.com/citations?view_op=view_citation&hl=en&user=2QsddMIAAAAJ&pagesize=50&citation_for_view=2QsddMIAAAAJ:4fKUyHm3Qg0C,"Catalytic transformation of CH4 under a mild condition is significant for efficient utilization of shale gas under the circumstance of switching raw materials of chemical industries to shale gas. Here, we report the transformation of CH4 to acetic acid and methanol through coupling of CH4, CO and O2 on single-site Rh1O5 anchored in microporous aluminosilicates in solution at ≤150 °C. The activity of these singly dispersed precious metal sites for production of organic oxygenates can reach about 0.10 acetic acid molecules on a Rh1O5 site per second at 150 °C with a selectivity of ~70% for production of acetic acid. It is higher than the activity of free Rh cations by >1000 times. Computational studies suggest that the first C–H bond of CH4 is activated by Rh1O5 anchored on the wall of micropores of ZSM-5; the formed CH3 then couples with CO and OH, to produce acetic acid over a low activation barrier."
5,Understanding seed-mediated growth of gold nanoclusters at molecular level,318,2017,https://scholar.google.com/citations?view_op=view_citation&hl=en&user=2QsddMIAAAAJ&pagesize=50&citation_for_view=2QsddMIAAAAJ:WbkHhVStYXYC,"The continuous development of total synthesis chemistry has allowed many organic and biomolecules to be produced with known synthetic history–that is, a complete set of step reactions in their synthetic routes. Here, we extend such molecular-level precise reaction routes to nanochemistry, particularly to a seed-mediated synthesis of inorganic nanoparticles. By systematically investigating the time−dependent abundance of 35 intermediate species in total, we map out relevant step reactions in a model size growth reaction from molecularly pure Au25 to Au44 nanoparticles. The size growth of Au nanoparticles involves two different size−evolution processes (monotonic LaMer growth and volcano-shaped aggregative growth), which are driven by a sequential 2-electron boosting of the valence electron count of Au nanoparticles. Such fundamental findings not only provide guiding principles to produce other sizes of …"
6,Machine learned features from density of states for accurate adsorption energy prediction,250,2021,https://scholar.google.com/citations?view_op=view_citation&hl=en&user=2QsddMIAAAAJ&pagesize=50&citation_for_view=2QsddMIAAAAJ:hkOj_22Ku90C,"Materials databases generated by high-throughput computational screening, typically using density functional theory (DFT), have become valuable resources for discovering new heterogeneous catalysts, though the computational cost associated with generating them presents a crucial roadblock. Hence there is a significant demand for developing descriptors or features, in lieu of DFT, to accurately predict catalytic properties, such as adsorption energies. Here, we demonstrate an approach to predict energies using a convolutional neural network-based machine learning model to automatically obtain key features from the electronic density of states (DOS). The model, DOSnet, is evaluated for a diverse set of adsorbates and surfaces, yielding a mean absolute error on the order of 0.1 eV. In addition, DOSnet can provide physically meaningful predictions and insights by predicting responses to external …"
7,Nickel–platinum nanoparticles as peroxidase mimics with a record high catalytic efficiency,247,2021,https://scholar.google.com/citations?view_op=view_citation&hl=en&user=2QsddMIAAAAJ&pagesize=50&citation_for_view=2QsddMIAAAAJ:JQOojiI6XY0C,"While nanoscale mimics of peroxidase have been extensively developed over the past decade or so, their catalytic efficiency as a key parameter has not been substantially improved in recent years. Herein, we report a class of highly efficient peroxidase mimic–nickel–platinum nanoparticles (Ni–Pt NPs) that consist of nickel-rich cores and platinum-rich shells. The Ni–Pt NPs exhibit a record high catalytic efficiency with a catalytic constant (Kcat) as high as 4.5 × 107 s–1, which is ∼46- and 104-fold greater than the Kcat values of conventional Pt nanoparticles and natural peroxidases, respectively. Density functional theory calculations reveal that the unique surface structure of Ni–Pt NPs weakens the adsorption of key intermediates during catalysis, which boosts the catalytic efficiency. The Ni–Pt NPs were applied to an immunoassay of a carcinoembryonic antigen that achieved an ultralow detection limit of 1.1 pg/mL …"
8,Oxidative dehydrogenation of propane to propylene with soft oxidants via heterogeneous catalysis,209,2021,https://scholar.google.com/citations?view_op=view_citation&hl=en&user=2QsddMIAAAAJ&pagesize=50&citation_for_view=2QsddMIAAAAJ:_Ybze24A_UAC,"Oxidative dehydrogenation of propane to propylene can be achieved using conventional, oxygen-assisted dehydrogenation of propane (O2–ODHP) or via the use of soft oxidants, such as CO2, N2O, S-containing compounds, and halogens/halides. The major roles of soft oxidants include inhibiting overoxidation and improving propylene selectivity, which are considered to be current challenges in O2-assisted dehydrogenation. For both CO2– and N2O–ODHP reactions, significant efforts have been devoted to developing redox-active (e.g., chromium, vanadate, iron, etc.), nonredox-type main group metal oxide (e.g., group IIIA, gallium), and other transition metal/metal oxide catalysts (e.g., molybdenum, palladium platinum, rhodium, ruthenium, etc.), as well as zeolite-based catalysts with adjustable acid–base properties, unique pore structures, and topologies. Metal sulfides have shown promising performance in …"
9,"High-throughput predictions of metal–organic framework electronic properties: theoretical challenges, graph neural networks, and data exploration",184,2022,https://scholar.google.com/citations?view_op=view_citation&hl=en&user=2QsddMIAAAAJ&pagesize=50&citation_for_view=2QsddMIAAAAJ:tzM49s52ZIMC,"With the goal of accelerating the design and discovery of metal–organic frameworks (MOFs) for electronic, optoelectronic, and energy storage applications, we present a dataset of predicted electronic structure properties for thousands of MOFs carried out using multiple density functional approximations. Compared to more accurate hybrid functionals, we find that the widely used PBE generalized gradient approximation (GGA) functional severely underpredicts MOF band gaps in a largely systematic manner for semi-conductors and insulators without magnetic character. However, an even larger and less predictable disparity in the band gap prediction is present for MOFs with open-shell 3d transition metal cations. With regards to partial atomic charges, we find that different density functional approximations predict similar charges overall, although hybrid functionals tend to shift electron density away from the metal …"
10,Harnessing strong metal–support interactions via a reverse route,179,2020,https://scholar.google.com/citations?view_op=view_citation&hl=en&user=2QsddMIAAAAJ&pagesize=50&citation_for_view=2QsddMIAAAAJ:LjlpjdlvIbIC,"Engineering strong metal–support interactions (SMSI) is an effective strategy for tuning structures and performances of supported metal catalysts but induces poor exposure of active sites. Here, we demonstrate a strong metal–support interaction via a reverse route (SMSIR) by starting from the final morphology of SMSI (fully-encapsulated core–shell structure) to obtain the intermediate state with desirable exposure of metal sites. Using core–shell nanoparticles (NPs) as a building block, the Pd–FeOx NPs are transformed into a porous yolk–shell structure along with the formation of SMSIR upon treatment under a reductive atmosphere. The final structure, denoted as Pd–Fe3O4–H, exhibits excellent catalytic performance in semi-hydrogenation of acetylene with 100% conversion and 85.1% selectivity to ethylene at 80 °C. Detailed electron microscopic and spectroscopic experiments coupled with computational …"
11,Descriptors for hydrogen evolution on single atom catalysts in nitrogen-doped graphene,155,2020,https://scholar.google.com/citations?view_op=view_citation&hl=en&user=2QsddMIAAAAJ&pagesize=50&citation_for_view=2QsddMIAAAAJ:ZuybSZzF8UAC,"Single-atom catalysts (SACs) are a new research frontier in electrocatalysis such as in the hydrogen evolution reaction (HER). Recent theoretical and experimental studies have demonstrated that certain M–N–C (metal–nitrogen–carbon) based SACs exhibit excellent performance for HER. Here we report a new approach to tune HER activity for SACs by changing the size and dimensionality of the carbon substrate while maintaining the same coordination environment. We screen the 3d, 4d, and 5d transition metal SACs in N-doped 2D graphene and nanographenes of several sizes for HER using first-principles density functional theory (DFT). Nanographenes containing V, Rh, and Ir are predicted to have significantly enhanced HER activity compared to their 2D graphene counterparts. We turn to machine learning to accurately predict the free energy of hydrogen adsorption (ΔGH) based on various descriptors and …"
12,Precise control of alloying sites of bimetallic nanoclusters via surface motif exchange reaction,152,2017,https://scholar.google.com/citations?view_op=view_citation&hl=en&user=2QsddMIAAAAJ&pagesize=50&citation_for_view=2QsddMIAAAAJ:08ZZubdj9fEC,"Precise control of alloying sites has long been a challenging pursuit, yet little has been achieved for the atomic-level manipulation of metallic nanomaterials. Here we describe utilization of a surface motif exchange (SME) reaction to selectively replace the surface motifs of parent [Ag44(SR)30]4− (SR = thiolate) nanoparticles (NPs), leading to bimetallic NPs with well-defined molecular formula and atomically-controlled alloying sites in protecting shell. A systematic mass (and tandem mass) spectrometry analysis suggests that the SME reaction is an atomically precise displacement of SR–Ag(I)–SR-protecting modules of Ag NPs by the incoming SR–Au(I)–SR modules, giving rise to a core-shell [Ag32@Au12(SR)30]4−. Theoretical calculation suggests that the thermodynamically less favorable core-shell Ag@Au nanostructure is kinetically stabilized by the intermediate Ag20 shell, preventing inward diffusion of the …"
13,Hydrogen spillover and its relation to hydrogenation: observations on structurally defined single‐atom sites,146,2022,https://scholar.google.com/citations?view_op=view_citation&hl=en&user=2QsddMIAAAAJ&pagesize=50&citation_for_view=2QsddMIAAAAJ:uJ-U7cs_P_0C,"Hydrogen spillover, involving the transfer of H atoms from metal sites onto the catalyst support, is ubiquitous in chemical processes such as catalytic hydrogenation and hydrogen storage. Atomic level information concerning the kinetics of this process, the structural evolution of catalysts during hydrogen spillover, as well as the nature of participation of the spilled over H in catalysis, remain vastly lacking. Here, we provide insights to those questions with a solubilized polyoxometalate‐supported single‐atom catalyst which allows for the use of characterization techniques generally inaccessible to the study of heterogeneous catalysts. Hydrogenation kinetics together with poisoning studies further reveal that hydrogen spillover can be either detrimental or beneficial for catalysis, the direction and magnitude of which depends mostly on the nature of the reducible functional group. Similar trends were observed on one of …"
14,Radical chemistry and reaction mechanisms of propane oxidative dehydrogenation over hexagonal boron nitride catalysts,134,2020,https://scholar.google.com/citations?view_op=view_citation&hl=en&user=2QsddMIAAAAJ&pagesize=50&citation_for_view=2QsddMIAAAAJ:SdhP9T11ey4C,"Although hexagonal boron nitride (h‐BN) has recently been identified as a highly efficient catalyst for the oxidative dehydrogenation of propane (ODHP) reaction, the reaction mechanisms, especially regarding radical chemistry of this system, remain elusive. Now, the first direct experimental evidence of gas‐phase methyl radicals (CH3.) in the ODHP reaction over boron‐based catalysts is achieved by using online synchrotron vacuum ultraviolet photoionization mass spectroscopy (SVUV‐PIMS), which uncovers the existence of gas‐phase radical pathways. Combined with density functional theory (DFT) calculations, the results demonstrate that propene is mainly generated on the catalyst surface from the C−H activation of propane, while C2 and C1 products can be formed via both surface‐mediated and gas‐phase pathways. These observations provide new insights towards understanding the ODHP reaction …"
15,Synthesis of Water-Soluble [Au25(SR)18]− Using a Stoichiometric Amount of NaBH4,118,2018,https://scholar.google.com/citations?view_op=view_citation&hl=en&user=2QsddMIAAAAJ&pagesize=50&citation_for_view=2QsddMIAAAAJ:BrmTIyaxlBUC,"Determination of the stoichiometry of reactions is a pivotal step for any chemical reactions toward a desirable product, which has been successfully achieved in organic synthesis. Here, we present the first precise determination of the stoichiometry for the reactions toward gold nanoparticle formation in the sodium borohydride reduction method. Leveraging on the real-time mass spectrometry technique, we have determined a precise balanced reaction, 32/x [Au(SR)]x + 8 e– = [Au25(SR)18]− + 7 [Au(SR)2]− (here SR denotes a thiolate ligand), toward a stoichiometric synthesis of water-soluble [Au25(SR)18]−, where 8 electrons (from reducing agents) are sufficient to react with every 32 Au atoms, leading to the formation of high-purity [Au25(SR)18]−. More interestingly, by real-time monitoring of the growth process of thiolate-protected Au nanoclusters, we have successfully identified an important yet missing byproduct …"
16,Control of single-ligand chemistry on thiolated Au25 nanoclusters,114,2020,https://scholar.google.com/citations?view_op=view_citation&hl=en&user=2QsddMIAAAAJ&pagesize=50&citation_for_view=2QsddMIAAAAJ:1yQoGdGgb4wC,"Diverse methods have been developed to tailor the number of metal atoms in metal nanoclusters, but control of surface ligand number at a given cluster size is rare. Here we demonstrate that reversible addition and elimination of a single surface thiolate ligand (-SR) on gold nanoclusters can be realized, opening the door to precision ligand engineering on atomically precise nanoclusters. We find that oxidative etching of [Au25SR18]− nanoclusters adds an excess thiolate ligand and generates a new species, [Au25SR19]0. The addition reaction can be reversed by CO reduction of [Au25SR19]0, leading back to [Au25SR18]− and eliminating precisely one surface ligand. Intriguingly, we show that the ligand shell of Au25 nanoclusters becomes more fragile and rigid after ligand addition. This reversible addition/elimination reaction of a single surface ligand on gold nanoclusters shows potential to precisely control the …"
17,Nature of reactive hydrogen for ammonia synthesis over a Ru/C12A7 electride catalyst,111,2020,https://scholar.google.com/citations?view_op=view_citation&hl=en&user=2QsddMIAAAAJ&pagesize=50&citation_for_view=2QsddMIAAAAJ:eq2jaN3J8jMC,"Recently, there have been renewed interests in exploring new catalysts for ammonia synthesis under mild conditions. Electride-based catalysts are among the emerging ones. Ruthenium particles supported on an electride composed of a mixture of calcium and aluminum oxides (C12A7) have attracted great attention for ammonia synthesis due to their facile ability in activating N2 under ambient pressure. However, the exact nature of the reactive hydrogen species and the role of electride support still remain elusive for this catalytic system. In this work, we report for the first time that the surface-adsorbed hydrogen, rather than the hydride encaged in the C12A7 electride, plays a major role in ammonia synthesis over the Ru/C12A7 electride catalyst with the aid of in situ neutron scattering techniques. Combining in situ neutron diffraction, inelastic neutron spectroscopy, density functional theory (DFT) calculation, and …"
18,Revealing isoelectronic size conversion dynamics of metal nanoclusters by a noncrystallization approach,110,2018,https://scholar.google.com/citations?view_op=view_citation&hl=en&user=2QsddMIAAAAJ&pagesize=50&citation_for_view=2QsddMIAAAAJ:fQNAKQ3IYiAC,"Atom-by-atom engineering of nanomaterials requires atomic-level knowledge of the size evolution mechanism of nanoparticles, which remains one of the greatest mysteries in nanochemistry. Here we reveal atomic-level dynamics of size evolution reaction of molecular-like nanoparticles, i.e., nanoclusters (NCs) by delicate mass spectrometry (MS) analyses. The model size-conversion reaction is [Au23(SR)16]− → [Au25(SR)18]− (SR = thiolate ligand). We demonstrate that such isoelectronic (valence electron count is 8 in both NCs) size-conversion occurs by a surface-motif-exchange-induced symmetry-breaking core structure transformation mechanism, surfacing as a definitive reaction of [Au23(SR)16]− + 2 [Au2(SR)3]− → [Au25(SR)18]− + 2 [Au(SR)2]−. The detailed tandem MS analyses further suggest the bond susceptibility hierarchies in feed and final Au NCs, shedding mechanistic light on cluster reaction …"
19,Acid–base reactivity of perovskite catalysts probed via conversion of 2-propanol over titanates and zirconates,104,2017,https://scholar.google.com/citations?view_op=view_citation&hl=en&user=2QsddMIAAAAJ&pagesize=50&citation_for_view=2QsddMIAAAAJ:u9iWguZQMMsC,"Although perovskite catalysts are well-known for their excellent redox property, their acid–base reactivity remains largely unknown. To explore the potential of perovskites in acid–base catalysis, we made a comprehensive investigation in this work on the acid–base properties and reactivity of a series of selected perovskites, SrTiO3, BaTiO3, SrZrO3, and BaZrO3, via a combination of various approaches including adsorption microcalorimetry, in situ FTIR spectroscopy, steady state kinetic measurements, and density functional theory (DFT) modeling. The perovskite surfaces are shown to be dominated with intermediate and strong basic sites with the presence of some weak Lewis acid sites, due to the preferred exposure of SrO/BaO on the perovskite surfaces as evidenced by low energy ion scattering (LEIS) measurements. Using the conversion of 2-propanol as a probe reaction, we found that the reaction is more …"
20,In Situ Strong Metal–Support Interaction (SMSI) Affects Catalytic Alcohol Conversion,98,2021,https://scholar.google.com/citations?view_op=view_citation&hl=en&user=2QsddMIAAAAJ&pagesize=50&citation_for_view=2QsddMIAAAAJ:uLbwQdceFCQC,"Strong metal–support interactions (SMSIs) and catalyst deactivation have been heavily researched for decades by the catalysis community. The promotion of SMSIs in supported metal oxides is commonly associated with H2 treatment at high temperature (>500 °C), and catalyst deactivation is commonly attributed to sintering, leaching of the active metal, and overoxidation of the metal, as well as strong adsorption of reaction intermediates. Alcohols can reduce metal oxides, and thus we hypothesized that catalytic conversion of alcohols can promote SMSIs in situ. In this work we show, via IR spectroscopy of CO adsorption and electron energy loss spectroscopy (EELS), that during 2-propanol conversion over Pd/TiO2 coverage of Pd sites occurs due to SMSIs at low reaction temperatures (as low as ∼190 °C). The emergence of SMSIs during the reaction (in situ) explains the apparent catalyst deactivation when the …"
21,Real time monitoring of the dynamic intracluster diffusion of single gold atoms into silver nanoclusters,96,2019,https://scholar.google.com/citations?view_op=view_citation&hl=en&user=2QsddMIAAAAJ&pagesize=50&citation_for_view=2QsddMIAAAAJ:eMMeJKvmdy0C,"Alloying metal materials with heterometal atoms is an efficient way to diversify the function of materials, but in-depth understanding of the dynamic heterometallic diffusion inside the alloying materials is rather limited, especially at the atomic level. Here, we report the real-time monitoring of the dynamic diffusion process of a single gold (Au) atom into an atomically precise silver nanocluster (Ag NC), Ag25(MHA)18 (MHA = 6-mercaptohexanoic acid), by using in situ UV–vis absorption spectroscopy in combination with mass and tandem mass spectrometry. We found that the Au heteroatom first replaces the Ag atom at the surface Ag2(MHA)3 motifs of Ag25(MHA)18. After that, the Au atom diffuses into the surface layer of the icosahedral Ag13 kernel and finally occupies the center of the alloy NCs to form the thermodynamically stable Au@Ag24(MHA)18 product. Density functional theory (DFT) calculations reveal that the …"
22,"Quinary, senary, and septenary high entropy alloy nanoparticle catalysts from core@ shell nanoparticles and the significance of intraparticle heterogeneity",89,2022,https://scholar.google.com/citations?view_op=view_citation&hl=en&user=2QsddMIAAAAJ&pagesize=50&citation_for_view=2QsddMIAAAAJ:9Nmd_mFXekcC,"Colloidally prepared core@shell nanoparticles (NPs) were converted to monodisperse high entropy alloy (HEA) NPs by annealing, including quinary, senary, and septenary phases comprised of PdCuPtNi with Co, Ir, Rh, Fe, and/or Ru. Intraparticle heterogeneity, i.e., subdomains within individual NPs with different metal distributions, was observed for NPs containing Ir and Ru, with the phase stabilities of the HEAs studied by atomistic simulations. The quinary HEA NPs were found to be durable catalysts for the oxygen reduction reaction, with all but the PdCuPtNiIr NPs presenting better activities than commercial Pt. Density functional theory (DFT) calculations for PdCuPtNiCo and PdCuPtNiIr surfaces (the two extremes in performance) found agreement with experiment by weighting the adsorption energy contributions by the probabilities of each active site based on their DFT energies. This finding highlights how …"
