Rank,Title,Citations,Year,URL,Description
23,Elucidation of the reaction mechanism for high-temperature water gas shift over an industrial-type copper–chromium–iron oxide catalyst,87,2019,https://scholar.google.com/citations?view_op=view_citation&hl=en&user=2QsddMIAAAAJ&pagesize=50&citation_for_view=2QsddMIAAAAJ:bnK-pcrLprsC,"The water gas shift (WGS) reaction is of paramount importance for the chemical industry, as it constitutes, coupled with methane reforming, the main industrial route to produce hydrogen. Copper–chromium–iron oxide-based catalysts have been widely used for the high-temperature WGS reaction industrially. The WGS reaction mechanism by the CuCrFeOx catalyst has been debated for years, mainly between a “redox” mechanism involving the participation of atomic oxygen from the catalyst and an “associative” mechanism proceeding via a surface formate-like intermediate. In the present work, advanced in situ characterization techniques (infrared spectroscopy, temperature-programmed surface reaction (TPSR), near-ambient pressure XPS (NAP-XPS), and inelastic neutron scattering (INS)) were applied to determine the nature of the catalyst surface and identify surface intermediate species under WGS reaction …"
24,General structure–reactivity relationship for oxygen on transition-metal oxides,86,2017,https://scholar.google.com/citations?view_op=view_citation&hl=en&user=2QsddMIAAAAJ&pagesize=50&citation_for_view=2QsddMIAAAAJ:p2g8aNsByqUC,"Despite many recent developments in designing and screening catalysts for improved performance, transition-metal oxides continue to prove to be challenging due to the myriad inherent complexities of the systems and the possible morphologies that they can exhibit. Herein we propose a structural descriptor, the adjusted coordination number (ACN), which can generalize the reactivity of the oxygen sites over the many possible surface facets and defects of a transition-metal oxide. We demonstrate the strong correlation of this geometric descriptor with the electronic and energetic properties of the active sites on five facets of four transition-metal oxides. We then use the structural descriptor to predict C–H activation energies to show the great potential of using ACN for the prediction of catalytic performance. This study presents a first look into quantifying the relation between active site structure and reactivity of …"
25,H2-reduced phosphomolybdate promotes room-temperature aerobic oxidation of methane to methanol,81,2023,https://scholar.google.com/citations?view_op=view_citation&hl=en&user=2QsddMIAAAAJ&pagesize=50&citation_for_view=2QsddMIAAAAJ:ML0RJ9NH7IQC,"The selective partial oxidation of methane to methanol using molecular oxygen (O2) represents a long-standing challenge, inspiring extensive study for many decades. However, considerable challenges still prevent low-temperature methane activation via the aerobic route. Here we report a precipitated Pd-containing phosphomolybdate, which, after activation by molecular hydrogen (H2), converts methane and O2 almost exclusively to methanol at room temperature. The highest activity reaches 67.4 μmol gcat−1 h−1. Pd enables rapid H2 activation and H spillover to phosphomolybdate for Mo reduction, while facile O2 activation and subsequent methane activation occur on the reduced phosphomolybdate sites. Continuous production of methanol from methane was also achieved by concurrently introducing H2, O2 and methane into the system, where H2 assists in maintaining a moderately reduced state of …"
26,Low-temperature activation of methane on doped single atoms: descriptor and prediction,81,2018,https://scholar.google.com/citations?view_op=view_citation&hl=en&user=2QsddMIAAAAJ&pagesize=50&citation_for_view=2QsddMIAAAAJ:5ugPr518TE4C,"Catalytic transformation of methane under mild conditions remains a grand challenge. Fundamental understanding of C–H activation of methane is crucial for designing a catalyst for the utilization of methane at low temperature. Recent experiments show that strong methane chemisorption on oxides of precious metals leads to facile C–H activation. However, only a very few such oxides are capable (for example, IrO2 and PdO). Here we show for the first time that strong methane chemisorption and facile C–H activation can be accomplished by single transition-metal atoms on TiO2, some of which are even better than IrO2. Using methane adsorption energy as a descriptor, we screened over 30 transition-metal single atoms doped on TiO2 for the chemisorption of methane by replacing a surface Ti atom with a single atom of another transition metal. It is found that the adsorption energies of methane on a single atom of …"
27,Physically informed machine learning prediction of electronic density of states,76,2022,https://scholar.google.com/citations?view_op=view_citation&hl=en&user=2QsddMIAAAAJ&pagesize=50&citation_for_view=2QsddMIAAAAJ:-_dYPAW6P2MC,"The electronic structure of a material, such as its density of states (DOS), provides key insights into its physical and functional properties and serves as a valuable source of high-quality features for many materials screening and discovery workflows. However, the computational cost of calculating the DOS, most commonly with density functional theory (DFT), becomes prohibitive for meeting high-fidelity or high-throughput requirements, necessitating a cheaper but sufficiently accurate surrogate. To fulfill this demand, we develop a general machine learning method based on graph neural networks for predicting the DOS purely from atomic positions, six orders of magnitude faster than DFT. This approach can effectively use large materials databases and be applied generally across the entire periodic table to materials classes of arbitrary compositional and structural diversity. We furthermore devise a highly adaptable …"
28,Controlling reaction selectivity through the surface termination of perovskite catalysts,75,2017,https://scholar.google.com/citations?view_op=view_citation&hl=en&user=2QsddMIAAAAJ&pagesize=50&citation_for_view=2QsddMIAAAAJ:XiSMed-E-HIC,"Although perovskites have been widely used in catalysis, tuning of their surface termination to control reaction selectivity has not been well established. In this study, we employed multiple surface‐sensitive techniques to characterize the surface termination (one aspect of surface reconstruction) of SrTiO3 (STO) after thermal pretreatment (Sr enrichment) and chemical etching (Ti enrichment). We show, by using the conversion of 2‐propanol as a probe reaction, that the surface termination of STO can be controlled to greatly tune catalytic acid/base properties and consequently the reaction selectivity over a wide range, which is not possible with single‐metal oxides, either SrO or TiO2. Density functional theory (DFT) calculations explain well the selectivity tuning and reaction mechanism on STO with different surface termination. Similar catalytic tunability was also observed on BaZrO3, thus highlighting the generality of …"
29,Exploring Structural Diversity and Fluxionality of Ptn (n = 10–13) Clusters from First-Principles,73,2017,https://scholar.google.com/citations?view_op=view_citation&hl=en&user=2QsddMIAAAAJ&pagesize=50&citation_for_view=2QsddMIAAAAJ:OU6Ihb5iCvQC,"Subnanometer transition-metal clusters have been shown to possess catalytic activity that is size-dependent. It has been suggested that the fluxionality of these small clusters may be closely related to their catalytic activity. Here we use basin-hopping global optimization with density functional theory (DFT) to study the energy landscape of Ptn (n = 10–13) clusters. We analyze a large set of local minima obtained from the DFT-based global optimization. We find that Pt10 is unique with respect to the other studied sizes in its structural landscape, which shows a single, distinct structural motif corresponding to a tetrahedral global minimum. In contrast, Pt11–13 all display characteristics of high fluxionality with the presence of multiple significantly differing structural features in the low-energy region, as characterized by coordination number, interatomic distances, and shape. These observations demonstrate the structural …"
30,Measuring and directing charge transfer in heterogenous catalysts,70,2022,https://scholar.google.com/citations?view_op=view_citation&hl=en&user=2QsddMIAAAAJ&pagesize=50&citation_for_view=2QsddMIAAAAJ:j8SEvjWlNXcC,"Precise control of charge transfer between catalyst nanoparticles and supports presents a unique opportunity to enhance the stability, activity, and selectivity of heterogeneous catalysts. While charge transfer is tunable using the atomic structure and chemistry of the catalyst-support interface, direct experimental evidence is missing for three-dimensional catalyst nanoparticles, primarily due to the lack of a high-resolution method that can probe and correlate both the charge distribution and atomic structure of catalyst/support interfaces in these structures. We demonstrate a robust scanning transmission electron microscopy (STEM) method that simultaneously visualizes the atomic-scale structure and sub-nanometer-scale charge distribution in heterogeneous catalysts using a model Au-catalyst/SrTiO3-support system. Using this method, we further reveal the atomic-scale mechanisms responsible for the highly active …"
31,New bonding model of radical adsorbate on lattice oxygen of perovskites,67,2018,https://scholar.google.com/citations?view_op=view_citation&hl=en&user=2QsddMIAAAAJ&pagesize=50&citation_for_view=2QsddMIAAAAJ:kRWSkSYxWN8C,"A new model of bonding between radical adsorbates and lattice oxygens is proposed that considers both the adsorbate–oxygen bonding and the weakening of the metal–oxygen bonds. Density functional calculations of SrMO3 perovskites for M being 3d, 4d, and 5d transition metals are used to correlate the bulk electronic structure with the surface-oxygen reactivity. Occupation of the metal–oxygen antibonding states, examined via the crystal orbital Hamilton population (COHP), is found to be a useful bulk descriptor that correlates with the vacancy formation energy of the lattice oxygen and its hydrogen adsorption energy. Analysis of density-of-states and COHP indicates that H adsorption energy is a combined result of formation of the O–H bond and the weakening of the surface metal–oxygen bond due to occupation of the metal–oxygen antibonding states by the electron from H. This insight will be useful in …"
32,Llmatdesign: Autonomous materials discovery with large language models,65,2024,https://scholar.google.com/citations?view_op=view_citation&hl=en&user=2QsddMIAAAAJ&pagesize=50&citation_for_view=2QsddMIAAAAJ:TIZ-Mc8IlK0C,"Discovering new materials can have significant scientific and technological implications but remains a challenging problem today due to the enormity of the chemical space. Recent advances in machine learning have enabled data-driven methods to rapidly screen or generate promising materials, but these methods still depend heavily on very large quantities of training data and often lack the flexibility and chemical understanding often desired in materials discovery. We introduce LLMatDesign, a novel language-based framework for interpretable materials design powered by large language models (LLMs). LLMatDesign utilizes LLM agents to translate human instructions, apply modifications to materials, and evaluate outcomes using provided tools. By incorporating self-reflection on its previous decisions, LLMatDesign adapts rapidly to new tasks and conditions in a zero-shot manner. A systematic evaluation of LLMatDesign on several materials design tasks, in silico, validates LLMatDesign's effectiveness in developing new materials with user-defined target properties in the small data regime. Our framework demonstrates the remarkable potential of autonomous LLM-guided materials discovery in the computational setting and towards self-driving laboratories in the future."
33,Inverse design of two-dimensional materials with invertible neural networks,65,2021,https://scholar.google.com/citations?view_op=view_citation&hl=en&user=2QsddMIAAAAJ&pagesize=50&citation_for_view=2QsddMIAAAAJ:7T2F9Uy0os0C,"The ability to readily design novel materials with chosen functional properties on-demand represents a next frontier in materials discovery. However, thoroughly and efficiently sampling the entire design space in a computationally tractable manner remains a highly challenging task. To tackle this problem, we propose an inverse design framework (MatDesINNe) utilizing invertible neural networks which can map both forward and reverse processes between the design space and target property. This approach can be used to generate materials candidates for a designated property, thereby satisfying the highly sought-after goal of inverse design. We then apply this framework to the task of band gap engineering in two-dimensional materials, starting with MoS2. Within the design space encompassing six degrees of freedom in applied tensile, compressive and shear strain plus an external electric field, we show the …"
34,Understanding the Impact of Surface Reconstruction of Perovskite Catalysts on CH4 Activation and Combustion,65,2018,https://scholar.google.com/citations?view_op=view_citation&hl=en&user=2QsddMIAAAAJ&pagesize=50&citation_for_view=2QsddMIAAAAJ:mvPsJ3kp5DgC,"Methane conversion has received renewed interest due to the rapid growth in production of shale gas. Methane combustion for power generation and transportation is one of the alternatives for methane utilization. However, complete conversion of methane is critical to minimize negative environmental effects from unburned methane, whose noxious effect is 25 times greater than that of CO2. Although perovskite catalysts have high thermal stability, their low activities for methane combustion prevent them from being utilized on a commercial basis. In this work, we show the impact from reconstruction of surface and subsurface monolayers of perovskite catalysts on methane combustion, using SrTiO3 (STO) as a model perovskite. Several STO samples obtained through different synthetic methods and subjected to different postsynthetic treatments were tested for methane combustion. Through top surface …"
35,Machine learning-aided inverse design and discovery of novel polymeric materials for membrane separation,59,2024,https://scholar.google.com/citations?view_op=view_citation&hl=en&user=2QsddMIAAAAJ&pagesize=50&citation_for_view=2QsddMIAAAAJ:lmc2jWPfTJgC,"Polymeric membranes have been widely used for liquid and gas separation in various industrial applications over the past few decades because of their exceptional versatility and high tunability. Traditional trial-and-error methods for material synthesis are inadequate to meet the growing demands for high-performance membranes. Machine learning (ML) has demonstrated huge potential to accelerate design and discovery of membrane materials. In this review, we cover strengths and weaknesses of the traditional methods, followed by a discussion on the emergence of ML for developing advanced polymeric membranes. We describe methodologies for data collection, data preparation, the commonly used ML models, and the explainable artificial intelligence (XAI) tools implemented in membrane research. Furthermore, we explain the experimental and computational validation steps to verify the results provided by …"
36,Single-Atom High-Temperature Catalysis on a Rh1O5 Cluster for Production of Syngas from Methane,58,2021,https://scholar.google.com/citations?view_op=view_citation&hl=en&user=2QsddMIAAAAJ&pagesize=50&citation_for_view=2QsddMIAAAAJ:_Re3VWB3Y0AC,"Single-atom catalysts are a relatively new type of catalyst active for numerous reactions but mainly for chemical transformations performed at low or intermediate temperatures. Here we report that singly dispersed Rh1O5 clusters on TiO2 can catalyze the partial oxidation of methane (POM) at high temperatures with a selectivity of 97% for producing syngas (CO + H2) and high activity with a long catalytic durability at 650 °C. The long durability results from the substitution of a Ti atom of the TiO2 surface lattice by Rh1, which forms a singly dispersed Rh1 atom coordinating with five oxygen atoms (Rh1O5) and an undercoordinated environment but with nearly saturated bonding with oxygen atoms. Computational studies show the back-donation of electrons from the dz2 orbital of the singly dispersed Rh1 atom to the unoccupied orbital of adsorbed CHn (n > 1) results in the charge depletion of the Rh1 atom and a strong …"
37,Work function engineering of 2D materials: the role of polar edge reconstructions,57,2021,https://scholar.google.com/citations?view_op=view_citation&hl=en&user=2QsddMIAAAAJ&pagesize=50&citation_for_view=2QsddMIAAAAJ:W5xh706n7nkC,"2D materials have attracted tremendous interest as functional materials because of their diverse and tunable properties, especially at their edges. A material’s work function is a critical parameter in many electronic devices; however, a fundamental understanding and a path toward large alterations of the work function in 2D materials still remain elusive. Here, we report the first evidence for anisotropy of the work function in 2D MoS2 from first-principles calculations. We also demonstrate large work-function tunability (in the range of 3.45–6.29 eV) choosing the 2H phase of MoS2 as a model system by sampling various edge configurations. We furthermore reveal the origin of this work function anisotropy and tunability by extending the existing work function relation to the local dipole moment at surfaces of 3D materials to those at edges in 2D materials. We then use machine-learning approaches to correlate work …"
38,Exploring perovskites for methane activation from first principles,57,2018,https://scholar.google.com/citations?view_op=view_citation&hl=en&user=2QsddMIAAAAJ&pagesize=50&citation_for_view=2QsddMIAAAAJ:vRqMK49ujn8C,"The diversity of perovskites offers many opportunities for catalysis, but an overall trend has been elusive. Using density functional theory, we studied a large set of perovskites in the ABO3 formula via descriptors of oxygen reactivity such as vacancy formation energy, hydrogen adsorption energy, and the first C–H activation energy of methane. It was found that changing the identity of B within a period increases the oxygen reactivity from the early to late transition metals, while changing A within a group has a much smaller effect on oxygen reactivity. Within the same group, B in the 3d period has the most reactive lattice oxygen compared to the 4d or 5d period. Some perovskites display large differences in reactivity for different terminations. Further examination of the second C–H bond breaking on these perovskites revealed that larger A cations and non-transition metal B cations have higher activation energies, which …"
39,Electronic band contraction induced low temperature methane activation on metal alloys,55,2020,https://scholar.google.com/citations?view_op=view_citation&hl=en&user=2QsddMIAAAAJ&pagesize=50&citation_for_view=2QsddMIAAAAJ:_B80troHkn4C,"The catalytic conversion of methane under mild conditions is an appealing approach to selectively produce value-added products from natural gas. Catalysts which can chemisorb methane can potentially overcome challenges associated with its high stability and achieve facile activation. Although transition metals can activate C–H bonds, chemisorption and low-temperature conversion remain elusive on these surfaces. The broad electronic bands of metals can only weakly interact with the methane orbitals, in contrast to specific transition metal oxide and supported metal cluster surfaces which are now recognized to form methane σ-complexes. Here, we report methane chemisorption can, remarkably, occur on metal surfaces via electronic band contraction and localization from metal alloying. From a broad screening including single atom and intermetallic alloys in various substrates, we find early transition metals …"
40,Tuning catalytic selectivity of oxidative catalysis through deposition of nonmetallic atoms in surface lattice of metal oxide,52,2016,https://scholar.google.com/citations?view_op=view_citation&hl=en&user=2QsddMIAAAAJ&pagesize=50&citation_for_view=2QsddMIAAAAJ:u-x6o8ySG0sC,"Catalytic selectivity for producing an ideal product is a key topic for chemical transformations through heterogeneous catalysis. Tuning catalytic selectivity by integrating the second metal to form an alloy has been well demonstrated in the literature. Here we report a method to tune catalytic selectivity in oxidative catalysis on another category of heterogeneous catalysts, transition-metal oxides. By choosing the oxidative dehydrogenation (ODH) of ethane to ethylene as a probe reaction, we demonstrated that doping nonmetallic atoms to the surface lattice of catalyst of a transition-metal oxide can enhance catalytic selectivity through suppression of complete oxidation of the reactant molecules. Catalysts of Co3O4 with doped silicon atoms (Six-Co3O4) maintaining the spinel structure of pure Co3O4 exhibit much higher selectivity for the production of ethylene through ODH of ethane in comparison to pure Co3O4 at 600 …"
41,Understanding oxidative dehydrogenation of ethane on Co 3 O 4 nanorods from density functional theory,52,2016,https://scholar.google.com/citations?view_op=view_citation&hl=en&user=2QsddMIAAAAJ&pagesize=50&citation_for_view=2QsddMIAAAAJ:u5HHmVD_uO8C,"Co3O4 is a metal oxide catalyst with weak, tunable M–O bonds promising for catalysis. Here, density functional theory (DFT) is used to study the oxidative dehydrogenation (ODH) of ethane on Co3O4 nanorods based on the preferred surface orientation (111) from the experimental electron-microscopy image. The pathway and energetics of the full catalytic cycle including the first and second C–H bond cleavages, hydroxyl clustering, water formation, and oxygen-site regeneration are determined. We find that both lattice O and Co may participate as active sites in the dehydrogenation, with the lattice-O pathway being favored. We identify the best ethane ODH pathway based on the overall energy profiles of several routes. We identify that water formation from the lattice oxygen has the highest energy barrier and is likely a rate-determining step. This work of the complete catalytic cycle of ethane ODH will allow further …"
42,CO2-Assisted Oxidative Dehydrogenation of Propane over VOx/In2O3 Catalysts: Interplay between Redox Property and Acid–Base Interactions,48,2022,https://scholar.google.com/citations?view_op=view_citation&hl=en&user=2QsddMIAAAAJ&pagesize=50&citation_for_view=2QsddMIAAAAJ:z_wVstp3MssC,"In this work, a series of VOx-loaded In2O3 catalysts were prepared, and their catalytic performance was evaluated for CO2-assisted oxidative dehydrogenation of propane (CO2-ODHP) and compared with In2O3 alone. The optimal composition is obtained on 3.4V/In2O3 (surface V density of 3.4V nm–2), which exhibited not only a higher C3H6 selectivity than other V/In catalysts and In2O3 under isoconversion conditions but also an improved reaction stability. To elucidate the catalyst structure–activity relationship, the VOx/In2O3 catalysts were characterized by chemisorption [NH3-temperature-programmed desorption (TPD), NH3-diffuse reflectance infrared Fourier transform spectroscopy (DRIFTS), CO2-TPD, and CO2-DRIFTS], H2-temperature-programmed reduction (TPR), in situ Raman spectroscopy, UV–vis diffuse reflectance spectroscopy, near-ambient pressure X-ray photoelectron spectroscopy, X-ray …"
43,A new trick for an old support: Stabilizing gold single atoms on LaFeO3 perovskite,45,2020,https://scholar.google.com/citations?view_op=view_citation&hl=en&user=2QsddMIAAAAJ&pagesize=50&citation_for_view=2QsddMIAAAAJ:AXPGKjj_ei8C,"Single-atom catalysts (SACs) have shown great potential for achieving superior catalytic activity due to maximizing metal efficiency. The key obstacle in developing SACs lies in the availability of supports that can stabilize SACs. Here we report the first successful development of single gold (Au) atom catalysts supported on high-surface-area hierarchical perovskite oxides. The resulting Au single-atoms are extremely stable at calcination temperatures up to 700 °C in air and under reaction conditions. A high catalytic activity for CO oxidation and distinct self-activating property were also achieved. Furthermore, evidenced by theoretical calculations and experimental studies including X-ray absorption fine structures and in situ Fourier-transform infrared spectra, the surface Au active sites are confirmed to be predominately positively charged. This work provides a generalizable approach to fabricating highly stable Au …"
