Rank,Title,Citations,Year,URL,Description
1,Scale-Out NUMA,233,2014,https://scholar.google.com/citations?view_op=view_citation&hl=en&user=Mm-dHpMAAAAJ&pagesize=50&citation_for_view=Mm-dHpMAAAAJ:UeHWp8X0CEIC,"Emerging datacenter applications operate on vast datasets that are kept in DRAM to minimize latency. The large number of servers needed to accommodate this massive memory footprint requires frequent server-to-server communication in applications such as key-value stores and graph-based applications that rely on large irregular data structures. The fine-grained nature of the accesses is a poor match to commodity networking technologies, including RDMA, which incur delays of 10-1000x over local DRAM operations. We introduce Scale-Out NUMA (soNUMA) -- an architecture, programming model, and communication protocol for low-latency, distributed in-memory processing. soNUMA layers an RDMA-inspired programming model directly on top of a NUMA memory fabric via a stateless messaging protocol. To facilitate interactions between the application, OS, and the fabric, soNUMA relies on the remote …"
2,The Mondrian Data Engine,176,2017,https://scholar.google.com/citations?view_op=view_citation&hl=en&user=Mm-dHpMAAAAJ&pagesize=50&citation_for_view=Mm-dHpMAAAAJ:ufrVoPGSRksC,"The increasing demand for extracting value out of ever-growing data poses an ongoing challenge to system designers, a task only made trickier by the end of Dennard scaling. As the performance density of traditional CPU-centric architectures stagnates, advancing compute capabilities necessitates novel architectural approaches. Near-memory processing (NMP) architectures are reemerging as promising candidates to improve computing efficiency through tight coupling of logic and memory. NMP architectures are especially fitting for data analytics, as they provide immense bandwidth to memory-resident data and dramatically reduce data movement, the main source of energy consumption. Modern data analytics operators are optimized for CPU execution and hence rely on large caches and employ random memory accesses. In the context of NMP, such random accesses result in wasteful DRAM row buffer …"
3,Exploiting Errors for Efficiency: A Survey from Circuits to Applications,102,2020,https://scholar.google.com/citations?view_op=view_citation&hl=en&user=Mm-dHpMAAAAJ&pagesize=50&citation_for_view=Mm-dHpMAAAAJ:Se3iqnhoufwC,"When a computational task tolerates a relaxation of its specification or when an algorithm tolerates the effects of noise in its execution, hardware, system software, and programming language compilers or their runtime systems can trade deviations from correct behavior for lower resource usage. We present, for the first time, a synthesis of research results on computing systems that only make as many errors as their end-to-end applications can tolerate. The results span the disciplines of computer-aided design of circuits, digital system design, computer architecture, programming languages, operating systems, and information theory. Rather than over-provisioning the resources controlled by each of these layers of abstraction to avoid errors, it can be more efficient to exploit the masking of errors occurring at one layer and thereby prevent those errors from propagating to a higher layer. We demonstrate the potential …"
4,RPCValet: NI-Driven Tail-Aware Balancing of µs-Scale RPCs,91,2019,https://scholar.google.com/citations?view_op=view_citation&hl=en&user=Mm-dHpMAAAAJ&pagesize=50&citation_for_view=Mm-dHpMAAAAJ:0EnyYjriUFMC,"Modern online services come with stringent quality requirements in terms of response time tail latency. Because of their decomposition into fine-grained communicating software layers, a single user request fans out into a plethora of short, μs-scale RPCs, aggravating the need for faster inter-server communication. In reaction to that need, we are witnessing a technological transition characterized by the emergence of hardware-terminated user-level protocols (e.g., InfiniBand/RDMA) and new architectures with fully integrated Network Interfaces (NIs). Such architectures offer a unique opportunity for a new NI-driven approach to balancing RPCs among the cores of manycore server CPUs, yielding major tail latency improvements for μs-scale RPCs. We introduce RPCValet, an NI-driven RPC load-balancing design for architectures with hardware-terminated protocols and integrated NIs, that delivers near-optimal tail …"
5,The NeBuLa RPC-Optimized Architecture,77,2020,https://scholar.google.com/citations?view_op=view_citation&hl=en&user=Mm-dHpMAAAAJ&pagesize=50&citation_for_view=Mm-dHpMAAAAJ:KlAtU1dfN6UC,"Large-scale online services are commonly structured as a network of software tiers, which communicate over the datacenter network using RPCs. Ongoing trends towards software decomposition have led to the prevalence of tiers receiving and generating RPCs with runtimes of only a few microseconds. With such small software runtimes, even the smallest latency overheads in RPC handling have a significant relative performance impact. In particular, we find that growing network bandwidth introduces queuing effects within a server’s memory hierarchy, considerably hurting the response latency of fine-grained RPCs. In this work we introduce NEBULA, an architecture optimized to accelerate the most challenging microsecond-scale RPCs, by leveraging two novel mechanisms to drastically improve server throughput under strict tail latency goals. First, NEBULA reduces detrimental queuing at the memory controllers …"
6,Cerebros: Evading the RPC Tax in Datacenters,64,2021,https://scholar.google.com/citations?view_op=view_citation&hl=en&user=Mm-dHpMAAAAJ&pagesize=50&citation_for_view=Mm-dHpMAAAAJ:_kc_bZDykSQC,Description not available
7,Scale-Out Non-Uniform Memory Access,63,2017,https://scholar.google.com/citations?view_op=view_citation&hl=en&user=Mm-dHpMAAAAJ&pagesize=50&citation_for_view=Mm-dHpMAAAAJ:Tyk-4Ss8FVUC,"(57) ABSTRACT A computing system that uses a Scale-Out NUMA ("" SONUMA”) architecture, programming model, and/or communication protocol provides for low-latency, distrib uted in-memory processing. Using soNUMA, a program ming model is layered directly on top of a NUMA memory fabric via a stateless messaging protocol. To facilitate inter actions between the application, OS, and the fabric, SONUMA uses a remote memory controller—an architec turally-exposed hardware block integrated into the node's local coherence hierarchy."
8,The Case for RackOut: Scalable Data Serving Using Rack-Scale Systems,51,2016,https://scholar.google.com/citations?view_op=view_citation&hl=en&user=Mm-dHpMAAAAJ&pagesize=50&citation_for_view=Mm-dHpMAAAAJ:YsMSGLbcyi4C,"To provide low latency and high throughput guarantees, most large key-value stores keep the data in the memory of many servers. Despite the natural parallelism across lookups, the load imbalance, introduced by heavy skew in the popularity distribution of keys, limits performance. To avoid violating tail latency service-level objectives, systems tend to keep server utilization low and organize the data in micro-shards, which provides units of migration and replication for the purpose of load balancing. These techniques reduce the skew, but incur additional monitoring, data replication and consistency maintenance overheads. In this work, we introduce RackOut, a memory pooling technique that leverages the one-sided remote read primitive of emerging rack-scale systems to mitigate load imbalance while respecting service-level objectives. In RackOut, the data is aggregated at rack-scale granularity, with all of the …"
9,Manycore Network Interfaces for In-Memory Rack-Scale Computing,45,2015,https://scholar.google.com/citations?view_op=view_citation&hl=en&user=Mm-dHpMAAAAJ&pagesize=50&citation_for_view=Mm-dHpMAAAAJ:IjCSPb-OGe4C,"Datacenter operators rely on low-cost, high-density technologies to maximize throughput for data-intensive services with tight tail latencies. In-memory rack-scale computing is emerging as a promising paradigm in scale-out datacenters capitalizing on commodity SoCs, low-latency and high-bandwidth communication fabrics and a remote memory access model to enable aggregation of a rack's memory for critical data-intensive applications such as graph processing or key-value stores. Low latency and high bandwidth not only dictate eliminating communication bottlenecks in the software protocols and off-chip fabrics but also a careful on-chip integration of network interfaces. The latter is a key challenge especially in architectures with RDMA-inspired one-sided operations that aim to achieve low latency and high bandwidth through on-chip Network Interface (NI) support. This paper proposes and evaluates network …"
10,Distributed Logless Atomic Durability with Persistent Memory,44,2019,https://scholar.google.com/citations?view_op=view_citation&hl=en&user=Mm-dHpMAAAAJ&pagesize=50&citation_for_view=Mm-dHpMAAAAJ:kNdYIx-mwKoC,"Datacenter operators have started deploying Persistent Memory (PM), leveraging its combination of fast access and persistence for significant performance gains. A key challenge for PM-aware software is to maintain high performance while achieving atomic durability. The latter typically requires the use of logging, which introduces considerable overhead with additional CPU cycles, write traffic, and ordering requirements. In this paper, we exploit the data multiversioning inherent in the memory hierarchy to achieve atomic durability without logging. Our design, LAD, relies on persistent buffering space at the memory controllers (MCs)---already present in modern CPUs---to speculatively accumulate all of a transaction's updates before they are all atomically committed to PM. LAD employs an on-chip distributed commit protocol in hardware to manage the distributed speculative state each transaction accumulates …"
11,Design Guidelines for High-Performance SCM Hierarchies,38,2018,https://scholar.google.com/citations?view_op=view_citation&hl=en&user=Mm-dHpMAAAAJ&pagesize=50&citation_for_view=Mm-dHpMAAAAJ:hqOjcs7Dif8C,"With emerging storage-class memory (SCM) nearing commercialization, there is evidence that it will deliver the much-anticipated high density and access latencies within only a few factors of DRAM. Nevertheless, the latency-sensitive nature of memory-resident services makes seamless integration of SCM in servers questionable. In this paper, we ask the question of how best to introduce SCM for such servers to improve overall performance/cost over existing DRAM-only architectures. We first show that even with the most optimistic latency projections for SCM, the higher memory access latency results in prohibitive performance degradation. However, we find that deployment of a modestly sized high-bandwidth 3D stacked DRAM cache makes the performance of an SCM-mostly memory system competitive. The high degree of spatial locality that memory-resident services exhibit not only simplifies the DRAM cache …"
12,OneEdge: An Efficient Control Plane for Geo-Distributed Infrastructures,32,2021,https://scholar.google.com/citations?view_op=view_citation&hl=en&user=Mm-dHpMAAAAJ&pagesize=50&citation_for_view=Mm-dHpMAAAAJ:4TOpqqG69KYC,"Resource management for geo-distributed infrastructures is challenging due to the scarcity and non-uniformity of edge resources, as well as the high client mobility and workload surges inherent to situation awareness applications. Due to their centralized nature, state-of-the-art schedulers that work well in datacenters lack the performance and feature requirements of such applications. We present OneEdge, a hybrid control plane that enables autonomous decision-making at edge sites for localized, rapid single-site application deployment. Edge sites handle mobility, churn, and load spikes, by cooperating with a centralized controller that allows coordinated multi-site scheduling and dynamic reconfiguration. OneEdge's scheduling decisions are driven by each application's end-to-end service level objective (E2E SLO) as well as the specific requirements of situation awareness applications. OneEdge's novel …"
13,CoaXiaL: A CXL-Centric Memory System for Scalable Servers,31,2024,https://scholar.google.com/citations?view_op=view_citation&hl=en&user=Mm-dHpMAAAAJ&pagesize=50&citation_for_view=Mm-dHpMAAAAJ:R3hNpaxXUhUC,"The memory system is a major performance determinant for server processors. Ever-growing core counts and datasets demand higher memory bandwidth and capacity. DDR—the dominant processor interface to memory—requires a large number of on-chip pins, which is a scarce resource, thus limiting the processor’s memory bandwidth. With limited bandwidth, multiple concurrent memory requests experience significant queuing delays that often overshadow DRAM’s service time and degrade performance. We present CoaXial, a memory system design for throughput-oriented manycore servers that replaces all of the processor’s DDR interfaces with the pin-efficient CXL interface, which offers higher bandwidth per pin. While such replacement incurs a considerable latency overhead, we demonstrate that, for many workloads, and with careful integration, CXL’s higher bandwidth more than offsets its latency premium …"
14,Atomic Object Reads for In-Memory Rack-Scale Computing,31,2021,https://scholar.google.com/citations?view_op=view_citation&hl=en&user=Mm-dHpMAAAAJ&pagesize=50&citation_for_view=Mm-dHpMAAAAJ:LkGwnXOMwfcC,"A distributed memory system including a plurality of chips, a plurality of nodes that are distributed across the plurality of chips such that each node is comprised within a chip, each node includes a dedicated local memory and a processor core, and each local memory is configured to be accessible over network communication, a network interface for each node, the network interface configured such that a corre sponding network interface of each node is integrated in a coherence domain of the chip of the corresponding node, wherein each of the network interfaces are configured to support a one-sided operation, the network interface directly reading or writing in the dedicated local memory of the corresponding node without involving a processor core, and the one-sided operation is configured such that the processor core of a corresponding node uses a protocol to directly inject a remote memory access for read or …"
15,SABRes: Atomic Object Reads for In-Memory Rack-Scale Computing,31,2016,https://scholar.google.com/citations?view_op=view_citation&hl=en&user=Mm-dHpMAAAAJ&pagesize=50&citation_for_view=Mm-dHpMAAAAJ:W7OEmFMy1HYC,"Modern in-memory services rely on large distributed object stores to achieve the high scalability essential to ser-vice thousands of requests concurrently. The independent and unpredictable nature of incoming requests results in random accesses to the object store, triggering frequent remote memory accesses. State-of-the-art distributed memory frameworks leverage the one-sided operations offered by RDMA technology to mitigate the traditionally high cost of remote memory access. Unfortunately, the limited semantics of RDMA one-sided operations bound remote memory access atomicity to a single cache block; therefore, atomic remote object access relies on software mechanisms. Emerging highly integrated rack-scale systems that reduce the latency of one-sided operations to a small multiple of DRAM latency expose the overhead of these software mechanisms as a major latency contributor. This technology …"
16,Turbo: SmartNIC-Enabled Dynamic Load Balancing of µs-Scale RPCss,20,2023,https://scholar.google.com/citations?view_op=view_citation&hl=en&user=Mm-dHpMAAAAJ&pagesize=50&citation_for_view=Mm-dHpMAAAAJ:L8Ckcad2t8MC,"Online services are decomposed into fine-grained software components that communicate over the network using fine-grained Remote Procedure Calls (RPCs). Inter-server communication often exhibits patterns of wide RPC fan-outs between software tiers, raising the well-known tail at scale effect and necessitating mechanisms that curb long response tail latencies. When handling µs-scale RPCs, request distribution across the cores of multicore servers is a major determinant of the resulting tail latency. Software approaches for inter-core RPC balancing introduce considerable overheads, throttling a server’s peak throughput. On the other hand, existing NIC-based hardware mechanisms ameliorate software and inter-core synchronization overheads, but result in inter-core load imbalance that leaves significant performance improvement headroom.We introduce Turbo, a hardware on-NIC load-balancing …"
17,eCloud: A Vision for the Evolution of the Edge-Cloud Continuum,20,2021,https://scholar.google.com/citations?view_op=view_citation&hl=en&user=Mm-dHpMAAAAJ&pagesize=50&citation_for_view=Mm-dHpMAAAAJ:YOwf2qJgpHMC,"We present a holistic vision for the edge-cloud ecosystem, with the intent of spurring the creation of next-generation technologies for futuristic applications that operate at computational-perception speeds to convert sensed data to actionable knowledge."
18,An Analysis of Load Imbalance in Scale-Out Data Serving,18,2016,https://scholar.google.com/citations?view_op=view_citation&hl=en&user=Mm-dHpMAAAAJ&pagesize=50&citation_for_view=Mm-dHpMAAAAJ:Y0pCki6q_DkC,"Despite the natural parallelism across lookups, performance of distributed key-value stores is often limited due to load imbalance induced by heavy skew in the popularity distribution of the dataset. To avoid violating service level objectives expressed in terms of tail latency, systems tend to keep server utilization low and organize the data in micro-shards, which in turn provides units of migration and replication for the purpose of load balancing. These techniques reduce the skew, but incur additional monitoring, data replication and consistency maintenance overheads. This work shows that the trend towards extreme scale-out will further exacerbate the skew-induced load imbalance, and hence the overhead of migration and replication."
19,Mitigating Load Imbalance in Distributed Data Serving with Rack-Scale Memory Pooling,16,2019,https://scholar.google.com/citations?view_op=view_citation&hl=en&user=Mm-dHpMAAAAJ&pagesize=50&citation_for_view=Mm-dHpMAAAAJ:3fE2CSJIrl8C,"To provide low-latency and high-throughput guarantees, most large key-value stores keep the data in the memory of many servers. Despite the natural parallelism across lookups, the load imbalance, introduced by heavy skew in the popularity distribution of keys, limits performance. To avoid violating tail latency service-level objectives, systems tend to keep server utilization low and organize the data in micro-shards, which provides units of migration and replication for the purpose of load balancing. These techniques reduce the skew but incur additional monitoring, data replication, and consistency maintenance overheads. In this work, we introduce RackOut, a memory pooling technique that leverages the one-sided remote read primitive of emerging rack-scale systems to mitigate load imbalance while respecting service-level objectives. In RackOut, the data are aggregated at rack-scale granularity, with all of the …"
20,StarNUMA: Mitigating NUMA Challenges with Memory Pooling,12,2024,https://scholar.google.com/citations?view_op=view_citation&hl=en&user=Mm-dHpMAAAAJ&pagesize=50&citation_for_view=Mm-dHpMAAAAJ:e5wmG9Sq2KIC,"Large multi-socket machines are mission-critical high-performance systems for workloads requiring massive memory shared by hundreds of processors. Beyond eight sockets, such systems typically feature multi-hop inter-socket networks, exacerbating the Non-Uniform Memory Access (NUMA) challenge. NUMA effects stem from major disparity in latency and bandwidth characteristics of local and remote memory, often in the 4–10× range. While judicious data placement across the distributed memory's fragments can ameliorate NUMA effects, we observe that in challenging workloads with irregular access patterns, a large fraction of accessed pages are “vagabond”: being actively shared by multiple sockets, they lack a fitting home socket location. On 16-socket systems, such pages incur up to 75% remote memory accesses, which encounter significant latency overheads and bandwidth bottlenecks. StarNUMA …"
21,COMET: A Comprehensive Cluster Design Methodology for Distributed Deep Learning Training,10,2022,https://scholar.google.com/citations?view_op=view_citation&hl=en&user=Mm-dHpMAAAAJ&pagesize=50&citation_for_view=Mm-dHpMAAAAJ:dhFuZR0502QC,"Modern Deep Learning (DL) models have grown to sizes requiring massive clusters of specialized, high-end nodes to train. Designing such clusters to maximize both performance and utilization--to amortize their steep cost--is a challenging task requiring careful balance of compute, memory, and network resources. Moreover, a plethora of each model's tuning knobs drastically affect the performance, with optimal values often depending on the underlying cluster's characteristics, which necessitates a complex cluster-workload co-design process. To facilitate the design space exploration of such massive DL training clusters, we introduce COMET, a holistic cluster design methodology and workflow to jointly study the impact of parallelization strategies and key cluster resource provisioning on the performance of distributed DL training. We develop a step-by-step process to establish a reusable and flexible methodology, and demonstrate its application with case studies of training large models on cluster configurations of variable compute, memory, and network resources. Our case studies demonstrate COMET's utility in identifying promising architectural optimization directions and guiding system designers in configuring key model and cluster parameters. To illustrate, cluster configuration comparisons identify performance differences of up to 7.7x and highlight performance optimization opportunities of up to 1.4x when employing memory expansion as an optimization technique."
22,Patching up Network Data Leaks with Sweeper,9,2022,https://scholar.google.com/citations?view_op=view_citation&hl=en&user=Mm-dHpMAAAAJ&pagesize=50&citation_for_view=Mm-dHpMAAAAJ:QIV2ME_5wuYC,"Datacenters have witnessed a staggering evolution in networking technologies, driven by insatiable application demands for larger datasets and inter-server data transfers. Modern NICs can already handle 100s of Gbps of traffic, a bandwidth capability equivalent to several memory channels. Direct Cache Access mechanisms like DDIO that contain network traffic inside the CPU’s caches are therefore essential to effectively handle growing network traffic rates. However, a growing body of work reveals instances of a critical DDIO weakness known as “leaky DMA”, occurring when a significant fraction of network traffic leaks from the CPU’s caches to memory. We find that such network data leaks cap the network bandwidth a server can effectively utilize. We identify that a major culprit for such network data leaks are evictions of already consumed dirty network buffers. Our key insight is that buffers already consumed by the …"
23,Cooperative Concurrency Control for Write-Intensive Key-Value Workloads,8,2023,https://scholar.google.com/citations?view_op=view_citation&hl=en&user=Mm-dHpMAAAAJ&pagesize=50&citation_for_view=Mm-dHpMAAAAJ:9ZlFYXVOiuMC,"Key-Value Stores (KVS) are foundational infrastructure components for online services. Due to their latency-critical nature, today’s best-performing KVS contain a plethora of full-stack optimizations commonly targeting read-mostly, popularity-skewed workloads. Motivated by production studies showing the increased prevalence of write-intensive workloads, we break down the KVS workload space into four distinct classes, and argue that current designs are only sufficient for two of them. The reason is that KVS concurrency control protocols expose a fundamental tradeoff: avoiding synchronization by partitioning writes across threads is mandatory for high throughput, but necessarily creates load imbalance that grows with core count and write fraction. We break this tradeoff with C-4, a co-design between NIC hardware and KVS software that judiciously separates write requests into two classes: independent ones that …"
