Rank,Title,Citations,Year,URL,Description
24,NFSlicer: Data Movement Optimization for Shallow Network Functions,7,2022,https://scholar.google.com/citations?view_op=view_citation&hl=en&user=Mm-dHpMAAAAJ&pagesize=50&citation_for_view=Mm-dHpMAAAAJ:mVmsd5A6BfQC,"Network Function (NF) deployments on commodity servers have become ubiquitous in datacenters and enterprise settings. Many commonly used NFs such as firewalls, load balancers and NATs are shallow - i.e., they only examine the packet's header, despite the entire packet being transferred on and off the server. As a result, the gap between moved and inspected data when handling large packets exceeds 20x. At modern network rates, such excess data movement is detrimental to performance, hurting both the average and 90% tail latency of large packets by up to 1.7x. Our thorough performance analysis identifies high contention on the NIC-server PCIe interface and in the server's memory hierarchy as the main bottlenecks. We introduce NFSlicer, a data movement optimization implemented as a NIC extension to mitigate the bottlenecks stemming from data movement deluge in deployments of shallow NFs on commodity servers. NFSlicer only transfers the small portion of each packet that the deployed NFs actually inspect, by slicing the packet's payload and temporarily storing it in on-NIC memory. When the server later transmits the processed packet, NFSlicer splices it to its previously sliced payload. We develop a software-based emulation platform and demonstrate that NFSlicer effectively minimizes data movement between the NIC and the server, bridging the latency gap between small and large packet NF processing. On a range of shallow NFs handling 1518B packets, NFSlicer reduces average and 90% tail latency by up to 17% / 29%, respectively."
25,Algorithm/Architecture Co-Design for Near-Memory Processing,7,2018,https://scholar.google.com/citations?view_op=view_citation&hl=en&user=Mm-dHpMAAAAJ&pagesize=50&citation_for_view=Mm-dHpMAAAAJ:roLk4NBRz8UC,"With mainstream technologies to couple logic tightly with memory on the horizon, near-memory processing has re-emerged as a promising approach to improving performance and energy for data-centric computing. DRAM, however, is primarily designed for density and low cost, with a rigid internal organization that favors coarse-grain streaming rather than byte-level random access. This paper makes the case that treating DRAM as a block-oriented streaming device yields significant efficiency and performance benefits, which motivate for algorithm/architecture co-design to favor streaming access patterns, even at the price of a higher order algorithmic complexity. We present the Mondrian Data Engine that drastically improves the runtime and energy efficiency of basic in-memory analytic operators, despite doing more work as compared to traditional CPU-optimized algorithms, which heavily rely on random …"
26,COSPlay: Leveraging Task-Level Parallelism for High-Throughput Synchronous Persistence,4,2021,https://scholar.google.com/citations?view_op=view_citation&hl=en&user=Mm-dHpMAAAAJ&pagesize=50&citation_for_view=Mm-dHpMAAAAJ:M3ejUd6NZC8C,"A key challenge in programming crash-consistent applications for Persistent Memory (PM) is achieving high performance while controlling the order of PM updates. Managing persist ordering from the CPU typically requires frequent synchronization points, which expose the PM’s high persist latency on the execution’s critical path. To mitigate this overhead, prior proposals relax the persistency model and decouple persistence from the program’s volatile execution, delegating persistence ordering to specialized hardware mechanisms such that persistent state lags behind volatile state. In this work, we identify the opportunity to mitigate the effect of persist latency by leveraging the task-level parallelism available in many PM applications, while preserving the stricter semantics of synchronous persistence and the familiar x86 persistency model. We introduce COSPlay, a software-hardware co-design that employs …"
27,IDIO: Orchestrating Inbound Network Data on Server Processors,4,2020,https://scholar.google.com/citations?view_op=view_citation&hl=en&user=Mm-dHpMAAAAJ&pagesize=50&citation_for_view=Mm-dHpMAAAAJ:ULOm3_A8WrAC,"Network bandwidth demand in datacenters is doubling every 12 to 15 months. In response to this demand, high-bandwidth network interface cards, each capable of transferring 100s of Gigabits of data per second, are making inroads into the servers of next-generation datacenters. Such unprecedented data delivery rates on server endpoints raise new challenges, as inbound network traffic placement decisions within the memory hierarchy have a direct impact on end-to-end performance. Modern server-class Intel processors leverage DDIO technology to steer all inbound network data into the last-level cache (LLC), regardless of the network traffic’s nature. This static data placement policy is suboptimal, both from a performance and an energy efficiency standpoint. In this work, we design IDIO, a framework that—unlike DDIO—dynamically decides where to place inbound network traffic within a server’s multi-level …"
28,Citadel: Rethinking Memory Allocation to Safeguard Against Inter-Domain Rowhammer Exploits,3,2025,https://scholar.google.com/citations?view_op=view_citation&hl=en&user=Mm-dHpMAAAAJ&pagesize=50&citation_for_view=Mm-dHpMAAAAJ:bEWYMUwI8FkC,"Rowhammer is a hardware security vulnerability at the heart of every DRAM-based memory system. Despite its discovery a decade ago, comprehensive defenses in current systems remain elusive, while the probability of successful attacks grows with DRAM density. Hardware-based defenses have proven ineffective due to substantial cost, delays in commercial adoption, and repeated circumventions by attackers, while more flexible software-based solutions incur major performance and memory capacity overheads or offer only limited protection. Citadel is a new memory allocator design that prevents Rowhammer-initiated security exploits by addressing the vulnerability’s root cause: physical adjacency of DRAM rows. It introduces flexible security domains and isolates them in physically disjoint memory regions, guaranteeing security by design. On a server system, Citadel supports thousands of security domains …"
29,Leveraging memory expansion to accelerate large-scale dl training,3,2024,https://scholar.google.com/citations?view_op=view_citation&hl=en&user=Mm-dHpMAAAAJ&pagesize=50&citation_for_view=Mm-dHpMAAAAJ:HDshCWvjkbEC,"Modern Deep Learning (DL) models require massive clusters of specialized, high-end nodes to train. Designing such clusters to maximize both performance and utilization is a challenging task requiring careful balance of compute, memory, and network resources. Moreover, a plethora of each model's tuning knobs drastically affect a cluster's performance, with optimal values often depending on the underlying hardware characteristics, thus necessitating a complex cluster-workload co-design process. To facilitate design space exploration, we develop Come T,a holistic cluster design methodology and workflow to jointly study the impact of parallelization strategies and key cluster resource provisioning on the performance of distributed DL training. In this short paper, we use Comet to focus on studying the impact of each compute node's memory system on overall cluster performance. We show that per-node memory …"
30,Safety hints for htm capacity abort mitigation,2,2023,https://scholar.google.com/citations?view_op=view_citation&hl=en&user=Mm-dHpMAAAAJ&pagesize=50&citation_for_view=Mm-dHpMAAAAJ:ZeXyd9-uunAC,"Hardware Transactional Memory (HTM) is a high-performance instantiation of the powerful programming abstraction of transactional memory, which simplifies the daunting— yet critically important—task of parallel programming. While many HTM implementations with variable complexity exist in the literature, commercially available HTMs impose rigid restrictions to transaction and system behavior, limiting their practical use. A key constraint is the limited size of supported transactions, implicitly capped by hardware buffering capacity. We identify the opportunity to expand the effective capacity of these limited hardware structures by being more selective in memory accesses that need to be tracked. We leverage compiler and virtual memory support to identify safe memory accesses, which can never cause a transaction abort, subsequently passed as safety hints to the underlying HTM. With minor extensions over a …"
31,Exploring Memory Expansion Designs for Training Mixture-of-Experts Models,2,2023,https://scholar.google.com/citations?view_op=view_citation&hl=en&user=Mm-dHpMAAAAJ&pagesize=50&citation_for_view=Mm-dHpMAAAAJ:qUcmZB5y_30C,"Memory Optimization Techniques. ZeRO [27] is a representative memory optimization technique. ZeRO-DP optimizes the model states by partitioning model parameters and removing replicates while ZeRO-R optimizes the residual states. ZeRO-DP has three stages: ZeRO-1, ZeRO-2, and ZeRO-3. Fullysharded data parallelism (FSDP)[5],[24],[36] is a library similar to ZeRO-3 that enables parameter sharding. Other previously proposed memory optimization techniques include memory-efficient optimizers [2],[32], recomputation [7],[25],[33], and memory harvesting [9]. Memory Offloading Techniques. The key idea behind memory offloading is to offload model parameters or optimizer states to remote memory, which is located away from local"
32,Network-Compute Co-Design for Distributed In-Memory Computing,2,2018,https://scholar.google.com/citations?view_op=view_citation&hl=en&user=Mm-dHpMAAAAJ&pagesize=50&citation_for_view=Mm-dHpMAAAAJ:UebtZRa9Y70C,"Modern online services have gradually become an integral part of everyday life for billions of users. Web search, email, social networking, and e-commerce are a few examples of such popular massive-scale services. At the time of writing, Google claims 1 billion Gmail users and 1.5 billion search engine users, servicing over 3.5 billion search queries per day [42, 84]. Facebook has over 1.4 billion daily and 2.1 billion monthly active users [58], while massive-scale online retailers Amazon and Alibaba receive online orders corresponding to 3 and 12 million daily item shipments, respectively [172]. With every user constantly generating data and each user request probing data services handling petabytes of data, data access demands are growing dramatically. To cope with such data and userbase deluge, online service providers deploy several massive-scale datacenters, each populated with tens of thousands of servers.In addition to the challenge of immense volume, online services have to be interactive, delivering seamless high-quality experience to all users; failing to do so may result in customer loss. Prior work has shown that users are sensitive to response latencies in the orders of hundreds of milliseconds [86, 131]. Experiences from real-life commercial settings corroborate this observation and highlight the dramatic impact of latency in company revenue: every 100ms of latency costs Amazon 1% in sales, while an extra 500ms in search page generation time drops traffic to Google by 20%[77]. It is therefore common for online service providers to set strict latency boundaries for servicing user requests as part of their service’s quality metric …"
33,Pushing the Memory Bandwidth Wall with CXL-enabled Idle I/O Bandwidth Harvesting,1,2025,https://scholar.google.com/citations?view_op=view_citation&hl=en&user=Mm-dHpMAAAAJ&pagesize=50&citation_for_view=Mm-dHpMAAAAJ:k_IJM867U9cC,"The continual increase of cores on server-grade CPUs raises demands on memory systems, which are constrained by limited off-chip pin and data transfer rate scalability. As a result, high-end processors typically feature lower memory bandwidth per core, at the detriment of memory-intensive workloads. We propose alleviating this challenge by improving the utility of the CPU's limited pins. In a typical CPU design process, the available pins are apportioned between memory and I/O traffic, each accounting for about half of the total off-chip bandwidth availability. Consequently, unless both memory and I/O are simultaneously highly utilized, such fragmentation leads to underutilization of the valuable off-chip bandwidth resources. An ideal architecture would offer I/O and memory bandwidth fungibility, allowing use of the aggregate off-chip bandwidth in the form required by each workload. In this work, we introduce SURGE, a software-supported architectural technique that boosts memory bandwidth availability by salvaging idle I/O bandwidth resources. SURGE leverages the capability of versatile interconnect technologies like CXL to dynamically multiplex memory and I/O traffic over the same processor interface. We demonstrate that SURGE-enhanced architectures can accelerate memory-intensive workloads on bandwidth-constrained servers by up to 1.3x."
34,Sassy: SmartNIC-Assisted Notification Delivery for μs-Scale RDMA Workloads,0,2026,https://scholar.google.com/citations?view_op=view_citation&hl=en&user=Mm-dHpMAAAAJ&pagesize=50&citation_for_view=Mm-dHpMAAAAJ:JV2RwH3_ST0C,"RDMA is the preferred ultra-low-latency transport in modern datacenters. As services decompose into latency-critical microservices, servers maintain hundreds to thousands of connections across tiers. However, RDMA's polling-based RPC notification struggles at high core and connection counts, forcing a tradeoff between idle polling, inter-core synchronization costs, and load imbalance—each limiting throughput for -scale services. We introduce Sassy, a smartNIC-based notification mechanism that breaks this tradeoff, optimizing the performance and scalability of servicing -scale RPCs over high connection counts. Sassy eliminates performance overheads stemming from idle polling and inter-core synchronization, while balancing the load of active RDMA connections across available cores. We implement Sassy on an FPGA-enhanced NIC and evaluate it on a range of traffic patterns, as well as a high …"
35,System and method for mitigating non-uniform memory access challenges with compute express link-enabled memory pooling,0,2025,https://scholar.google.com/citations?view_op=view_citation&hl=en&user=Mm-dHpMAAAAJ&pagesize=50&citation_for_view=Mm-dHpMAAAAJ:maZDTaKrznsC,"An exemplary multi-socket system and method are disclosed for employing a memory pool configured with memory resources accessible to every core, at CPU sockets, of every multi-CPU-socket chassis in the system. The exemplary system can migrate, via one or more computer express links (CXL), heavily shared memory resources (eg, vagabond pages) from a specific multi-CPU-socket chassis to the memory pool, where every core can access the shared memory resources in quick single-hop accesses, thereby mitigating performance bottlenecks caused by slow multi-hop memory accesses to the same memory resources."
36,Algorithmic Tradeoff Exploration for Component Placement and Wire Routing in Nanomodular Electronics,0,2025,https://scholar.google.com/citations?view_op=view_citation&hl=en&user=Mm-dHpMAAAAJ&pagesize=50&citation_for_view=Mm-dHpMAAAAJ:TFP_iSt0sucC,"Advances in fabrication technology have enabled modularizing electronic components at the micro- or nano-scale and composing these modules on demand into larger circuits. Micromodular and nanomodular electronics (ME and NE) open a new design space in electronics, promising a degree of flexibility, extensibility, and accessibility far superior to traditional monolithic methods. ME/NE leverage a multi-stage process of initial imprecise component deposition, followed by precise wire printing to compose them into a circuit. Due to imperfections in deposition, each circuit instance has a unique layout with its own component placement and wire routing solutions, putting the design automation process on the critical path. Moreover, high-performance nanomodular components enable the synthesis of larger heterogeneous circuits than traditional printed electronics, requiring more scalable algorithms. ME/NE thus introduce a tradeoff between the time-to-solution for placement/routing algorithms and the resulting total wire length, with the latter dictating circuit printing time. We explore this tradeoff by adapting standard partitioning, floorplanning, placement, and routing algorithms to the unique characteristics of ME/NE. Our evaluations demonstrate significant optimization headroom in different dimensions. For example, our tunable algorithms can deliver a improvement in end-to-end manufacturing time at the cost of increase in total wire length. Conversely, circuit quality/performance can be prioritized at the cost of increased manufacturing time, highlighting the value of the ability to dynamically navigate the tradeoff space according to the …"
37,eCAV: An Edge-Assisted Evaluation Platform for Connected Autonomous Vehicles,0,2025,https://scholar.google.com/citations?view_op=view_citation&hl=en&user=Mm-dHpMAAAAJ&pagesize=50&citation_for_view=Mm-dHpMAAAAJ:iH-uZ7U-co4C,"As autonomous vehicles edge closer to widespread adoption, enhancing road safety through collision avoidance and minimization of collateral damage becomes imperative. Vehicle-to-everything (V2X) technologies, which include vehicle-to-vehicle (V2V), vehicle-to-infrastructure (V2I), and vehicle-to-cloud (V2C), are being proposed as mechanisms to achieve this safety improvement. Simulation-based testing is crucial for early-stage evaluation of Connected Autonomous Vehicle (CAV) control systems, offering a safer and more cost-effective alternative to real-world tests. However, simulating large 3D environments with many complex single- and multi-vehicle sensors and controllers is computationally intensive. There is currently no evaluation framework that can effectively evaluate realistic scenarios involving large numbers of autonomous vehicles. We propose eCAV -- an efficient, modular, and scalable evaluation platform to facilitate both functional validation of algorithmic approaches to increasing road safety, as well as performance prediction of algorithms of various V2X technologies, including a futuristic Vehicle-to-Edge control plane and correspondingly designed control algorithms. eCAV can model up to 256 vehicles running individual control algorithms without perception enabled, which is more vehicles than what is possible with state-of-the-art alternatives."
38,Filtering Wasteful Vertex Visits in Breadth-First Search,0,2023,https://scholar.google.com/citations?view_op=view_citation&hl=en&user=Mm-dHpMAAAAJ&pagesize=50&citation_for_view=Mm-dHpMAAAAJ:hC7cP41nSMkC,"Breadth-First Search (BFS) is a common building block for several graph processing algorithms today. In this work, we highlight that a large fraction of vertex visits across the network in distributed BFS results in wasteful work. We investigate methods to identify and filter such wasteful cross-network vertex visits to save network bandwidth for energy and performance improvements. We analyze the metadata requirements to perform such filtering in modern hierarchical distributed architectures and identify the tradeoffs between storage and filtering rate. We perform our experiments using the graph500 benchmark and provide a model to scale results to larger graphs. Finally, we propose heuristics to reduce the storage for a BFS message filter and explore the design space for implementing such filtering logic in software, hardware, or a combination."
39,Unleashing the full potential of persistent memory with logless atomic durability,0,2020,https://scholar.google.com/citations?view_op=view_citation&hl=en&user=Mm-dHpMAAAAJ&pagesize=50&citation_for_view=Mm-dHpMAAAAJ:blknAaTinKkC,"Persistent Memory (PM) devices, like 3D-Xpoint, are now commercially available. Software can leverage the combination of its fast access and persistence for significant performance gains. A key challenge for PM-aware software is to maintain high performance while achieving atomic durability requirements. The latter traditionally requires the use of logging, which introduces considerable overhead with additional CPU cycles, write traffic, and ordering requirements. In this paper, we exploit the data multiversioning inherent in the memory hierarchy to achieve atomic durability without logging. Our design, LAD, relies on persistent buffering space at the memory controllers (MCs)—already present in modern CPUs—to speculatively accumulate all of a transaction’s updates before atomically committing them to PM. LAD employs an on-chip distributed commit protocol in hardware to manage the distributed speculative state each transaction accumulates across multiple MCs. LAD relies on modest hardware modifications to provide atomically durable transactions, delivering up to 80% of ideal—ie, PM-oblivious software’s—performance."
40,Scale-out non-uniform memory access,0,2015,https://scholar.google.com/citations?view_op=view_citation&hl=en&user=Mm-dHpMAAAAJ&pagesize=50&citation_for_view=Mm-dHpMAAAAJ:M3NEmzRMIkIC,"A computing system that uses a Scale-Out NUMA (“soNUMA”) architecture, programming model, and/or communication protocol provides for low-latency, distributed in-memory processing. Using soNUMA, a programming model is layered directly on top of a NUMA memory fabric via a stateless messaging protocol. To facilitate interactions between the application, OS, and the fabric, soNUMA uses a remote memory controller—an architecturally-exposed hardware block integrated into the node's local coherence hierarchy."
