Rank,Title,Citations,Year,URL,Description
45,“Why Did You Say That?”: Understanding Explainability in Conversational AI Systems for Older Adults with Mild Cognitive Impairment (MCI),8,2023,https://scholar.google.com/citations?view_op=view_citation&hl=en&user=LAuxzv0AAAAJ&pagesize=50&citation_for_view=LAuxzv0AAAAJ:pqnbT2bcN3wC,"As Conversational AI systems evolve, their user base widens to encompass individuals with varying cognitive abilities, including older adults facing cognitive challenges like Mild Cognitive Impairment (MCI). Current systems, like smart speakers, struggle to provide effective explanations for their decisions or responses. This paper argues that the expectations and requirements for AI explanations for older adults with MCI differ significantly from conventional Explainable AI (XAI) research goals. Drawing from our ongoing research involving older adults with MCI and their interactions with the Google Home Hub, we highlight breakdowns in conversational flow when older adults seek explanations. Based on our experience, we conclude with recommendations for HCI researchers to adopt a more human-centered approach as we move towards developing the next generation of AI systems."
46,Supporting children with complex communication needs,8,2014,https://scholar.google.com/citations?view_op=view_citation&hl=en&user=LAuxzv0AAAAJ&pagesize=50&citation_for_view=LAuxzv0AAAAJ:_kc_bZDykSQC,"Many children face significant challenges communicating, expressing themselves, and sharing their creative thoughts and ideas with others. Interactive technologies are playing an increasing role in addressing these challenges. This workshop will be an opportunity to discuss design, implementation, and evaluation methods, the needs of specific communities, as well as experiences in previous and current projects."
47,Ai‐Caring: National AI Institute for Collaborative Assistance and responsive interaction for networked groups,7,2024,https://scholar.google.com/citations?view_op=view_citation&hl=en&user=LAuxzv0AAAAJ&pagesize=50&citation_for_view=LAuxzv0AAAAJ:HoB7MX3m0LUC,"Over 13 million Americans aged 65 and older are currently living with a diagnosis of mild cognitive impairment (MCI), a common precursor to dementia. These individuals largely rely on a network of informal caregivers—family, friends, and community members—who work together with professional healthcare and social service providers to provide care and support in home settings. The AI‐CARING Institute contributes foundational AI research focused on developing personalized collaborative AI systems that improve the quality of life and independence of aging adults living at home."
48,Towards in-home collection of behavior specimens: Within the cultural context of autism in Pakistan,7,2012,https://scholar.google.com/citations?view_op=view_citation&hl=en&user=LAuxzv0AAAAJ&pagesize=50&citation_for_view=LAuxzv0AAAAJ:3fE2CSJIrl8C,"Children with autism often engage in problem behaviors. The frequency and severity of these behaviors can be very detrimental to their quality of life. Direct observation of problem behaviors is the gold standard for assessment and intervention, but it can be costly and intrusive. It also introduces specific challenges, such as lack of occurrence of episodes of problem behavior during clinical observation, and behavior reactivity in the presence of an observer. We propose a smart phone based capture system that can support parents in collecting samples of their child's problem behaviors in the home for assessment and intervention purposes. Four concept exploration and concept validation studies were conducted with parents, behavior analysts and other caregivers of children with autism in Pakistan. A prototype informed by the concept exploration studies was developed and used as a probe in the concept validation …"
49,Detection of laughter in children's speech using spectral and prosodic acoustic features,6,2013,https://scholar.google.com/citations?view_op=view_citation&hl=en&user=LAuxzv0AAAAJ&pagesize=50&citation_for_view=LAuxzv0AAAAJ:UebtZRa9Y70C,"Laughter is an important para-linguistic cue that can be useful in gauging the affective state of the speaker. In this paper, we present an approach to detecting laughter in children's speech using acoustic features in the spectral and prosodic domains. Feature selection was performed using the information gain-based technique and a speaker-independent validation using a support vector machine (SVM), an accuracy of 94.43% was observed, which was a 12.48% absolute improvement over the baseline result of 81.95%. For us to explore generalization properties, the models of speech and laughter were tested on a completely different database of adult-child interactions known as the Multimodal Dyadic Behavior Dataset (MDBD). The accuracy using the earlier trained models was 70.58%. Even though the children in this database were toddlers (less than three years old), the results suggest that the predictive …"
50,The collaboration and harmonization of digital biomarkers for Alzheimer’s research,5,2022,https://scholar.google.com/citations?view_op=view_citation&hl=en&user=LAuxzv0AAAAJ&pagesize=50&citation_for_view=LAuxzv0AAAAJ:2P1L_qKh6hAC,"Background Among prominent unmet needs of the Alzheimer’s disease and related dementia (ADRD) research community is the ability to leverage opportunities to improve the assessments of persons with and at risk for ADRD. This vision can be realized by providing the tools and infrastructure to transform dementia assessment using remote sensing and digital technologies, pervasive computing, and wireless communications, all in concert with high dimensional data analytics. The Collaborative Aging Research using Technology (CART) initiative (carthome.org), a non‐proprietary, sharable end‐to‐end system for capturing and handling diverse kinds of digital data has been developed. The CART technology platform offers the opportunity to bring new assessment methodology and data types to NIA Alzheimer’s Disease Research Centers (ADRC) and related centers and transform the clinical research enterprise …"
