Rank,Title,Citations,Year,URL,Description
23,Brief report: using a point-of-view camera to measure eye gaze in young children with autism spectrum disorder during naturalistic social interactions: a pilot study,53,2017,https://scholar.google.com/citations?view_op=view_citation&hl=en&user=LAuxzv0AAAAJ&pagesize=50&citation_for_view=LAuxzv0AAAAJ:mB3voiENLucC,"Children with autism spectrum disorder (ASD) show reduced gaze to social partners. Eye contact during live interactions is often measured using stationary cameras that capture various views of the child, but determining a child’s precise gaze target within another’s face is nearly impossible. This study compared eye gaze coding derived from stationary cameras to coding derived from a “point-of-view” (PoV) camera on the social partner. Interobserver agreement for gaze targets was higher using PoV cameras relative to stationary cameras. PoV camera codes, but not stationary cameras codes, revealed a difference between gaze targets of children with ASD and typically developing children. PoV cameras may provide a more sensitive method for measuring eye contact in children with ASD during live interactions."
24,Increased eye contact during conversation compared to play in children with autism,49,2017,https://scholar.google.com/citations?view_op=view_citation&hl=en&user=LAuxzv0AAAAJ&pagesize=50&citation_for_view=LAuxzv0AAAAJ:-f6ydRqryjwC,"Children with autism have atypical gaze behavior but it is unknown whether gaze differs during distinct types of reciprocal interactions. Typically developing children (N = 20) and children with autism (N = 20) (4–13 years) made similar amounts of eye contact with an examiner during a conversation. Surprisingly, there was minimal eye contact during interactive play in both groups. Gaze behavior was stable across 8 weeks in children with autism (N = 15). Lastly, gaze behavior during conversation but not play was associated with autism social affect severity scores (ADOS CSS SA) and the Social Responsiveness Scale (SRS-2). Together findings suggests that eye contact in typical and atypical development is influenced by subtle changes in context, which has implications for optimizing assessments of social communication skills."
25,Representing sudden shifts in intensive dyadic interaction data using differential equation models with regime switching,46,2018,https://scholar.google.com/citations?view_op=view_citation&hl=en&user=LAuxzv0AAAAJ&pagesize=50&citation_for_view=LAuxzv0AAAAJ:bEWYMUwI8FkC,"A growing number of social scientists have turned to differential equations as a tool for capturing the dynamic interdependence among a system of variables. Current tools for fitting differential equation models do not provide a straightforward mechanism for diagnosing evidence for qualitative shifts in dynamics, nor do they provide ways of identifying the timing and possible determinants of such shifts. In this paper, we discuss regime-switching differential equation models, a novel modeling framework for representing abrupt changes in a system of differential equation models. Estimation was performed by combining the Kim filter (Kim and Nelson State-space models with regime switching: classical and Gibbs-sampling approaches with applications, MIT Press, Cambridge, 1999) and a numerical differential equation solver that can handle both ordinary and stochastic differential equations. The proposed approach …"
26,Error patterns on the Raven's Standard Progressive Matrices test,42,2016,https://scholar.google.com/citations?view_op=view_citation&hl=en&user=LAuxzv0AAAAJ&pagesize=50&citation_for_view=LAuxzv0AAAAJ:qUcmZB5y_30C,"Although many psychometric tests, like the Raven's Progressive Matrices test, are commonly evaluated according to total score, additional variables can lend insight into the underlying cognitive processes of the test takers. We examine conceptual errors on the Raven's Standard Progressive Matrices (SPM) test. We present a new, complete classification of error types on the SPM using a two-kind coding scheme. We also present a new method for analyzing group errors patterns on these kinds of tests. We present two examples of this analysis using our SPM error classification. The first looks at the errors made by an artificial intelligence model of Raven's problem solving. The second example looks at the errors made by children and adults who are typically developing or have been diagnosed with autism. We close by discussing implications of this error classification and analysis method for the interpretation of …"
27,Maternal sensitivity and attachment in atypical groups,42,2003,https://scholar.google.com/citations?view_op=view_citation&hl=en&user=LAuxzv0AAAAJ&pagesize=50&citation_for_view=LAuxzv0AAAAJ:IjCSPb-OGe4C,"The parent–child relationship develops and is shaped by both parental and child characteristics. Although the burden of responsibility is on the adult, the child, from birth, behaves in ways that will elicit care from the parent. Infants are genetically programmed to behave in ways that promote and maintain contact with other humans. The infant, through discriminative crying, looking, and smiling, initiates, maintains, and responds to social interaction (Bell, 1981). Infants actively seek out stimulation, attend selectively, and show strong preferences among stimuli and for certain levels of stimulus change. Significant individual differences are noted. But what if the infant’s initiations are seriously diminished, as occurs with very low birthweight preterm infants who are born very early (Goldberg & DiVitto, 1995)? Or what if the child’s initiations and responses are deviant, as in the case of either Down syndrome or autistic …"
28,Play with Me: Measuring a Child’s Engagement in a Social Interaction,32,2015,https://scholar.google.com/citations?view_op=view_citation&hl=en&user=LAuxzv0AAAAJ&pagesize=50&citation_for_view=LAuxzv0AAAAJ:4DMP91E08xMC,"Due to the challenges in automatically observing child behaviour in a social interaction, an automatic extraction of high-level features, such as head poses and hand gestures, is difficult and noisy, leading to an inaccurate model. Hence, the feasibility of using easily obtainable low-level optical flow based features is investigated in this work. A comparative study involving high-level features, baseline annotations of multiple modalities and the low-level features is carried out. Optical flow based hidden structure learning of behaviours is strongly discriminatory in predicting a child's engagement level in a social interaction. A two-stage approach of discovering the hidden structures using Hidden Conditional Random Fields, followed by learning an SVM-based model on the hidden state marginals is proposed. This is validated by conducting experiments on the Multimodal Dyadic Behaviour Dataset and the results indicate …"
29,""" I don't know how to help with that""-Learning from Limitations of Modern Conversational Agent Systems in Caregiving Networks",31,2023,https://scholar.google.com/citations?view_op=view_citation&hl=en&user=LAuxzv0AAAAJ&pagesize=50&citation_for_view=LAuxzv0AAAAJ:g5m5HwL7SMYC,"While commercial conversational agents (CA) (i.e. Google assistant, Siri, Alexa) are widely used, these systems have limitations in error-handling, flexibility, personalization and overall dialogue management that are amplified in care coordination settings. In this paper, we synthesize and articulate these limitations through quantitative and qualitative analysis of 56 older adults interacting with a commercial CA deployed in their home for a 10 week period. We look at the CA as a compensatory technology in an older adult's care network. We argue that the CA limitations are rooted in the rigid cue-and-response style of task-oriented interactions common in CAs. We then propose a redesign for CA conversation flow to favor flexibility and personalization that is nonetheless viable within the limitations of current AI and machine learning technologies. We explore design tradeoffs to better support the usability needs of …"
30,Supporting parents for in-home capture of problem behaviors of children with developmental disabilities,29,2012,https://scholar.google.com/citations?view_op=view_citation&hl=en&user=LAuxzv0AAAAJ&pagesize=50&citation_for_view=LAuxzv0AAAAJ:YsMSGLbcyi4C,"Ubiquitous computing has shown promise in applications for health care in the home. In this paper, we focus on a study of how a particular ubicomp capability, selective archiving, can be used to support behavioral health research and practice. Selective archiving technology, which allows the capture of a window of data prior to and after an event, can enable parents of children with autism and related disabilities to record video clips of events leading up to and following an instance of problem behavior. Behavior analysts later view these video clips to perform a functional assessment. In contrast to the current practice of direct observation, a powerful method to gather data about child problem behaviors but costly in terms of human resources and liable to alter behavior in the subjects, selective archiving is cost effective and has the potential to provide rich data with minimal instructions to the natural environment. To …"
31,Visual analysis of proximal temporal relationships of social and communicative behaviors,28,2015,https://scholar.google.com/citations?view_op=view_citation&hl=en&user=LAuxzv0AAAAJ&pagesize=50&citation_for_view=LAuxzv0AAAAJ:qxL8FJ1GzNcC,"Developmental psychology researchers examine the temporal relationships of social and communicative behaviors, such as how a child responds to a name call, to understand early typical and atypical development and to discover early signs of autism and developmental delay. These related behaviors occur together or within close temporal proximity, forming unique patterns and relationships of interest. However, the task of finding these early signs, which are in the form of atypical behavioral patterns, becomes more challenging when behaviors of multiple children at different ages need to be compared with each other in search of generalizable patterns. The ability to visually explore the temporal relationships of behaviors, including flexible redefinition of closeness, over multiple social interaction sessions with children of different ages, can make such knowledge extraction easier. We have designed a …"
32,Joint alignment and modeling of correlated behavior streams,28,2013,https://scholar.google.com/citations?view_op=view_citation&hl=en&user=LAuxzv0AAAAJ&pagesize=50&citation_for_view=LAuxzv0AAAAJ:Se3iqnhoufwC,"The Variable Time-Shift Hidden Markov Model (VTS-HMM) is proposed for learning and modeling pairs of correlated streams. Unlike previous coupled models for time series, the VTS-HMM accounts for varying time shifts between correlated events in pairs of streams having different properties. The VTS-HMM is learned on a set of pairs of unaligned streams and, thus, learning entails simultaneous estimation of the varying time shifts and of the parameters of the model. The formulation is demonstrated in the analysis of videos of dyadic social interactions between children and adults in the Multimodal Dyadic Behavior Dataset (MMDB). In dyadic social interactions, an agent starts an interaction with one or more"" initiating behaviors"" that elicit one or more"" responding behaviors"" from the partner within a temporal window. The proposed VTS-HMM explicitly accounts for varying time shifts between initiating and responding behaviors in these behavior streams. The experiments confirm that modeling of these varying time shifts in the VTS-HMM can yield improved estimation of the level of engagement of the child and adult and more accurate discrimination among complex activities."
33,Acoustical analysis of engagement behavior in children.,23,2012,https://scholar.google.com/citations?view_op=view_citation&hl=en&user=LAuxzv0AAAAJ&pagesize=50&citation_for_view=LAuxzv0AAAAJ:_FxGoFyzp5QC,"In this work we analyze the expressive manifestation of a child’s engagement behavior on his speech as well as in the speech of psychologist interacting with the child. Visual cues such as facial gestures and gaze are known to be informative of engagement, but here, we examine the less studied speech cues of the children’s non-verbal vocalizations. We study the spectral, prosodic and duration features obtained from the child and the psychologist’s vocal data. We observe that these measures carry discriminative power in assessing specific engagement levels of the children (49.2% accuracy in classifying 3 levels of engagement compared to 33% chance accuracy). We also present our results as a detection task for disengagement with precision, recall and f-measure of. 70,. 42,. 53, respectively. The unweighted accuracy for binary classification between engagement and disengagement is 62.9%. Our results …"
34,Continuous measurement of attachment behavior: A multimodal view of the strange situation procedure,22,2021,https://scholar.google.com/citations?view_op=view_citation&hl=en&user=LAuxzv0AAAAJ&pagesize=50&citation_for_view=LAuxzv0AAAAJ:J_g5lzvAfSwC,"Infant attachment is a critical indicator of healthy infant social-emotional functioning, which is typically measured using the gold-standard Strange Situation Procedure (SSP). However, expert-based attachment classifications from the SSP are time-intensive (with respect both to expert training and rating), and do not provide an objective, continuous record of infant behavior. To continuously quantify predictors of key attachment behaviors and dimensions, multimodal movement and audio data were collected during the SSP. Forty-nine 1-year-olds and their mothers participated in the SSP and were tracked in three-dimensional space using five synchronized Kinect sensors; LENA recordings were used to quantify crying duration. Theoretically-informed multimodal measures of attachment-related behavior (e.g., dyadic contact duration, infant velocity of approach toward the mother, and infant crying) were used to predict …"
35,Major Current Neuropsychological,22,2010,https://scholar.google.com/citations?view_op=view_citation&hl=en&user=LAuxzv0AAAAJ&pagesize=50&citation_for_view=LAuxzv0AAAAJ:hqOjcs7Dif8C,"Since 1943, when Leo Kanner first described autism, numerous neuropsychological theories have attempted to explain the triad of deficits in social relatedness, communication, and restricted, repetitive, and stereotyped behaviors and interests that characterize autism spectrum disorders (ASD). A strong neuropsychologi-cal theory explicitly connects observable behavior to brain function and/or structure, elucidating the brainbehavior relationships. However, a strong neuropsy-chological theory of autism also should address all three domains of symptoms seen in autism. The hypotheses regarding autism's etiology have varied in their ability to explain all three areas of deficit. In fact, rather than a broad approach that ties together the three symptom domains, many theories instead take the approach of identifying the"" core deficit"" from which the other symptoms develop as a cascade. This chapter reviews the major neuropsychological theories of ASD that have emerged in the last several decades, which we have sorted into the following categories: executive functioning, information processing, social motivation, and social cognition. We close with a section on emerging topics, and relatively recent theories and models for which researchers are building empirical support, such as mirror neurons and their relevance to mimicry and imitation, animal models, and neural networks. Some of the theories discussed here are dealt with in more detail in other chapters in this volume."
36,Modeling multiple time series annotations as noisy distortions of the ground truth: An expectation-maximization approach,21,2016,https://scholar.google.com/citations?view_op=view_citation&hl=en&user=LAuxzv0AAAAJ&pagesize=50&citation_for_view=LAuxzv0AAAAJ:iH-uZ7U-co4C,"Studies of time-continuous human behavioral phenomena often rely on ratings from multiple annotators. Since the ground truth of the target construct is often latent, the standard practice is to use ad-hoc metrics (such as averaging annotator ratings). Despite being easy to compute, such metrics may not provide accurate representations of the underlying construct. In this paper, we present a novel method for modeling multiple time series annotations over a continuous variable that computes the ground truth by modeling annotator specific distortions. We condition the ground truth on a set of features extracted from the data and further assume that the annotators provide their ratings as modification of the ground truth, with each annotator having specific distortion tendencies. We train the model using an Expectation-Maximization based algorithm and evaluate it on a study involving natural interaction between a child …"
37,Measuring child visual attention using markerless head tracking from color and depth sensing cameras,20,2014,https://scholar.google.com/citations?view_op=view_citation&hl=en&user=LAuxzv0AAAAJ&pagesize=50&citation_for_view=LAuxzv0AAAAJ:Wp0gIr-vW9MC,"A child's failure to respond to his or her name being called is an early warning sign for autism and response to name is currently assessed as a part of standard autism screening and diagnostic tools. In this paper, we explore markerless child head tracking as an unobtrusive approach for automatically predicting child response to name. Head turns are used as a proxy for visual attention. We analyzed 50 recorded response to name sessions with the goal of predicting if children, ages 15 to 30 months, responded to name calls by turning to look at an examiner within a defined time interval. The child's head turn angles and hand annotated child name call intervals were extracted from each session. Human assisted tracking was employed using an overhead Kinect camera, and automated tracking was later employed using an additional forward facing camera as a proof-of-concept. We explore two distinct analytical …"
38,Intermittent high‐flux albumin dialysis with continuous venovenous hemodialysis for acute‐on‐chronic liver failure and acute kidney injury,18,2020,https://scholar.google.com/citations?view_op=view_citation&hl=en&user=LAuxzv0AAAAJ&pagesize=50&citation_for_view=LAuxzv0AAAAJ:blknAaTinKkC,"Acute‐on‐chronic liver failure (ACLF) requiring intensive medical care and associated with acute kidney injury (AKI) has a mortality rate as high as 90% due to the lack of effective therapies. In this study, we assessed the effects of intermittent high‐flux single‐pass albumin dialysis (SPAD) coupled with continuous venovenous hemodialysis (CVVHD) on 28‐day and 90‐day survival and an array of clinical and laboratory parameters in patients with severe ACLF and renal insufficiency. Sixteen patients were studied. The diagnosis of ACLF and AKI was made in accordance with current EASL Clinical Practice Guidelines, including the recommendations of the International Club of Ascites. All patients received SPAD/CVVHD treatments as the blood purification therapy to support liver, kidneys, and other organs. Five patients were transplanted and 11 were not listed for transplantation because of active alcoholism. Data at …"
39,Use of a novel imaging technology for remote autism diagnosis: A reflection on experience of stakeholders,18,2015,https://scholar.google.com/citations?view_op=view_citation&hl=en&user=LAuxzv0AAAAJ&pagesize=50&citation_for_view=LAuxzv0AAAAJ:dhFuZR0502QC,"Timely diagnosis and early interventions are critical to improving the long term functioning of a child with ASD. However, a major challenge facing parents is difficulty in obtaining on-time access to appropriate diagnostic services. To address this need, an imaging technology, NODA® (Naturalistic Observation Diagnostic Assessment), has been successfully developed and field-tested. NODA® includes 1) NODA SmartCapture; a smart-phone based recording system for parents to capture and share in-home video evidence of their child behavior and 2) NODA Connect; a HIPPA compliant web-platform for diagnosticians to conduct remote autism diagnostic assessments based on in-home video evidence of behavior, developmental history and their clinical judgment. In the field study, parents captured and shared videos evidence from their homes via NODA SmartCapture and diagnosticians conducted remote …"
40,Modeling multiple time series annotations based on ground truth inference and distortion,15,2016,https://scholar.google.com/citations?view_op=view_citation&hl=en&user=LAuxzv0AAAAJ&pagesize=50&citation_for_view=LAuxzv0AAAAJ:ZeXyd9-uunAC,Description not available
41,Methods for classifying errors on the Raven’s standard progressive matrices test,12,2013,https://scholar.google.com/citations?view_op=view_citation&hl=en&user=LAuxzv0AAAAJ&pagesize=50&citation_for_view=LAuxzv0AAAAJ:eQOLeE2rZwMC,"Although many psychometric tests, like Raven’s Progressive Matrices, are commonly evaluated according to total score, additional variables can lend insight into the underlying cognitive processes. We examine conceptual errors on the Raven’s Standard Progressive Matrices (SPM) test. We present a complete classification of error types on the SPM using a two-kind coding scheme, yielding≥ 95% inter-rater reliability. We also examine how to extract error data from a computational model, and we present a method for measuring errors through systematic ablation to create a “population” of models whose performance can be examined as a group. We present a preliminary analysis of error patterns on the SPM from typically developing individuals, individuals diagnosed with autism, and a computational model called ASTI. We discuss what the error patterns suggest regarding cognition on the SPM and routes towards improving the ASTI model."
42,Infants’ pre-empathic behaviors are associated with language skills,11,2012,https://scholar.google.com/citations?view_op=view_citation&hl=en&user=LAuxzv0AAAAJ&pagesize=50&citation_for_view=LAuxzv0AAAAJ:WF5omc3nYNoC,"Infants’ responses to other people's distress reflect efforts to make sense of affective information about another person and apply it to oneself. This study sought to determine whether 12-month olds’ responses to another person's display of negative affect reflect characteristics that support social learning and predict social functioning and language skills at 36 months. Measures of infants’ responsiveness include congruent changes in affect and looking time to the person in distress. Attention to the examiner displaying positive affect, analyzed as a control condition, was not related to social functioning or language skills at 36 months. Neither attention nor affective response to the examiner's distress at 12 months was related to social functioning at 36 months. However, longer time spent looking at the examiner feigning distress predicted higher language scores. Moreover, infants who demonstrated a congruent …"
43,Mining themes and interests in the Asperger’s and autism community,10,2014,https://scholar.google.com/citations?view_op=view_citation&hl=en&user=LAuxzv0AAAAJ&pagesize=50&citation_for_view=LAuxzv0AAAAJ:LkGwnXOMwfcC,"Discussion forums offer a new source of insight for the experiences and challenges faced by individuals affected by mental disorders. Language technology can help domain experts gather insight from these forums, by aggregating themes and user behaviors across thousands of conversations. We present a novel model for web forums, which captures both thematic content as well as user-specific interests. Applying this model to the Aspies Central forum (which covers issues related to Asperger’s syndrome and autism spectrum disorder), we identify several topics of concern to individuals who report being on the autism spectrum. We perform the evaluation on the data collected from Aspies Central forum, including 1,939 threads, 29,947 posts and 972 users. Quantitative evaluations demonstrate that the topics extracted by this model are substantially more than those obtained by Latent Dirichlet Allocation and the Author-Topic Model. Qualitative analysis by subjectmatter experts suggests intriguing directions for future investigation."
44,"Feasibility of accelerometer technology with individuals with autism spectrum disorder referred for aggression, disruption, and self injury",9,2022,https://scholar.google.com/citations?view_op=view_citation&hl=en&user=LAuxzv0AAAAJ&pagesize=50&citation_for_view=LAuxzv0AAAAJ:ldfaerwXgEUC,"BackgroundMost research on aggression, self-injury, and disruption in autism spectrum disorder (ASD) has relied on caregiver report or direct observation, both of which have limitations. Past studies demonstrate preliminary evidence for direct detection of these behaviors using accelerometers, but additional research is needed to determine the feasibility during actual clinical assessments and times when a therapist cannot be present for direct observation, as measurement during these periods has the most applied significance.AimsThis study addressed these gaps by evaluating the feasibility of accelerometer use with children with ASD and severe aggression, self-injury, and disruption in clinical and home contexts.Methods and ProceduresWe evaluated the feasibility of individuals with ASD wearing accelerometers during behavioral assessments following structured habituation procedures. We also evaluated …"
