Rank,Title,Citations,Year,URL,Description
1,A prospective study of the emergence of early behavioral signs of autism,1497,2010,https://scholar.google.com/citations?view_op=view_citation&hl=en&user=LAuxzv0AAAAJ&pagesize=50&citation_for_view=LAuxzv0AAAAJ:u5HHmVD_uO8C,"OBJECTIVE To examine prospectively the emergence of behavioral signs of autism in the first years of life in infants at low and high risk for autism. METHOD A prospective longitudinal design was used to compare 25 infants later diagnosed with an autism spectrum disorder (ASD) with 25 gender-matched low-risk children later determined to have typical development. Participants were evaluated at 6, 12, 18, 24, and 36 months of age. Frequencies of gaze to faces, social smiles, and directed vocalizations were coded from video and rated by examiners. RESULTS The frequency of gaze to faces, shared smiles, and vocalizations to others were highly comparable between groups at 6 months of age, but significantly declining trajectories over time were apparent in the group later diagnosed with ASD. Group differences were significant by 12 months of age on most variables. Although repeated evaluation documented …"
2,A prospective study of response to name in infants at risk for autism,368,2007,https://scholar.google.com/citations?view_op=view_citation&hl=en&user=LAuxzv0AAAAJ&pagesize=50&citation_for_view=LAuxzv0AAAAJ:u-x6o8ySG0sC,"ObjectiveTo assess the sensitivity and specificity of decreased response to name at age 12 months as a screen for autism spectrum disorders (ASD) and other developmental delays.DesignProspective, longitudinal design studying infants at risk for ASD.SettingResearch laboratory at university medical center.ParticipantsInfants at risk for autism (55 six-month-olds, 101 twelve-month-olds) and a control group at no known risk (43 six-month-olds, 46 twelve-month-olds). To date, 46 at-risk infants and 25 control infants have been followed up to 24 months.InterventionExperimental task eliciting response-to-name behavior.Main Outcome MeasuresAutism Diagnostic Observation Schedule, Mullen Scales of Early Learning.ResultsAt age 6 months, there was a nonsignificant trend for control infants to require a fewer number of calls to respond to name than infants at risk for autism. At age 12 months, 100% of infants in the …"
3,Behavioral profiles of affected and unaffected siblings of children with autism: Contribution of measures of mother–infant interaction and nonverbal communication,366,2011,https://scholar.google.com/citations?view_op=view_citation&hl=en&user=LAuxzv0AAAAJ&pagesize=50&citation_for_view=LAuxzv0AAAAJ:9yKSN-GCB0IC,"We investigated whether deficits in social gaze and affect and in joint attention behaviors are evident within the first year of life among siblings of children with autism who go on to be diagnosed with autism or ASD (ASD) and siblings who are non-diagnosed (NoASD-sib) compared to low-risk controls. The ASD group did not differ from the other two groups at 6 months of age in the frequency of gaze, smiles, and vocalizations directed toward the caregiver, nor in their sensitivity to her withdrawal from interaction. However, by 12 months, infants in the ASD group exhibited lower rates of joint attention and requesting behaviors. In contrast, NoASD-sibs did not differ from comparison infants on any variables of interest at 6 and 12 months."
4,Early detection of core deficits in autism,256,2004,https://scholar.google.com/citations?view_op=view_citation&hl=en&user=LAuxzv0AAAAJ&pagesize=50&citation_for_view=LAuxzv0AAAAJ:d1gkVwhDpl0C,"The goal of this review of the research literature is to discuss approaches to the early detection of autism in infancy. Early detection would enable diagnoses to be made before 18 months of age rather than at 24–30 months, the age where diagnoses start to be made now. After summarizing the criteria for a deficit to be considered “core” to the disorder, the literature on research strategies used in early detection is examined. In order to guide the design of future studies, the review then turns to an overview of what is known about the processes of early social development in typically developing children that underlie the domains in which core deficits are manifested in young children with autism. The social domains covered in the review are those that show development in typically developing infants below 18 months of age: dyadic interaction and imitation; emotion discrimination; and attachment. The review …"
5,Decoding children's social behavior,235,2013,https://scholar.google.com/citations?view_op=view_citation&hl=en&user=LAuxzv0AAAAJ&pagesize=50&citation_for_view=LAuxzv0AAAAJ:zYLM7Y9cAGgC,"We introduce a new problem domain for activity recognition: the analysis of children's social and communicative behaviors based on video and audio data. We specifically target interactions between children aged 1-2 years and an adult. Such interactions arise naturally in the diagnosis and treatment of developmental disorders such as autism. We introduce a new publicly-available dataset containing over 160 sessions of a 3-5 minute child-adult interaction. In each session, the adult examiner followed a semistructured play interaction protocol which was designed to elicit a broad range of social behaviors. We identify the key technical challenges in analyzing these behaviors, and describe methods for decoding the interactions. We present experimental results that demonstrate the potential of the dataset to drive interesting research questions, and show preliminary results for multi-modal activity recognition."
6,Imitation from 12 to 24 months in autism and typical development: a longitudinal Rasch analysis.,213,2011,https://scholar.google.com/citations?view_op=view_citation&hl=en&user=LAuxzv0AAAAJ&pagesize=50&citation_for_view=LAuxzv0AAAAJ:2osOgNQ5qMEC,"The development of imitation during the second year of life plays an important role in domains of sociocognitive development such as language and social learning. Deficits in imitation ability in persons with autism spectrum disorder (ASD) from toddlerhood into adulthood have also been repeatedly documented, raising the possibility that early disruptions in imitation contribute to the onset of ASD and the deficits in language and social interaction that define the disorder. This study prospectively examined the development of imitation between 12 and 24 months of age in 154 infants at familial risk for ASD and 78 typically developing infants who were all later assessed at 36 months for ASD or other developmental delays. The study established a developmental measure of imitation ability and examined group differences over time, using an analytic Rasch measurement model. Results revealed a unidimensional …"
7,"Connecting gaze, scene, and attention: Generalized attention estimation via joint modeling of gaze and scene saliency",189,2018,https://scholar.google.com/citations?view_op=view_citation&hl=en&user=LAuxzv0AAAAJ&pagesize=50&citation_for_view=LAuxzv0AAAAJ:isC4tDSrTZIC,"This paper addresses the challenging problem of estimating the general visual attention of people in images. Our proposed method is designed to work across multiple naturalistic social scenarios and provides a full picture of the subject’s attention and gaze. In contrast, earlier works on gaze and attention estimation have focused on constrained problems in more specific contexts. In particular, our model explicitly represents the gaze direction and handles out-of-frame gaze targets. We leverage three different datasets using a multi-task learning approach. We evaluate our method on widely used benchmarks for single-tasks such as gaze angle estimation and attention-within-an-image, as well as on the new challenging task of generalized visual attention prediction. In addition, we have created extended annotations for the MMDB and GazeFollow datasets which are used in our experiments, which we will publicly release."
8,Using electrodermal activity to recognize ease of engagement in children during social interactions,180,2014,https://scholar.google.com/citations?view_op=view_citation&hl=en&user=LAuxzv0AAAAJ&pagesize=50&citation_for_view=LAuxzv0AAAAJ:KlAtU1dfN6UC,"The recent emergence of comfortable wearable sensors has focused almost entirely on monitoring physical activity, ignoring opportunities to monitor more subtle phenomena, such as the quality of social interactions. We argue that it is compelling to address whether physiological sensors can shed light on quality of social interactive behavior. This work leverages the use of a wearable electrodermal activity (EDA) sensor to recognize ease of engagement of children during a social interaction with an adult. In particular, we monitored 51 child-adult dyads in a semi-structured play interaction and used Support Vector Machines to automatically identify children who had been rated by the adult as more or less difficult to engage. We report on the classification value of several features extracted from the child's EDA responses, as well as several other features capturing the physiological synchrony between the child and …"
9,Detecting eye contact using wearable eye-tracking glasses,174,2012,https://scholar.google.com/citations?view_op=view_citation&hl=en&user=LAuxzv0AAAAJ&pagesize=50&citation_for_view=LAuxzv0AAAAJ:Y0pCki6q_DkC,"We describe a system for detecting moments of eye contact between an adult and a child, based on a single pair of gaze-tracking glasses which are worn by the adult. Our method utilizes commercial gaze tracking technology to determine the adult's point of gaze, and combines this with computer vision analysis of video of the child's face to determine their gaze direction. Eye contact is then detected as the event of simultaneous, mutual looking at faces by the dyad. We report encouraging findings from an initial implementation and evaluation of this approach."
10,Automatic assessment of problem behavior in individuals with developmental disabilities,154,2012,https://scholar.google.com/citations?view_op=view_citation&hl=en&user=LAuxzv0AAAAJ&pagesize=50&citation_for_view=LAuxzv0AAAAJ:Tyk-4Ss8FVUC,"Severe behavior problems of children with developmental disabilities often require intervention by specialists. These specialists rely on direct observation of the behavior, usually in a controlled clinical environment. In this paper, we present a technique for using on-body accelerometers to assist in automated classification of problem behavior during such direct observation. Using simulated data of episodes of severe behavior acted out by trained specialists, we demonstrate how machine learning techniques can be used to segment relevant behavioral episodes from a continuous sensor stream and to classify them into distinct categories of severe behavior (aggression, disruption, and self-injury). We further validate our approach by demonstrating it produces no false positives when applied to a publicly accessible dataset of activities of daily living. Finally, we show promising classification results when our sensing …"
11,Play and developmental outcomes in infant siblings of children with autism,147,2010,https://scholar.google.com/citations?view_op=view_citation&hl=en&user=LAuxzv0AAAAJ&pagesize=50&citation_for_view=LAuxzv0AAAAJ:UeHWp8X0CEIC,"We observed infant siblings of children with autism later diagnosed with ASD (ASD siblings; n = 17), infant siblings of children with autism with and without other delays (Other Delays and No Delays siblings; n = 12 and n = 19, respectively) and typically developing controls (TD controls; n = 19) during a free-play task at 18 months of age. Functional, symbolic, and repeated play actions were coded. ASD siblings showed fewer functional and more non-functional repeated play behaviors than TD controls. Other Delays and No Delays siblings showed more non-functional repeated play than TD controls. Group differences disappeared with the inclusion of verbal mental age. Play as an early indicator of autism and its relationship to the broader autism phenotype is discussed."
12,Investigating the accuracy of a novel telehealth diagnostic approach for autism spectrum disorder.,127,2017,https://scholar.google.com/citations?view_op=view_citation&hl=en&user=LAuxzv0AAAAJ&pagesize=50&citation_for_view=LAuxzv0AAAAJ:7PzlFSSx8tAC,"Research indicates that a substantial amount of time elapses between parents’ first concerns about their child’s development and a formal diagnosis of autism spectrum disorder (ASD). Telehealth presents an opportunity to expedite the diagnostic process. This project compared a novel telehealth diagnostic approach that utilizes clinically guided in-home video recordings to the gold standard in-person diagnostic assessment. Participants included 40 families seeking an ASD evaluation for their child and 11 families of typically developing children. Children were between the ages of 18 months and 6 years 11 months; mean adaptive behavior composite= 75.47 (SD= 15.94). All parent participants spoke English fluently. Families completed the Naturalistic Observation Diagnostic Assessment (NODA) for ASD, which was compared to an in-person assessment (IPA). Agreement between the 2 methods, as well as …"
13,Detecting gaze towards eyes in natural social interactions and its use in child assessment,102,2017,https://scholar.google.com/citations?view_op=view_citation&hl=en&user=LAuxzv0AAAAJ&pagesize=50&citation_for_view=LAuxzv0AAAAJ:_Qo2XoVZTnwC,"Eye contact is a crucial element of non-verbal communication that signifies interest, attention, and participation in social interactions. As a result, measures of eye contact arise in a variety of applications such as the assessment of the social communication skills of children at risk for developmental disorders such as autism, or the analysis of turn-taking and social roles during group meetings. However, the automated measurement of visual attention during naturalistic social interactions is challenging due to the difficulty of estimating a subject’s looking direction from video. This paper proposes a novel approach to eye contact detection during adult-child social interactions in which the adult wears a point-of-view camera which captures an egocentric view of the child’s behavior. By analyzing the child’s face regions and inferring their head pose we can accurately identify the onset and duration of the child’s looks to …"
14,Response to distress in infants at risk for autism: A prospective longitudinal study,101,2010,https://scholar.google.com/citations?view_op=view_citation&hl=en&user=LAuxzv0AAAAJ&pagesize=50&citation_for_view=LAuxzv0AAAAJ:qjMakFHDy7sC,"Background: Infants and preschoolers with ASD show impairment in their responses to other people’s distress relative to children with other developmental delays and typically developing children. This deficit is expected to disrupt social interactions, social learning, and the formation of close relationships. Response to distress has not been evaluated previously in infants with ASD earlier than 18 months of age. Methods: Participants were 103 infant siblings of children with autism and 55 low‐risk controls. All children were screened for ASD at 36 months and 14 were diagnosed with ASD. Infants’ responsiveness to distress was evaluated at 12, 18, 24, and 36 months. An examiner pretended to hit her finger with a toy mallet and infants’ responses were video‐recorded. Attention to the examiner and congruent changes in affect were coded on four‐point Likert scales. Results: Cross‐sectional and longitudinal …"
15,A novel system for supporting autism diagnosis using home videos: Iterative development and evaluation of system design,88,2015,https://scholar.google.com/citations?view_op=view_citation&hl=en&user=LAuxzv0AAAAJ&pagesize=50&citation_for_view=LAuxzv0AAAAJ:M3ejUd6NZC8C,"Background: Observing behavior in the natural environment is valuable to obtain an accurate and comprehensive assessment of a child’s behavior, but in practice it is limited to in-clinic observation. Research shows significant time lag between when parents first become concerned and when the child is finally diagnosed with autism. This lag can delay early interventions that have been shown to improve developmental outcomes.Objective: To develop and evaluate the design of an asynchronous system that allows parents to easily collect clinically valid in-home videos of their child’s behavior and supports diagnosticians in completing diagnostic assessment of autism.Methods: First, interviews were conducted with 11 clinicians and 6 families to solicit feedback from stakeholders about the system concept. Next, the system was iteratively designed, informed by experiences of families using it in a controlled home-like experimental setting and a participatory design process involving domain experts. Finally, in-field evaluation of the system design was conducted with 5 families of children (4 with previous autism diagnosis and 1 child typically developing) and 3 diagnosticians. For each family, 2 diagnosticians, blind to the child’s previous diagnostic status, independently completed an autism diagnosis via our system. We compared the outcome of the assessment between the 2 diagnosticians, and between each diagnostician and the child’s previous diagnostic status.Results: The system that resulted through the iterative design process includes (1) NODA smartCapture, a mobile phone-based application for parents to record prescribed video …"
16,A short-term longitudinal study of correlates and sequelae of attachment security in autism,81,2018,https://scholar.google.com/citations?view_op=view_citation&hl=en&user=LAuxzv0AAAAJ&pagesize=50&citation_for_view=LAuxzv0AAAAJ:4JMBOYKVnBMC,"In this short-term longitudinal study, 30 preschool-aged children with autism were first observed in Ainsworth’s Strange Situation Procedure and, separately, interacting with the primary caregiver in the home. One year later, each child completed both a developmental assessment and an observational assessment of empathic responding. Behaviors typical for children with autism were distinguished from behaviors suggestive of relationally based attachment disorganization. Forty-five percent of the children were classified as securely attached. The secure group demonstrated language skills superior to those of the insecurely attached group, concurrently and during the follow-up. Compared to parents of children who were insecurely attached, parents of securely attached children were rated as more sensitive. Compared to both organized insecure and disorganized children, secure children were rated as more …"
17,Designing motion-based activities to engage students with autism in classroom settings,76,2015,https://scholar.google.com/citations?view_op=view_citation&hl=en&user=LAuxzv0AAAAJ&pagesize=50&citation_for_view=LAuxzv0AAAAJ:4TOpqqG69KYC,"We report on a nine-month-long observational study with teachers and students with autism in a classroom setting. We explore the impact of motion-based activities on students' behavior. In particular, we examine how the playful gaming activity impacted students' engagement, peer-directed social behaviors, and motor skills. We document the effectiveness of a collaborative game in supporting initiation of social activities between peers, and in eliciting novel body movements that students were not observed to produce outside of game play. We further identify the positive impact of game play on overall classroom engagement. This includes an ""audience effect"" whereby non-playing peers direct initiations to those playing the game and vice versa, and a positive ""spillover"" effect of the activity on students' social behavior outside of game play. We identify key considerations for designing and deploying motion-based …"
18,"Undifferentiated facial electromyography responses to dynamic, audio‐visual emotion displays in individuals with autism spectrum disorders",73,2013,https://scholar.google.com/citations?view_op=view_citation&hl=en&user=LAuxzv0AAAAJ&pagesize=50&citation_for_view=LAuxzv0AAAAJ:W7OEmFMy1HYC,"We examined facial electromyography (fEMG) activity to dynamic, audio‐visual emotional displays in individuals with autism spectrum disorders (ASD) and typically developing (TD) individuals. Participants viewed clips of happy, angry, and fearful displays that contained both facial expression and affective prosody while surface electrodes measured corrugator supercilli and zygomaticus major facial muscle activity. Across measures of average and peak activity, the TD group demonstrated emotion‐selective fEMG responding, with greater relative activation of the zygomatic to happy stimuli and greater relative activation of the corrugator to fearful stimuli. In contrast, the ASD group largely showed no significant differences between zygomatic and corrugator activity across these emotions. There were no group differences in the magnitude and timing of fEMG response in the muscle congruent to the stimuli. This …"
19,Behavioral imaging and autism,72,2014,https://scholar.google.com/citations?view_op=view_citation&hl=en&user=LAuxzv0AAAAJ&pagesize=50&citation_for_view=LAuxzv0AAAAJ:0EnyYjriUFMC,Behavioral imaging encompasses the use of computational sensing and modeling techniques to measure and analyze human behavior. This article discusses a research program focused on the study of dyadic social interactions between children and their caregivers and peers. The study has resulted in a dataset containing semi-structured play interactions between children and adults. Behavioral imaging could broadly affect the quality of care for individuals with a developmental or behavioral disorder.
20,Detecting bids for eye contact using a wearable camera,71,2015,https://scholar.google.com/citations?view_op=view_citation&hl=en&user=LAuxzv0AAAAJ&pagesize=50&citation_for_view=LAuxzv0AAAAJ:IWHjjKOFINEC,We propose a system for detecting bids for eye contact directed from a child to an adult who is wearing a point-of-view camera. The camera captures an egocentric view of the child-adult interaction from the adult's perspective. We detect and analyze the child's face in the egocentric video in order to automatically identify moments in which the child is trying to make eye contact with the adult. We present a learning-based method that couples a pose-dependent appearance model with a temporal Conditional Random Field (CRF). We present encouraging findings from an experimental evaluation using a newly collected dataset of 12 children. Our method outperforms state-of-the-art approaches and enables measuring gaze behavior in naturalistic social interactions.
21,Detecting bids for eye contact using a wearable camera,71,2015,https://scholar.google.com/citations?view_op=view_citation&hl=en&user=LAuxzv0AAAAJ&pagesize=50&citation_for_view=LAuxzv0AAAAJ:aqlVkmm33-oC,We propose a system for detecting bids for eye contact directed from a child to an adult who is wearing a point-of-view camera. The camera captures an egocentric view of the child-adult interaction from the adult's perspective. We detect and analyze the child's face in the egocentric video in order to automatically identify moments in which the child is trying to make eye contact with the adult. We present a learning-based method that couples a pose-dependent appearance model with a temporal Conditional Random Field (CRF). We present encouraging findings from an experimental evaluation using a newly collected dataset of 12 children. Our method outperforms state-of-the-art approaches and enables measuring gaze behavior in naturalistic social interactions.
22,Detection of eye contact with deep neural networks is as accurate as human experts,66,2020,https://scholar.google.com/citations?view_op=view_citation&hl=en&user=LAuxzv0AAAAJ&pagesize=50&citation_for_view=LAuxzv0AAAAJ:GnPB-g6toBAC,"Eye contact is among the most primary means of social communication used by humans. Quantification of eye contact is valuable as a part of the analysis of social roles and communication skills, and for clinical screening. Estimating a subject’s looking direction is a challenging task, but eye contact can be effectively captured by a wearable point-of-view camera which provides a unique viewpoint. While moments of eye contact from this viewpoint can be hand-coded, such a process tends to be laborious and subjective. In this work, we develop a deep neural network model to automatically detect eye contact in egocentric video. It is the first to achieve accuracy equivalent to that of human experts. We train a deep convolutional network using a dataset of 4,339,879 annotated images, consisting of 103 subjects with diverse demographic backgrounds. 57 subjects have a diagnosis of Autism Spectrum Disorder. The …"
