Rank,Title,Citations,Year,URL,Description
1,The evolution of engagements and social bonds during child-parent co-design,97,2016,https://scholar.google.com/citations?view_op=view_citation&hl=en&user=n6zdTxUAAAAJ&pagesize=50&citation_for_view=n6zdTxUAAAAJ:hqOjcs7Dif8C,"Partnering with parents and children in the design process can be important for producing technologies that take into consideration the rich context of family life. However, to date, few studies have examined the actual process of designing with families and their children. Without understanding the process, we risk making poor design choices in user-interactive experiences that take into account important family dynamics. The purpose of this investigation is to understand how parent-child relationships in families shape co-design processes and how they are reshaped through co-design. We document the evolutionary process and outcomes that exist in co-design partnerships between researchers and families. We found that parents' engagement patterns shifted more slowly than that of children's from observing and facilitating to design partnering practices. Our analysis suggests the importance of establishing and …"
2,Detecting and notifying of various potential hazards,62,2018,https://scholar.google.com/citations?view_op=view_citation&hl=en&user=n6zdTxUAAAAJ&pagesize=50&citation_for_view=n6zdTxUAAAAJ:8k81kl-MbHgC,(57) ABSTRACT A method for detecting and notifying of various potential hazards may include receiving a plurality of biometric data values by a first set of sensors of a sensing device. The biometric data values may correspond to a health state of a person. A plurality of environmental data values may be received by a second set of sensors of the sensing device.The environmental data values may correspond to a safety state of an environment that the person is in. The sensing device may compare the plurality of biometric data and environmental data values against respective models of biometric and environmental threshold data values that indicate a likelihood of a person or environment in an unhealthy or unsafe state. The sensing device may notify one or more communication devices if at least one of the biometric or environmental data values exceeds at least one of the threshold data values.
3,Going global: Understanding English language learners’ student motivation in English-language MOOCs,57,2018,https://scholar.google.com/citations?view_op=view_citation&hl=en&user=n6zdTxUAAAAJ&pagesize=50&citation_for_view=n6zdTxUAAAAJ:YOwf2qJgpHMC,"Massive Open Online Courses (MOOCs) offer high quality, free courses to anyone with an Internet connection. However, these courses may be relatively inaccessible to the large global population of students who are English Language Learners (ELLs). Current efforts to understand student motivation in MOOCs do not take into account the specific needs of ELL students. Through interviews with 12 ELL online students, and a survey with 20,084 ELL respondents, we investigate ELL students’ motivations for taking online courses. We show that ELL students’ motivations are highly socialized strategies for achieving long-term goals of economic, social, and geographic mobility. Although research studies show that ELLs interact sparingly with other students in MOOCs, we present evidence that they have unmet needs for interaction, and discuss how student interaction systems in MOOCs can better address these needs …"
4,Designing Appropriate Learning Technologies for School vs Home Settings in Tanzanian Rural Villages,46,2018,https://scholar.google.com/citations?view_op=view_citation&hl=en&user=n6zdTxUAAAAJ&pagesize=50&citation_for_view=n6zdTxUAAAAJ:qxL8FJ1GzNcC,"Smartphone- and tablet-based learning systems are often posited as solutions for closing early literacy gaps between rural and urban regions in emerging economies. These systems are often developed based on experiences with students in urban contexts, limiting their success rates with children from rural areas who have had little to no prior exposure to technology. To explore how such technologies are used in different learning contexts, we deployed an early literacy learning application in school and home settings in a rural village in Tanzania. We use Rogoff's theory of instructional models to understand and describe the interaction between learners, adults, and peers. We found that in the presence of a school teacher, the instructional model was primarily ""adult-run"" where information was almost entirely disseminated by the teacher, while in home settings, the instructional model was similar to a ""community …"
5,Understanding ESL students' motivations to increase MOOC accessibility,36,2016,https://scholar.google.com/citations?view_op=view_citation&hl=en&user=n6zdTxUAAAAJ&pagesize=50&citation_for_view=n6zdTxUAAAAJ:0EnyYjriUFMC,"Massive Open Online Courses (MOOCs) have the potential to bridge education and literacy gaps by offering high quality, free courses to anyone with an Internet connection. MOOCs in their present state, however, may be relatively inaccessible to non-native English speakers, as a majority of MOOC content is in the English language. While a potential solution is to translate all MOOC content into all languages, it is not known whether this solution will satisfy the learning goals of all English as a Second Language (ESL) speakers. Through a series of interviews, we investigate ESL speakers' motivations for taking MOOCs and other online courses. Our findings show that ESL speakers have a variety of motivations for taking online courses that are not captured in current surveys, which implies that current one-size-fits-all approaches to increasing MOOC accessibility for learners with a first language other than English …"
6,Personalized assistive web for improving mobile web browsing and accessibility for visually impaired users,35,2017,https://scholar.google.com/citations?view_op=view_citation&hl=en&user=n6zdTxUAAAAJ&pagesize=50&citation_for_view=n6zdTxUAAAAJ:KlAtU1dfN6UC,"Mobile web browsing has become a daily routine for many people, including those with visual impairments. However, usability and accessibility challenges of mobile handheld devices may compromise the benefits of mobile web access, particularly for users with visual impairments. To improve mobile web accessibility, we propose a Personalized Assistive Web (PAW) that aims to improve skimming in mobile web browsing for users with visual impairments through hierarchical outline view and personalization adaptations in this research. We empirically evaluated PAW via a controlled lab experiment with 21 blind participants and 34 sighted participants. The empirical results provide strong evidence for the positive impacts of the hierarchical outline view adaptation on user performance of information search (i.e., search time) and perceptions (i.e., perceived ease of use and perceived usefulness) across the two …"
7,How do English language learners interact with different content types in MOOC videos?,30,2018,https://scholar.google.com/citations?view_op=view_citation&hl=en&user=n6zdTxUAAAAJ&pagesize=50&citation_for_view=n6zdTxUAAAAJ:_kc_bZDykSQC,"English Language Learners (ELLs) are a substantial portion of the students who enroll in MOOCs. In order to fulfill the promise of MOOCs – i.e., making higher education accessible to everyone with an internet connection – appropriate interventions should be offered to students who struggle with the language of course content. Through the analysis of clickstream log data gathered from two MOOC courses deployed on Coursera, Introduction to Psychology and Statistical Thermodynamics, we show that compared to native English speakers, ELL students have distinct behavioral patterns in how they engage with MOOC content including increased interaction with content that contains text, increased seeking away from content without visual support, and decreased video play rates. These patterns are expressed differently in response to different types of course content and domains. Our findings not only suggest …"
8,Privacy and fear in the drone era: Preserving privacy expectations through technology,30,2018,https://scholar.google.com/citations?view_op=view_citation&hl=en&user=n6zdTxUAAAAJ&pagesize=50&citation_for_view=n6zdTxUAAAAJ:M3ejUd6NZC8C,"The increasing use of unmanned aerial vehicles (i.e. drones) is raising a number of privacy issues. The high-resolution cameras that drones can carry may pose serious privacy hazards to the general public. Numerous media stories highlight incidents of drones spying on people, often with negative consequences (e.g. lawsuits and arrests). Our research seeks to understand how incorporating privacy-preserving technologies in drone design can mitigate privacy fears. We identify several classes of privacy-preserving technological solutions and evaluate their potential efficacy across a variety of situations through a Mechanical Turk survey of 7,200 respondents. Our results inform both drone designers and regulators who wish to develop, operate, and/or regulate novel drone services while assuaging public fears of privacy violations."
9,Learning from African Classroom Pedagogy to Increase Student Engagement in Education Technologies,28,2019,https://scholar.google.com/citations?view_op=view_citation&hl=en&user=n6zdTxUAAAAJ&pagesize=50&citation_for_view=n6zdTxUAAAAJ:7PzlFSSx8tAC,"Tablet-based educational technologies provide a supplement to traditional classroom-based early literacy education, especially in regions with limited schooling resources. Prior work has probed how children generally interact with and learn from these technologies, however, there is limited research on student engagement with applications that utilize valuable input techniques such as automatic handwriting and speech recognition. In our study, we designed and field-tested early literacy speech and handwriting recognition applications with the primary aim of maximizing student engagement. We designed the applications based on prior research insights and classroom observations from our target population and field-tested the applications with 283 children living in rural Tanzania. We found that observing a small set of classrooms can produce design insights that increase engagement on tablet-based learning …"
10,Co-designing an AI curriculum with university researchers and middle school teachers,23,2022,https://scholar.google.com/citations?view_op=view_citation&hl=en&user=n6zdTxUAAAAJ&pagesize=50&citation_for_view=n6zdTxUAAAAJ:_Qo2XoVZTnwC,"Over the past year, our AI4GA team of university faculty and middle school teachers have co-designed a middle school AI curriculum. In this poster we share how we used co-design both as a tool for collaboratively developing engaging AI activities and as a mechanism for mutual professional development. We explain our co-design process, give examples of curriculum materials provided to teachers, and showcase several teacher-created activities. We believe this approach to curriculum development centers the lived experiences of teachers and leverages the knowledge and expertise of university researchers to create high quality and engaging AI learning experiences for K-12 students."
11,Lessons learned from teaching artificial intelligence to middle school students,12,2022,https://scholar.google.com/citations?view_op=view_citation&hl=en&user=n6zdTxUAAAAJ&pagesize=50&citation_for_view=n6zdTxUAAAAJ:RHpTSmoSYBkC,"The AI4GA project is developing a nine-week elective course called Living and Working with Artificial Intelligence and piloting it in several Georgia middle schools. Since we aspire to educate all students about AI, the course addresses a wide range of student abilities, levels of academic preparedness, and prior computing experience, and leaves room for teachers to adapt the material to their own students' needs and interests. The course content is primarily focused on unplugged activities and online demonstration programs. We also provide small programming projects using AI tools as an option for teachers to incorporate. In this poster we describe lessons learned from initial pilot offerings by five teachers who taught 12 sections of the course totaling 299 students. We present evidence that middle school students can successfully engage with substantive technical content about Artificial Intelligence."
12,Characterizing ELL students' behavior during MOOC videos using content type,12,2017,https://scholar.google.com/citations?view_op=view_citation&hl=en&user=n6zdTxUAAAAJ&pagesize=50&citation_for_view=n6zdTxUAAAAJ:kNdYIx-mwKoC,"Making MOOCs accessible to English Language Learners (ELLs) requires that students understand the language of instruction, and that instructional strategies address their unique learning challenges. Through the analysis of clickstream log data gathered from two MOOC courses deployed on Coursera, Introduction to Psychology and Statistical Thermodynamics, we show that ELL students exhibit distinct struggle behaviors in video portions without visual aids e.g., narrations without slides. Our findings challenge widely accepted multimedia design principles such as the split attention effect, provide insights into designing MOOC videos, and emphasize the need for adaptivity to increase MOOC access for ELLs."
13,Browser language preferences as a metric for identifying ESL speakers in MOOCs,12,2016,https://scholar.google.com/citations?view_op=view_citation&hl=en&user=n6zdTxUAAAAJ&pagesize=50&citation_for_view=n6zdTxUAAAAJ:5nxA0vEk-isC,"Open access and low cost make Massively Open Online Courses (MOOCs) an attractive learning platform for students all over the world. However, the majority of MOOCs are deployed in English, which can pose an accessibility problem for students with English as a Second Language (ESL). In order to design appropriate interventions for ESL speakers, it is important to correctly identify these students using a method that is scalable to the high number of MOOC enrollees. Our findings suggest that a new metric, browser language preference, may be better than the commonly-used IP address for inferring whether or not a student is ESL."
14,Fostering equitable help-seeking for K-3 students in low income and rural contexts,10,2021,https://scholar.google.com/citations?view_op=view_citation&hl=en&user=n6zdTxUAAAAJ&pagesize=50&citation_for_view=n6zdTxUAAAAJ:mB3voiENLucC,"Adaptive Collaborative Learning Support (ACLS) systems improve collaboration and learning for students over individual work or collaboration with non-adaptive support. However, many ACLS systems are ill-suited for rural contexts where students often need multiple kinds of support to complete tasks, may speak languages unsupported by the system, and require more than pre-assigned tutor-tutee student pairs for more equitable learning. We designed an intervention that fosters more equitable help-seeking by automatically detecting student struggles and prompts them to seek help from specific peers that can help. We conducted a mixed-methods experimental study with 98 K-3 students in a rural village in Tanzania over a one-month period, evaluating how the system affects student interactions, system engagement, and student learning. Our intervention increased student interactions by almost 4 times …"
15,Navigating connected inquiry learning with ScienceKit,10,2015,https://scholar.google.com/citations?view_op=view_citation&hl=en&user=n6zdTxUAAAAJ&pagesize=50&citation_for_view=n6zdTxUAAAAJ:u-x6o8ySG0sC,"New pervasive, social, and mobile technologies hold great potential for supporting young people’s connections between interests, peer culture, and academic pursuits. Such connected learning experiences are critical for deep and engaged learning. However, efforts to identify and sustain ways to connect these experiences for learners remain elusive. In this study, we shed light on how we can initiate the process of connected learning through technology-realized and facilitator-based scaffolding of learners’ interests, social interactions, and scientific inquiry pursuits. Specifically, we documented three cases of learners in an afterschool program called Kitchen Chemistry and their use of a social media app called ScienceKit. Analysis of ScienceKit data with facilitator interactions reveals a typology of learner paths across connected learning experiences. Furthermore, understanding typologies that best match each learner appears to be critical for helping learners to make connections across interest-driven and peer-supported scientific inquiry."
16,“What's Your Name Again?”: How Race and Gender Dynamics Impact Codesign Processes and Output,7,2023,https://scholar.google.com/citations?view_op=view_citation&hl=en&user=n6zdTxUAAAAJ&pagesize=50&citation_for_view=n6zdTxUAAAAJ:4JMBOYKVnBMC,"Creating technology products using codesign techniques often results in higher end-user engagement compared to expert-driven designs. Codesign sessions are typically structured in flexible and informal ways to achieve equal design partnerships, especially in adult-child interactions. This generally leads to better design output, however, it may also increase the enactment of socially constructed stereotypes and biases in ways that negatively affect the experiences of racial minorities and girls/women in design spaces. We codesigned a video game with a K-5 afterschool program located in a working-class, rural, predominantly white county over 20 weeks. We uncover ways that the codesign process and different activity types can create a permissive environment for enacting behaviors that are harmful to minorities. We discuss ways to manage and restructure codesign programs to be more conducive for children …"
17,“I'm a little less inclined to do it”: How Afterschool Programs’ Culture Impact Co-Design Processes and Outcomes,7,2023,https://scholar.google.com/citations?view_op=view_citation&hl=en&user=n6zdTxUAAAAJ&pagesize=50&citation_for_view=n6zdTxUAAAAJ:bEWYMUwI8FkC,"The importance of considering local context and partnering with target users is well established in co-design. Less common is an examination of the adaptations needed when deploying the same co-design program across heterogenous settings to maximize program efficacy and equity. We report on our experience co-designing educational games with six culturally and socioeconomically diverse afterschool sites over two years, and insights from interviewing ten program administrators across all sites. We found that even within the same afterschool program network, site differences in organizational culture and resources impacted the effectiveness of co-design programs, the co-design output, and expectations for student engagement. We characterize our afterschool partners into different archetypes – Safe Havens, Recreation Centers, Homework Helpers, and STEM Enrichment Centers. We provide …"
18,The design of co-robotic games for computer science education,7,2021,https://scholar.google.com/citations?view_op=view_citation&hl=en&user=n6zdTxUAAAAJ&pagesize=50&citation_for_view=n6zdTxUAAAAJ:R3hNpaxXUhUC,"Digital games featuring programmable agents are popular tools for teaching coding and computational thinking skills. However, today's games perpetuate an arguably obsolete relationship between programmable agents and human operators. Borrowing from the field of human-robotics interaction, we argue that collaborative robots, or cobots, are a better model for thinking about computational agents, working directly with humans rather than in place of or at arm's length from them. In this paper, we describe an initial design inquiry into the design of “cobot games”, programmable agent scenarios in which players program an in-game ally to assist them in accomplishing gameplay objectives. We detail three questions that emerged out of this exploration, our present thinking on them, and plans for deepening inquiry into cobot game design moving forward."
19,Learning about learning through participatory design with families,7,2017,https://scholar.google.com/citations?view_op=view_citation&hl=en&user=n6zdTxUAAAAJ&pagesize=50&citation_for_view=n6zdTxUAAAAJ:Zph67rFs4hoC,"The value of family in the physical, emotional, and intellectual growth of children is indispensable. Family life is a primary context for children to learn, and the importance of the family unit is accepted as a driver for academic achievement. Participatory design (PD) methodologies, in particular, show great potential for fostering balanced parent child interactions by creating a rich context that can illuminate and enhance the ways in which families learn together. This chapter discusses how PD can be used to gather rich contextual information that can improve family dynamics and guide the design of systems and artifacts aimed at supporting family learning. Design thinking is a movement that elevates the philosophy and approaches of design into a disposition, whereby design is a lens through which one engages in thinking and doing with the goal of innovating for a better world. Parents are constantly balancing a …"
20,From lecture hall to homeroom: co-designing an AI elective with middle school CS teachers,5,2025,https://scholar.google.com/citations?view_op=view_citation&hl=en&user=n6zdTxUAAAAJ&pagesize=50&citation_for_view=n6zdTxUAAAAJ:NMxIlDl6LWMC,"Middle School students in the United States are exposed to an unprecedented number of AI-driven consumer products. This exposure demands that educators help students develop their personal understandings of these technologies to engage with them responsibly. Designing age-appropriate AI curricula for middle school students calls for collaboration and partnership between computer and learning scientists, as well as middle school teachers. Over a 3-year period, we co-designed and successfully implemented an AI education curriculum across 9 geographically and economically diverse schools, offering it to a total of 1551 students. Drawing from our analyses of the curriculum and teacher and student experiences, we propose an effective format for teaching, assessing, and implementing fundamental AI education for middle school settings in the United States. Our research also highlights the value of …"
21,Investigating demographics and motivation in engineering education using radio and phone-based educational technologies,5,2024,https://scholar.google.com/citations?view_op=view_citation&hl=en&user=n6zdTxUAAAAJ&pagesize=50&citation_for_view=n6zdTxUAAAAJ:blknAaTinKkC,"Despite the best intentions to support equity with educational technologies, they often lead to a “rich get richer” effect, in which communities of more advantaged learners gain greater benefit from these solutions. Effective design of these technologies necessitates a deeper understanding of learners in understudied contexts and their motivations to pursue an education. Consequently, we studied a 15-week remote course launched in 2021 with 17,896 learners that provided engineering education through a radio and phone-based system aimed for use in rural settings within Northern Uganda. We address shifts in learners’ motivations for course participation and investigate the impact of demographic features and motivations of students on persistence and performance. We found significant increases in student motivation to learn more about and pursue STEM. Importantly, the course was most successful for …"
22,Considerations for improving comprehensive undergraduate computing ethics education,5,2024,https://scholar.google.com/citations?view_op=view_citation&hl=en&user=n6zdTxUAAAAJ&pagesize=50&citation_for_view=n6zdTxUAAAAJ:maZDTaKrznsC,"Computing Ethics (CE) courses are an increasingly important component of the undergraduate computing curriculum because of the outsized influence of computing on society. CE encompasses topics from multiple disciplines including the humanities; however, it is typically taught by educators within a Computer Science (CS) department in most undergraduate institutions in the United States, potentially leading to a less than comprehensive CE education for students. We surveyed 318 computing educators in US higher education to investigate CS educators' perceptions of how CE topics should ideally be taught. Most of our respondents thought that CE should be taught by a multidisciplinary team of instructors, and further that it should be taught both as a standalone course and embedded in other courses. Our research provides insights into ways to improve CE education that result in a better student experience."
23,Navigating connected inquiry learning with ScienceKit.. International Society of the Learning Sciences,5,2015,https://scholar.google.com/citations?view_op=view_citation&hl=en&user=n6zdTxUAAAAJ&pagesize=50&citation_for_view=n6zdTxUAAAAJ:hC7cP41nSMkC,Description not available
