Rank,Title,Citations,Year,URL,Description
24,Towards a More Inclusive Curriculum: Opportunities for Broadening and Diversifying Computing Ethics Education,4,2025,https://scholar.google.com/citations?view_op=view_citation&hl=en&user=n6zdTxUAAAAJ&pagesize=50&citation_for_view=n6zdTxUAAAAJ:BqipwSGYUEgC,"Computing ethics instruction is a vital aspect of the undergraduate computing curriculum. It has received greater focus in recent years driven in part by concerns about the societal impacts of computing technologies such as social media and artificial intelligence. The increased attention provides an opportunity, even an imperative, to examine and rethink common practices. To support our understanding of current practices in computing ethics education, we surveyed 318 computing educators in the United States (U.S.), including 56 who have never taught ethics. The survey included questions about ethics teaching methods and challenges the instructors confronted. We show that ethical frameworks are frequently taught yet teaching them is regarded as one of the least important learning outcomes, and that respondents largely do not consider author demographics when selecting readings for their ethics classes …"
25,""" Those don't work for us"": An Assets-Based Approach to Incorporating Emerging Technologies in Viable Hawaiian Teacher Support Tools for Culturally Relevant CS Education",4,2024,https://scholar.google.com/citations?view_op=view_citation&hl=en&user=n6zdTxUAAAAJ&pagesize=50&citation_for_view=n6zdTxUAAAAJ:hMod-77fHWUC,"Hawaiian bilingual language immersion (Kaiapuni) schools infuse curricula with place-based education to increase student connection to culture. However, stand-in teachers often lack the background and tools needed to support immersion learning, resulting in discontinuity for students in their culturally relevant education. This experience report describes a partnership between the Ka Moamoa Lab at the Georgia Institute of Technology and Ke Kula Kaiapuni 'O Pu'ohala School to design a teacher-substitute support platform via a hybrid of assets-based design methodology and emerging technology capabilities. We share insights offered by teachers and design requirements for such a platform. We also reflect on how HCI methodologies should adapt to center and respect Native Hawaiian perspectives."
26,Designing black children in video games,4,2023,https://scholar.google.com/citations?view_op=view_citation&hl=en&user=n6zdTxUAAAAJ&pagesize=50&citation_for_view=n6zdTxUAAAAJ:isC4tDSrTZIC,"Community + Culture features practitioner perspectives on designing technologies for and with communities. We highlight compelling projects and provocative points of view that speak to both community technology practice and the interaction design field as a whole. --- Sheena Erete, Editor"
27,Artificial intelligence education in Georgia middle schools,3,2025,https://scholar.google.com/citations?view_op=view_citation&hl=en&user=n6zdTxUAAAAJ&pagesize=50&citation_for_view=n6zdTxUAAAAJ:J_g5lzvAfSwC,"In a partnership between four universities, the Georgia Department of Education, and nine Georgia school districts, we developed a 9‐week middle school elective called “Living and Working with Artificial Intelligence,” and a professional development (PD) program for prospective middle school AI teachers. To ensure that our curriculum could meet the needs of all learners, we recruited a diverse set of districts that included rural districts serving mainly White students, urban districts that were majority African American, and suburban districts serving a mix of Hispanic and African American students. Now in its fourth year, our “AI for Georgia” project (AI4GA) has provided PD to 20 teachers and AI education to over 1600 students. The AI4GA curriculum does more than foster AI literacy: It empowers students to view themselves as creators of AI‐powered technology and to think about future career options that involve the …"
28,Escape or D13: Understanding Youth Perspectives of AI through Educational Game Co-design,3,2025,https://scholar.google.com/citations?view_op=view_citation&hl=en&user=n6zdTxUAAAAJ&pagesize=50&citation_for_view=n6zdTxUAAAAJ:O3NaXMp0MMsC,"There are many initiatives that teach Artificial Intelligence (AI) literacy to K-12 students. Most downsize college-level instructional materials to grade-level appropriate formats, overlooking students’ unique perspectives in the design of curricula. To investigate the use of educational games as a vehicle for uncovering youth’s understanding of AI instruction, we co-designed games with 39 Black, Hispanic, and Asian high school girls and non-binary youth to create engaging learning materials for their peers. We conducted qualitative analyses on the designed game artifacts, student discourse, and their feedback on the efficacy of learning activities. This study highlights the benefits of co-design and learning games to uncover students’ understanding and ability to apply AI concepts in game-based learning, their emergent perspectives of AI, and the prior knowledge that informs their game design choices. Our research …"
29,Increasing Access to CS Instruction in Low-Income Afterschool Settings,3,2024,https://scholar.google.com/citations?view_op=view_citation&hl=en&user=n6zdTxUAAAAJ&pagesize=50&citation_for_view=n6zdTxUAAAAJ:JV2RwH3_ST0C,"Afterschool programs routinely provide or supplement Computer Science (CS) education to K-12 students in the United States. However, such opportunities are rarely available to students from low-income communities due to limited computing resources and CS instructors. One strategy for increasing access to instructors in such settings is to train afterschool staff to teach CS to students in their programs. To investigate the viability of this approach, we recruited and trained three afterschool staff with little prior computing experience to teach their students block programming. We analyzed data from teaching observations and survey-based teaching reflections to understand high-level challenges to this strategy. We found that instructors internalized students' successes and failures as reflections of their own CS teaching ability, and they sometimes struggled to adapt the structured teaching materials to the informal …"
30,Should We Teach Computing Ethics to Master's Students?,2,2024,https://scholar.google.com/citations?view_op=view_citation&hl=en&user=n6zdTxUAAAAJ&pagesize=50&citation_for_view=n6zdTxUAAAAJ:k_IJM867U9cC,"Computing ethics courses are generally considered essential in undergraduate programs, but there is limited research on the importance of their inclusion at the master's level. In this study, we extend research conducted by Dexter et al. in 2013 about the importance of ethics in master's programs. We surveyed Associate Chairs and Associate Deans of Graduate Studies representing 81 different computing programs in the United States. 72% of respondents shared that ethics should be required in master's computing programs. In contrast, only 46% of the 81 programs surveyed require any type of ethics course at the master's level. Our findings also uncover barriers to the inclusion of ethics at the master's level and propose strategies for alleviating these challenges."
31,Negotiating Systemic Racial and Gender Bias as a Minoritized Adult Design Researcher.,2,2021,https://scholar.google.com/citations?view_op=view_citation&hl=en&user=n6zdTxUAAAAJ&pagesize=50&citation_for_view=n6zdTxUAAAAJ:j3f4tGmQtD8C,Description not available
32,The Effectiveness of Publicly vs,2,2019,https://scholar.google.com/citations?view_op=view_citation&hl=en&user=n6zdTxUAAAAJ&pagesize=50&citation_for_view=n6zdTxUAAAAJ:r0BpntZqJG4C,Description not available
33,Design Considerations for Evaluating Middle School AI Knowledge,1,2025,https://scholar.google.com/citations?view_op=view_citation&hl=en&user=n6zdTxUAAAAJ&pagesize=50&citation_for_view=n6zdTxUAAAAJ:RGFaLdJalmkC,"K-12 students need to understand technical and ethical knowledge about Artificial Intelligence to utilize ubiquitous AI-powered technologies responsibly. Recent studies have explored ways to teach AI to K-12 students effectively, but little is known about ways to assess their learning. In this study, we describe how five computer science teachers from urban and rural Georgia school districts designed, adapted, and implemented assessments in their classrooms while teaching a middle school elective course aligned with the Five Big Ideas of AI. Analyzing artifacts from 201 students, we explore the efficacy of different assessment instruments co-designed with teachers, measuring students’ understanding of sensors and the societal impacts of autonomous vehicles. We suggest design considerations for AI knowledge assessments to meet the needs and challenges in diverse classroom contexts."
34,Supporting Student Engagement in K-12 AI Education with a Card Game Construction Toolkit,1,2024,https://scholar.google.com/citations?view_op=view_citation&hl=en&user=n6zdTxUAAAAJ&pagesize=50&citation_for_view=n6zdTxUAAAAJ:M3NEmzRMIkIC,"With the growing prevalence of AI, the need for K-12 AI education is becoming more crucial, which is prompting active research in developing engaging AI learning activities. In this paper, we present our work on a game construction toolkit for middle school students and educators that enables them to tailor an AI-focused unplugged card game activity. In our prior work, we designed, developed, and piloted an unplugged card game activity where players predict the identity of a person based on hand-drawn features extracted from a set of facial cards. The activity aims to teach AI concepts aligned with one of the big ideas in AI utilizing techniques from facial recognition. During our pilot testing of the activity, we discovered that creating face cards that capture students' interest is a crucial factor in promoting student engagement. As a result, we designed a card game construction toolkit that allows students and educators …"
35,Comparative Design-Based Research: How Afterschool Programs Impact Learners' Engagement with a Video Game Codesign,1,2023,https://scholar.google.com/citations?view_op=view_citation&hl=en&user=n6zdTxUAAAAJ&pagesize=50&citation_for_view=n6zdTxUAAAAJ:TFP_iSt0sucC,"Community-based afterschool programs are valuable spaces for researchers to codesign technologies with direct relevance to local communities. However, afterschool programs differ in resources available, culture, and student demographics in ways that may impact the efficacy of the codesign process and outcome. We ran a series of multi-week educational game codesign workshops across five programs over twenty weeks and found notable differences, despite deploying the same protocol. Our findings characterize three types of programs: Safe Havens, Recreation Centers, and Homework Helpers. We note major differences in students' patterns of participation directly influenced by each program's culture and expectations for equitable partnerships and introduce Comparative Design-Based Research (cDBR) as a beneficial lens for codesign."
36,Teacher Perspectives on Peer-Peer Collaboration and Education Technologies in Rural Tanzanian Classrooms,1,2021,https://scholar.google.com/citations?view_op=view_citation&hl=en&user=n6zdTxUAAAAJ&pagesize=50&citation_for_view=n6zdTxUAAAAJ:TQgYirikUcIC,"Teachers’ perspectives are critical for understanding classroom culture. They create and enforce rules in classrooms and are responsible for educating students using methods that they perceive to be most effective. Therefore, creating supplementary education technologies without understanding teachers and the culture they promote may lead to interventions that are underutilized or ineffective. Our research specifically investigates how technologies that foster student collaboration fit into teachers’ views of learning in a rural context with limited existing collaboration scaffolds. We interviewed 24 teachers and observed 39 classrooms in a rural Tanzanian village to understand how teachers value peer-peer collaboration in their teaching practice, and the unique challenges they face educating students in rural classroom settings. We uncover insights that inform the design and deployment of supplementary education …"
37,The Effectiveness of Publicly vs. Privately Assigned Group Leaders among Learners in Rural Villages in Tanzania,1,2019,https://scholar.google.com/citations?view_op=view_citation&hl=en&user=n6zdTxUAAAAJ&pagesize=50&citation_for_view=n6zdTxUAAAAJ:L8Ckcad2t8MC,"Research studies show that teachers increase the success of education technologies in rural settings by supporting students via technology support, domain-relevant explanations, enforcing discipline, and maintaining student engagement. However, a teacher's presence hinders student collaboration in some cultural contexts, and some students may not have a teacher or knowledgeable adult who can provide this support. We conducted an experiment with K-1 students (N=36) in a rural Tanzanian village, where we trained students to provide technology support for their peers under different experimental conditions. We found that with basic technical training and social awareness of the assigned leaders, students can indeed provide peer support in the absence of a teacher, and additionally enable collaboration. We challenge the popularly held notion that natural leaders will emerge and support students' technology and learning needs without adequate training, and discuss the implications of our findings in the deployment of technologies in similar socio-cultural contexts."
38,Can Afterschool Volunteers Teach Educational Robotics?,0,2026,https://scholar.google.com/citations?view_op=view_citation&hl=en&user=n6zdTxUAAAAJ&pagesize=50&citation_for_view=n6zdTxUAAAAJ:vV6vV6tmYwMC,"Afterschool centers present a valuable opportunity to broaden access to Computer Science (CS) education in the United States (US). To address the shortage of CS instructors in afterschool programs, prior work has shown that volunteers and K-12 teachers from other disciplines can be trained to teach foundational CS topics, such as block programming. However, supporting these educators to teach specialized content, such as Robotics, requires further investigation into the training strategies and pedagogical scaffolding required for them to provide high-quality instruction. To address this gap, we present a case study of one afterschool instructor, a kindergarten teacher, whom we trained to teach virtual and physical robotics to fourth and fifth grade students. This study highlights the different levels of instructional support that such teachers need across virtual and physical curricula, and provides strategies that can …"
39,Gaming Towards Understanding: Shifting AI Perceptions in High School Students,0,2026,https://scholar.google.com/citations?view_op=view_citation&hl=en&user=n6zdTxUAAAAJ&pagesize=50&citation_for_view=n6zdTxUAAAAJ:lSLTfruPkqcC,"Students' perceptions of AI are often shaped by commercialized and fictional depictions of AI, leading to misuse, underuse, and over-reliance on AI tools. Such preconceptions place additional burdens on K-12 AI curricula to not only educate students on foundational AI knowledge components, but also uncover and reshape students' understanding of AI. To understand ways to uncover and address students' AI misconceptions in formal learning settings, we conducted a study that taught foundational AI concepts using a formal AI curriculum, games, interactive activities, and scenario-based challenges to high school girls. We analyzed student dialog and survey responses data to observe shifts in their perceptions and understanding of AI. Our findings indicate that unstructured AI activities effectively scaffold student reflection and metacognition on AI topics, contributing to significant shifts in perception. This work …"
40,Preparing the next generation of African Business professionals using CS programming MOOCs,0,2025,https://scholar.google.com/citations?view_op=view_citation&hl=en&user=n6zdTxUAAAAJ&pagesize=50&citation_for_view=n6zdTxUAAAAJ:RYcK_YlVTxYC,"The increased demand for Computer Science (CS) skills across most professions has necessitated providing CS training for post-secondary learners regardless of their fields of study. This is especially true in developing countries with high unemployment rates, where workers need to update their skills continuously to remain employable. Understanding the motivations of students who enroll in CS courses with limited prior training is critical for designing learning environments that help them achieve their desired goals. This paper studied the motivations of 2376 African students and working professionals enrolled in a smartphone-based programming MOOC. We found that the non-CS major participants wanted to learn programming to develop business applications, keep up with the demand for computing skills in their careers, and produce tools that positively impact their community. We also found that factors such …"
41,Extending the Benefits of Culturally Responsive Pedagogy from K-12 to Undergraduate CS,0,2025,https://scholar.google.com/citations?view_op=view_citation&hl=en&user=n6zdTxUAAAAJ&pagesize=50&citation_for_view=n6zdTxUAAAAJ:NaGl4SEjCO4C,"Despite assumptions that Culturally Responsive Pedagogy (CRP) only benefits marginalized students, studies show that it creates a rigorous, relatable, and engaging learning environment for all students. While CRP's impact in K-12 settings is well-established, its application in undergraduate CS education remains limited. Synthesizing findings from 113 studies, this article argues that CRP holds significant potential to foster inclusive learning and improve student outcomes in undergraduate CS settings. However, significant challenges such as faculty resistance and lack of institutional support continue to impede wider implementation. This review identifies critical research gaps and offers recommendations for future CRP research and practice in undergraduate CS contexts presenting a well-supported perspective for its adoption for fostering more equitable and effective learning environments."
42,Uncovering Opportunities for K-12 CS Professional Development in West African Schools.,0,2025,https://scholar.google.com/citations?view_op=view_citation&hl=en&user=n6zdTxUAAAAJ&pagesize=50&citation_for_view=n6zdTxUAAAAJ:YFjsv_pBGBYC,"Computer science education in Africa is gaining momentum as computer science skills give employees a competitive advantage in an increasingly globalized labor market. Researchers and educators have addressed this demand by making CS instructional materials more accessible, creating professional development (PD) resources, and designing online courses targeted at undergraduate CS education settings. However, there is limited research on what types of support African teachers need to improve pedagogy in K-12 settings, which is critical for fostering foundational interest in CS. To address this, we interviewed fourteen CS teachers in nine K-12 schools in the Greater Accra Region of Ghana to uncover opportunities to design interventions that address challenges they experience with teaching CS in schools and support their professional development. We found that most CS teachers lack formal CS …"
43,Building Capacity for K-12 AI Education: A Non-Computer Science Teacher’s Experience,0,2025,https://scholar.google.com/citations?view_op=view_citation&hl=en&user=n6zdTxUAAAAJ&pagesize=50&citation_for_view=n6zdTxUAAAAJ:ns9cj8rnVeAC,"This case study explores the experiences of a non-computer science educator participating in a professional development program designed to support AI teaching in rural middle schools. Using Cultural-Historical Activity Theory and expansive learning as analytical lenses, the research examines how the educator leveraged supportive elements within her environment to overcome challenges, gradually building confidence while adopting new teaching practices. Findings underscore the need for tailored professional development, ongoing support, and progressive teacher learning for effective AI education. This study contributes to understanding how non-computer science educators can be supported in bringing AI learning experiences to their students, thereby making AI education more accessible."
44,Improving the Efficacy of AI Instructional Materials via Co-Design with Students & Instructors,0,2025,https://scholar.google.com/citations?view_op=view_citation&hl=en&user=n6zdTxUAAAAJ&pagesize=50&citation_for_view=n6zdTxUAAAAJ:GnPB-g6toBAC,"Middle School students are exposed to an unprecedented number of AI-driven consumer products. This exposure demands that educators help students develop their personal understandings of these technologies to engage with them responsibly. Designing age-appropriate AI curricula for middle school students calls for collaboration and partnership between computer and learning scientists, computer science instructors, as well as middle school students. Over a 4-year period, I have facilitated co-designing AI education games and instructional materials with teachers and students, and successfully implemented them with students across 9 geographically and economically diverse schools in the US. Drawing from our analyses of the curriculum, designed artifacts, and teacher and student experiences, I will highlight the benefits of co-design and learning games to improve students’ AI literacy, uncover students …"
45,Negotiating Systemic Racial and Gender Bias as a Minoritized Adult Design Researcher,0,2021,https://scholar.google.com/citations?view_op=view_citation&hl=en&user=n6zdTxUAAAAJ&pagesize=50&citation_for_view=n6zdTxUAAAAJ:e5wmG9Sq2KIC,"Fostering equal design partnerships in adult-child codesign interactions is a well-documented challenge in HCI. It is assumed that adults come into these interactions with power and have to make adjustments to allow childrens’ input to be equally valued. However, power is not a unilateral construct - it is in part determined by social and cultural norms that often disadvantage minoritized groups. Striving for equal partnership without centering users’ and participants’ intersectional identities may lead to unproductive adult-child codesign interactions. We codesigned a game, primarily facilitated by a black woman researcher, with K-5 afterschool programs comprised of students from three different communities – a middle-class, racially diverse community; a low-income, primarily African American community; and a working-class rural, white, community over a period of 20 weeks. We share preliminary insights on how …"
46,Facilitiating Help-Seeking for K-2 Students in Rural Schools in Tanzania,0,2020,https://scholar.google.com/citations?view_op=view_citation&hl=en&user=n6zdTxUAAAAJ&pagesize=50&citation_for_view=n6zdTxUAAAAJ:qUcmZB5y_30C,"Sub-Saharan Africa is the world’s fastest growing region with regards to the adoption of mobile technologies with three quarters of the population owning a mobile device1. The region is also currently undergoing an education crisis with over 32 million out-of-school children, and over 80% of schoolenrolled children not meeting minimum proficiency in math and reading assessments. Therefore, interested organizations and governments have attempted to tackle this issue by introducing mobile educational technologies to supplement, and sometimes replace traditional classroom education. Some of these initiatives have shown positive learning gains for students, often attributing these outcomes to children’s innate curiosity to teach themselves the content, context-aware curriculums, as well as peer support and collaboration in the learning process. Indeed, peer support should be utilized and encouraged to maximize the efficacy of educational technologies. Collaborative peer learning leads to increased test scores, cognitive activity, motivation and enthusiasm, and satisfaction over individualized learning settings. While knowledgeable adults can provide (or be trained to provide) adequate domain knowledge support for children learning with technology, this often comes at the expense of the benefits that peer collaboration brings to the learning process, especially in regions where peer-peer collaboration may not be encouraged by teachers such as some cultures in Tanzania.To begin this thesis, I conducted two research studies to understand how peers support each other in rural, low-resource contexts in Tanzania. In the first study, I deployed a …"
47,Communication mode control for wearable devices,0,2020,https://scholar.google.com/citations?view_op=view_citation&hl=en&user=n6zdTxUAAAAJ&pagesize=50&citation_for_view=n6zdTxUAAAAJ:ZeXyd9-uunAC,"A method, executed by one or more processors, includes monitoring a plurality of ambient condition sensors config ured to sense a plurality of ambient conditions that are relevant to a plurality of communication modes provided by at least one user I/O device, deactivating a first communi cation mode of the plurality of communication modes and activating a second communication mode of the plurality of communication modes in response to determining, via the plurality of ambient condition sensors, that one or more of the plurality of ambient conditions are not conducive to the first communication mode and that the plurality of ambient conditions are collectively more conducive to the second communication mode than the first communication mode. A corresponding apparatus and computer program product are also disclosed herein."
