Rank,Title,Citations,Year,URL,Description
23,From back-of-the-envelope to informed estimation of edge computing benefits in minutes using castnet,7,2019,https://scholar.google.com/citations?view_op=view_citation&hl=en&user=vlV_GoEAAAAJ&pagesize=50&citation_for_view=vlV_GoEAAAAJ:MXK_kJrjxJIC,"Multi-access Edge Computing (MEC) is emerging as the next evolution in computing infrastructure. However, the broad adoption of edge computing solutions is still lagging behind. We posit that a significant factor contributing to this trend is related to the challenges in evaluating the trade-offs offered by edge computing and answering a simple question: Will the edge investments be offset with commensurate gains in performance metrics such as improved application responsiveness or lower backhaul bandwidth costs? Existing simulation tools, developed for cloud computing and networking research, require a large amount of effort to be applied to the edge computing space. Their native abstractions and interfaces pose limitations in how such frameworks can be extended to allow for characterization and analysis of diverse edge computing use cases. Moreover, as we demonstrate, they can be slow, taking days, to …"
24,Astrolabe: modeling RTT variability in Leo networks,5,2023,https://scholar.google.com/citations?view_op=view_citation&hl=en&user=vlV_GoEAAAAJ&pagesize=50&citation_for_view=vlV_GoEAAAAJ:dhFuZR0502QC,"Networking practitioners heavily rely on intuitive models of the behavior of networks when designing and analyzing protocols and algorithms. However, there is still a lack of such intuitive models of the behavior of LEO satellite networks, hindering innovation. In this paper, we provide a first step towards improving the intuitive understanding of the behavior of LEO satellite networks. In particular, we focus on developing a model that captures the RTT variability exhibited by such networks. We rely on simple and intuitive calculations instead of expensive simulations. To capture the high RTT variability exhibited by satellite networks, we estimate lower and upper bounds for the RTT between a pair of ground stations. We introduce Astrolabe, a novel approach that achieves accurate bounds, with a median lower bound within 1.15X the actual lowest RTT and a median upper bound within 2X the highest RTT in a few …"
25,Don’t let your LEO edge fade at night,5,2023,https://scholar.google.com/citations?view_op=view_citation&hl=en&user=vlV_GoEAAAAJ&pagesize=50&citation_for_view=vlV_GoEAAAAJ:QIV2ME_5wuYC,"The Low Earth Orbit (LEO) satellite edge has emerged as a promising solution to alleviate data congestion on the ground-satellite links (GSLs). However, existing approaches either offer inflexible fixed-function deployments or focus solely on addressing infrastructure mobility. In this paper, we shed light on the unique challenges posed by the varying energy harvested by satellites, which necessitates a fresh perspective on orchestration within satellites. Our work serves as a compelling call to integrate energy as a first-class metric for orchestrating applications within the LEO satellite infrastructure, posed as the new frontier of computing infrastructure."
26,The Performance Argument for Blockchain-based Edge DNS Caching,5,2021,https://scholar.google.com/citations?view_op=view_citation&hl=en&user=vlV_GoEAAAAJ&pagesize=50&citation_for_view=vlV_GoEAAAAJ:M3ejUd6NZC8C,"The Domain Name System (DNS,) a standard way of looking up IP addresses of Internet services, has served the Internet ecosystem well. However with the advent of edge computing, it falls short of many desirable properties. These include accurate fine-grained geographic localization of edge services, fast look-ups, and ensuring record freshness and cache integrity for end users. To satisfy these properties we consider blockchain-based solutions, a counter-intuitive approach as blockchain is not often associated with performance or the latency requirements of the edge. Despite this, we argue blockchain can address the shortcomings we've identified in DNS specifically in the edge context. We've found blockchain-based solutions are not sufficient as is, thus we present GeoENS - a prototype based on the Ethereum blockchain suitable for, and enabled by, the edge. It achieves these goals via novel record …"
27,Shapeshifter: Resolving the hidden latency contention problem in MEC,4,2022,https://scholar.google.com/citations?view_op=view_citation&hl=en&user=vlV_GoEAAAAJ&pagesize=50&citation_for_view=vlV_GoEAAAAJ:qxL8FJ1GzNcC,"Mobile Edge Computing (MEC) creates new infrastructure at the edges of the mobile networks, thus providing transformative opportunities for applications seeking latency benefits by operating closer to end-users and devices. However, the reduced network distance between the application endpoints of the MEC flows causes pattern shifts in the packet bursts exchanged at the network edges. The longer and denser bursts create a new source of contention that is not considered by current solutions. As a result, naively collocating applications onto the MEC tier can negatively affect latency-critical workloads, resulting in up to 73% packets experiencing as much as 3.8x increased latency. This makes it impossible to support latency-centric SLOs in MEC, obviating its expected benefits from MEC. This paper is the first to describe this new contention point in mobile networks and its potentially crippling impact on the …"
28,Adrenaline: Adaptive rendering optimization system for scalable cloud gaming,3,2024,https://scholar.google.com/citations?view_op=view_citation&hl=en&user=vlV_GoEAAAAJ&pagesize=50&citation_for_view=vlV_GoEAAAAJ:IWHjjKOFINEC,"Cloud gaming requires a low-latency network connection, making it a prime candidate for being hosted at the network edge. However, an edge server is provisioned with a fixed compute capacity, causing an issue for multi-user service and resulting in users having to wait before they can play when the server is occupied. In this work, we present a new insight that when a user's network condition results in use of lossy compression, the end-to-end visual quality more degrades for frames of high rendering quality, wasting the server's computing resources. We leverage this observation to build Adrenaline, a new system which adaptively optimizes the game rendering qualities by considering the user-side visual quality and server-side rendering cost. The rendering quality optimization of Adrenaline is done via a scoring mechanism quantifying the effectiveness of server resource usage on the user-side gaming quality. Our open-sourced implementation of Adrenaline demonstrates easy integration with modern game engines. In our evaluations, Adrenaline achieves up to 24% higher service quality and 2x more users served with the same resource footprint compared to other baselines."
29,Tgh: A tee/gc hybrid enabling confidential faas platforms,3,2023,https://scholar.google.com/citations?view_op=view_citation&hl=en&user=vlV_GoEAAAAJ&pagesize=50&citation_for_view=vlV_GoEAAAAJ:mVmsd5A6BfQC,"Trusted Execution Environments (TEEs) suffer from performance issues when executing certain management instructions, such as creating an enclave, context switching in and out of protected mode, and swapping cached pages. This is especially problematic for short-running, interactive functions in Function-as-a-Service (FaaS) platforms, where existing techniques to address enclave overheads are insufficient. We find FaaS functions can spend more time managing the enclave than executing application instructions. In this work, we propose a TEE/GC hybrid (TGh) protocol to enable confidential FaaS platforms. TGh moves computation out of the enclave onto the untrusted host using garbled circuits (GC), a cryptographic construction for secure function evaluation. Our approach retains the security guarantees of enclaves while avoiding the performance issues associated with enclave management instructions."
30,DRIVESHAFT: Improving Perceived Mobile Web Performance,3,2018,https://scholar.google.com/citations?view_op=view_citation&hl=en&user=vlV_GoEAAAAJ&pagesize=50&citation_for_view=vlV_GoEAAAAJ:UebtZRa9Y70C,"With mobiles overtaking desktops as the primary vehicle of Internet consumption, mobile web performance has become a crucial factor for websites as it directly impacts their revenue. In principle, improving web performance entails squeezing out every millisecond of the webpage delivery, loading, and rendering. However, on a practical note, an illusion of faster websites suffices. This paper presents DriveShaft, a system envisioned to be deployed in Content Delivery Networks, which improves the perceived web performance on mobile devices by reducing the time taken to show visually complete web pages, without requiring any changes in websites, browsers, or any actions from end-user. DriveShaft employs (i) crowdsourcing, (ii) on-the-fly JavaScript injection, (iii) privacy preserving desensitization, and (iv) automatic HTML generation to achieve its goals. Experimental evaluations using 200 representative websites on different networks (Wi-Fi and 4G), different devices (high-end and low-end phones) and different browsers, show a reduction of 5x in the time required to see a visually complete website while giving a perception of 5x-6x faster page loading."
31,Colibri: Efficient collection of fine-grained resource metrics necessary for mobile edge computing,2,2024,https://scholar.google.com/citations?view_op=view_citation&hl=en&user=vlV_GoEAAAAJ&pagesize=50&citation_for_view=vlV_GoEAAAAJ:hC7cP41nSMkC,"Effective provisioning and resource management in edge environments are critical for ensuring infrastructure efficiency while providing latency-critical service-level objectives (SLOs). Realizing this requires low-overhead aggregation of fine-grained information regarding workloads' resource demands. Unfortunately, we show that this cannot be adequately achieved with existing solutions used for cloud technologies such as Kubernetes and containers, which are prevalent in edge systems. We propose Colibri, a lightweight and flexible monitoring system for edge computing that characterizes containers across CPU, memory, and network resource usage patterns at millisecond granularity. Colibri can be dispatched dynamically as needed and enables accurate characterization of workload resource usage. We demonstrate experimentally that using Colibri can significantly reduce SLO violations caused when relying …"
32,Angler: Dark pool resource allocation,2,2023,https://scholar.google.com/citations?view_op=view_citation&hl=en&user=vlV_GoEAAAAJ&pagesize=50&citation_for_view=vlV_GoEAAAAJ:7PzlFSSx8tAC,"Demand for distributed computational infrastructure is growing in order to offer low latency connections to end users. The fragmenting infrastructure complicates the resource allocation process. As the number of infrastructure providers grows, points of presence are resource constrained compared to the cloud, they have diverse availability profiles, and diverse connectivity properties. Existing resource allocation approaches require providers share intimate details about their infrastructure to support the placement process, or rely on third party aggregators. Such solutions introduce strong assumptions of trust and collaboration. In this work we present Angler, the first system to allocate resources from dark pools, meaning the capacity and requests of the distributed pool of resources are unknown. Angler leverages cryptographic protocols for secure function evaluation, namely the WRK secure multiparty computation …"
33,GeoENS: Blockchain-based Infrastructure for Service Discovery at the Edge,2,2020,https://scholar.google.com/citations?view_op=view_citation&hl=en&user=vlV_GoEAAAAJ&pagesize=50&citation_for_view=vlV_GoEAAAAJ:YOwf2qJgpHMC,"The Domain Name System (DNS), a standard way of looking up IP addresses of internet services, has served the Internet ecosystem well. However with the advent of edge computing it falls short of some must-have functional properties as well as good-to-have desirable properties. The must-haves include fine-grained geographic localization and discovery of edge services. The good-to-haves include doing so in a timely manner with low overhead costs measured in storage and bandwidth as well as user privacy preservation. To illustrate the need for DNS infrastructure purpose built for multi-access edge computing, consider the following example. Suppose a computer vision service which assists autonomous vehicles is running on hardware at the base station of every cell tower in the United States. In traditional DNS infrastructure, this service would have a CNAME record pointing to an authoritative nameserver which would use GeoIP services [4] to direct users to the closest instance of the edge application. To provide location-specific query resolution, DNS relies on a distributed tier of nameservers, each resolving queries to local/nearby service provider instances. Unfortunately, current support for geo-localization operates in coarse geographic granularity due to the fact that query localization is based on third-party services with variable accuracy. This is due to the limited ability of GeoIP services to localize users by IP address [5]. The course granularity at which GeoIP services operate are unacceptable for edge applications which demand ultra low latency between end users and the edge. Motivated by these gaps, this work explores the …"
34,Ephemeral apps,2,2016,https://scholar.google.com/citations?view_op=view_citation&hl=en&user=vlV_GoEAAAAJ&pagesize=50&citation_for_view=vlV_GoEAAAAJ:Y0pCki6q_DkC,"Despite a tremendous increase in the number of mobile apps, coupled with their popularity with consumers, there exists a wide gap in app availability vs. their use. Recent trends suggest that this gap will further widen in the future. Ephemeral apps, proposed in this paper, lower the barrier for end-user app acceptance by removing the app installation step when `trying out' new apps, without requiring modifications to current apps or any additional programming efforts by app developers. We estimate the resulting reduction in time-to-use for apps to be a factor of 10x by leveraging the emerging `edge cloud' tier of the Internet."
35,vSensor: Toward Sensor-rich Mobile Applications,2,2015,https://scholar.google.com/citations?view_op=view_citation&hl=en&user=vlV_GoEAAAAJ&pagesize=50&citation_for_view=vlV_GoEAAAAJ:2osOgNQ5qMEC,"Interacting with sensors presents numerous challenges, particularly for applications running on resource-constrained platforms like smartphones or tablets. This paper suggests vSensor abstractions providing such applications with the ease of use for today’s multitude of sensors. vSensor abstractions also interact with nearby and cloud resources for the applications to easily process sensoracquired data and control actuators in a consistent way, which permits applications to scale their use of sensors by leveraging other nearby and cloud resources. The vSensor abstraction developed in our research seek to provide globally transparent, uniform access to the ambient sensors to unmodified applications as well as those with the vSensor awareness. We implement and evaluate the vSensor abstraction on Android platforms."
36,Ushering in the Low Earth Orbit Compute Cloud Era,1,2025,https://scholar.google.com/citations?view_op=view_citation&hl=en&user=vlV_GoEAAAAJ&pagesize=50&citation_for_view=vlV_GoEAAAAJ:hFOr9nPyWt4C,"The last few years have seen low Earth orbit satellites becoming an integral part of global connectivity, including high-speed broadband, cellular, and Internet of Things. This article outlines a vision in which this new infrastructure tier is used like today’s clouds to flexibly deploy diverse services in space."
37,Poster: Fine-grained Control Plane Container Profiler for MEC,1,2022,https://scholar.google.com/citations?view_op=view_citation&hl=en&user=vlV_GoEAAAAJ&pagesize=50&citation_for_view=vlV_GoEAAAAJ:aqlVkmm33-oC,"Today, the edge computing system stack is built by leveraging the current cloud technologies, such as the containers, Kubernetes, etc., because, like the cloud, the edge is multi-tenant infrastructure. However, edge applications have more latency-critical SLAs and the infrastructure itself resource-constrained. That puts additional burdens on its control plane, which are not addressed by the cloud control plain tools. At the edge, if deployments aren't specified accurately, edge providers will face the dilemma between the waste of resource due to overcommitment vs. SLA violations. However, we observed that it is not feasible to rely on the existing monitoring tools, designed for the cloud, to glean that information from workloads with varying use of resources, at the needed fine granularity. Trying to do that with brute-forcing cloud solutions turns out to be extremely demanding on the resources allocated to the control …"
38,"Frame, rods and beads of the edge computing abacus",1,2016,https://scholar.google.com/citations?view_op=view_citation&hl=en&user=vlV_GoEAAAAJ&pagesize=50&citation_for_view=vlV_GoEAAAAJ:ufrVoPGSRksC,"Going beyond point solutions, the vision of edge computing is to assimilate itself in the existing computing ecosystem to enable web services to deploy their edge functions (EF) in a multitenant edge infrastructure. However, there are critical challenges in making that vision possible. This dissertation addresses three such critical challenges:"
39,Efficient Cross-Frequency Beam Prediction in 6G Wireless Using Time Series Data,0,2024,https://scholar.google.com/citations?view_op=view_citation&hl=en&user=vlV_GoEAAAAJ&pagesize=50&citation_for_view=vlV_GoEAAAAJ:ZeXyd9-uunAC,"Next generation 6G wireless envisions a much higher data rate and a lower latency compared to 5G wireless networks. Directional antennas with narrow beams across high mmWave frequencies hold the key to achieving such high data rates. However, Beam Management (BM), which is the process of finding appropriate transmit and receive beams, offers significant challenges. Dynamic channel variation, user mobility, and narrow beams in high frequency mmWave channels further complicate these challenges. Efficient Machine Learning (ML) strategies can be used to alleviate this overhead. In spite of their underlying differences, sub-6 GHz and high frequency mmWave channels share some similarities in array geometry, number of paths, and surrounding environment. As sub-6 GHz channel characteristics are relatively easier to acquire and learn, we introduce a new machine learning framework, using …"
40,A Characterization of Route Variability,0,2023,https://scholar.google.com/citations?view_op=view_citation&hl=en&user=vlV_GoEAAAAJ&pagesize=50&citation_for_view=vlV_GoEAAAAJ:-f6ydRqryjwC,"LEO satellite networks possess highly dynamic topologies, with satellites moving at 27,000 km/hour to maintain their orbit. As satellites move, the characteristics of the satellite network routes change, triggering rerouting events. Frequent rerouting can cause poor perfor-mance for path-adaptive algorithms (eg, congestion control). In this paper, we provide a thorough characterization of route variability in LEO satellite networks, focusing on route churn and RTT variability. We show that high route churn is common, with most paths used for less than half of their lifetime. With some paths used for just a few sec-onds. This churn is also unnecessary with rerouting leading to marginal gains in most cases (eg, less than a 15% reduction in RTT). Moreover, we show that the high route churn is harmful to network utilization and congestion control performance. By examining RTT variability, we find that the smallest achievable RTT between two ground stations can increase by 2.5× as satellites move in their orbits. We show that the magnitude of RTT variability depends on the location of the communi-cating ground stations, exhibiting a spatial structure. Finally, we show that adding more satellites, and providing more routes between stations, does not necessarily reduce route variability. Rather, constellation con-figuration (ie, the number of orbits and their inclination) plays a more significant role. We hope that the findings of this study will help with designing more robust routing algorithms for LEO satellite networks."
41,HotMobile 2016,0,2016,https://scholar.google.com/citations?view_op=view_citation&hl=en&user=vlV_GoEAAAAJ&pagesize=50&citation_for_view=vlV_GoEAAAAJ:W7OEmFMy1HYC,"Learn about the Seventeenth Workshop on Mobile Computing Systems and Applications (ACM HotMobile 2016), which showcased a diverse set of early research findings and new directions within the mobile systems community."
42,Stimpack: An Adaptive Rendering Optimization System for Scalable Cloud Gaming,0,,https://scholar.google.com/citations?view_op=view_citation&hl=en&user=vlV_GoEAAAAJ&pagesize=50&citation_for_view=vlV_GoEAAAAJ:mB3voiENLucC,"Stimpack: An Adaptive Rendering Optimization System for Scalable Cloud Gaming | USENIX Back to USENIX Sign In Conferences Register Now Attend Registration Information Registration Discounts Grant Opportunities Venue, Hotel, and Travel Program Technical Sessions Spring Accepted Papers Participate Call for Papers Call for Artifacts Instructions for Presenters Sponsorship About Past Symposia Symposium Organizers Conference Policies Code of Conduct Questions Stimpack: An Adaptive Rendering Optimization System for Scalable Cloud Gaming Jin Heo, Dolby Laboratories; Vic Wang, Ketan Bhardwaj, and Ada Gavrilovska, Georgia Institute of Technology Attend Registration Information Registration Discounts Grant Opportunities Venue, Hotel, and Travel Program Technical Sessions Spring Accepted Papers Participate Call for Papers Call for Artifacts Instructions for Presenters Sponsorship About Past …"
43,SEC 2024,0,,https://scholar.google.com/citations?view_op=view_citation&hl=en&user=vlV_GoEAAAAJ&pagesize=50&citation_for_view=vlV_GoEAAAAJ:qUcmZB5y_30C,"Table of Contents Page 1 2024 IEEE/ACM Symposium on Edge Computing (SEC) SEC 2024 Table of Contents Message from General Chair xiv Message from Program Chairs xv Organizing Committee xvi Sponsors xix Session 1 - Edge Resource Management and Optimization EdgeCore: Resource Dependency-Aware Multi-Tenant Orchestration for Mobile Edge Clouds 1 Amran Haroon (Texas A&M University, USA), Liuyi Jin (Texas A&M University, USA), Radu Stoleru (Texas A&M University, USA), Maxwell Maurice (National Institute of Standards and Technology (NIST), USA), and Roger Blalock (National Institute of Standards and Technology (NIST), USA) Righteous: Automatic Right-Sizing for Complex Edge Deployments 15 Aniruddha Rakshit (Binghamton University, USA), Salil Reddy (Ohio State University, USA), Rajiv Ramnath (Ohio State University, USA), Anish Arora (Ohio State University, USA), and …"
