Rank,Title,Citations,Year,URL,Description
1,Towards {IoT-DDoS} prevention using edge computing,135,2018,https://scholar.google.com/citations?view_op=view_citation&hl=en&user=vlV_GoEAAAAJ&pagesize=50&citation_for_view=vlV_GoEAAAAJ:_FxGoFyzp5QC,"Application-level DDoS attacks mounted using compromised IoT devices are emerging as a critical problem. The application-level and seemingly legitimate nature of traffic in such attacks renders most existing solutions ineffective, and the sheer amount and distribution of the generated traffic make mitigation extremely costly. This paper proposes a new approach which leverages edge computing to deploy edge functions that gather information about incoming traffic and communicate that information via a fast-path with a nearby detection service. This accelerates the detection and the arrest of such attacks, limiting their damaging impact. Preliminary investigation shows promise for up to 10x faster detection that reduces up to 82% of the Internet traffic due to IoT-DDoS."
2,"Fast, scalable and secure onloading of edge functions using airbox",88,2016,https://scholar.google.com/citations?view_op=view_citation&hl=en&user=vlV_GoEAAAAJ&pagesize=50&citation_for_view=vlV_GoEAAAAJ:YsMSGLbcyi4C,"This paper argues for the utility of back-end driven onloading to the edge as a way to address bandwidth use and latency challenges for future device-cloud interactions. Supporting such edge functions (EFs) requires solutions that can provide (i) fast and scalable EF provisioning and (ii) strong guarantees for the integrity of the EF execution and confidentiality of the state stored at the edge. In response to these goals, we (i) present a detailed design space exploration of the current technologies that can be leveraged in the design of edge function platforms (EFPs), (ii) develop a solution to address security concerns of EFs that leverages emerging hardware support for OS agnostic trusted execution environments such as Intel SGX enclaves, and (iii) propose and evaluate AirBox, a platform for fast, scalable and secure onloading of edge functions."
3,Couper: Dnn model slicing for visual analytics containers at the edge,80,2019,https://scholar.google.com/citations?view_op=view_citation&hl=en&user=vlV_GoEAAAAJ&pagesize=50&citation_for_view=vlV_GoEAAAAJ:3fE2CSJIrl8C,"Applications incorporating DNN-based visual analytics are growing in demand. This class of data-intensive and latency-sensitive workloads has an opportunity to benefit from the emerging edge computing tier. However, to decouple the growing resource demand of DNN models, from the characteristics and resource limitations of the infrastructure elements available at the edge, new methods are needed to quickly slice the DNNs into appropriately-sized components, and to deploy those DNN slices to be executed on the edge infrastructure stacks. This paper presents Couper, a practical solution that provides for quick creation of slices of production DNNs for visual analytics, and enables their deployment in contemporary container-based edge software stacks. Couper is evaluated with 7 production DNNs, under varying edge configurations."
4,Creation and delivery of pre-rendered web pages for accelerated browsing,63,2017,https://scholar.google.com/citations?view_op=view_citation&hl=en&user=vlV_GoEAAAAJ&pagesize=50&citation_for_view=vlV_GoEAAAAJ:zYLM7Y9cAGgC,"The process of rendering web pages can be significantly improved with a content delivery system that pre-renders web content for a client device. A web page “program'can be pre-executed and the result delivered to a requesting client device, rather than or before sending a traditional set of web page components, such as a markup language document, cascading style sheets, embedded objects. This pre-execution can relieve the client device of the burden of rendering the web page, saving resources and decreasing latency before the web page is ready, and can reduce the number of network requests that the client device must make before being able to display the page. Disclosed herein are methods, systems, and devices for creating and delivering pre-rendered web pages for accelerated browsing."
5,Personal clouds: Sharing and integrating networked resources to enhance end user experiences,53,2014,https://scholar.google.com/citations?view_op=view_citation&hl=en&user=vlV_GoEAAAAJ&pagesize=50&citation_for_view=vlV_GoEAAAAJ:u5HHmVD_uO8C,"End user experiences on mobile devices with their rich sets of sensors are constrained by limited device battery lives and restricted form factors, as well as by the `scope' of the data available locally. The `Personal Cloud' distributed software abstractions address these issues by enhancing the capabilities of a mobile device via seamless use of both nearby and remote cloud resources. In contrast to vendor-specific, middleware-based cloud solutions, Personal Cloud instances are created at hypervisor-level, to create for each end user the federation of networked resources best suited for the current environment and use. Specifically, the Cirrostratus extensions of the Xen hypervisor can federate a user's networked resources to establish a personal execution environment, governed by policies that go beyond evaluating network connectivity to also consider device ownership and access rights, the latter managed in a …"
6,Toward Loosely Coupled Orchestration for the {LEO} Satellite Edge,39,2020,https://scholar.google.com/citations?view_op=view_citation&hl=en&user=vlV_GoEAAAAJ&pagesize=50&citation_for_view=vlV_GoEAAAAJ:KlAtU1dfN6UC,"Low Earth Orbit (LEO) satellites are envisioned to be capable of providing Internet services for billions of users who currently lack reliable Internet connectivity. This calls for a new LEO edge capable of providing edge computing benefits from space. This paper proposes an orchestration approach for the LEO edge that incorporates path models, temporal compensation and affinity chains as the primary scheduling constructs, and presents preliminary results that illustrate opportunities for achieving improved service availability and improved performance for a stateful (caching) edge function."
7,Ecc: Edge cloud composites,33,2014,https://scholar.google.com/citations?view_op=view_citation&hl=en&user=vlV_GoEAAAAJ&pagesize=50&citation_for_view=vlV_GoEAAAAJ:9yKSN-GCB0IC,"With an ever increasing number of networked devices used in mobile settings, or residing in homes, offices, and elsewhere, there is a plethora of potential computational infrastructure available for providing end users with new functionality and improved experiences for their interactions with the cyber physical world. The goal of our research is to permit end user applications to take advantage of dynamically available, local and remote computational infrastructure, without requiring applications to be explicitly rewritten and/or reconfigured for each scenario and with minimal end user intervention. Edge Cloud Composites (ECC) make possible the dynamic creation of virtual computational platforms that (i) can be composed from specific capabilities - competences - of participating devices, (ii) are guided by end user-centric abstractions capturing current user context and user intent, and (iii) use dynamic methods for …"
8,Toward lighter containers for the edge,30,2020,https://scholar.google.com/citations?view_op=view_citation&hl=en&user=vlV_GoEAAAAJ&pagesize=50&citation_for_view=vlV_GoEAAAAJ:Zph67rFs4hoC,"Edge computing environments, being resource-limited, cannot tolerate the bloat in size of edge applications due to use of thick, complex software runtimes and hardware acceleration support. But such capabilities are critical to support rich, diverse and high performance applications. Performance includes deployment time, responsiveness and scalability, and is impacted by the bloat if using cloud-native container-based systems at the edge. If not addressed, this will limit the ability of the edge to scale to increasing number of workloads. This paper makes a case for a new featherweight system–Pocket–to support edge computing. Pocket addresses the limitations in current container-based systems while retaining their benefits. Pocket achieves this by splitting containerized applications into two parts: application container and a bloat-causing execution environment container. Experimental evaluations of an early prototype show that by sharing the execution environment containers across multiple application containers, Pocket is able to achieve significant reductions of the resource pressure at the edge, thus presenting a path toward greater efficiency and scalability for edge computing."
9,A characterization of route variability in LEO satellite networks,29,2023,https://scholar.google.com/citations?view_op=view_citation&hl=en&user=vlV_GoEAAAAJ&pagesize=50&citation_for_view=vlV_GoEAAAAJ:4DMP91E08xMC,"LEO satellite networks possess highly dynamic topologies, with satellites moving at 27,000 km/hour to maintain their orbit. As satellites move, the characteristics of the satellite network routes change, triggering rerouting events. Frequent rerouting can cause poor performance for path-adaptive algorithms (e.g., congestion control). In this paper, we provide a thorough characterization of route variability in LEO satellite networks, focusing on route churn and RTT variability. We show that high route churn is common, with most paths used for less than half of their lifetime. With some paths used for just a few seconds. This churn is also unnecessary with rerouting leading to marginal gains in most cases (e.g., less than a 15% reduction in RTT). Moreover, we show that the high route churn is harmful to network utilization and congestion control performance. By examining RTT variability, we find that the smallest achievable RTT …"
10,SOUL: an edge-cloud system for mobile applications in a sensor-rich world,27,2016,https://scholar.google.com/citations?view_op=view_citation&hl=en&user=vlV_GoEAAAAJ&pagesize=50&citation_for_view=vlV_GoEAAAAJ:eQOLeE2rZwMC,"With the Internet of Things, sensors are becoming ever more ubiquitous, but interacting with them continues to present numerous challenges, particularly for applications running on resource-constrained devices like smartphones. The SOUL abstractions in this paper address two issues faced by such applications: (1) access to sensors with the levels of convenience needed for their ubiquitous, dynamic use, and only by parties authorized to do so, and (2) scalability in sensor access, given today's multitude of sensors. Toward this end, SOUL, first, introduces a new abstraction for the applications to transparently and uniformly access both on-device and ambient sensors with associated actuators. Second, potentially expensive sensor-related processing needs not just occur on smartphones, but can also leverage edge-and remote-cloud resources. Finally, SOUL provides access control methods that permit users to …"
11,AppSachet: Distributed app delivery from the edge cloud,27,2015,https://scholar.google.com/citations?view_op=view_citation&hl=en&user=vlV_GoEAAAAJ&pagesize=50&citation_for_view=vlV_GoEAAAAJ:IjCSPb-OGe4C,"With total app installs touching 100 Billion in 2015, the increasing number of active devices that support apps are posed to result in 200 billion downloads by 2017. Data center based App stores offering users convenient app access, however, cause congestion in the last mile of the Internet, despite use of content delivery networks (CDNs) or ISP-based caching. This paper explores the new paradigm of eBoxes, situated in the ‘edge cloud’ tier beyond the last mile, which can be used to alleviate this congestion. With redesigned app caches – termed AppSachet – such edge cloud based distributed caching can achieve a hit ratio of up to 83 %, demonstrated on real-world Internet traffic. The redesign leverages proposed new caching policies, termed p-LRU and c-LRU, specifically targeted at eBoxes’ limited storage and for the traffic caused by app installs and updates. A cost benefit analysis shows that the additional …"
12,Addressing the fragmentation problem in distributed and decentralized edge computing: A vision,14,2019,https://scholar.google.com/citations?view_op=view_citation&hl=en&user=vlV_GoEAAAAJ&pagesize=50&citation_for_view=vlV_GoEAAAAJ:8k81kl-MbHgC,"At the core of the value proposition of edge computing is the ability to put computation close enough to the data sources, on demand. However, the data sources, computational infrastructure and software services needed to come together to power emerging and future edge computing applications are fragmented across different stakeholders, each with their own incentives, policies, and constraints on resources they can afford. This fragmentation limits the ability of edge computing to guarantee to applications and data the edge which will deliver the desired benefit. In this paper, we present our vision for an Edge Exchange, a decentralized directory service for a multi-stakeholder edge, as a path forward to enabling applications to be deployed across the best available edge resources, while still providing each stakeholder with controls regarding their resource use and sharing policies."
13,Serving mobile apps: A slice at a time,13,2019,https://scholar.google.com/citations?view_op=view_citation&hl=en&user=vlV_GoEAAAAJ&pagesize=50&citation_for_view=vlV_GoEAAAAJ:0EnyYjriUFMC,"End users wanting to do more and more with mobile apps has led to explosive growth in the number of available apps. This has widened the gap between developers making apps available and end users being able to install all the apps they want on their device. To address this, Google introduced Instant Apps for Android where users can access selective app features on demand without having to download and install entire apps. But this requires developers to refactor apps and limits the apps' functionality. In this paper, we present AppSlicer -- a solution that automates the creation, delivery, execution and cleanup of lightweight app slices from native apps. With AppSlicer, app slices are created from existing native apps, without requiring any additional developer effort. App slices run on end-user devices and correspond to arbitrary single functionality (task) that is carried out using an app. We demonstrate that …"
14,Pocket: ml serving from the edge,12,2023,https://scholar.google.com/citations?view_op=view_citation&hl=en&user=vlV_GoEAAAAJ&pagesize=50&citation_for_view=vlV_GoEAAAAJ:Wp0gIr-vW9MC,"One of the major challenges in serving ML applications is the resource pressure introduced by the underlying ML frameworks. This becomes a bigger problem at resource-constrained, multi-tenant edge server locations, where it is necessary to scale to a larger number of clients with a fixed resource envelope. Naive approaches which simply minimize the resource budget allocation of each application result in performance degradation that voids the benefits expected from operating at the edge. This paper presents Pocket - a new approach for serving ML applications in settings like the edge, based on a shared ML runtime backend as a service and lightweight ML application pocket containers. Key to realizing Pocket is use of lightweight IPC, support for cross-client isolation, and a novel resource amplification method which inlines resource reallocation with IPC. The latter ensures just-in-time assignment of the …"
15,AppFlux: Taming app delivery via Streaming,12,2015,https://scholar.google.com/citations?view_op=view_citation&hl=en&user=vlV_GoEAAAAJ&pagesize=50&citation_for_view=vlV_GoEAAAAJ:UeHWp8X0CEIC,"The number of apps downloaded for smart devices has surpassed 80 billion, with trends suggesting continued substantial increases. The resulting volume of app installs and updates puts pressure on the existing appdelivery infrastructure due to interactions of end user devices with app stores via the Internet that involve app stores’ data center, content delivery network’s (CDNs) points of presence and the Internet Service Provider (ISP) pipes. This paper presents ‘AppFlux’–a novel app streaming approach to app delivery which reduces the load app delivery poses on the app infrastructure, and relieves users from having to deal with unnecessary updates potentially saving bytes on their costly data plan. By leveraging the emerging ‘edge cloud’tier of the Internet, the AppFlux approach provides ‘just-in-time’delivery of apps and their updates while (i) reducing the traffic due to app installs and updates seen in the last mile of Internet by up to 70%,(ii) facilitating twice as fast app delivery compared to CDNs and (iii) App streaming can potentially lead to 20% improvements in the app load times on devices. With its implementation for the Android app ecosystem, AppFlux achieves this in a completely invisible manner ie, without requiring any changes by app developers or any explicit actions by end users."
16,DNS does not suffice for MEC-CDN,11,2020,https://scholar.google.com/citations?view_op=view_citation&hl=en&user=vlV_GoEAAAAJ&pagesize=50&citation_for_view=vlV_GoEAAAAJ:_kc_bZDykSQC,"Mobile edge computing (MEC) can transform mobile networks into a new infrastructure tier for services requiring low response times, such as those providing content to emerging AR/VR, autonomous driving, and other types of applications. To be successful, the CDNs operating in this MEC infrastructure tier MEC-CDNs will need to ensure end user applications gain access to a cache server in a fast and accurate manner. This paper sheds light on the challenges that the current mobile DNS architecture poses toward achieving this goal, and presents ideas on how to re-architect the existing DNS architecture to enable CDNs to provide low-latency content delivery from the edge."
17,FleXR: A system enabling flexibly distributed extended reality,10,2023,https://scholar.google.com/citations?view_op=view_citation&hl=en&user=vlV_GoEAAAAJ&pagesize=50&citation_for_view=vlV_GoEAAAAJ:9ZlFYXVOiuMC,"Extended reality (XR) applications require computationally demanding functionalities with low end-to-end latency and high throughput. To enable XR on commodity devices, a number of distributed systems solutions enable offloading of XR workloads on remote servers. However, they make a priori decisions regarding the offloaded functionalities based on assumptions about operating factors, and their benefits are restricted to specific deployment contexts. To realize the benefits of offloading in various distributed environments, we present a distributed stream processing system, FleXR, which is specialized for real-time and interactive workloads and enables flexible distributions of XR functionalities. In building FleXR, we identified and resolved several issues of presenting XR functionalities as distributed pipelines. FleXR provides a framework for flexible distribution of XR pipelines while streamlining development …"
18,Creation and delivery of pre-rendered web pages for accelerated browsing,10,2019,https://scholar.google.com/citations?view_op=view_citation&hl=en&user=vlV_GoEAAAAJ&pagesize=50&citation_for_view=vlV_GoEAAAAJ:LkGwnXOMwfcC,"The process of rendering web pages can be significantly improved with a content delivery system that pre-renders web content for a client device. A web page “program” can be pre-executed and the result delivered to a requesting client device, rather than or before sending a traditional set of web page components, such as a markup language document, cascading style sheets, embedded objects. This pre-execution can relieve the client device of the burden of rendering the web page, saving resources and decreasing latency before the web page is ready, and can reduce the number of network requests that the client device must make before being able to display the page. Disclosed herein are methods, systems, and devices for creating and delivering pre-rendered web pages for accelerated browsing."
19,SPX: Preserving end-to-end security for edge computing,10,2018,https://scholar.google.com/citations?view_op=view_citation&hl=en&user=vlV_GoEAAAAJ&pagesize=50&citation_for_view=vlV_GoEAAAAJ:Se3iqnhoufwC,"Beyond point solutions, the vision of edge computing is to enable web services to deploy their edge functions in a multi-tenant infrastructure present at the edge of mobile networks. However, edge functions can be rendered useless because of one critical issue: Web services are delivered over end-to-end encrypted connections, so edge functions cannot operate on encrypted traffic without compromising security or degrading performance. Any solution to this problem must interoperate with existing protocols like TLS, as well as with new emerging security protocols for client and IoT devices. The edge functions must remain invisible to client-side endpoints but may require explicit control from their service-side web services. Finally, a solution must operate within overhead margins which do not obviate the benefits of the edge. To address this problem, this paper presents SPX - a solution for edge-ready and end-to-end secure protocol extensions, which can efficiently maintain end-to-edge-to-end () security semantics. Using our SPX prototype, we allow edge functions to operate on encrypted traffic, while ensuring that security semantics of secure protocols still hold. SPX uses Intel SGX to bind the communication channel with remote attestation and to provide a solution that not only defends against potential attacks but also results in low performance overheads, and neither mandates any changes on the end-user side nor breaks interoperability with existing protocols."
20,Methods and systems for providing secure mobile edge computing ecosystems,9,2021,https://scholar.google.com/citations?view_op=view_citation&hl=en&user=vlV_GoEAAAAJ&pagesize=50&citation_for_view=vlV_GoEAAAAJ:5nxA0vEk-isC,"The disclosed technology may include systems and methods that provide a secure mobile edge computing eco-system employing end-to-end encrypted communication and edge functions capable of withstanding compromised operating systems. A secure mobile edge computing eco-system may include a use, an edge, and a backend. The backend may upload functionality to the backend onto secure edge func tions (EFs). The functionality may be used to respond to user request at the edge in order to reduce bandwidth require ments and latency effects on a system. The secure edge functions (EFs) employing trusted execution environments (TEEs) to provide for secure execution and storage of functionality uploaded by the backend. The secure mobile (Continued)"
21,Krios: Scheduling abstractions and mechanisms for enabling a LEO compute cloud,8,2024,https://scholar.google.com/citations?view_op=view_citation&hl=en&user=vlV_GoEAAAAJ&pagesize=50&citation_for_view=vlV_GoEAAAAJ:L8Ckcad2t8MC,"Low Earth Orbit (LEO) satellites are an important facet of global connectivity providing high speed Internet, cellular, IoT connectivity and so on. Combined with the rich resource availability on each satellite, LEO satellites represent a new, emerging cloud frontier - the LEO Compute Cloud. However, satellite mobility introduces non-trivial challenges when orchestrating applications for a LEO compute cloud, making it harder to deploy applications without increasing the latency and bandwidth costs. In this paper, we identify the concrete challenges in using state-of-the-art terrestrial orchestrators for a LEO compute cloud. We present Krios - a LEO compute cloud orchestration system that hides the complexities introduced by satellite mobility and enables a practical LEO compute cloud. The design of Krios is centered around a novel LEO zones abstraction that allows application providers to specify where their …"
22,Poster: Enabling flexible edge-assisted xr,7,2021,https://scholar.google.com/citations?view_op=view_citation&hl=en&user=vlV_GoEAAAAJ&pagesize=50&citation_for_view=vlV_GoEAAAAJ:4TOpqqG69KYC,"Extended reality (XR) is touted as the next frontier of the digital future. XR includes all immersive technologies of augmented reality (AR), virtual reality (VR), and mixed reality (MR). XR applications obtain the real-world context of the user from an underlying system, and provide rich, immersive, and interactive virtual experiences based on the user's context in real-time. XR systems process streams of data from device sensors, and provide functionalities including perceptions and graphics required by the applications. These processing steps are computationally intensive, and the challenge is that they must be performed within the strict latency requirements of XR. This poses limitations on the possible XR experiences that can be supported on mobile devices with limited computing resources. In this XR context, edge computing is an effective approach to address this problem for mobile users. The edge is located …"
