Rank,Title,Citations,Year,URL,Description
24,Optimization on the hierarchical tucker manifold–applications to tensor completion,107,2015,https://scholar.google.com/citations?view_op=view_citation&hl=en&user=hw23CTQAAAAJ&pagesize=50&citation_for_view=hw23CTQAAAAJ:q3CdL3IzO_QC,"In this work, we develop an optimization framework for problems whose solutions are well-approximated by Hierarchical Tucker (HT) tensors, an efficient structured tensor format based on recursive subspace factorizations. By exploiting the smooth manifold structure of these tensors, we construct standard optimization algorithms such as Steepest Descent and Conjugate Gradient for completing tensors from missing entries. Our algorithmic framework is fast and scalable to large problem sizes as we do not require SVDs on the ambient tensor space, as required by other methods. Moreover, we exploit the structure of the Gramian matrices associated with the HT format to regularize our problem, reducing overfitting for high subsampling ratios. We also find that the organization of the tensor can have a major impact on completion from realistic seismic acquisition geometries. These samplings are far from idealized …"
25,The importance of transfer learning in seismic modeling and imaging,106,2019,https://scholar.google.com/citations?view_op=view_citation&hl=en&user=hw23CTQAAAAJ&pagesize=50&citation_for_view=hw23CTQAAAAJ:UoSa6IK8DwsC,"Accurate forward modeling is essential for solving inverse problems in exploration seismology. Unfortunately, it is often not possible to afford being physically or numerically accurate. To overcome this conundrum, we make use of raw and processed data from nearby surveys. We have used these data, consisting of shot records or velocity models, to pretrain a neural network to correct for the effects of, for instance, the free surface or numerical dispersion, both of which can be considered as proxies for incomplete or inaccurate physics. Given this pretrained neural network, we apply transfer learning to fine-tune this pretrained neural network so it performs well on its task of mapping low-cost, but low-fidelity, solutions to high-fidelity solutions for the current survey. As long as we can limit ourselves during fine-tuning to using only a small fraction of high-fidelity data, we gain processing the current survey while using …"
26,"Fast methods for denoising matrix completion formulations, with applications to robust seismic data interpolation",100,2014,https://scholar.google.com/citations?view_op=view_citation&hl=en&user=hw23CTQAAAAJ&pagesize=50&citation_for_view=hw23CTQAAAAJ:69viAa4lnfgC,"Recent SVD-free matrix factorization formulations have enabled rank minimization for systems with millions of rows and columns, paving the way for matrix completion in extremely large-scale applications, such as seismic data interpolation. In this paper, we consider matrix completion formulations designed to hit a target data-fitting error level provided by the user, and we propose an algorithm called LR-BPDN that is able to exploit factorized formulations to solve the corresponding optimization problem. Since practitioners typically have strong prior knowledge about target error level, this innovation makes it easy to apply the algorithm in practice, leaving only the factor rank to be determined. Within the established framework, we propose two extensions that are highly relevant to solving practical challenges of data interpolation. First, we propose a weighted extension that allows known subspace information to …"
27,Compressed wavefield extrapolation,100,2007,https://scholar.google.com/citations?view_op=view_citation&hl=en&user=hw23CTQAAAAJ&pagesize=50&citation_for_view=hw23CTQAAAAJ:UeHWp8X0CEIC,"An explicit algorithm for the extrapolation of one-way wavefields is proposed that combines recent developments in information theory and theoretical signal processing with the physics of wave propagation. Because of excessive memory requirements, explicit formulations for wave propagation have proven to be a challenge in 3D. By using ideas from compressed sensing, we are able to formulate the (inverse) wavefield extrapolation problem on small subsets of the data volume, thereby reducing the size of the operators. Compressed sensing entails a new paradigm for signal recovery that provides conditions under which signals can be recovered from incomplete samplings by nonlinear recovery methods that promote sparsity of the to-be-recovered signal. According to this theory, signals can be successfully recovered when the measurement basis is incoherent with the representation in which the wavefield …"
28,Robust estimation of primaries by sparse inversion via one-norm minimization,97,2013,https://scholar.google.com/citations?view_op=view_citation&hl=en&user=hw23CTQAAAAJ&pagesize=50&citation_for_view=hw23CTQAAAAJ:EYYDruWGBe4C,"A recently proposed method called estimation of primaries by sparse inversion (EPSI) avoids the need for adaptive subtraction of approximate multiple predictions by directly inverting for the multiple-free subsurface impulse response as a collection of band-limited spikes. Although it can be shown that the correct primary impulse response is obtained through the sparsest possible solution, the original EPSI algorithm was not designed to take advantage of this result, and instead it relies on a multitude of inversion parameters, such as the level of sparsity per gradient update. We proposed and tested a new algorithm, named robust EPSI, in which we make obtaining the sparsest solution an explicit goal. Our approach remains a gradient-based approach like the original algorithm, but it is derived from a new biconvex optimization framework based on an extended basis-pursuit denoising formulation. Furthermore …"
29,Sparco: A testing framework for sparse reconstruction,91,2007,https://scholar.google.com/citations?view_op=view_citation&hl=en&user=hw23CTQAAAAJ&pagesize=50&citation_for_view=hw23CTQAAAAJ:YsMSGLbcyi4C,"Sparco is a framework for testing and benchmarking algorithms for sparse reconstruction. It includes a large collection of sparse reconstruction problems drawn from the imaging, compressed sensing, and geophysics literature. Sparco is also a framework for implementing new test problems and can be used as a tool for reproducible research. Sparco is implemented entirely in Matlab, and is released as open-source software under the GNU Public License."
30,Fast imaging with surface-related multiples by sparse inversion,90,2015,https://scholar.google.com/citations?view_op=view_citation&hl=en&user=hw23CTQAAAAJ&pagesize=50&citation_for_view=hw23CTQAAAAJ:dQJM2trw0wsC,"In marine exploration seismology, surface-related multiples are usually treated as noise mainly because subsequent processing steps, such as migration velocity analysis and imaging, require multiple-free data. Failure to remove these wavefield components from the data may lead to erroneous estimates for migration velocity or result in strong coherent artefacts that interfere with the imaged reflectors. However, multiples can carry complementary information compared to primaries, as they interact with the free surface and are therefore exposed more to the subsurface. Recent work has shown that when processed correctly multiples can improve seismic illumination. Given a sufficiently accurate background velocity model and an estimate for the source signature, we propose a new and computationally efficient linearized inversion procedure based on two-way wave equations, which produces accurate images …"
31,Seismic waveform inversion by stochastic optimization,85,2011,https://scholar.google.com/citations?view_op=view_citation&hl=en&user=hw23CTQAAAAJ&pagesize=50&citation_for_view=hw23CTQAAAAJ:r0BpntZqJG4C,"We explore the use of stochastic optimization methods for seismic waveform inversion. The basic principle of such methods is to randomly draw a batch of realizations of a given misfit function and goes back to the 1950s. The ultimate goal of such an approach is to dramatically reduce the computational cost involved in evaluating the misfit. Following earlier work, we introduce the stochasticity in waveform inversion problem in a rigorous way via a technique called randomized trace estimation. We then review theoretical results that underlie recent developments in the use of stochastic methods for waveform inversion. We present numerical experiments to illustrate the behavior of different types of stochastic optimization methods and investigate the sensitivity to the batch size and the noise level in the data. We find that it is possible to reproduce results that are qualitatively similar to the solution of the full problem …"
32,New insights into one-norm solvers from the Pareto curve,85,2008,https://scholar.google.com/citations?view_op=view_citation&hl=en&user=hw23CTQAAAAJ&pagesize=50&citation_for_view=hw23CTQAAAAJ:_FxGoFyzp5QC,"Geophysical inverse problems typically involve a trade-off between data misfit and some prior model. Pareto curves trace the optimal trade-off between these two competing aims. These curves are used commonly in problems with two-norm priors in which they are plotted on a log-log scale and are known as L-curves. For other priors, such as the sparsity-promoting one-norm prior, Pareto curves remain relatively unexplored. We show how these curves lead to new insights into one-norm regularization. First, we confirm theoretical properties of smoothness and convexity of these curves from a stylized and a geophysical example. Second, we exploit these crucial properties to approximate the Pareto curve for a large-scale problem. Third, we show how Pareto curves provide an objective criterion to gauge how different one-norm solvers advance toward the solution."
33,Seismic data reconstruction with generative adversarial networks,84,2018,https://scholar.google.com/citations?view_op=view_citation&hl=en&user=hw23CTQAAAAJ&pagesize=50&citation_for_view=hw23CTQAAAAJ:jW3pDOCzWhQC,"A main challenge in seismic imaging is acquiring densely sampled data. Compressed Sensing has provided theoretical foundations upon which desired sampling rate can be achieved by applying a sparsity promoting algorithm on sub-sampled data. The key point in successful recovery is to deploy a randomized sampling scheme. In this paper, we propose a novel deep learning-based method for fast and accurate reconstruction of heavily under-sampled seismic data, regardless of type of sampling. A neural network learns to do reconstruction directly from data via an adversarial process. Once trained, the reconstruction can be done by just feeding the frequency slice with missing data into the neural network. This adaptive nonlinear model makes the algorithm extremely flexible, applicable to data with arbitrarily type of sampling. With the assumption that we have access to training data, the quality of reconstructed …"
34,Application of randomized sampling schemes to curvelet‐based sparsity‐promoting seismic data recovery,84,2013,https://scholar.google.com/citations?view_op=view_citation&hl=en&user=hw23CTQAAAAJ&pagesize=50&citation_for_view=hw23CTQAAAAJ:ILKRHgRFtOwC,"Reconstruction of seismic data is routinely used to improve the quality and resolution of seismic data from incomplete acquired seismic recordings. Curvelet‐based Recovery by Sparsity‐promoting Inversion, adapted from the recently‐developed theory of compressive sensing, is one such kind of reconstruction, especially good for recovery of undersampled seismic data. Like traditional Fourier‐based methods, it performs best when used in conjunction with randomized subsampling, which converts aliases from the usual regular periodic subsampling into easy‐to‐eliminate noise. By virtue of its ability to control gap size, along with the random and irregular nature of its sampling pattern, jittered (sub)sampling is one proven method that has been used successfully for the determination of geophone positions along a seismic line. In this paper, we extend jittered sampling to two‐dimensional acquisition design, a more …"
35,A new optimization approach for source-encoding full-waveform inversion,82,2013,https://scholar.google.com/citations?view_op=view_citation&hl=en&user=hw23CTQAAAAJ&pagesize=50&citation_for_view=hw23CTQAAAAJ:vbGhcppDl1QC,"Waveform inversion is the method of choice for determining a highly heterogeneous subsurface structure. However, conventional waveform inversion requires that the wavefield for each source is computed separately. This makes it very expensive for realistic 3D seismic surveys. Source-encoding waveform inversion, in which the sources are modeled simultaneously, is considerably faster than conventional waveform inversion but suffers from artifacts. These artifacts can partly be removed by assigning random weights to the source wavefields. We found that the misfit function, and therefore also its gradient, for source-encoding waveform inversion is an unbiased random estimation of the misfit function used in conventional waveform inversion. We found a new method of source-encoding waveform inversion that takes into account the random nature of the gradients used in the optimization. In this new method …"
36,Randomized full-waveform inversion: a dimenstionality-reduction approach,82,2010,https://scholar.google.com/citations?view_op=view_citation&hl=en&user=hw23CTQAAAAJ&pagesize=50&citation_for_view=hw23CTQAAAAJ:hFOr9nPyWt4C,"SUMMARY Full-waveform inversion relies on the collection of large multiexperiment data volumes in combination with a sophisticated back-end to create high-fidelity inversion results. While improvements in acquisition and inversion have been extremely successful, the current trend of incessantly pushing for higher quality models in increasingly complicated regions of the Earth reveals fundamental shortcomings in our ability to handle increasing problem sizes numerically. Two main culprits can be identified. First, there is the so-called “curse of dimensionality” exemplified by Nyquist’s sampling criterion, which puts disproportionate strain on current acquisition and processing systems as the size and desired resolution increases. INTRODUCTION With the recent resurgence of full-waveform inversion (FWI), the costs of computing gradient and Newton updates have–aside from …"
37,Designing simultaneous acquisitions with compressive sensing,81,2009,https://scholar.google.com/citations?view_op=view_citation&hl=en&user=hw23CTQAAAAJ&pagesize=50&citation_for_view=hw23CTQAAAAJ:oNZyr7d5Mn4C,The goal of this paper is in designing a functional simultaneous acquisition scheme by applying the principles of compressive sensing. By framing the acquisition in a compressive sensing setting we immediately gain insight into not only how to choose the
38,Constrained waveform inversion for automatic salt flooding,80,2016,https://scholar.google.com/citations?view_op=view_citation&hl=en&user=hw23CTQAAAAJ&pagesize=50&citation_for_view=hw23CTQAAAAJ:07QC26MHY14C,"Given appropriate data acquisition, processing to remove nonprimary arrivals, and use of an accurate migration algorithm, it is the quality of the subsurface velocity model that typically controls the quality of imaging that can be obtained from salt-affected seismic data. Full-waveform inversion has the potential to improve the accuracy, resolution, repeatability, and speed with which such velocity models can be generated, but, in the absence of an accurate starting model, that potential is difficult to realize in practice. Presented are successful inversion results, obtained from synthetic subsalt models, using a robust full-waveform inversion code that includes constraints upon the set of allowable earth models. These constraints include limitations on the total variation of the velocity of the model and, most significantly, on the asymmetric variation of velocity with depth such that negative velocity excursions are limited. During …"
39,"Devito (v3. 1.0): An embedded domain-specific language for finite differences and geophysical exploration: Geoscientific Model Development, 12, 1165–1187, doi: 10.5194",79,2019,https://scholar.google.com/citations?view_op=view_citation&hl=en&user=hw23CTQAAAAJ&pagesize=50&citation_for_view=hw23CTQAAAAJ:qVBRRHSSJ04C,Description not available
40,A large-scale framework for symbolic implementations of seismic inversion algorithms in Julia,78,2019,https://scholar.google.com/citations?view_op=view_citation&hl=en&user=hw23CTQAAAAJ&pagesize=50&citation_for_view=hw23CTQAAAAJ:FSHXWovK7t4C,"Writing software packages for seismic inversion is a very challenging task because problems such as full-waveform inversion or least-squares imaging are algorithmically and computationally demanding due to the large number of unknown parameters and the fact that waves are propagated over many wavelengths. Therefore, software frameworks need to combine versatility and performance to provide geophysicists with the means and flexibility to implement complex algorithms that scale to exceedingly large 3D problems. Following these principles, we have developed the Julia Devito Inversion framework, an open-source software package in Julia for large-scale seismic modeling and inversion based on Devito, a domain-specific language compiler for automatic code generation. The framework consists of matrix-free linear operators for implementing seismic inversion algorithms that closely resemble the …"
41,Randomized marine acquisition with compressive sampling matrices,78,2012,https://scholar.google.com/citations?view_op=view_citation&hl=en&user=hw23CTQAAAAJ&pagesize=50&citation_for_view=hw23CTQAAAAJ:tKAzc9rXhukC,"Seismic data acquisition in marine environments is a costly process that calls for the adoption of simultaneous‐source or randomized acquisition ‐ an emerging technology that is stimulating both geophysical research and commercial efforts. Simultaneous marine acquisition calls for the development of a new set of design principles and post‐processing tools. In this paper, we discuss the properties of a specific class of randomized simultaneous acquisition matrices and demonstrate that sparsity‐promoting recovery improves the quality of reconstructed seismic data volumes. We propose a practical randomized marine acquisition scheme where the sequential sources fire airguns at only randomly time‐dithered instances. We demonstrate that the recovery using sparse approximation from random time‐dithering with a single source approaches the recovery from simultaneous‐source acquisition with multiple …"
42,Source separation for simultaneous towed-streamer marine acquisition—A compressed sensing approach,76,2015,https://scholar.google.com/citations?view_op=view_citation&hl=en&user=hw23CTQAAAAJ&pagesize=50&citation_for_view=hw23CTQAAAAJ:H2XcuePHLsAC,"Simultaneous marine acquisition is an economic way to sample seismic data and speed up acquisition, wherein single or multiple source vessels fire sources at near-simultaneous or slightly random times, resulting in overlapping shot records. The current paradigm for simultaneous towed-streamer marine acquisition incorporates “low variability” in source firing times, i.e., or 2 s because the sources and receivers are moving. This results in a low degree of randomness in simultaneous data, which is challenging to separate (into its constituent sources) using compressed-sensing-based separation techniques because randomization is key to successful recovery via compressed sensing. We have addressed the challenge of source separation for simultaneous towed-streamer acquisitions via two compressed-sensing-based approaches, i.e., sparsity promotion and rank minimization. We have evaluated the …"
43,Curvelet-based ground roll removal,75,2006,https://scholar.google.com/citations?view_op=view_citation&hl=en&user=hw23CTQAAAAJ&pagesize=50&citation_for_view=hw23CTQAAAAJ:IWHjjKOFINEC,"ABSTRACT We have effectively identified and removed ground roll through a two-step process. The first step is to identify the major components of the ground roll through various methods including multiscale separation, directional or frequency filtering or by any other method that identifies the ground roll. Given this estimate for ground roll, the recorded signal is separated during the second step through a block-coordinate relaxation method that seeks the sparsest set for weighted curvelet coefficients of the ground roll and the sought-after reflectivity. The combination of these two methods allows us to separate out the ground roll signal while preserving the reflector information. Since our method is iterative, we have control of the separation process. We successfully tested our algorithm on a real data set with a complex ground roll and reflector structure."
44,Surface-related multiple elimination with deep learning,72,2019,https://scholar.google.com/citations?view_op=view_citation&hl=en&user=hw23CTQAAAAJ&pagesize=50&citation_for_view=hw23CTQAAAAJ:ZuSUVyMx-TgC,"ABSTRACT We explore the potential of neural networks in approximating the action of the computationally expensive Estimation of Primaries by Sparse Inversion (EPSI) algorithm, applied to real data, via a supervised learning algorithm. We show that given suitable training data, consisting of a relatively cheap prediction of multiples and pairs of shot records with and without surface-related multiples, obtained via EPSI, a well-trained neural network is capable of providing an approximation to the action of the EPSI algorithm. We perform our numerical experiment on the field Nelson data set. Our results demonstrate that the quality of the multiple elimination via our neural network improves compared to the case where we only feed the network with shot records with surface-related multiples. We take these benefits by supplying the neural network with a relatively poor prediction of the multiples, e.g …"
45,Curvelet-domain multiple elimination with sparseness constraints,72,2004,https://scholar.google.com/citations?view_op=view_citation&hl=en&user=hw23CTQAAAAJ&pagesize=50&citation_for_view=hw23CTQAAAAJ:MXK_kJrjxJIC,"ABSTRACT Predictive multiple suppression methods consist of two main steps: a prediction step, in which multiples are predicted from the seismic data, and a subtraction step, in which the predicted multiples are matched with the true multiples in the data. The last step appears crucial in practice: an incorrect adaptive subtraction method will cause multiples to be sub-optimally subtracted or primaries being distorted, or both. Therefore, we propose a new domain for separation of primaries and multiples via the Curvelet transform. This transform maps the data into almost orthogonal localized events with a directional and spatial-temporal component. The multiples are suppressed by thresholding the input data at those Curvelet components where the predicted multiples have large amplitudes. In this way the more traditional filtering of predicted multiples to fit the input data is avoided. An initial field data …"
46,Constraints versus penalties for edge-preserving full-waveform inversion,64,2017,https://scholar.google.com/citations?view_op=view_citation&hl=en&user=hw23CTQAAAAJ&pagesize=50&citation_for_view=hw23CTQAAAAJ:oFKsPyNwwpYC,"Full-waveform inversion is challenging in complex geologic areas. Even when provided with an accurate starting model, the inversion algorithms often struggle to update the velocity model. Compared with other areas in applied geophysics, including prior information in full-waveform inversion is still in its relative infancy. In part, this is due to the fact that it is difficult to incorporate prior information that relates to geologic settings where strong discontinuities in the velocity model dominate, because these settings call for nonsmooth regularizations. We tackle this problem by including constraints on the spatial variations and value ranges of the inverted velocities, as opposed to adding penalties to the objective, which is more customary in mainstream geophysical inversion. By demonstrating the lack of predictability of edge-preserving inversion when the regularization is in the form of an added penalty term, we advocate …"
47,Curvelet-based migration preconditioning and scaling,64,2009,https://scholar.google.com/citations?view_op=view_citation&hl=en&user=hw23CTQAAAAJ&pagesize=50&citation_for_view=hw23CTQAAAAJ:Wp0gIr-vW9MC,"The extremely large size of typical seismic imaging problems has been a major stumbling block for iterative techniques to attain accurate migration amplitudes. These iterative methods are important because they complement theoretical approaches hampered by difficulties controlling problems such as finite-acquisition aperture, source-receiver frequency response, and directivity. To solve these problems, we apply preconditioning, which significantly improves convergence of least-squares migration. We discuss different levels of preconditioning: corrections for the order of the migration operator, corrections for spherical spreading, and position- and reflector-dip-dependent amplitude errors. Although the first two corrections correspond to simple scalings in the Fourier and physical domain, the third correction requires phase-space (space spanned by location and dip) scaling, which we carry out with curvelets. Our …"
