Rank,Title,Citations,Year,URL,Description
1,Non-parametric seismic data recovery with curvelet frames,781,2008,https://scholar.google.com/citations?view_op=view_citation&hl=en&user=hw23CTQAAAAJ&pagesize=50&citation_for_view=hw23CTQAAAAJ:u5HHmVD_uO8C,"Seismic data recovery from data with missing traces on otherwise regular acquisition grids forms a crucial step in the seismic processing flow. For instance, unsuccessful recovery leads to imaging artefacts and to erroneous predictions for the multiples, adversely affecting the performance of multiple elimination. A non-parametric transform-based recovery method is presented that exploits the compression of seismic data volumes by recently developed curvelet frames. The elements of this transform are multidimensional and directional and locally resemble wave fronts present in the data, which leads to a compressible representation for seismic data. This compression enables us to formulate a new curvelet-based seismic data recovery algorithm through sparsity-promoting inversion. The concept of sparsity-promoting inversion is in itself not new to geophysics. However, the recent insights from the field of …"
2,Simply denoise: Wavefield reconstruction via jittered undersampling,460,2008,https://scholar.google.com/citations?view_op=view_citation&hl=en&user=hw23CTQAAAAJ&pagesize=50&citation_for_view=hw23CTQAAAAJ:9yKSN-GCB0IC,"We present a new, discrete undersampling scheme designed to favor wavefield reconstruction by sparsity-promoting inversion with transform elements localized in the Fourier domain. The work is motivated by empirical observations in the seismic community, corroborated by results from compressive sampling, that indicate favorable (wavefield) reconstructions from random rather than regular undersampling. Indeed, random undersampling renders coherent aliases into harmless incoherent random noise, effectively turning the interpolation problem into a much simpler denoising problem. A practical requirement of wavefield reconstruction with localized sparsifying transforms is the control on the maximum gap size. Unfortunately, random undersampling does not provide such a control. Thus, we introduce a sampling scheme, termed jittered undersampling, that shares the benefits of random sampling and …"
3,Mitigating local minima in full-waveform inversion by expanding the search space,439,2013,https://scholar.google.com/citations?view_op=view_citation&hl=en&user=hw23CTQAAAAJ&pagesize=50&citation_for_view=hw23CTQAAAAJ:i2xiXl-TujoC,"Wave equation based inversions, such as full-waveform inversion and reverse-time migration, are challenging because of their computational costs, memory requirements and reliance on accurate initial models. To confront these issues, we propose a novel formulation of wave equation based inversion based on a penalty method. In this formulation, the objective function consists of a data-misfit term and a penalty term, which measures how accurately the wavefields satisfy the wave equation. This new approach is a major departure from current formulations where forward and adjoint wavefields, which both satisfy the wave equation, are correlated to compute updates for the unknown model parameters. Instead, we carry out the inversions over two alternating steps during which we first estimate the wavefield everywhere, given the current model parameters, source and observed data, followed by a second …"
4,Seismic denoising with nonuniformly sampled curvelets,344,2006,https://scholar.google.com/citations?view_op=view_citation&hl=en&user=hw23CTQAAAAJ&pagesize=50&citation_for_view=hw23CTQAAAAJ:d1gkVwhDpl0C,The authors present an extension of the fast discrete curvelet transform (FDCT) to nonuniformly sampled data. This extension not only restores curvelet compression rates for nonuniformly sampled data but also removes noise and maps the data to a regular grid
5,Curvelet-based seismic data processing: A multiscale and nonlinear approach,301,2008,https://scholar.google.com/citations?view_op=view_citation&hl=en&user=hw23CTQAAAAJ&pagesize=50&citation_for_view=hw23CTQAAAAJ:IjCSPb-OGe4C,"Mitigating missing data, multiples, and erroneous migration amplitudes are key factors that determine image quality. Curvelets, little “plane waves,” complete with oscillations in one direction and smoothness in the other directions, sparsify a property we leverage explicitly with sparsity promotion. With this principle, we recover seismic data with high fidelity from a small subset (20%) of randomly selected traces. Similarly, sparsity leads to a natural decorrelation and hence to a robust curvelet-domain primary-multiple separation for North Sea data. Finally, sparsity helps to recover migration amplitudes from noisy data. With these examples, we show that exploiting the curvelet's ability to sparsify wavefrontlike features is powerful, and our results are a clear indication of the broad applicability of this transform to exploration seismology."
6,Devito (v3. 1.0): an embedded domain-specific language for finite differences and geophysical exploration,254,2019,https://scholar.google.com/citations?view_op=view_citation&hl=en&user=hw23CTQAAAAJ&pagesize=50&citation_for_view=hw23CTQAAAAJ:2PyGcyYA7d0C,"We introduce Devito, a new domain-specific language for implementing high-performance finite-difference partial differential equation solvers. The motivating application is exploration seismology for which methods such as full-waveform inversion and reverse-time migration are used to invert terabytes of seismic data to create images of the Earth's subsurface. Even using modern supercomputers, it can take weeks to process a single seismic survey and create a useful subsurface image. The computational cost is dominated by the numerical solution of wave equations and their corresponding adjoints. Therefore, a great deal of effort is invested in aggressively optimizing the performance of these wave-equation propagators for different computer architectures. Additionally, the actual set of partial differential equations being solved and their numerical discretization is under constant innovation as increasingly realistic representations of the physics are developed, further ratcheting up the cost of practical solvers. By embedding a domain-specific language within Python and making heavy use of SymPy, a symbolic mathematics library, we make it possible to develop finite-difference simulators quickly using a syntax that strongly resembles the mathematics. The Devito compiler reads this code and applies a wide range of analysis to generate highly optimized and parallel code. This approach can reduce the development time of a verified and optimized solver from months to days."
7,Randomized sampling and sparsity: Getting more information from fewer samples,253,2010,https://scholar.google.com/citations?view_op=view_citation&hl=en&user=hw23CTQAAAAJ&pagesize=50&citation_for_view=hw23CTQAAAAJ:R3hNpaxXUhUC,"Many seismic exploration techniques rely on the collection of massive data volumes that are subsequently mined for information during processing. Although this approach has been extremely successful in the past, current efforts toward higher-resolution images in increasingly complicated regions of the earth continue to reveal fundamental shortcomings in our workflows. Chiefly among these is the so-called “curse of dimensionality” exemplified by Nyquist's sampling criterion, which disproportionately strains current acquisition and processing systems as the size and desired resolution of our survey areas continue to increase. We offer an alternative sampling method leveraging recent insights from compressive sensing toward seismic acquisition and processing for data that are traditionally considered to be undersampled. The main outcome of this approach is a new technology where acquisition and …"
8,A penalty method for PDE-constrained optimization in inverse problems,243,2016,https://scholar.google.com/citations?view_op=view_citation&hl=en&user=hw23CTQAAAAJ&pagesize=50&citation_for_view=hw23CTQAAAAJ:WYleWgRJor0C,"Many inverse and parameter estimation problems can be written as PDE-constrained optimization problems. The goal is to infer the parameters, typically coefficients of the PDE, from partial measurements of the solutions of the PDE for several right-hand sides. Such PDE-constrained problems can be solved by finding a stationary point of the Lagrangian, which entails simultaneously updating the parameters and the (adjoint) state variables. For large-scale problems, such an all-at-once approach is not feasible as it requires storing all the state variables. In this case one usually resorts to a reduced approach where the constraints are explicitly eliminated (at each iteration) by solving the PDEs. These two approaches, and variations thereof, are the main workhorses for solving PDE-constrained optimization problems arising from inverse problems. In this paper, we present an alternative method that aims to combine …"
9,"Architecture and performance of Devito, a system for automated stencil computation",214,2020,https://scholar.google.com/citations?view_op=view_citation&hl=en&user=hw23CTQAAAAJ&pagesize=50&citation_for_view=hw23CTQAAAAJ:C4Vd9JCM9EcC,"Stencil computations are a key part of many high-performance computing applications, such as image processing, convolutional neural networks, and finite-difference solvers for partial differential equations. Devito is a framework capable of generating highly optimized code given symbolic equations expressed in Python, specialized in, but not limited to, affine (stencil) codes. The lowering process—from mathematical equations down to C++ code—is performed by the Devito compiler through a series of intermediate representations. Several performance optimizations are introduced, including advanced common sub-expressions elimination, tiling, and parallelization. Some of these are obtained through well-established stencil optimizers, integrated in the backend of the Devito compiler. The architecture of the Devito compiler, as well as the performance optimizations that are applied when generating code, are …"
10,Total variation regularization strategies in full-waveform inversion,191,2018,https://scholar.google.com/citations?view_op=view_citation&hl=en&user=hw23CTQAAAAJ&pagesize=50&citation_for_view=hw23CTQAAAAJ:_bh1rdP-zDcC,"We propose an extended full-waveform inversion formulation that includes general convex constraints on the model. Though the full problem is highly nonconvex, the overarching optimization scheme arrives at geologically plausible results by solving a sequence of relaxed and warm-started constrained convex subproblems. The combination of box, total variation, and successively relaxed asymmetric total variation constraints allows us to steer free from parasitic local minima while keeping the estimated physical parameters laterally continuous and in a physically realistic range. For accurate starting models, numerical experiments carried out on the challenging 2004 BP velocity benchmark demonstrate that bound and total variation constraints improve the inversion result significantly by removing inversion artifacts, related to source encoding, and by clearly improved delineation of top, bottom, and flanks of a high …"
11,An effective method for parameter estimation with PDE constraints with multiple right-hand sides,189,2012,https://scholar.google.com/citations?view_op=view_citation&hl=en&user=hw23CTQAAAAJ&pagesize=50&citation_for_view=hw23CTQAAAAJ:kNdYIx-mwKoC,"Often, parameter estimation problems of parameter-dependent PDEs involve multiple right-hand sides. The computational cost and memory requirements of such problems increase linearly with the number of right-hand sides. For many applications this is the main bottleneck of the computation. In this paper we show that problems with multiple right-hand sides can be reformulated as stochastic programming problems by combining the right-hand sides into a few „simultaneous” sources. This effectively reduces the cost of the forward problem and results in problems that are much cheaper to solve. We discuss two solution methodologies: namely sample average approximation and stochastic approximation. To illustrate the effectiveness of our approach we present two model problems, direct current resistivity and seismic tomography."
12,Nonequispaced curvelet transform for seismic data reconstruction: A sparsity-promoting approach,188,2010,https://scholar.google.com/citations?view_op=view_citation&hl=en&user=hw23CTQAAAAJ&pagesize=50&citation_for_view=hw23CTQAAAAJ:hMod-77fHWUC,"We extend our earlier work on the nonequispaced fast discrete curvelet transform (NFDCT) and introduce a second generation of the transform. This new generation differs from the previous one by the approach taken to compute accurate curvelet coefficients from irregularly sampled data. The first generation relies on accurate Fourier coefficients obtained by an -regularized inversion of the nonequispaced fast Fourier transform (FFT) whereas the second is based on a direct -regularized inversion of the operator that links curvelet coefficients to irregular data. Also, by construction the second generation NFDCT is lossless unlike the first generation NFDCT. This property is particularly attractive for processing irregularly sampled seismic data in the curvelet domain and bringing them back to their irregular recording locations with high fidelity. Secondly, we combine the second generation NFDCT with the …"
13,Sparsity-and continuity-promoting seismic image recovery with curvelet frames,164,2008,https://scholar.google.com/citations?view_op=view_citation&hl=en&user=hw23CTQAAAAJ&pagesize=50&citation_for_view=hw23CTQAAAAJ:2osOgNQ5qMEC,"A nonlinear singularity-preserving solution to seismic image recovery with sparseness and continuity constraints is proposed. We observe that curvelets, as a directional frame expansion, lead to sparsity of seismic images and exhibit invariance under the normal operator of the linearized imaging problem. Based on this observation we derive a method for stable recovery of the migration amplitudes from noisy data. The method corrects the amplitudes during a post-processing step after migration, such that the main additional cost is one application of the normal operator, i.e., a modeling followed by a migration. Asymptotically this normal operator corresponds to a pseudodifferential operator, for which a convenient diagonal approximation in the curvelet domain is derived, including a bound for its error and a method for the estimation of the diagonal from a compound operator consisting of discrete implementations …"
14,Non-linear primary-multiple separation with directional curvelet frames,161,2007,https://scholar.google.com/citations?view_op=view_citation&hl=en&user=hw23CTQAAAAJ&pagesize=50&citation_for_view=hw23CTQAAAAJ:qjMakFHDy7sC,"Predictive multiple suppression methods consist of two main steps: a prediction step, during which multiples are predicted from seismic data, and a primary-multiple separation step, during which the predicted multiples are ‘matched’ with the true multiples in the data and subsequently removed. This second separation step, which we will call the estimation step, is crucial in practice: an incorrect separation will cause residual multiple energy in the result or may lead to a distortion of the primaries, or both. To reduce these adverse effects, a new transformed-domain method is proposed where primaries and multiples are separated rather than matched. This separation is carried out on the basis of differences in the multiscale and multidirectional characteristics of these two signal components. Our method uses the curvelet transform, which maps multidimensional data volumes into almost orthogonal localized …"
15,Efficient least‐squares imaging with sparsity promotion and compressive sensing,154,2012,https://scholar.google.com/citations?view_op=view_citation&hl=en&user=hw23CTQAAAAJ&pagesize=50&citation_for_view=hw23CTQAAAAJ:VL0QpB8kHFEC,"Seismic imaging is a linearized inversion problem relying on the minimization of a least‐squares misfit functional as a function of the medium perturbation. The success of this procedure hinges on our ability to handle large systems of equations – whose size grows exponentially with the demand for higher resolution images in more and more complicated areas – and our ability to invert these systems given a limited amount of computational resources. To overcome this ‘curse of dimensionality’ in problem size and computational complexity, we propose a combination of randomized dimensionality‐reduction and divide‐and‐conquer techniques. This approach allows us to take advantage of sophisticated sparsity‐promoting solvers that work on a series of smaller subproblems each involving a small randomized subset of data. These subsets correspond to artificial simultaneous‐source experiments made of random …"
16,Fighting the curse of dimensionality: Compressive sensing in exploration seismology,154,2012,https://scholar.google.com/citations?view_op=view_citation&hl=en&user=hw23CTQAAAAJ&pagesize=50&citation_for_view=hw23CTQAAAAJ:bEWYMUwI8FkC,"Many seismic exploration techniques rely on the collection of massive data volumes that are mined for information during processing. This approach has been extremely successful, but current efforts toward higher resolution images in increasingly complicated regions of Earth continue to reveal fundamental shortcomings in our typical workflows. The “curse” of dimensionality is the main roadblock and is exemplified by Nyquist's sampling criterion, which disproportionately strains current acquisition and processing systems as the size and desired resolution of our survey areas continues to increase."
17,Fast waveform inversion without source‐encoding,137,2013,https://scholar.google.com/citations?view_op=view_citation&hl=en&user=hw23CTQAAAAJ&pagesize=50&citation_for_view=hw23CTQAAAAJ:evX43VCCuoAC,"Randomized source‐encoding has recently been proposed as a way to dramatically reduce the costs of full waveform inversion. The main idea is to replace all sequential sources by a small number of simultaneous sources. This introduces random cross‐talk in model updates and special stochastic optimization strategies are required to deal with this. Two problems arise with this approach: i) source‐encoding can only be applied to fixed‐spread acquisition setups and ii) stochastic optimization methods tend to converge very slowly, relying on averaging to suppress the cross‐talk. Although the slow convergence is partly off‐set by a low iteration cost, we show that conventional optimization strategies are bound to outperform stochastic methods in the long run. In this paper we argue that we do not need randomized source‐encoding to reap the benefits of stochastic optimization and we review an optimization …"
18,Compressive simultaneous full-waveform simulation,130,2009,https://scholar.google.com/citations?view_op=view_citation&hl=en&user=hw23CTQAAAAJ&pagesize=50&citation_for_view=hw23CTQAAAAJ:Tyk-4Ss8FVUC,"The fact that the computational complexity of wavefield simulation is proportional to the size of the discretized model and acquisition geometry and not to the complexity of the simulated wavefield is a major impediment within seismic imaging. By turning simulation into a compressive sensing problem, where simulated data are recovered from a relatively small number of independent simultaneous sources, we remove this impediment by showing that compressively sampling a simulation is equivalent to compressively sampling the sources, followed by solving a reduced system. As in compressive sensing, this reduces sampling rate and hence simulation costs. We demonstrate this principle for the time-harmonic Helmholtz solver. The solution is computed by inverting the reduced system, followed by recovering the full wavefield with a program that promotes sparsity. Depending on the wavefield's sparsity, this …"
19,Fast randomized full-waveform inversion with compressive sensing,127,2012,https://scholar.google.com/citations?view_op=view_citation&hl=en&user=hw23CTQAAAAJ&pagesize=50&citation_for_view=hw23CTQAAAAJ:1yQoGdGgb4wC,"Wave-equation-based seismic inversion can be formulated as a nonlinear least-squares problem. The demand for higher-resolution models in more geologically complex areas drives the need to develop techniques that exploit the special structure of full-waveform inversion to reduce the computational burden and to regularize the inverse problem. We meet these goals by using ideas from compressive sensing and stochastic optimization to design a novel Gauss-Newton method, where the updates are computed from random subsets of the data via curvelet-domain sparsity promotion. Two different subset sampling strategies are considered: randomized source encoding, and drawing sequential shots firing at random source locations from marine data with missing near and far offsets. In both cases, we obtain excellent inversion results compared to conventional methods at reduced computational costs."
20,Efficient matrix completion for seismic data reconstruction,121,2015,https://scholar.google.com/citations?view_op=view_citation&hl=en&user=hw23CTQAAAAJ&pagesize=50&citation_for_view=hw23CTQAAAAJ:ysWPWRY3VgcC,"Despite recent developments in improved acquisition, seismic data often remain undersampled along source and receiver coordinates, resulting in incomplete data for key applications such as migration and multiple prediction. We have interpreted the missing-trace interpolation problem in the context of matrix completion (MC), and developed three practical principles for using low-rank optimization techniques to recover seismic data. Specifically, we strive for recovery scenarios wherein the original signal is low rank and the subsampling scheme increases the singular values of the matrix. We use an optimization program that restores this low-rank structure to recover the full volume. Omitting one or more of these principles can lead to poor interpolation results, as we found experimentally. In light of this theory, we compensate for the high-rank behavior of data in the source-receiver domain by using the …"
21,Adaptive curvelet-domain primary-multiple separation,121,2008,https://scholar.google.com/citations?view_op=view_citation&hl=en&user=hw23CTQAAAAJ&pagesize=50&citation_for_view=hw23CTQAAAAJ:W7OEmFMy1HYC,"In many exploration areas, successful separation of primaries and multiples greatly determines the quality of seismic imaging. Despite major advances made by surface-related multiple elimination (SRME), amplitude errors in the predicted multiples remain a problem. When these errors vary for each type of multiple in different ways (as a function of offset, time, and dip), they pose a serious challenge for conventional least-squares matching and for the recently introduced separation by curvelet-domain thresholding. We propose a data-adaptive method that corrects amplitude errors, which vary smoothly as a function of location, scale (frequency band), and angle. With this method, the amplitudes can be corrected by an elementwise curvelet-domain scaling of the predicted multiples. We show that this scaling leads to successful estimation of primaries, despite amplitude, sign, timing, and phase errors in the …"
22,"Robust inversion, dimensionality reduction, and randomized sampling",110,2012,https://scholar.google.com/citations?view_op=view_citation&hl=en&user=hw23CTQAAAAJ&pagesize=50&citation_for_view=hw23CTQAAAAJ:l7t_Zn2s7bgC,"We consider a class of inverse problems in which the forward model is the solution operator to linear ODEs or PDEs. This class admits several dimensionality-reduction techniques based on data averaging or sampling, which are especially useful for large-scale problems. We survey these approaches and their connection to stochastic optimization. The data-averaging approach is only viable, however, for a least-squares misfit, which is sensitive to outliers in the data and artifacts unexplained by the forward model. This motivates us to propose a robust formulation based on the Student’s t-distribution of the error. We demonstrate how the corresponding penalty function, together with the sampling approach, can obtain good results for a large-scale seismic inverse problem with 50 % corrupted data."
23,"A scaling medium representation, a discussion on well-logs, fractals and waves",109,1997,https://scholar.google.com/citations?view_op=view_citation&hl=en&user=hw23CTQAAAAJ&pagesize=50&citation_for_view=hw23CTQAAAAJ:u-x6o8ySG0sC,"9. Op het moment dat de akoestische golfsnelheid van de schaal afhangt kan men slechts een uitspraak over de snelheid doen indien men een maatstok zou kunnen definieren. De meest voor de hand liggende kandidaat voor deze maatstok binnen het golfprobleem is de golflengte. Hier eindigt men echter in een"" Catch 22"" aangezien de golflengte zelf van de snelheid afhangt.10. De huidige verklaring voor de geobserveerde dissipatie met behulp van viscoelasticiteit is niets anders dan een parametiïsatie keuze waarvoor een werkelijke fysische verklaring in de geofysica ontbreekt. Alhoewel een dergelijk mecha nisme een aantal problemen, zoals het garanderen van causaliteit, uit de wereld helpt, zou een verklaring met behulp van schaaldynamiea een fysisch plausibel alternatief kunnen bieden."
