Rank,Title,Citations,Year,URL,Description
44,Emprof: Memory profiling via em-emanation in iot and hand-held devices,33,2018,https://scholar.google.com/citations?view_op=view_citation&hl=en&user=A_j_baAAAAAJ&pagesize=50&citation_for_view=A_j_baAAAAAJ:nb7KW1ujOQ8C,"This paper presents EMPROF, a new method for profiling the performance impact of the memory subsystem without any support on, or interference with, the profiled system. Rather than rely on hardware support and/or software instrumentation on the profiled system, EMPROF analyzes the system's EM emanations to identify processor stalls that are associated with last-level cache (LLC) misses. This enables EMPROF to accurately pinpoint LLC misses in the execution timeline and to measure the cost (stall time) of each miss. Since EMPROF has zero ""observer effect"", so it can be used to profile applications that adjust their activity to their performance. It has no overhead on target machine, so it can be used for profiling embedded, hand-held, and IoT devices which usually have limited support for collecting, and limited resources for storing, the profiling data. Finally, since EMPROF can profile the system as-is, its …"
45,LIME: A framework for debugging load imbalance in multi-threaded execution,33,2011,https://scholar.google.com/citations?view_op=view_citation&hl=en&user=A_j_baAAAAAJ&pagesize=50&citation_for_view=A_j_baAAAAAJ:dhFuZR0502QC,"With the ubiquity of multi-core processors, software must make effective use of multiple cores to obtain good performance on modern hardware. One of the biggest roadblocks to this is load imbalance, or the uneven distribution of work across cores. We propose LIME, a framework for analyzing parallel programs and reporting the cause of load imbalance in application source code. This framework uses statistical techniques to pinpoint load imbalance problems stemming from both control flow issues (e.g., unequal iteration counts) and interactions between the application and hardware (e.g., unequal cache miss counts). We evaluate LIME on applications from widely used parallel benchmark suites, and show that LIME accurately reports the causes of load imbalance, their nature and origin in the code, and their relative importance."
46,The bulk multicore architecture for improved programmability,33,2009,https://scholar.google.com/citations?view_op=view_citation&hl=en&user=A_j_baAAAAAJ&pagesize=50&citation_for_view=A_j_baAAAAAJ:0EnyYjriUFMC,Easing the programmer's burden does not compromise system performance or increase the complexity of hardware implementation.
47,Architectural support for parallel reductions in scalable shared-memory multiprocessors,33,2001,https://scholar.google.com/citations?view_op=view_citation&hl=en&user=A_j_baAAAAAJ&pagesize=50&citation_for_view=A_j_baAAAAAJ:roLk4NBRz8UC,"Reductions are important and time-consuming operations in many scientific codes. Effective parallelization of reductions is a critical transformation for loop parallelization, especially for sparse, dynamic applications. Unfortunately, conventional reduction parallelization algorithms are not scalable. In this paper, we present new architectural support that significantly speeds up parallel reduction and makes it scalable in shared-memory multiprocessors. The required architectural changes are mostly confined to the directory controllers. Experimental results based on simulations show that the proposed support is very effective. While conventional software-only reduction parallelization delivers average speedups of only 2.7 for 16 processors, our scheme delivers average speedups of 7.6."
48,Near-field backscattering-based sensing for hardware trojan detection,32,2020,https://scholar.google.com/citations?view_op=view_citation&hl=en&user=A_j_baAAAAAJ&pagesize=50&citation_for_view=A_j_baAAAAAJ:q3oQSFYPqjQC,"This article presents the near-field measurement setup and the sensor topology used to measure the backscattered signal from a small spot of ~1 mm on an FPGA to enable hardware Trojan (HT) detection. The novel sensor topology used in the setup contains a combination of E- and H-field probes with a tip diameter of 0.2 mm, which is used to excite a carrier and receive the modulated scattered signal that carries a signature of the inspected logic circuit. As a proof of concept and to develop insight, an EM-circuit co-simulation is presented to show that the received signal contains a signature of the logic circuit under test, which is imprinted on the relative power levels of the modulated scattered clock harmonics. The received modulated scattering signature was successfully used to detect the presence of an HT in the original circuit with 100% accuracy without false positives. The effects of using Eand H-field probes …"
49,Comparison of electromagnetic side-channel energy available to the attacker from different computer systems,32,2015,https://scholar.google.com/citations?view_op=view_citation&hl=en&user=A_j_baAAAAAJ&pagesize=50&citation_for_view=A_j_baAAAAAJ:ns9cj8rnVeAC,"This paper evaluates electromagnetic (EM) side-channel energy (ESE) available to the attacker from several different computer systems. In particular, we present measured ESE for several common instructions executed on a laptop, a desktop, and an FPGA at several different frequencies. The results show that ESE measurements are repeatable across a range of frequencies, and that similar frequencies result in similar ESE. While FPGA ESE is smaller than desktop or laptop ESE, similar trends are found between all three systems. The presented results can be useful to computer designers who wish to find out which parts of the design are most susceptible to EM side-channel vulnerabilities, and to software developers who need to know which variations in program behavior are most likely to allow successful side-channel attacks, especially for behaviors that are consistently vulnerable across processor …"
50,A method for efficient localization of magnetic field sources excited by execution of instructions in a processor,31,2017,https://scholar.google.com/citations?view_op=view_citation&hl=en&user=A_j_baAAAAAJ&pagesize=50&citation_for_view=A_j_baAAAAAJ:rO6llkc54NcC,"This paper proposes a method for efficient identification of instruction-dependent sources on a printed circuit board (PCB) by localizing magnetic field sources from a limited number of measurements around the PCB. We first excite the processor by generating an artificial leakage signal at a specific frequency that is directly related to processor instructions. Then, we collect all three components of the magnetic field, but only at locations around the edge of the board. Furthermore, we model these magnetic field sources and then solve a forward–backward optimization problem using the model and measured data to identify the locations of the magnetic field sources, the magnitudes of the moments, and their orientations. The localization results are first verified using simulations, then tested when noise is added to the simulation results, and finally verified against measurements on field-programmable gate array (FPGA …"
