Rank,Title,Citations,Year,URL,Description
22,Removing architectural bottlenecks to the scalability of speculative parallelization,81,2001,https://scholar.google.com/citations?view_op=view_citation&hl=en&user=A_j_baAAAAAJ&pagesize=50&citation_for_view=A_j_baAAAAAJ:UeHWp8X0CEIC,"Speculative thread-level parallelization is a promising way to speed up codes that compilers fail to parallelize. While several speculative parallelization schemes have been proposed for different machine sizes and types of codes, the results so far show that it is hard to deliver scalable speedups. Often, the problem is not true dependence violations, but sub-optimal architectural design. Consequently, we attempt to identify and eliminate major architectural bottlenecks that limit the scalability of speculative parallelization. The solutions that we propose are: low-complexity commit in constant time to eliminate the task commit bottleneck, a memory-based overflow area to eliminate stall due to speculative buffer overflow, and exploiting high-level access patterns to minimize speculation-induced traffic. To show that the resulting system is truly scalable, we perform simulations with up to 128 processors. With our …"
23,Efficient data protection for distributed shared memory multiprocessors,79,2006,https://scholar.google.com/citations?view_op=view_citation&hl=en&user=A_j_baAAAAAJ&pagesize=50&citation_for_view=A_j_baAAAAAJ:WF5omc3nYNoC,"Data security in computer systems has recently become an increasing concern, and hardware-based attacks have emerged. As a result, researchers have investigated hardware encryption and authentication mechanisms as a means of addressing this security concern. Unfortunately, no such techniques have been investigated for Distributed Shared Memory (DSM) multiprocessors, and previously proposed techniques for uni-processor and Symmetric Multiprocessor (SMP) systems cannot be directly used for DSMs. This work is the first to examine the issues involved in protecting secrecy and integrity of data in DSM systems. We first derive security requirements for processor-processor communication in DSMs, and find that different types of coherence messages need different protection. Then we propose and evaluate techniques to provide efficient encryption and authentication of the data in DSM systems. Our …"
24,A method for finding frequency-modulated and amplitude-modulated electromagnetic emanations in computer systems,77,2016,https://scholar.google.com/citations?view_op=view_citation&hl=en&user=A_j_baAAAAAJ&pagesize=50&citation_for_view=A_j_baAAAAAJ:2P1L_qKh6hAC,"This paper presents an algorithm for finding carriers of frequency-modulated (FM) and amplitude-modulated (AM) electromagnetic (EM) emanations from computer systems. Computer systems create EM emanations across the RF spectrum making it difficult, error-prone, and time consuming to find the relatively few emanations that expose sensitive information. One of the most common and simplest mechanisms for information leakage occurs when an amplitude or a frequency of an existing strong signal (e.g., a processor or memory clock) is amplitude or frequency modulated by a system activity. If the system activity can be linked to sensitive information, this results in information leakage. We present an algorithm for automatically finding these AM and FM signals, demonstrate the algorithm's performance on several different types of processors and systems (desktop, laptop, and smartphone), and compare the …"
25,Effective memory protection using dynamic tainting,76,2007,https://scholar.google.com/citations?view_op=view_citation&hl=en&user=A_j_baAAAAAJ&pagesize=50&citation_for_view=A_j_baAAAAAJ:Se3iqnhoufwC,"Programs written in languages that provide direct access tomemory through pointers often contain memory-related faults, which may cause non-deterministic failures and even security vulnerabilities. In this paper, we present a new technique based on dynamic tainting for protecting programs from illegal memory accesses. When memory is allocated, at runtime, our technique taints both the memory and the corresponding pointer using the same taint mark. Taint marks are then suitably propagated while the program executes and are checked every time a memory address m is accessed through a pointer p; if the taint marks associated with mand p differ, the execution is stopped and the illegalaccess is reported. To allow for a low-overhead, hardware-assisted implementation of the approach, we make several key technical and engineering decisions in the definition of our technique. In particular, we use a …"
26,Comprehensively and efficiently protecting the heap,76,2006,https://scholar.google.com/citations?view_op=view_citation&hl=en&user=A_j_baAAAAAJ&pagesize=50&citation_for_view=A_j_baAAAAAJ:_FxGoFyzp5QC,"The goal of this paper is to propose a scheme that provides comprehensive security protection for the heap. Heap vulnerabilities are increasingly being exploited for attacks on computer programs. In most implementations, the heap management library keeps the heap meta-data (heap structure information) and the application's heap data in an interleaved fashion and does not protect them against each other. Such implementations are inherently unsafe: vulnerabilities in the application can cause the heap library to perform unintended actions to achieve control-flow and non-control attacks.Unfortunately, current heap protection techniques are limited in that they use too many assumptions on how the attacks will be performed, require new hardware support, or require too many changes to the software developers' toolchain. We propose Heap Server, a new solution that does not have such drawbacks. Through …"
27,REMOTE: Robust external malware detection framework by using electromagnetic signals,74,2019,https://scholar.google.com/citations?view_op=view_citation&hl=en&user=A_j_baAAAAAJ&pagesize=50&citation_for_view=A_j_baAAAAAJ:tS2w5q8j5-wC,"Cyber-physical systems (CPS) are controlling many critical and sensitive aspects of our physical world while being continuously exposed to potential cyber-attacks. These systems typically have limited performance, memory, and energy reserves, which limits their ability to run existing advanced malware protection, and that, in turn, makes securing them very challenging. To tackle these problems, this paper proposes, REMOTE, a new robust framework to detect malware by externally observing Electromagnetic (EM) signals emitted by an electronic computing device (e.g., a microprocessor) while running a known application, in real-time and with a low detection latency, and without any a priori knowledge of the malware. REMOTE does not require any resources or infrastructure on, or any modifications to, the monitored system itself, which makes REMOTE especially suitable for malware detection on resource …"
28,Improving system performance with compressed memory,69,2001,https://scholar.google.com/citations?view_op=view_citation&hl=en&user=A_j_baAAAAAJ&pagesize=50&citation_for_view=A_j_baAAAAAJ:W7OEmFMy1HYC,"This paper summarizes our research on implementing a compressed memory in computer systems. The basic premise is that the throughput for applications whose working set size does not fit in main memory degrades significantly due to an increase in the number of page faults. Hence we propose compressing memory pages that need to be paged out and storing them in memory. This hides the large latencies associated with a disk access, since the page has to be merely uncompressed when a page fault occurs. Our implementation is in the form of a device driver for Linux. We show results with some applications from the SPEC 2000 CPU benchmark suite and a computing kernel. It is seen that speed-ups ranging from 5% to 250% can be obtained depending on the paging behavior of the application."
29,"Heapmon: A helper-thread approach to programmable, automatic, and low-overhead memory bug detection",68,2006,https://scholar.google.com/citations?view_op=view_citation&hl=en&user=A_j_baAAAAAJ&pagesize=50&citation_for_view=A_j_baAAAAAJ:Y0pCki6q_DkC,"The ability to detect and pinpoint memory-related bugs in production runs is important because in-house testing may miss bugs. This paper presents HeapMon, a heap memory bug-detection scheme that has a very low performance overhead, is automatic, and is easy to deploy. HeapMon relies on two new techniques. First, it decouples application execution from bug monitoring, which executes as a helper thread on a separate core in a chip multiprocessor system. Second, it associates a filter bit with each cached word to safely and significantly reduce bug checking frequency—by 95% on average. We test the effectiveness of these techniques using existing and injected memory bugs in SPEC®2000 applications and show that HeapMon effectively detects and identifies most forms of heap memory bugs. Our results also indicate that the HeapMon performance overhead is only 5%, on average—orders of magnitude …"
30,Tradeoffs in buffering speculative memory state for thread-level speculation in multiprocessors,64,2005,https://scholar.google.com/citations?view_op=view_citation&hl=en&user=A_j_baAAAAAJ&pagesize=50&citation_for_view=A_j_baAAAAAJ:LkGwnXOMwfcC,"Thread-Level Speculation (TLS) provides architectural support to aggressively run hard-to-analyze code in parallel. As speculative tasks run concurrently, they generate unsafe or speculative memory state that needs to be separately buffered and managed in the presence of distributed caches and buffers. Such a state may contain multiple versions of the same variable. In this paper, we introduce a novel taxonomy of approaches to buffer and manage multiversion speculative memory state in multiprocessors. We also present a detailed complexity-benefit tradeoff analysis of the different approaches. Finally, we use numerical applications to evaluate the performance of the approaches under a single architectural framework. Our key insights are that support for buffering the state of multiple speculative tasks and versions per processor is more complexity-effective than support for lazily merging the state of tasks with …"
31,TLSync: support for multiple fast barriers using on-chip transmission lines,57,2011,https://scholar.google.com/citations?view_op=view_citation&hl=en&user=A_j_baAAAAAJ&pagesize=50&citation_for_view=A_j_baAAAAAJ:YOwf2qJgpHMC,"As the number of cores on a single-chip grows, scalable barrier synchronization becomes increasingly difficult to implement. In software implementations, such as the tournament barrier, a larger number of cores results in a longer latency for each round and a larger number of rounds. Hardware barrier implementations require significant dedicated wiring, e.g., using a reduction (arrival) tree and a notification (release) tree, and multiple instances of this wiring are needed to support multiple barriers (e.g., when concurrently executing multiple parallel applications). This paper presents TLSync, a novel hardware barrier implementation that uses the high-frequency part of the spectrum in a transmission-line broadcast network, thus leaving the transmission line network free for non-modulated (baseband) data transmission. In contrast to other implementations of hardware barriers, TLSync allows multiple thread groups to …"
32,Sesc,57,2006,https://scholar.google.com/citations?view_op=view_citation&hl=en&user=A_j_baAAAAAJ&pagesize=50&citation_for_view=A_j_baAAAAAJ:fPk4N6BV_jEC,Description not available
33,Single-level integrity and confidentiality protection for distributed shared memory multiprocessors,55,2008,https://scholar.google.com/citations?view_op=view_citation&hl=en&user=A_j_baAAAAAJ&pagesize=50&citation_for_view=A_j_baAAAAAJ:5nxA0vEk-isC,"Multiprocessor computer systems are currently widely used in commercial settings to run critical applications. These applications often operate on sensitive data such as customer records, credit card numbers, and financial data. As a result, these systems are the frequent targets of attacks because of the potentially significant gain an attacker could obtain from stealing or tampering with such data. This provides strong motivation to protect the confidentiality and integrity of data in commercial multiprocessor systems through architectural support. Architectural support is able to protect against software-based attacks, and is necessary to protect against hardware-based attacks. In this work, we propose architectural mechanisms to ensure data confidentiality and integrity in Distributed Shared Memory multiprocessors which utilize a point-to-point based interconnection network. Our approach improves upon previous work …"
34,A new side-channel vulnerability on modern computers by exploiting electromagnetic emanations from the power management unit,53,2020,https://scholar.google.com/citations?view_op=view_citation&hl=en&user=A_j_baAAAAAJ&pagesize=50&citation_for_view=A_j_baAAAAAJ:fQNAKQ3IYiAC,"This paper presents a new micro-architectural vulnerability on the power management units of modern computers which creates an electromagnetic-based side-channel. The key observations that enable us to discover this sidechannel are: 1) in an effort to manage and minimize power consumption, modern microprocessors have a number of possible operating modes (power states) in which various sub-systems of the processor are powered down, 2) for some of the transitions between power states, the processor also changes the operating mode of the voltage regulator module (VRM) that supplies power to the affected sub-system, and 3) the electromagnetic (EM) emanations from the VRM are heavily dependent on its operating mode. As a result, these state-dependent EM emanations create a side-channel which can potentially reveal sensitive information about the current state of the processor and, more …"
35,HARE++: Hardware assisted reverse execution revisited,53,2011,https://scholar.google.com/citations?view_op=view_citation&hl=en&user=A_j_baAAAAAJ&pagesize=50&citation_for_view=A_j_baAAAAAJ:-f6ydRqryjwC,"Bidirectional debugging is a promising and powerful debugging technique that can help programmers backtrack and find the causes of program errors faster. A key component of bidirectional debugging is checkpointing, which allows the debugger to restore the program to any previously encountered state, but can incur significant performance and memory overheads that can render bidirectional debugging unusable. Multiple software and hardware checkpointing techniques have been proposed. Software provides better memory management through checkpoint consolidation, while hardware can create checkpoints at low performance cost which unfortunately are not consolidation-friendly. HARE was the first hardware technique to create consolidatable checkpoints in order to reduce the overall performance and memory costs. In this paper we are proposing HARE++, a redesign of the original HARE that addresses the shortcomings of the original technique. HARE++ reduces the reverse execution latency by 3.5-4 times on average compared to HARE and provides the ability to construct both undo and redo-log checkpoints allowing the seamless movement over the execution time of the program. At the same time HARE++ maintains the performance advantages of HARE, incurring< 2% performance overhead on average across all benchmarks, and allows the consolidation of checkpoints with memory requirements similar to HARE."
36,Virtual memory system utilizing data compression implemented through a device,53,2003,https://scholar.google.com/citations?view_op=view_citation&hl=en&user=A_j_baAAAAAJ&pagesize=50&citation_for_view=A_j_baAAAAAJ:hqOjcs7Dif8C,"A data processing System typically consists of a processor, a volatile memory for Storing instructions and data, and Some form of permanent Storage ie a magnetic disk. Due to ever increasing Sizes in application programs, operating Systems use virtual memory to extend the visible size of the real random access memory (RAM) by backing it with a region on a permanent Storage device (Swap file or device). This procedure also allows multitasking Systems to run multiple processes on the machine, where each proceSS can be given access to the complete Virtual address Space of the processor. The address Space is divided into page frames which are typically fixed in size. A translation mechanism is used to convert the virtual address issued by a running process to the physical page that contains the instructions or data required by the process. When the System runs low on physical pages, it writes less active …"
37,Electromagnetic side channel information leakage created by execution of series of instructions in a computer processor,47,2019,https://scholar.google.com/citations?view_op=view_citation&hl=en&user=A_j_baAAAAAJ&pagesize=50&citation_for_view=A_j_baAAAAAJ:K3LRdlH-MEoC,"The side-channel leakage is a consequence of program execution in a computer processor, and understanding relationship between code execution and information leakage is a necessary step in estimating information leakage and its capacity limits. This paper proposes a methodology to relate program execution to electromagnetic side-channel emanations and estimates side-channel information capacity created by execution of series of instructions (e.g., a function, a procedure, or a program) in a processor. To model dependence among program instructions in a code, we propose to use Markov source model, which includes the dependencies among sequence of instructions as well as dependencies among instructions as they pass through a pipeline of the processor. The emitted electromagnetic (EM) signals during instruction executions are natural choice for the inputs into the model. To obtain the channel …"
38,Tradeoffs in buffering memory state for thread-level speculation in multiprocessors,47,2003,https://scholar.google.com/citations?view_op=view_citation&hl=en&user=A_j_baAAAAAJ&pagesize=50&citation_for_view=A_j_baAAAAAJ:Tyk-4Ss8FVUC,"Thread-level speculation provides architectural support to aggressively run hard-to-analyze code in parallel. As speculative tasks run concurrently, they generate unsafe or speculative memory state that needs to be separately buffered and managed in the presence of distributed caches and buffers. Such state may contain multiple versions of the same variable. In this paper, we introduce a novel taxonomy of approaches to buffering and managing multi-version speculative memory state in multiprocessors. We also present a detailed complexity-benefit tradeoff analysis of the different approaches. Finally, we use numerical applications to evaluate the performance of the approaches under a single architectural framework. Our key insights are that support for buffering the state of multiple speculative tasks and versions per processor is more complexity-effective than support for merging the state of tasks with main …"
39,Emma: Hardware/software attestation framework for embedded systems using electromagnetic signals,45,2019,https://scholar.google.com/citations?view_op=view_citation&hl=en&user=A_j_baAAAAAJ&pagesize=50&citation_for_view=A_j_baAAAAAJ:vRqMK49ujn8C,"Establishing trust for an execution environment is an important problem, and practical solutions for it rely on attestation, where an untrusted system (prover) computes a response to a challenge sent by the trusted system (verifier). The response typically is a checksum of the prover's program, which the verifier checks against expected values for a ""clean"" (trustworthy) system. The main challenge in attestation is that, in addition to checking the response, the verifier also needs to verify the integrity of the response computation. On higher-end processors, this integrity is verified cryptographically, using dedicated trusted hardware. On embedded systems, however, constraints prevent the use of such hardware support. Instead, a popular approach is to use the request-to-response time as a way to establish confidence. However, the overall request-to-response time provides only one coarse-grained measurement from …"
40,Capacity of the em covert/side-channel created by the execution of instructions in a processor,45,2017,https://scholar.google.com/citations?view_op=view_citation&hl=en&user=A_j_baAAAAAJ&pagesize=50&citation_for_view=A_j_baAAAAAJ:zA6iFVUQeVQC,"The goal of this paper is to answer how much information is “transmitted” by the execution of particular sequence of instructions in a processor. Introducing such a measure would provide quantitative guidance for designing programs and computer hardware that minimizes inadvertent (side channel) information leakage, and would also help detect parts of a program or hardware design that have unusually high leakage (i.e., were designed to function as covert channel “transmitters”). To answer this question, we propose a new method to estimate the maximum information leakage through EM signals generated by the execution of instructions in a processor. We start by deriving a mathematical relationship between electromagnetic side-channel energy of individual instructions and the measured pairwise side-channel signal power. Then, we use this measure to calculate the transition probabilities needed for …"
41,EMSim: A microarchitecture-level simulation tool for modeling electromagnetic side-channel signals,44,2020,https://scholar.google.com/citations?view_op=view_citation&hl=en&user=A_j_baAAAAAJ&pagesize=50&citation_for_view=A_j_baAAAAAJ:VOx2b1Wkg3QC,"Side-channel attacks have become a serious security concern for computing systems, especially for embedded devices, where the device is often located in, or in proximity to, a public place, and yet the system contains sensitive information. To design systems that are highly resilient to such attacks, an accurate and efficient design-stage quantitative analysis of side-channel leakage is needed. For many systems properties (e.g., performance, power, etc.), cycle-accurate simulation can provide such an efficient-yet-accurate design-stage estimate. Unfortunately, for an important class of side-channels, electromagnetic emanations, such a model does not exist, and there has not even been much quantitative evidence about what level of modeling detail (e.g., hardware, microarchitecture, etc.) would be needed for high accuracy. This paper presents EMSim, an approach that enables simulation of the electromagnetic …"
42,A novel golden-chip-free clustering technique using backscattering side channel for hardware trojan detection,43,2020,https://scholar.google.com/citations?view_op=view_citation&hl=en&user=A_j_baAAAAAJ&pagesize=50&citation_for_view=A_j_baAAAAAJ:J-pR_7NvFogC,"Over the past few years, malicious hardware modifications, a.k.a. hardware Trojans (HT), have emerged as a major security threat because integrated circuit (IC) companies have been fabricating chips at offshore foundries due to various factors including time-to-market, cost reduction demands, and the increased complexity of ICs. Among proposed hardware Trojan detection techniques, reverse engineering appears to be the most accurate and reliable one because it works for all circuits and Trojan types without a golden example of the chip. However, because reverse engineering is an extremely expensive, time-consuming, and destructive process, it is difficult to apply this technique for a large population of ICs in a real test environment. This paper proposes a novel golden-chip-free clustering method using backscattering side-channel to divide ICs into groups of Trojan-free and Trojan-infected boards. The …"
43,Detailed tracking of program control flow using analog side-channel signals: a promise for iot malware detection and a threat for many cryptographic implementations,36,2018,https://scholar.google.com/citations?view_op=view_citation&hl=en&user=A_j_baAAAAAJ&pagesize=50&citation_for_view=A_j_baAAAAAJ:f2IySw72cVMC,"Side-channel signals have long been used in cryptanalysis, and recently they have also been utilized as a way to monitor program execution without involving the monitored system in its own monitoring. Both of these use-cases for side-channel analysis have seen steady improvement, allowing ever-smaller deviations in program behavior to be monitored (to track program behavior and/or identify anomalies) or exploited (to steal sensitive information). However, there is still very little intuition about where the limits for this are, e.g. whether a single-instruction or a single-bit difference can realistically be recovered from the signal. In this paper, we use a popular open-source cryptographic software package as a test subject to demonstrate that, with enough training data, enough signal bandwidth, and enough signal-to-noise ratio, the decision of branch instructions that cause even single-instruction-differences in …"
