Rank,Title,Citations,Year,URL,Description
1,Narrative planning: Balancing plot and character,960,2010,https://scholar.google.com/citations?view_op=view_citation&hl=en&user=Yg_QjxcAAAAJ&pagesize=50&citation_for_view=Yg_QjxcAAAAJ:IjCSPb-OGe4C,"Narrative, and in particular storytelling, is an important part of the human experience. Consequently, computational systems that can reason about narrative can be more effective communicators, entertainers, educators, and trainers. One of the central challenges in computational narrative reasoning is narrative generation, the automated creation of meaningful event sequences. There are many factors--logical and aesthetic--that contribute to the success of a narrative artifact. Central to this success is its understandability. We argue that the following two attributes of narratives are universal:(a) the logical causal progression of plot, and (b) character believability. Character believability is the perception by the audience that the actions performed by characters do not negatively impact the audience's suspension of disbelief. Specifically, characters must be perceived by the audience to be intentional agents. In this article, we explore the use of refinement search as a technique for solving the narrative generation problem--to find a sound and believable sequence of character actions that transforms an initial world state into a world state in which goal propositions hold. We describe a novel refinement search planning algorithm--the Intent-based Partial Order Causal Link (IPOCL) planner--that, in addition to creating causally sound plot progression, reasons about character intentionality by identifying possible character goals that explain their actions and creating plan structures that explain why those characters commit to their goals. We present the results of an empirical evaluation that demonstrates that narrative plans generated by the IPOCL algorithm …"
2,Expanding explainability: Towards social transparency in ai systems,784,2021,https://scholar.google.com/citations?view_op=view_citation&hl=en&user=Yg_QjxcAAAAJ&pagesize=50&citation_for_view=Yg_QjxcAAAAJ:Ri6SYOTghG4C,"As AI-powered systems increasingly mediate consequential decision-making, their explainability is critical for end-users to take informed and accountable actions. Explanations in human-human interactions are socially-situated. AI systems are often socio-organizationally embedded. However, Explainable AI (XAI) approaches have been predominantly algorithm-centered. We take a developmental step towards socially-situated XAI by introducing and exploring Social Transparency (ST), a sociotechnically informed perspective that incorporates the socio-organizational context into explaining AI-mediated decision-making. To explore ST conceptually, we conducted interviews with 29 AI users and practitioners grounded in a speculative design scenario. We suggested constitutive design elements of ST and developed a conceptual framework to unpack ST’s effect and implications at the technical, decision-making …"
3,Human‐centered artificial intelligence and machine learning,617,2019,https://scholar.google.com/citations?view_op=view_citation&hl=en&user=Yg_QjxcAAAAJ&pagesize=50&citation_for_view=Yg_QjxcAAAAJ:tYavs44e6CUC,"Humans are increasingly coming into contact with artificial intelligence (AI) and machine learning (ML) systems. Human‐centered AI is a perspective on AI and ML that algorithms must be designed with awareness that they are part of a larger system consisting of humans. We lay forth an argument that human‐centered AI can be broken down into two aspects: (a) AI systems that understand humans from a sociocultural perspective, and (b) AI systems that help humans understand them. We further argue that issues of social responsibility such as fairness, accountability, interpretability, and transparency."
4,Interactive narrative: An intelligent systems approach,537,2013,https://scholar.google.com/citations?view_op=view_citation&hl=en&user=Yg_QjxcAAAAJ&pagesize=50&citation_for_view=Yg_QjxcAAAAJ:xtRiw3GOFMkC,"Interactive narrative is a form of digital interactive experience in which users create or influence a dramatic storyline through their actions. The goal of an interactive narrative system is to immerse the user in a virtual world such that he or she believes that they are an integral part of an unfolding story and that their actions can significantly alter the direction and/or outcome of the story. In this article we review the ways in which artificial intelligence can be brought to bear on the creation of interactive narrative systems. We lay out the landscape of about 20 years of interactive narrative research and explore the successes as well as open research questions pertaining to the novel use of computational narrative intelligence in the pursuit of entertainment, education, and training."
5,Human-centered explainable ai: Towards a reflective sociotechnical approach,427,2020,https://scholar.google.com/citations?view_op=view_citation&hl=en&user=Yg_QjxcAAAAJ&pagesize=50&citation_for_view=Yg_QjxcAAAAJ:HbR8gkJAVGIC,"Explanations—a form of post-hoc interpretability—play an instrumental role in making systems accessible as AI continues to proliferate complex and sensitive sociotechnical systems. In this paper, we introduce Human-centered Explainable AI (HCXAI) as an approach that puts the human at the center of technology design. It develops a holistic understanding of “who” the human is by considering the interplay of values, interpersonal dynamics, and the socially situated nature of AI systems. In particular, we advocate for a reflective sociotechnical approach. We illustrate HCXAI through a case study of an explanation system for non-technical end-users that shows how technical advancements and the understanding of human factors co-evolve. Building on the case study, we lay out open research questions pertaining to further refining our understanding of “who” the human is and extending beyond 1-to-1 human …"
6,Managing interaction between users and agents in a multi-agent storytelling environment,364,2003,https://scholar.google.com/citations?view_op=view_citation&hl=en&user=Yg_QjxcAAAAJ&pagesize=50&citation_for_view=Yg_QjxcAAAAJ:u-x6o8ySG0sC,"This paper describes an approach for managing the interaction of human users with computer-controlled agents in an interactive narrative-oriented virtual environment. In these kinds of systems, the freedom of the user to perform whatever action she desires must be balanced with the preservation of the storyline used to control the system's characters. We describe a technique, narrative mediation, that exploits a plan-based model of narrative structure to manage and respond to users' actions inside a virtual world. We define two general classes of response to situations where users execute actions that interfere with story structure: accommodation and intervention. Finally, we specify an architecture that uses these definitions to monitor and automatically characterize user actions, and to compute and implement responses to unanticipated activity. The approach effectively integrates user action and system response …"
7,Automated rationale generation: a technique for explainable AI and its effects on human perceptions,355,2019,https://scholar.google.com/citations?view_op=view_citation&hl=en&user=Yg_QjxcAAAAJ&pagesize=50&citation_for_view=Yg_QjxcAAAAJ:hMsQuOkrut0C,"Automated rationale generation is an approach for real-time explanation generation whereby a computational model learns to translate an autonomous agent's internal state and action data representations into natural language. Training on human explanation data can enable agents to learn to generate human-like explanations for their behavior. In this paper, using the context of an agent that plays Frogger, we describe (a) how to collect a corpus of explanations, (b) how to train a neural rationale generator to produce different styles of rationales, and (c) how people perceive these rationales. We conducted two user studies. The first study establishes the plausibility of each type of generated rationale and situates their user perceptions along the dimensions of confidence, humanlike-ness, adequate justification, and understandability. The second study further explores user preferences between the generated …"
8,From linear story generation to branching story graphs,352,2006,https://scholar.google.com/citations?view_op=view_citation&hl=en&user=Yg_QjxcAAAAJ&pagesize=50&citation_for_view=Yg_QjxcAAAAJ:9yKSN-GCB0IC,"Narrative intelligence refers to the ability - human or computer - to organize experience into narrative. Recently, researchers have applied narrative intelligence to create interactive narrative systems, virtual worlds in which a story unfolds and the user is considered a character in the story, able to interact with elements and other characters in the virtual world. The standard approach to incorporating storytelling into a computer system is to script a story at design time. However, this approach limits the computer system's ability to adapt to the user's preferences and abilities. The alternative approach is to generate stories dynamically or on a per-session basis (one story per time the system is engaged). Narrative generation is a process that involves the selection, ordering, and presentation through discourse of narrative content. A system that can generate stories can adapt narrative to the user's preferences and abilities …"
9,An architecture for integrating plan-based behavior generation with interactive game environments.,344,2004,https://scholar.google.com/citations?view_op=view_citation&hl=en&user=Yg_QjxcAAAAJ&pagesize=50&citation_for_view=Yg_QjxcAAAAJ:u5HHmVD_uO8C,One central challenge for game developers is the need to create compelling behavior for a game’s characters and objects. Most approaches to behavior generation have either used scripting or finite-state approaches. Both of these approaches are restricted the requirement to anticipate game state at design time. Research in artificial intelligence has developed a number of techniques for automatic plan generation that create novel action sequences that are highly sensitive to run-time context.
10,Story generation with crowdsourced plot graphs,305,2013,https://scholar.google.com/citations?view_op=view_citation&hl=en&user=Yg_QjxcAAAAJ&pagesize=50&citation_for_view=Yg_QjxcAAAAJ:nb7KW1ujOQ8C,"Story generation is the problem of automatically selecting a sequence of events that meet a set of criteria and can be told as a story. Story generation is knowledge-intensive; traditional story generators rely on a priori defined domain models about fictional worlds, including characters, places, and actions that can be performed. Manually authoring the domain models is costly and thus not scalable. We present a novel class of story generation system that can generate stories in an unknown domain. Our system (a) automatically learns a domain model by crowdsourcing a corpus of narrative examples and (b) generates stories by sampling from the space defined by the domain model. A large-scale evaluation shows that stories generated by our system for a previously unknown topic are comparable in quality to simple stories authored by untrained humans"
11,Event representations for automated story generation with deep neural nets,296,2018,https://scholar.google.com/citations?view_op=view_citation&hl=en&user=Yg_QjxcAAAAJ&pagesize=50&citation_for_view=Yg_QjxcAAAAJ:tzM49s52ZIMC,"Automated story generation is the problem of automatically selecting a sequence of events, actions, or words that can be told as a story. We seek to develop a system that can generate stories by learning everything it needs to know from textual story corpora. To date, recurrent neural networks that learn language models at character, word, or sentence levels have had little success generating coherent stories. We explore the question of event representations that provide a mid-level of abstraction between words and sentences in order to retain the semantic information of the original data while minimizing event sparsity. We present a technique for preprocessing textual story data into event sequences. We then present a technique for automated story generation whereby we decompose the problem into the generation of successive events (event2event) and the generation of natural language sentences from events (event2sentence). We give empirical results comparing different event representations and their effects on event successor generation and the translation of events to natural language."
12,An intent-driven planner for multi-agent story generation,239,2004,https://scholar.google.com/citations?view_op=view_citation&hl=en&user=Yg_QjxcAAAAJ&pagesize=50&citation_for_view=Yg_QjxcAAAAJ:d1gkVwhDpl0C,"The ability to generate narrative is of importance to computer systems that wish to use story effectively for entertainment, training, or education. We identify two properties of story–plot coherence and character believability–which play a role in the success of a story. Plot coherence is the perception by audience members that character actions have relevance to the outcome of the story. Character believability is the perception that character actions are motivated by agents' internal beliefs and desires. Unlike conventional planning in which plan goals represent an agent's intended world state, multiagent story planning involves goals that represent the outcome of a story. In order for the plans' actions to appear believable, multi-agent story planners must determine not only how agents' actions achieve a story's goal state, but must also ensure that each agent appears to be acting intentionally. We present a narrative generation planning system for multi-agent stories that is capable of generating narratives with both strong plot coherence and strong character believability. The planning algorithm uses causal reasoning and a simulated intention recognition process to drive plan creation."
13,"Dynamic experience management in virtual worlds for entertainment, education, and training",223,2008,https://scholar.google.com/citations?view_op=view_citation&hl=en&user=Yg_QjxcAAAAJ&pagesize=50&citation_for_view=Yg_QjxcAAAAJ:zYLM7Y9cAGgC,"Modern computer systems have the ability to make the storytelling experience interactive by involving a participant or learner as a character in the narrative itself. We present a framework for creating interactive narratives for entertainment, educational, and training purposes based on a type of agent called an experience manager. An experience manager (a generalization of a drama manager) is an intelligent computer agent that manipulates a virtual world to coerce a participant’s experience to conform to a set of provided properties. Our realization of the experience manager automatically generates narrative content in order to adapt to the user’s actions in the virtual world. The experience management framework has been used to develop an interactive version of Little Red Riding Hood and an interactive practice environment called IN-TALE for educating and training cognitive skills such as situation awareness, cultural awareness, leadership, and decisionmaking."
14,Believable agents and intelligent story adaptation for interactive storytelling,220,2006,https://scholar.google.com/citations?view_op=view_citation&hl=en&user=Yg_QjxcAAAAJ&pagesize=50&citation_for_view=Yg_QjxcAAAAJ:2osOgNQ5qMEC,Interactive Narrative is an approach to interactive entertainment that enables the player to make decisions that directly affect the direction and/or outcome of the narrative experience being delivered by the computer system. Interactive narrative requires two seemingly conflicting requirements: coherent narrative and user agency. We present an interactive narrative system that uses a combination of narrative control and autonomous believable character agents to augment a story world simulation in which the user has a high degree of agency with narrative plot control. A drama manager called the Automated Story Director gives plot-based guidance to believable agents. The believable agents are endowed with the autonomy necessary to carry out directives in the most believable fashion possible. Agents also handle interaction with the user. When the user performs actions that change the world in such a way that …
15,"Friend, collaborator, student, manager: How design of an ai-driven game level editor affects creators",215,2019,https://scholar.google.com/citations?view_op=view_citation&hl=en&user=Yg_QjxcAAAAJ&pagesize=50&citation_for_view=Yg_QjxcAAAAJ:KUbvn5osdkgC,"Machine learning advances have afforded an increase in algorithms capable of creating art, music, stories, games, and more. However, it is not yet well-understood how machine learning algorithms might best collaborate with people to support creative expression. To investigate how practicing designers perceive the role of AI in the creative process, we developed a game level design tool for Super Mario Bros.-style games with a built-in AI level designer. In this paper we discuss our design of the Morai Maker intelligent tool through two mixed-methods studies with a total of over one-hundred participants. Our findings are as follows: (1) level designers vary in their desired interactions with, and role of, the AI, (2) the AI prompted the level designers to alter their design practices, and (3) the level designers perceived the AI as having potential value in their design practice, varying based on their desired role for the AI."
16,AI for game production,214,2013,https://scholar.google.com/citations?view_op=view_citation&hl=en&user=Yg_QjxcAAAAJ&pagesize=50&citation_for_view=Yg_QjxcAAAAJ:SP6oXDckpogC,"A number of changes are occurring in the field of computer game development: persistent online games, digital distribution platforms and portals, social and mobile games, and the emergence of new business models have pushed game development to put heavier emphasis on the live operation of games. Artificial intelligence has long been an important part of game development practices. The forces of change in the industry present an opportunity for Game AI to have new and profound impact on game production practices. Specifically, Game AI agents should act as “producers” responsible for managing a long-running set of live games, their player communities, and real-world context. We characterize a confluence of four major forces at play in the games industry today, together producing a wealth of data that opens unique research opportunities and challenges for Game AI in game production. We enumerate …"
17,Reframing human-AI collaboration for generating free-text explanations,207,2022,https://scholar.google.com/citations?view_op=view_citation&hl=en&user=Yg_QjxcAAAAJ&pagesize=50&citation_for_view=Yg_QjxcAAAAJ:WJVC3Jt7v1AC,"Large language models are increasingly capable of generating fluent-appearing text with relatively little task-specific supervision. But can these models accurately explain classification decisions? We consider the task of generating free-text explanations using human-written examples in a few-shot manner. We find that (1) authoring higher quality prompts results in higher quality generations; and (2) surprisingly, in a head-to-head comparison, crowdworkers often prefer explanations generated by GPT-3 to crowdsourced explanations in existing datasets. Our human studies also show, however, that while models often produce factual, grammatical, and sufficient explanations, they have room to improve along axes such as providing novel information and supporting the label. We create a pipeline that combines GPT-3 with a supervised filter that incorporates binary acceptability judgments from humans in the loop. Despite the intrinsic subjectivity of acceptability judgments, we demonstrate that acceptability is partially correlated with various fine-grained attributes of explanations. Our approach is able to consistently filter GPT-3-generated explanations deemed acceptable by humans."
18,Rationalization: A neural machine translation approach to generating natural language explanations,206,2018,https://scholar.google.com/citations?view_op=view_citation&hl=en&user=Yg_QjxcAAAAJ&pagesize=50&citation_for_view=Yg_QjxcAAAAJ:7T2F9Uy0os0C,"We introduce \em AI rationalization, an approach for generating explanations of autonomous system behavior as if a human had performed the behavior. We describe a rationalization technique that uses neural machine translation to translate internal state-action representations of an autonomous agent into natural language. We evaluate our technique in the Frogger game environment, training an autonomous game playing agent to rationalize its action choices using natural language. A natural language training corpus is collected from human players thinking out loud as they play the game. We motivate the use of rationalization as an approach to explanation generation and show the results of two experiments evaluating the effectiveness of rationalization. Results of these evaluations show that neural machine translation is able to accurately generate rationalizations that describe agent behavior, and that …"
19,Operationalizing human-centered perspectives in explainable AI,198,2021,https://scholar.google.com/citations?view_op=view_citation&hl=en&user=Yg_QjxcAAAAJ&pagesize=50&citation_for_view=Yg_QjxcAAAAJ:NXb4pA-qfm4C,"The realm of Artificial Intelligence (AI)’s impact on our lives is far reaching – with AI systems proliferating high-stakes domains such as healthcare, finance, mobility, law, etc., these systems must be able to explain their decision to diverse end-users comprehensibly. Yet the discourse of Explainable AI (XAI) has been predominantly focused on algorithm-centered approaches, suffering from gaps in meeting user needs and exacerbating issues of algorithmic opacity. To address these issues, researchers have called for human-centered approaches to XAI. There is a need to chart the domain and shape the discourse of XAI with reflective discussions from diverse stakeholders. The goal of this workshop is to examine how human-centered perspectives in XAI can be operationalized at the conceptual, methodological, and technical levels. Encouraging holistic (historical, sociological, and technical) approaches, we put an …"
20,Human-Centered Explainable AI (HCXAI): beyond opening the black-box of AI,180,2022,https://scholar.google.com/citations?view_op=view_citation&hl=en&user=Yg_QjxcAAAAJ&pagesize=50&citation_for_view=Yg_QjxcAAAAJ:HtS1dXgVpQUC,"Explainability of AI systems is crucial to hold them accountable because they are increasingly becoming consequential in our lives by powering high-stakes decisions in domains like healthcare and law. When it comes to Explainable AI (XAI), understanding who interacts with the black-box of AI is just as important as “opening” it, if not more. Yet the discourse of XAI has been predominantly centered around the black-box, suffering from deficiencies in meeting user needs and exacerbating issues of algorithmic opacity. To address these issues, researchers have called for human-centered approaches to XAI. In this second CHI workshop on Human-centered XAI (HCXAI), we build on the success of the first installment from CHI 2021 to expand the conversation around XAI. We chart the domain and shape the HCXAI discourse with reflective discussions from diverse stakeholders. The goal of the second installment is to …"
21,Playing text-adventure games with graph-based deep reinforcement learning,179,2019,https://scholar.google.com/citations?view_op=view_citation&hl=en&user=Yg_QjxcAAAAJ&pagesize=50&citation_for_view=Yg_QjxcAAAAJ:ILKRHgRFtOwC,"Text-based adventure games provide a platform on which to explore reinforcement learning in the context of a combinatorial action space, such as natural language. We present a deep reinforcement learning architecture that represents the game state as a knowledge graph which is learned during exploration. This graph is used to prune the action space, enabling more efficient exploration. The question of which action to take can be reduced to a question-answering task, a form of transfer learning that pre-trains certain parts of our architecture. In experiments using the TextWorld framework, we show that our proposed technique can learn a control policy faster than baseline alternatives. We have also open-sourced our code at https://github. com/rajammanabrolu/KG-DQN."
22,Toward supporting stories with procedurally generated game worlds,167,2011,https://scholar.google.com/citations?view_op=view_citation&hl=en&user=Yg_QjxcAAAAJ&pagesize=50&citation_for_view=Yg_QjxcAAAAJ:g5m5HwL7SMYC,"Computer role playing games engage players through interleaved story and open-ended game play. We present an approach to procedurally generating, rendering, and making playable novel games based on a priori unknown story structures. These stories may be authored by humans or by computational story generation systems. Our approach couples player, designer, and algorithm to generate a novel game using preferences for game play style, general design aesthetics, and a novel story structure. Our approach is implemented in Game Forge, a system that uses search-based optimization to find and render a novel game world configuration that supports a sequence of plot points plus play style preferences. Additionally, Game Forge supports execution of the game through reactive control of game world logic and non-player character behavior."
