Rank,Title,Citations,Year,URL,Description
46,Crowdsourcing narrative intelligence,79,2012,https://scholar.google.com/citations?view_op=view_citation&hl=en&user=Yg_QjxcAAAAJ&pagesize=50&citation_for_view=Yg_QjxcAAAAJ:NhqRSupF_l8C,"Narrative intelligence is an important part of human cognition, especially in sensemaking and communicating with people. Humans draw on a lifetime of relevant experiences to explain stories, to tell stories, and to help choose the most appropriate actions in real-life settings. Manual authoring the required knowledge presents a significant bottleneck in the creation of systems demonstrating narrative intelligence. In this paper, we describe a novel technique for automatically learning script-like narrative knowledge from crowdsourcing. By leveraging human workers’ collective understanding of social and procedural constructs, we can learn a potentially unlimited range of scripts regarding how real-world situations unfold. We present quantitative evaluations of the learned primitive events and the temporal ordering of events, which suggest we can identify orderings between events with high accuracy."
47,Game Engine Learning from Video.,78,2017,https://scholar.google.com/citations?view_op=view_citation&hl=en&user=Yg_QjxcAAAAJ&pagesize=50&citation_for_view=Yg_QjxcAAAAJ:j8SEvjWlNXcC,"Intelligent agents need to be able to make predictions about their environment. In this work we present a novel approach to learn a forward simulation model via simple search over pixel input. We make use of a video game, Super Mario Bros., as an initial test of our approach as it represents a physics system that is significantly less complex than reality. We demonstrate the significant improvement of our approach in predicting future states compared with a baseline CNN and apply the learned model to train a game playing agent. Thus we evaluate the algorithm in terms of the accuracy and value of its output model."
48,An offline planning approach to game plotline adaptation,77,2010,https://scholar.google.com/citations?view_op=view_citation&hl=en&user=Yg_QjxcAAAAJ&pagesize=50&citation_for_view=Yg_QjxcAAAAJ:kNdYIx-mwKoC,"Role-playing games, and other types of contemporary video games, usually contain a main storyline consisting of several causally related quests. As players have different motivations, tastes and preferences, it can be beneficial to customize game plotlines. In this paper, we present an offline algorithm for adapting human-authored game plotlines for computer role-playing games to suit the unique needs of individual players, thereby customizing gaming experiences and enhancing re-playability. Our approach uses an plan refinement technique based on partial-order planning to (a) optimize the global structure of the plotline according to input from a player model,(b) maintain plotline coherence, and (c) facilitate authorial intent by preserving as much of the original plotline as possible. A theoretical analysis of the authorial leverage and a user study suggest the benefits of this approach."
49,The algorithmic imprint,76,2022,https://scholar.google.com/citations?view_op=view_citation&hl=en&user=Yg_QjxcAAAAJ&pagesize=50&citation_for_view=Yg_QjxcAAAAJ:OcBU2YAGkTUC,"When algorithmic harms emerge, a reasonable response is to stop using the algorithm to resolve concerns related to fairness, accountability, transparency, and ethics (FATE). However, just because an algorithm is removed does not imply its FATE-related issues cease to exist. In this paper, we introduce the notion of the “algorithmic imprint” to illustrate how merely removing an algorithm does not necessarily undo or mitigate its consequences. We operationalize this concept and its implications through the 2020 events surrounding the algorithmic grading of the General Certificate of Education (GCE) Advanced (A) Level exams, an internationally recognized UK-based high school diploma exam administered in over 160 countries. While the algorithmic standardization was ultimately removed due to global protests, we show how the removal failed to undo the algorithmic imprint on the sociotechnical infrastructures …"
50,Incorporating Authorial Intent into Generative Narrative Systems.,76,2009,https://scholar.google.com/citations?view_op=view_citation&hl=en&user=Yg_QjxcAAAAJ&pagesize=50&citation_for_view=Yg_QjxcAAAAJ:hqOjcs7Dif8C,"One of the major themes to emerge in interactive narrative research is authorability and authorial intent. With interactive narratives, the human author is not present at run-time. Thus authoring interactive narratives is often a process of anticipating user actions in different contexts and using computational mechanisms and data structures for responding to the participant. Generative approaches to interactive narrative, in which an automated narrative generation system assumes some of the authoring responsibility, further decouple the human designer from the participants experience. We describe a general mechanism, called author goals, which can be used by human authors to assert authorial intent over generative narrative systems."
