Rank,Title,Citations,Year,URL,Description
23,The who in explainable ai: How ai background shapes perceptions of ai explanations,160,2021,https://scholar.google.com/citations?view_op=view_citation&hl=en&user=Yg_QjxcAAAAJ&pagesize=50&citation_for_view=Yg_QjxcAAAAJ:1yWc8FF-_SYC,"UPOL EHSAN, Georgia Institute of Technology, USA SAMIR PASSI, Cornell University, USA Q. VERA LIAO, IBM Research AI, USA LARRY CHAN, Georgia Institute of Technology, USA I-HSIANG LEE, Georgia Institute of Technology, USA MICHAEL MULLER, IBM Research AI, USA MARK O. RIEDL, Georgia Institute of Technology, USAExplainability of AI systems is critical for users to take informed actions and hold systems accountable. While “opening the opaque box” is important, understanding who opens the box can govern if the Human-AI interaction is effective. In this paper, we conduct a mixed-methods study of how two different groups of whos—people with and without a background in AI—perceive different types of AI explanations. These groups were chosen to look at how disparities in AI backgrounds can exacerbate the creator-consumer gap. We quantitatively share what the perceptions are along five dimensions: confidence, intelligence, understandability, second chance, and friendliness. Qualitatively, we highlight how the AI background influences each group’s interpretations and elucidate why the differences might exist through the lenses of appropriation and cognitive heuristics. We find that (1) both groups had unwarranted faith in numbers, to different extents and for different reasons,(2) each group found explanatory values in different explanations that went beyond the usage we designed them for, and (3) each group had different requirements of what counts as humanlike explanations. Using our findings, we discuss potential negative consequences such as harmful manipulation of user trust and propose design interventions …"
24,Controllable neural story plot generation via reward shaping,157,2018,https://scholar.google.com/citations?view_op=view_citation&hl=en&user=Yg_QjxcAAAAJ&pagesize=50&citation_for_view=Yg_QjxcAAAAJ:WZBGuue-350C,"Language-modeling--based approaches to story plot generation attempt to construct a plot by sampling from a language model (LM) to predict the next character, word, or sentence to add to the story. LM techniques lack the ability to receive guidance from the user to achieve a specific goal, resulting in stories that don't have a clear sense of progression and lack coherence. We present a reward-shaping technique that analyzes a story corpus and produces intermediate rewards that are backpropagated into a pre-trained LM in order to guide the model towards a given goal. Automated evaluations show our technique can create a model that generates story plots which consistently achieve a specified goal. Human-subject studies show that the generated stories have more plausible event ordering than baseline plot generation techniques."
25,Game level generation from gameplay videos,153,2016,https://scholar.google.com/citations?view_op=view_citation&hl=en&user=Yg_QjxcAAAAJ&pagesize=50&citation_for_view=Yg_QjxcAAAAJ:t6usbXjVLHcC,"We present an unsupervised process to generate full video game levels from a model trained on gameplay video. The model represents probabilistic relationships between shapes properties, and relates the relationships to stylistic variance within a domain. We utilize the classic platformer game Super Mario Bros. to evaluate this process due to its highly-regarded level design. We evaluate the output in comparison to other data-driven level generation techniques via a user study and demonstrate its ability to produce novel output more stylistically similar to exemplar input."
26,Towards an architecture for intelligent control of narrative in interactive virtual worlds,149,2003,https://scholar.google.com/citations?view_op=view_citation&hl=en&user=Yg_QjxcAAAAJ&pagesize=50&citation_for_view=Yg_QjxcAAAAJ:qjMakFHDy7sC,"The creation of novel, engaging and dynamic interactive stories presents a unique challenge to the designers of systems for interactive entertainment, education and training. Unlike conventional narrative media, an interactive narrative-based system may be required to generate its own story structure, determine the appropriate interface elements to use to convey the storys action and manage the effective interaction of a user within the story as it plays out. Here we describe the architecture of the Mimesis system, which integrates a 3D graphical gaming environment with intelligent techniques for generating and controlling interaction with and within a narrative in order to create an engaging and coherent user experience"
27,Using Stories to Teach Human Values to Artificial Agents.,144,2016,https://scholar.google.com/citations?view_op=view_citation&hl=en&user=Yg_QjxcAAAAJ&pagesize=50&citation_for_view=Yg_QjxcAAAAJ:eMMeJKvmdy0C,"Value alignment is a property of an intelligent agent indicating that it can only pursue goals that are beneficial to humans. Successful value alignment should ensure that an artificial general intelligence cannot intentionally or unintentionally perform behaviors that adversely affect humans. This is problematic in practice since it is difficult to exhaustively enumerated by human programmers. In order for successful value alignment, we argue that values should be learned. In this paper, we hypothesize that an artificial intelligence that can read and understand stories can learn the values tacitly held by the culture from which the stories originate. We describe preliminary work on using stories to generate a value-aligned reward signal for reinforcement learning agents that prevents psychotic-appearing behavior."
28,Charting the sociotechnical gap in explainable AI: A framework to address the gap in XAI,135,2023,https://scholar.google.com/citations?view_op=view_citation&hl=en&user=Yg_QjxcAAAAJ&pagesize=50&citation_for_view=Yg_QjxcAAAAJ:LgRImbQfgY4C,"Explainable AI (XAI) systems are sociotechnical in nature; thus, they are subject to the sociotechnical gap-divide between the technical affordances and the social needs. However, charting this gap is challenging. In the context of XAI, we argue that charting the gap improves our problem understanding, which can reflexively provide actionable insights to improve explainability. Utilizing two case studies in distinct domains, we empirically derive a framework that facilitates systematic charting of the sociotechnical gap by connecting AI guidelines in the context of XAI and elucidating how to use them to address the gap. We apply the framework to a third case in a new domain, showcasing its affordances. Finally, we discuss conceptual implications of the framework, share practical considerations in its operationalization, and offer guidance on transferring it to new contexts. By making conceptual and practical …"
29,Automated scenario generation: toward tailored and optimized military training in virtual environments,133,2012,https://scholar.google.com/citations?view_op=view_citation&hl=en&user=Yg_QjxcAAAAJ&pagesize=50&citation_for_view=Yg_QjxcAAAAJ:fPk4N6BV_jEC,"Scenario-based training exemplifies the learning-by-doing approach to human performance improvement. In this paper, we enumerate the advantages of incorporating automated scenario generation technologies into the traditional scenario development pipeline. An automated scenario generator is a system that creates training scenarios from scratch, augmenting human authoring to rapidly develop new scenarios, providing a richer diversity of tailored training opportunities, and delivering training scenarios on demand. We introduce a combinatorial optimization approach to scenario generation to deliver the requisite diversity and quality of scenarios while tailoring the scenarios to a particular learner's needs and abilities. We propose a set of evaluation metrics appropriate to scenario generation technologies and present preliminary evidence for the suitability of our approach compared to other scenario …"
30,Learning from explanations using sentiment and advice in RL,125,2016,https://scholar.google.com/citations?view_op=view_citation&hl=en&user=Yg_QjxcAAAAJ&pagesize=50&citation_for_view=Yg_QjxcAAAAJ:_Ybze24A_UAC,"In order for robots to learn from people with no machine learning expertise, robots should learn from natural human instruction. Most machine learning techniques that incorporate explanations require people to use a limited vocabulary and provide state information, even if it is not intuitive. This paper discusses a software agent that learned to play the Mario Bros. game using explanations. Our goals to improve learning from explanations were twofold: (1) to filter explanations into advice and warnings and (2) to learn policies from sentences without state information. We used sentiment analysis to filter explanations into advice of what to do and warnings of what to avoid. We developed object-focused advice to represent what actions the agent should take when dealing with objects. A reinforcement learning agent used object-focused advice to learn policies that maximized its reward. After mitigating false negatives …"
31,An empirical study of cognition and theatrical improvisation,122,2009,https://scholar.google.com/citations?view_op=view_citation&hl=en&user=Yg_QjxcAAAAJ&pagesize=50&citation_for_view=Yg_QjxcAAAAJ:3fE2CSJIrl8C,"This paper presents preliminary findings from our empirical study of the cognition employed by performers in improvisational theatre. Our study has been conducted in a laboratory setting with local improvisers. Participants performed predesigned improv ""games"", which were videotaped and shown to each individual participant for a retrospective protocol collection. The participants were then shown the video again as a group to elicit data on group dynamics, misunderstandings, etc. This paper presents our initial findings that we have built based on our initial analysis of the data and highlights details of interest."
32,The who in XAI: how AI background shapes perceptions of AI explanations,121,2024,https://scholar.google.com/citations?view_op=view_citation&hl=en&user=Yg_QjxcAAAAJ&pagesize=50&citation_for_view=Yg_QjxcAAAAJ:umqufdRvDiIC,"Explainability of AI systems is critical for users to take informed actions. Understanding who opens the black-box of AI is just as important as opening it. We conduct a mixed-methods study of how two different groups—people with and without AI background—perceive different types of AI explanations. Quantitatively, we share user perceptions along five dimensions. Qualitatively, we describe how AI background can influence interpretations, elucidating the differences through lenses of appropriation and cognitive heuristics. We find that (1) both groups showed unwarranted faith in numbers for different reasons and (2) each group found value in different explanations beyond their intended design. Carrying critical implications for the field of XAI, our findings showcase how AI generated explanations can have negative consequences despite best intentions and how that could lead to harmful manipulation of trust. We …"
33,Just say no: Analyzing the stance of neural dialogue generation in offensive contexts,113,2021,https://scholar.google.com/citations?view_op=view_citation&hl=en&user=Yg_QjxcAAAAJ&pagesize=50&citation_for_view=Yg_QjxcAAAAJ:sNmaIFBj_lkC,"Dialogue models trained on human conversations inadvertently learn to generate toxic responses. In addition to producing explicitly offensive utterances, these models can also implicitly insult a group or individual by aligning themselves with an offensive statement. To better understand the dynamics of contextually offensive language, we investigate the stance of dialogue model responses in offensive Reddit conversations. Specifically, we create ToxiChat, a crowd-annotated dataset of 2,000 Reddit threads and model responses labeled with offensive language and stance. Our analysis reveals that 42% of human responses agree with toxic comments, whereas only 13% agree with safe comments. This undesirable behavior is learned by neural dialogue models, such as DialoGPT, which we show are two times more likely to agree with offensive comments. To enable automatic detection of offensive language, we fine-tuned transformer-based classifiers on ToxiChat that achieve 0.71 F1 for offensive labels and 0.53 Macro-F1 for stance labels. Finally, we quantify the effectiveness of controllable text generation (CTG) methods to mitigate the tendency of neural dialogue models to agree with offensive comments. Compared to the baseline, our best CTG model achieves a 19% reduction in agreement with offensive comments and produces 29% fewer offensive replies. Our work highlights the need for further efforts to characterize and analyze inappropriate behavior in dialogue models, in order to help make them safer."
34,Explainability pitfalls: Beyond dark patterns in explainable AI,112,2024,https://scholar.google.com/citations?view_op=view_citation&hl=en&user=Yg_QjxcAAAAJ&pagesize=50&citation_for_view=Yg_QjxcAAAAJ:DUooU5lO8OsC,"To make explainable artificial intelligence (XAI) systems trustworthy, understanding harmful effects is important. In this paper, we address an important yet unarticulated type of negative effect in XAI. We introduce explainability pitfalls (EPs), unanticipated negative downstream effects from AI explanations manifesting even when there is no intention to manipulate users. EPs are different from dark patterns, which are intentionally deceptive practices. We articulate the concept of EPs by demarcating it from dark patterns and highlighting the challenges arising from uncertainties around pitfalls. We situate and operationalize the concept using a case study that showcases how, despite best intentions, unsuspecting negative effects, such as unwarranted trust in numerical explanations, can emerge. We propose proactive and preventative strategies to address EPs at three interconnected levels: research, design, and …"
35,A temporal data-driven player model for dynamic difficulty adjustment,112,2012,https://scholar.google.com/citations?view_op=view_citation&hl=en&user=Yg_QjxcAAAAJ&pagesize=50&citation_for_view=Yg_QjxcAAAAJ:pyW8ca7W8N0C,"Many computer games of all genres pit the player against a succession of increasingly difficult challenges such as combat with computer-controlled enemies and puzzles. Part of the fun of computer games is to master the skills necessary to complete the game. Challenge tailoring is the problem of matching the difficulty of skill-based events over the course of a game to a specific player's abilities. We present a tensor factorization approach to predicting player performance in skill-based computer games. Our tensor factorization approach is data-driven and can predict changes in players' skill mastery over time, allowing more accurate tailoring of challenges. We demonstrate the efficacy and scalability of tensor factorization models through an empirical study of human players in a simple role-playing combat game. We further find a significant correlation between these performance ratings and player subjective experiences of difficulty and discuss ways our model can be used to optimize player enjoyment."
36,Story planning as exploratory creativity: Techniques for expanding the narrative search space,110,2006,https://scholar.google.com/citations?view_op=view_citation&hl=en&user=Yg_QjxcAAAAJ&pagesize=50&citation_for_view=Yg_QjxcAAAAJ:Y0pCki6q_DkC,"The authoring of fictional stories is considered a creative process. The purpose of most story authoring is not to invent a new style or genre of story that will be accepted by the population but to invent a single narrative that is novel enough to be tellable. Computational story generation systems are more limited than human authors in the space of narratives that can be considered because it is often the case that story generation systems are constrained to operate within a fixed representation of the story world. These limitations can impact whether a story generation system is considered creative or not. In this paper, we describe a story planning system, Fabulist. Fabulist however is constrained by the world model input by the system user. We present two algorithms that enable story planning systems such as Fabulist to break outside the bounds of the initial world model in order to search a larger space of narratives."
37,A lightweight intelligent virtual cinematography system for machinima production,105,2007,https://scholar.google.com/citations?view_op=view_citation&hl=en&user=Yg_QjxcAAAAJ&pagesize=50&citation_for_view=Yg_QjxcAAAAJ:WF5omc3nYNoC,"Machinima is a low-cost alternative to full production filmmaking. However, creating quality cinematic visualizations with existing machinima techniques still requires a high degree of talent and effort. We introduce a lightweight artificial intelligence system, Cambot, that can be used to assist in machinima production. Cambot takes a script as input and produces a cinematic visualization. Unlike other virtual cinematography systems, Cambot favors an offline algorithm coupled with an extensible library of specific modular and reusable facets of cinematic knowledge. One of the advantages of this approach to virtual cinematography is a tight coordination between the positions and movements of the camera and the actors."
38,Story realization: Expanding plot events into sentences,103,2020,https://scholar.google.com/citations?view_op=view_citation&hl=en&user=Yg_QjxcAAAAJ&pagesize=50&citation_for_view=Yg_QjxcAAAAJ:-FonjvnnhkoC,"Neural network based approaches to automated story plot generation attempt to learn how to generate novel plots from a corpus of natural language plot summaries. Prior work has shown that a semantic abstraction of sentences called events improves neural plot generation and and allows one to decompose the problem into:(1) the generation of a sequence of events (event-to-event) and (2) the transformation of these events into natural language sentences (event-to-sentence). However, typical neural language generation approaches to event-to-sentence can ignore the event details and produce grammatically-correct but semantically-unrelated sentences. We present an ensemble-based model that generates natural language guided by events. We provide results—including a human subjects study—for a full end-to-end automated story generation system showing that our method generates more coherent and plausible stories than baseline approaches 1."
39,Character-focused narrative generation for execution in virtual worlds,99,2003,https://scholar.google.com/citations?view_op=view_citation&hl=en&user=Yg_QjxcAAAAJ&pagesize=50&citation_for_view=Yg_QjxcAAAAJ:Tyk-4Ss8FVUC,"Because narrative plays such a key role in the understanding of events in our daily lives, the ability to generate narrative can be of great use in virtual reality systems whose purpose is to entertain, train, or educate their users. Narrative generation, however, is complicated by the conflicting goals of plot coherence – the appearance that events in the narrative lead towards the narrative’s outcome – and character believability – the appearance that events in the narrative are driven by the traits of the story world characters. Many systems are capable of achieving either one or the other; we present a new approach to narrative generation in the Actor Conference system, which is capable of generating narratives with both plot coherence and character believability. These narratives are declarative in nature, readily lending themselves to execution by embodied agents in virtual reality environments."
40,A sequential recommendation approach for interactive personalized story generation.,95,2012,https://scholar.google.com/citations?view_op=view_citation&hl=en&user=Yg_QjxcAAAAJ&pagesize=50&citation_for_view=Yg_QjxcAAAAJ:rO6llkc54NcC,"In story-based games or other interactive story systems, a Drama Manager is an omniscient agent that acts to bring about a particular sequence of plot points for the user to experience. We present a Drama Manager that uses player modeling to personalize the user’s story according to his or her storytelling preferences. In order to deliver personalized stories, a Drama Manager must make decisions on not only which plot points to be included into the unfolding story but also the optimal sequence of the events the user should experience. A prefix based collaborative filtering algorithm based on users’ structural feedback is proposed to address the sequential selection problem. We demonstrate our system on a simple interactive story generation system based on choose-your-own-adventure stories to evaluate our algorithms. Results on human users and simulated users show that our Drama Manager is capable of capturing users’ preference and generating personalized stories with high accuracy."
41,Co-creative level design via machine learning,93,2018,https://scholar.google.com/citations?view_op=view_citation&hl=en&user=Yg_QjxcAAAAJ&pagesize=50&citation_for_view=Yg_QjxcAAAAJ:p__nRnzSRKYC,"Procedural Level Generation via Machine Learning (PLGML), the study of generating game levels with machine learning, has received a large amount of recent academic attention. For certain measures these approaches have shown success at replicating the quality of existing game levels. However, it is unclear the extent to which they might benefit human designers. In this paper we present a framework for co-creative level design with a PLGML agent. In support of this framework we present results from a user study and results from a comparative study of PLGML approaches."
42,"Automated storytelling via causal, commonsense plot ordering",87,2021,https://scholar.google.com/citations?view_op=view_citation&hl=en&user=Yg_QjxcAAAAJ&pagesize=50&citation_for_view=Yg_QjxcAAAAJ:FPJr55Dyh1AC,"Automated story plot generation is the task of generating a coherent sequence of plot events. Causal relations between plot events are believed to increase the perception of story and plot coherence. In this work, we introduce the concept of soft causal relations as causal relations inferred from commonsense reasoning. We demonstrate C2PO, an approach to narrative generation that operationalizes this concept through Causal, Commonsense Plot Ordering. Using human-participant protocols, we evaluate our system against baseline systems with different commonsense reasoning reasoning and inductive biases to determine the role of soft causal relations in perceived story quality. Through these studies we also probe the interplay of how changes in commonsense norms across storytelling genres affect perceptions of story quality."
43,Computational narrative intelligence: A human-centered goal for artificial intelligence,85,2016,https://scholar.google.com/citations?view_op=view_citation&hl=en&user=Yg_QjxcAAAAJ&pagesize=50&citation_for_view=Yg_QjxcAAAAJ:JoZmwDi-zQgC,"Narrative intelligence is the ability to craft, tell, understand, and respond affectively to stories. We argue that instilling artificial intelligences with computational narrative intelligence affords a number of applications beneficial to humans. We lay out some of the machine learning challenges necessary to solve to achieve computational narrative intelligence. Finally, we argue that computational narrative is a practical step towards machine enculturation, the teaching of sociocultural values to machines."
44,Bringing stories alive: Generating interactive fiction worlds,82,2020,https://scholar.google.com/citations?view_op=view_citation&hl=en&user=Yg_QjxcAAAAJ&pagesize=50&citation_for_view=Yg_QjxcAAAAJ:Dip1O2bNi0gC,"Interactive fictions—also called text-based games—are games in which a player interacts with a virtual world purely through textual natural language. In this work, we focus on procedurally generating interactive fiction worlds. Generating these worlds requires (a) referencing everyday and thematic commonsense priors in addition to (b) being semantically consistent,(c) interesting,(d) coherent throughout, all while (e) producing fluent natural language descriptions of places, people, and things. Using existing story plots from books as inspiration, we present a method that first extracts a partial knowledge graph encoding basic information regarding world structure such as locations and objects. This knowledge graph is then automatically completed utilizing thematic knowledge and used to guide a neural language generation model that fleshes out the rest of the world. We evaluate generated worlds with human-participant studies, comparing our technique against rule-based and human-made baselines"
45,The Lovelace 2.0 test of artificial creativity and intelligence,79,2014,https://scholar.google.com/citations?view_op=view_citation&hl=en&user=Yg_QjxcAAAAJ&pagesize=50&citation_for_view=Yg_QjxcAAAAJ:mvPsJ3kp5DgC,"Observing that the creation of certain types of artistic artifacts necessitate intelligence, we present the Lovelace 2.0 Test of creativity as an alternative to the Turing Test as a means of determining whether an agent is intelligent. The Lovelace 2.0 Test builds off prior tests of creativity and additionally provides a means of directly comparing the relative intelligence of different agents."
