Rank,Title,Citations,Year,URL,Description
22,Cardiac arrhythmia,83,2008,https://scholar.google.com/citations?view_op=view_citation&hl=en&user=E6h84HUAAAAJ&pagesize=50&citation_for_view=E6h84HUAAAAJ:5nxA0vEk-isC,"Cardiac arrhythmia is the condition in which the heart's normal rhythm is disrupted. In this article, we describe the heart's normal sinus rhythm and a number of different types of disruptions of this rhythm and how dynamical systems can be used to understand the behavior of the heart in these circumstances.The heart pumps blood containing oxygen, nutrients, immune cells, and regulatory molecules to the body organs. The rhythm of the heart is set by a small region of cardiac muscle cells in the right atrium called the sinoatrial (SA) node that acts as a spontaneous pacemaker, but is under the control of nerves and circulating hormones that affect the heart rate via a host of control circuits that maintain adequate blood pressure and oxygenation. The heart itself is composed of two upper chambers, the atria, and two lower chambers, the ventricles, as shown in Figure 2."
23,Toward real-time simulation of cardiac dynamics,82,2011,https://scholar.google.com/citations?view_op=view_citation&hl=en&user=E6h84HUAAAAJ&pagesize=50&citation_for_view=E6h84HUAAAAJ:LkGwnXOMwfcC,"We show that through careful and model-specific optimizations of their GPU implementations, simulations of realistic, detailed cardiac-cell models now can be performed in 2D and 3D in times that are close to real time using a desktop computer. Previously, large-scale simulations of detailed mathematical models of cardiac cells were possible only using supercomputers. In our study, we consider five different models of cardiac electrophysiology that span a broad range of computational complexity: the two-variable Karma model, the four-variable Bueno-Orovio-Cherry-Fenton model, the eight-variable Beeler-Reuter model, the 19-variable Ten Tusscher-Panfilov model, and the 67-variable Iyer-Mazhari-Winslow model. For each of these models, we treat both their single- and double-precision versions and demonstrate linear or even sub-linear growth in simulation times with an increase in the size of the grid used to …"
24,Effects of boundaries and geometry on the spatial distribution of action potential duration in cardiac tissue,75,2011,https://scholar.google.com/citations?view_op=view_citation&hl=en&user=E6h84HUAAAAJ&pagesize=50&citation_for_view=E6h84HUAAAAJ:Se3iqnhoufwC,"Increased dispersion of action potential duration across cardiac tissue has long been considered an important substrate for the development of most electrical arrhythmias. Although this dispersion has been studied previously by characterizing the static intrinsic gradients in cellular electrophysiology and dynamical gradients generated by fast pacing, few studies have concentrated on dispersions generated solely by structural effects. Here we show how boundaries and geometry can produce spatially dependent changes in action potential duration (APD) in homogeneous and isotropic tissue, where all the cells have the same APD in the absence of diffusion. Electrotonic currents due to coupling within the tissue and at the tissue boundaries can generate dispersion, and the profile of this dispersion can change dramatically depending on tissue size and shape, action potential morphology, tissue dimensionality, and …"
25,Real-time interactive simulations of large-scale systems on personal computers and cell phones: Toward patient-specific heart modeling and other applications,73,2019,https://scholar.google.com/citations?view_op=view_citation&hl=en&user=E6h84HUAAAAJ&pagesize=50&citation_for_view=E6h84HUAAAAJ:NhqRSupF_l8C,"Cardiac dynamics modeling has been useful for studying and treating arrhythmias. However, it is a multiscale problem requiring the solution of billions of differential equations describing the complex electrophysiology of interconnected cells. Therefore, large-scale cardiac modeling has been limited to groups with access to supercomputers and clusters. Many areas of computational science face similar problems where computational costs are too high for personal computers so that supercomputers or clusters currently are necessary. Here, we introduce a new approach that makes high-performance simulation of cardiac dynamics and other large-scale systems like fluid flow and crystal growth accessible to virtually anyone with a modest computer. For cardiac dynamics, this approach will allow not only scientists and students but also physicians to use physiologically accurate modeling and simulation tools that are …"
26,A quantitative comparison of the behavior of human ventricular cardiac electrophysiology models in tissue,72,2014,https://scholar.google.com/citations?view_op=view_citation&hl=en&user=E6h84HUAAAAJ&pagesize=50&citation_for_view=E6h84HUAAAAJ:0EnyYjriUFMC,"Numerical integration of mathematical models of heart cell electrophysiology provides an important computational tool for studying cardiac arrhythmias, but the abundance of available models complicates selecting an appropriate model. We study the behavior of two recently published models of human ventricular action potentials, the Grandi-Pasqualini-Bers (GPB) and the O'Hara-Virág-Varró-Rudy (OVVR) models, and compare the results with four previously published models and with available experimental and clinical data. We find the shapes and durations of action potentials and calcium transients differ between the GPB and OVVR models, as do the magnitudes and rate-dependent properties of transmembrane currents and the calcium transient. Differences also occur in the steady-state and S1–S2 action potential duration and conduction velocity restitution curves, including a maximum conduction velocity for the OVVR model roughly half that of the GPB model and well below clinical values. Between single cells and tissue, both models exhibit differences in properties, including maximum upstroke velocity, action potential amplitude, and minimum diastolic interval. Compared to experimental data, action potential durations for the GPB and OVVR models agree fairly well (although OVVR epicardial action potentials are shorter), but maximum slopes of steady-state restitution curves are smaller. Although studies show alternans in normal hearts, it occurs only in the OVVR model, and only for a narrow range of cycle lengths. We find initiated spiral waves do not progress to sustained breakup for either model. The dominant spiral wave period of …"
27,Simultaneous quantification of spatially discordant alternans in voltage and intracellular calcium in langendorff-perfused rabbit hearts and inconsistencies with models of …,52,2017,https://scholar.google.com/citations?view_op=view_citation&hl=en&user=E6h84HUAAAAJ&pagesize=50&citation_for_view=E6h84HUAAAAJ:zA6iFVUQeVQC,"Rationale: Discordant alternans, a phenomenon in which the action potential duration (APDs) and/or intracellular calcium transient durations (CaDs) in different spatial regions of cardiac tissue are out of phase, present a dynamical instability for complex spatial dispersion that can be associated with long-QT syndrome (LQTS) and the initiation of reentrant arrhythmias. Because the use of numerical simulations to investigate arrhythmic effects, such as acquired LQTS by drugs is beginning to be studied by the FDA, it is crucial to validate mathematical models that may be used during this process. Objective: In this study, we characterized with high spatio-temporal resolution the development of discordant alternans patterns in transmembrane voltage (Vm) and intracellular calcium concentration ([Cai]+2) as a function of pacing period in rabbit hearts. Then we compared the dynamics to that of the latest state-of-the-art model for ventricular action potentials and calcium transients to better understand the underlying mechanisms of discordant alternans and compared the experimental data to the mathematical models representing Vm and [Cai]+2 dynamics. Methods and Results: We performed simultaneous dual optical mapping imaging of Vm and [Cai]+2 in Langendorff-perfused rabbit hearts with higher spatial resolutions compared with previous studies. The rabbit hearts developed discordant alternans through decreased pacing period protocols and we quantified the presence of multiple nodal points along the direction of wave propagation, both in APD and CaD, and compared these findings with results from theoretical models. In experiments, the …"
28,"Control and anticontrol of chaos in fractional-order models of Diabetes, HIV, Dengue, Migraine, Parkinson's and Ebola virus diseases",47,2021,https://scholar.google.com/citations?view_op=view_citation&hl=en&user=E6h84HUAAAAJ&pagesize=50&citation_for_view=E6h84HUAAAAJ:VOx2b1Wkg3QC,"This work investigates new fractional-order (FO) models of six chaotic diseases whose fractional dynamics have not been studied so far in literature. Here, we design and analyse suitable controllers to control chaos in these bio-mathematical models that show chaos and require stability; and anticontrollers to generate chaos where it is absent and turbulence may be sought. The proposed controllers and anticontrollers address the problem of the health hazards arising from the dysfunctionalities due to the impact of chaos in these biological models. Chaotic behaviour of vital parameters is characterised by extreme sensitivity, and their slight variations such as fall in density of β–cells, abnormal secretion of insulin in blood, small drop in the number of CD4+ T cells, etc. may lead to unpredictable complexities in the models. Also, the evolution of the chaotic attractor in the disease model is revealed only when the …"
29,Real-time computer simulations of excitable media: JAVA as a scientific language and as a wrapper for C and FORTRAN programs,45,2002,https://scholar.google.com/citations?view_op=view_citation&hl=en&user=E6h84HUAAAAJ&pagesize=50&citation_for_view=E6h84HUAAAAJ:hqOjcs7Dif8C,"We describe a useful setting for interactive, real-time study of mathematical models of cardiac electrical activity, using implicit and explicit integration schemes implemented in java. These programs are intended as a teaching aid for the study and understanding of general excitable media. Particularly for cardiac cell models and the ionic currents underlying their basic electrical dynamics. Within the programs, excitable media properties such as thresholds and refractoriness and their dependence on parameter values can be analyzed. In addition, the cardiac model applets allow the study of reentrant tachyarrhythmias using premature stimuli and conduction blocks to induce or to terminate reentrant waves of electrical activation in one and two dimensions. The role of some physiological parameters in the transition from tachycardia to fibrillation also can be analyzed by varying the maximum conductances of ion …"
30,Synchronization as a mechanism for low-energy anti-fibrillation pacing,42,2017,https://scholar.google.com/citations?view_op=view_citation&hl=en&user=E6h84HUAAAAJ&pagesize=50&citation_for_view=E6h84HUAAAAJ:ldfaerwXgEUC,"BackgroundLow-energy anti-fibrillation pacing (LEAP) has been suggested as an alternative treatment in symptomatic fibrillation patients. It significantly lowers the energy required compared with standard 1-shock defibrillation.ObjectiveIn this study, we investigated the mechanism of arrhythmia termination by LEAP and systematically analyzed the influence of shock period and timing on the success rate of LEAP.MethodsWe induced atrial and ventricular fibrillation in isolated canine hearts and applied LEAP and standard 1-shock defibrillation to terminate the arrhythmia. We simulated the arrhythmia and LEAP using a 2-dimensional bidomain human atrial model.ResultsThe ex vivo experiments showed successful termination of atrial fibrillation and ventricular fibrillation using LEAP, with an average 88% and 81% energy reduction, respectively, and both experiments and simulations verified that synchronization from …"
31,Reconstructing three-dimensional reentrant cardiac electrical wave dynamics using data assimilation,36,2016,https://scholar.google.com/citations?view_op=view_citation&hl=en&user=E6h84HUAAAAJ&pagesize=50&citation_for_view=E6h84HUAAAAJ:HDshCWvjkbEC,"For many years, reentrant scroll waves have been predicted and studied as an underlying mechanism for cardiac arrhythmias using numerical techniques, and high-resolution mapping studies using fluorescence recordings from the surfaces of cardiac tissue preparations have confirmed the presence of visible spiral waves. However, assessing the three-dimensional dynamics of these reentrant waves using experimental techniques has been limited to verifying stable scroll-wave dynamics in relatively thin preparations. We propose a different approach to recovering the three-dimensional dynamics of reentrant waves in the heart. By applying techniques commonly used in weather forecasting, we combine dual-surface observations from a particular experiment with predictions from a numerical model to reconstruct the full three-dimensional time series of the experiment. Here, we use model-generated surrogate …"
32,Efficient parameterization of cardiac action potential models using a genetic algorithm,35,2017,https://scholar.google.com/citations?view_op=view_citation&hl=en&user=E6h84HUAAAAJ&pagesize=50&citation_for_view=E6h84HUAAAAJ:3s1wT3WcHBgC,"Finding appropriate values for parameters in mathematical models of cardiac cells is a challenging task. Here, we show that it is possible to obtain good parameterizations in as little as 30–40 s when as many as 27 parameters are fit simultaneously using a genetic algorithm and two flexible phenomenological models of cardiac action potentials. We demonstrate how our implementation works by considering cases of “model recovery” in which we attempt to find parameter values that match model-derived action potential data from several cycle lengths. We assess performance by evaluating the parameter values obtained, action potentials at fit and non-fit cycle lengths, and bifurcation plots for fidelity to the truth as well as consistency across different runs of the algorithm. We also fit the models to action potentials recorded experimentally using microelectrodes and analyze performance. We find that our …"
33,Basis for the induction of tissue‐level phase‐2 reentry as a repolarization disorder in the brugada syndrome,33,2015,https://scholar.google.com/citations?view_op=view_citation&hl=en&user=E6h84HUAAAAJ&pagesize=50&citation_for_view=E6h84HUAAAAJ:ZeXyd9-uunAC,"Aims. Human action potentials in the Brugada syndrome have been characterized by delayed or even complete loss of dome formation, especially in the right ventricular epicardial layers. Such a repolarization pattern is believed to trigger phase‐2 reentry (P2R); however, little is known about the conditions necessary for its initiation. This study aims to determine the specific mechanisms that facilitate P2R induction in Brugada‐affected cardiac tissue in humans. Methods. Ionic models for Brugada syndrome in human epicardial cells were developed and used to study the induction of P2R in cables, sheets, and a three‐dimensional model of the right ventricular free wall. Results. In one‐dimensional cables, P2R can be induced by adjoining lost‐dome and delayed‐dome regions, as mediated by tissue excitability and transmembrane voltage profiles, and reduced coupling facilitates its induction. In two and three …"
34,Teaching cardiac electrophysiology modeling to undergraduate students: laboratory exercises and GPU programming for the study of arrhythmias and spiral wave dynamics,31,2011,https://scholar.google.com/citations?view_op=view_citation&hl=en&user=E6h84HUAAAAJ&pagesize=50&citation_for_view=E6h84HUAAAAJ:Zph67rFs4hoC,"As part of a 3-wk intersession workshop funded by a National Science Foundation Expeditions in Computing award, 15 undergraduate students from the City University of New York collaborated on a study aimed at characterizing the voltage dynamics and arrhythmogenic behavior of cardiac cells for a broad range of physiologically relevant conditions using an in silico model. The primary goal of the workshop was to cultivate student interest in computational modeling and analysis of complex systems by introducing them through lectures and laboratory activities to current research in cardiac modeling and by engaging them in a hands-on research experience. The success of the workshop lay in the exposure of the students to active researchers and experts in their fields, the use of hands-on activities to communicate important concepts, active engagement of the students in research, and explanations of the …"
35,Termination of equine atrial fibrillation by quinidine: an optical mapping study,31,2008,https://scholar.google.com/citations?view_op=view_citation&hl=en&user=E6h84HUAAAAJ&pagesize=50&citation_for_view=E6h84HUAAAAJ:8k81kl-MbHgC,"OBJECTIVE To perform the first optical mapping studies of equine atrium to assess the spatiotemporal dynamics of atrial fibrillation (AF) and of its termination by quinidine. ANIMALS Intact, perfused atrial preparations obtained from four horses with normal cardiovascular examinations. MATERIALS AND METHODS AF was induced by a rapid pacing protocol with or without acetylcholine perfusion, and optical mapping was used to determine spatial dominant frequency distributions, electrical activity maps, and single-pixel optical signals. Following induction of AF, quinidine gluconate was perfused into the preparation and these parameters were monitored during quinidine-induced termination of AF. RESULTS Equine AF develops in the context of spatial gradients in action potential duration (APD) and diastolic interval (DI) that produce alternans, conduction block, and Wenckebach conduction in different regions at …"
36,Spatiotemporal correlation uncovers characteristic lengths in cardiac tissue,29,2019,https://scholar.google.com/citations?view_op=view_citation&hl=en&user=E6h84HUAAAAJ&pagesize=50&citation_for_view=E6h84HUAAAAJ:D03iK_w7-QYC,"Complex spatiotemporal patterns of action potential duration have been shown to occur in many mammalian hearts due to period-doubling bifurcations that develop with increasing frequency of stimulation. Here, through high-resolution optical mapping experiments and mathematical modeling, we introduce a characteristic spatial length of cardiac activity in canine ventricular wedges via a spatiotemporal correlation analysis, at different stimulation frequencies and during fibrillation. We show that the characteristic length ranges from 40 to 20 cm during one-to-one responses and it decreases to a specific value of about 3 cm at the transition from period-doubling bifurcation to fibrillation. We further show that during fibrillation, the characteristic length is about 1 cm. Another significant outcome of our analysis is the finding of a constitutive phenomenological law obtained from a nonlinear fitting of experimental data which …"
37,Introduction to focus issue: Complex cardiac dynamics,28,2017,https://scholar.google.com/citations?view_op=view_citation&hl=en&user=E6h84HUAAAAJ&pagesize=50&citation_for_view=E6h84HUAAAAJ:rO6llkc54NcC,"Even after over a century of active research, the heart continues to reveal new complexities in behavior and remains difficult to understand fully. Multi-scale dynamics ranging from cellular and subcellular behavior to chambers of the heart and the full organ make analysis complicated. In addition, different types of heart functions, including electrical wave signaling, mechanical contraction, and blood flow, present separate challenges. Theory, numerical modeling, and experiments provide different contributions to our understanding of cardiac processes and behavior. This Focus Issue includes papers from across all these spectra and addresses a number of interesting open questions regarding the complex dynamics of the heart.Understanding the complex dynamics of the heart has proved to be a challenging problem that for many decades has attracted researchers from numerous fields ranging from physiology and …"
38,Distinguishing mechanisms for alternans in cardiac cells using constant-diastolic-interval pacing,28,2017,https://scholar.google.com/citations?view_op=view_citation&hl=en&user=E6h84HUAAAAJ&pagesize=50&citation_for_view=E6h84HUAAAAJ:HoB7MX3m0LUC,"Alternans, a proarrhythmic dynamical state in which cardiac action potentials alternate between long and short durations despite a constant pacing period, traditionally has been explained at the cellular level using nonlinear dynamics principles under the assumption that the action potential duration (APD) is determined solely by the time elapsed since the end of the previous action potential, called the diastolic interval (DI). In this scenario, APDs at a steady state should be the same provided that the preceding DIs are the same. Nevertheless, experiments attempting to eliminate alternans by dynamically adjusting the timing of pacing stimuli to keep the DI constant showed that alternans persisted, contradicting the traditional theory. It is now widely known that alternans also can arise from a different mechanism associated with intracellular calcium cycling. Our goal is to determine whether intracellular calcium …"
39,Shock-induced termination of reentrant cardiac arrhythmias: Comparing monophasic and biphasic shock protocols,28,2013,https://scholar.google.com/citations?view_op=view_citation&hl=en&user=E6h84HUAAAAJ&pagesize=50&citation_for_view=E6h84HUAAAAJ:kNdYIx-mwKoC,"In this article, we compare quantitatively the efficiency of three different protocols commonly used in commercial defibrillators. These are based on monophasic and both symmetric and asymmetric biphasic shocks. A numerical one–dimensional model of cardiac tissue using the bidomain formulation is used in order to test the different protocols. In particular, we performed a total of 4.8× 10 6 simulations by varying shock waveform, shock energy, initial conditions, and heterogeneity in internal electrical conductivity. Whenever the shock successfully removed the reentrant dynamics in the tissue, we classified the mechanism. The analysis of the numerical data shows that biphasic shocks are significantly more efficient (by about 25%) than the corresponding monophasic ones. We determine that the increase in efficiency of the biphasic shocks can be explained by the higher proportion of newly excited tissue through the …"
40,A machine-learning approach for long-term prediction of experimental cardiac action potential time series using an autoencoder and echo state networks,26,2022,https://scholar.google.com/citations?view_op=view_citation&hl=en&user=E6h84HUAAAAJ&pagesize=50&citation_for_view=E6h84HUAAAAJ:eMMeJKvmdy0C,"Computational modeling and experimental/clinical prediction of the complex signals during cardiac arrhythmias have the potential to lead to new approaches for prevention and treatment. Machine-learning (ML) and deep-learning approaches can be used for time-series forecasting and have recently been applied to cardiac electrophysiology. While the high spatiotemporal nonlinearity of cardiac electrical dynamics has hindered application of these approaches, the fact that cardiac voltage time series are not random suggests that reliable and efficient ML methods have the potential to predict future action potentials. This work introduces and evaluates an integrated architecture in which a long short-term memory autoencoder (AE) is integrated into the echo state network (ESN) framework. In this approach, the AE learns a compressed representation of the input nonlinear time series. Then, the trained encoder serves …"
41,Fatal arrhythmias: another reason why doctors remain cautious about chloroquine/hydroxychloroquine for treating COVID-19,26,2020,https://scholar.google.com/citations?view_op=view_citation&hl=en&user=E6h84HUAAAAJ&pagesize=50&citation_for_view=E6h84HUAAAAJ:WbkHhVStYXYC,"BackgroundEarly during the current coronavirus disease 19 (COVID-19) pandemic, hydroxychloroquine (HCQ) received a significant amount of attention as a potential antiviral treatment, such that it became one of the most commonly prescribed medications for COVID-19 patients. However, not only has the effectiveness of HCQ remained questionable, but mainly based on preclinical and a few small clinical studies, HCQ is known to be potentially arrhythmogenic, especially as a result of QT prolongation.ObjectiveThe purpose of this study was to investigate the arrhythmic effects of HCQ, as the heightened risk is especially relevant to COVID-19 patients, who are at higher risk for cardiac complications and arrhythmias at baseline.MethodsAn optical mapping technique utilizing voltage-sensitive fluorescent dyes was used to determine the arrhythmic effects of HCQ in ex vivo guinea pig and rabbit hearts perfused with …"
