Rank,Title,Citations,Year,URL,Description
42,"Large-scale interactive numerical experiments of chaos, solitons and fractals in real time via GPU in a web browser",26,2019,https://scholar.google.com/citations?view_op=view_citation&hl=en&user=E6h84HUAAAAJ&pagesize=50&citation_for_view=E6h84HUAAAAJ:abG-DnoFyZgC,"The study of complex systems has emerged as an important field with many discoveries still to be made. Computer simulation and visualization provide important tools for studying complex dynamics including chaos, solitons, and fractals, but available computing power has been a limiting factor. In this work, we describe a novel and highly efficient computing and visualization paradigm using a Web Graphics Library (WebGL 2.0) methodology along with our newly developed library (Abubu.js). Our approach harnesses the power of widely available and highly parallel graphics cards while maintaining ease of use by simplifying programming through hiding implementation details, running in a web browser without the need for compilation, and avoiding the use of plugins. At the same time, it allows for interactivity, such as changing parameter values on the fly, and its computing is so fast that zooming in on a region of a …"
43,Multi-band decomposition analysis: application to cardiac alternans as a function of temperature,25,2017,https://scholar.google.com/citations?view_op=view_citation&hl=en&user=E6h84HUAAAAJ&pagesize=50&citation_for_view=E6h84HUAAAAJ:2P1L_qKh6hAC,"Objective: It has long been known that variations in temperature can facilitate the development of cardiac arrhythmias. Here, we aim to quantify the effects of temperature on cardiac alternans properties. Approach: in this work, we use optical mapping recordings of canine ventricular epicardial preparations to demonstrate that hypothermia can promote the formation of alternans, which is an important precursor to potentially lethal arrhythmias like fibrillation. We then present a novel quantification of alternans properties for a broad range of cycle lengths under different thermal states. Specifically, we apply the recently developed multi-band-decomposition analysis (MBDA) in the context of cardiac action potential dynamics. Main Results: We show that the MBDA offers several advantages compared with traditional analysis of action potential durations. First, MBDA allows a depiction and quantification of the magnitude of …"
44,Long-time prediction of arrhythmic cardiac action potentials using recurrent neural networks and reservoir computing,24,2021,https://scholar.google.com/citations?view_op=view_citation&hl=en&user=E6h84HUAAAAJ&pagesize=50&citation_for_view=E6h84HUAAAAJ:fQNAKQ3IYiAC,"The electrical signals triggering the heart's contraction are governed by non-linear processes that can produce complex irregular activity, especially during or preceding the onset of cardiac arrhythmias. Forecasts of cardiac voltage time series in such conditions could allow new opportunities for intervention and control but would require efficient computation of highly accurate predictions. Although machine-learning (ML) approaches hold promise for delivering such results, non-linear time-series forecasting poses significant challenges. In this manuscript, we study the performance of two recurrent neural network (RNN) approaches along with echo state networks (ESNs) from the reservoir computing (RC) paradigm in predicting cardiac voltage data in terms of accuracy, efficiency, and robustness. We show that these ML time-series prediction methods can forecast synthetic and experimental cardiac action potentials for at least 15–20 beats with a high degree of accuracy, with ESNs typically two orders of magnitude faster than RNN approaches for the same network size."
45,Characterization of electrograms from multipolar diagnostic catheters during atrial fibrillation,24,2015,https://scholar.google.com/citations?view_op=view_citation&hl=en&user=E6h84HUAAAAJ&pagesize=50&citation_for_view=E6h84HUAAAAJ:M3ejUd6NZC8C,"Atrial fibrillation (AF) is the most common arrhythmia in USA with more than 2.3 million people affected annually. Catheter ablation procedure is a method for treatment of AF, which involves 3D electroanatomic mapping of the patient′s left atrium (LA) by maneuvering a conventional multipolar diagnostic catheter (MPDC) along the LA endocardial surface after which pulmonary vein (PV) isolation is performed, thus eliminating the AF triggers originating from the PVs. However, it remains unclear how to effectively utilize the information provided by the MPDC to locate the AF‐sustaining sites, known as sustained rotor‐like activities (RotAs). In this study, we use computer modeling to investigate the variations in the characteristics of the MPDC electrograms, namely, total conduction delay (TCD) and average cycle length (CL), as the MPDC moves towards a RotA source. Subsequently, a study with a human subject was …"
46,Representing variability and transmural differences in a model of human heart failure,23,2015,https://scholar.google.com/citations?view_op=view_citation&hl=en&user=E6h84HUAAAAJ&pagesize=50&citation_for_view=E6h84HUAAAAJ:9ZlFYXVOiuMC,"During heart failure (HF) at the cellular level, the electrophysiological properties of single myocytes get remodeled, which can trigger the occurrence of ventricular arrhythmias that could be manifested in many forms such as early afterdepolarizations (EADs) and alternans (ALTs). In this paper, based on experimentally observed human HF data, specific ionic and exchanger current strengths are modified from a recently developed human ventricular cell model: the O’Hara–Virág–Varró–Rudy (OVVR) model. A new transmural HF-OVVR model is developed that incorporates HF changes and variability of the observed remodeling. This new heterogeneous HF-OVVR model is able to replicate many of the failing action potential (AP) properties and the dynamics of both and in accordance with experimental data. Moreover, it is able to generate EADs for different cell types and exhibits ALTs at modest pacing …"
47,Contribution of the Purkinje network to wave propagation in the canine ventricle: insights from a combined electrophysiological-anatomical model,23,2012,https://scholar.google.com/citations?view_op=view_citation&hl=en&user=E6h84HUAAAAJ&pagesize=50&citation_for_view=E6h84HUAAAAJ:3fE2CSJIrl8C,"The heart includes a specialized conduction system that ensures the necessary activation sequence and timing of the ventricles to produce an effective contraction. The role of this system, called the Purkinje network, during ventricular tachyarrhythmias remains unclear. To understand how the Purkinje network interacts with ventricular muscle, we develop the first combined electrophysiology-structural model of the canine Purkinje network based on microelectrode recordings and a digitized reconstruction of the Purkinje system. For the Purkinje electrophysiology model, we construct a new model of canine Purkinje electrophysiology based on action potentials recorded from canine tissue and designed to reproduce the important phenomenon of alternans. In addition, we use digital photographs of canine ventricular endocardium stained with Lugol’s solution to develop a structural model of the Purkinje network. We …"
48,Characterization of multiple spiral wave dynamics as a stochastic predator-prey system,22,2008,https://scholar.google.com/citations?view_op=view_citation&hl=en&user=E6h84HUAAAAJ&pagesize=50&citation_for_view=E6h84HUAAAAJ:MXK_kJrjxJIC,"A perspective on systems containing many action potential waves that, individually, are prone to spiral wave breakup is proposed. The perspective is based on two quantities, “predator” and “prey,” which we define as the fraction of the system in the excited state and in the excitable but unexcited state, respectively. These quantities exhibited a number of properties in both simulations and fibrillating canine cardiac tissue that were found to be consistent with a proposed theory that assumes the existence of regions we call “domains of influence,” each of which is associated with the activity of one action potential wave. The properties include (i) a propensity to rotate in phase space in the same sense as would be predicted by the standard Volterra-Lotka predator-prey equations, (ii) temporal behavior ranging from near periodic oscillation at a frequency close to the spiral wave rotation frequency (“type-1” behavior) to …"
49,Image‐based structural modeling of the cardiac Purkinje network,21,2015,https://scholar.google.com/citations?view_op=view_citation&hl=en&user=E6h84HUAAAAJ&pagesize=50&citation_for_view=E6h84HUAAAAJ:L8Ckcad2t8MC,"The Purkinje network is a specialized conduction system within the heart that ensures the proper activation of the ventricles to produce effective contraction. Its role during ventricular arrhythmias is less clear, but some experimental studies have suggested that the Purkinje network may significantly affect the genesis and maintenance of ventricular arrhythmias. Despite its importance, few structural models of the Purkinje network have been developed, primarily because current physical limitations prevent examination of the intact Purkinje network. In previous modeling efforts Purkinje‐like structures have been developed through either automated or hand‐drawn procedures, but these networks have been created according to general principles rather than based on real networks. To allow for greater realism in Purkinje structural models, we present a method for creating three‐dimensional Purkinje networks based …"
50,Quantifying arrhythmic long qt effects of hydroxychloroquine and azithromycin with whole-heart optical mapping and simulations,20,2021,https://scholar.google.com/citations?view_op=view_citation&hl=en&user=E6h84HUAAAAJ&pagesize=50&citation_for_view=E6h84HUAAAAJ:LPZeul_q3PIC,"BackgroundIn March 2020, hydroxychloroquine (HCQ) alone or combined with azithromycin (AZM) was authorized as a treatment for COVID-19 in many countries. The therapy proved ineffective with long QT and deadly cardiac arrhythmia risks, illustrating challenges to determine the new safety profile of repurposed drugs.ObjectiveTo investigate proarrhythmic effects and mechanism of HCQ and AZM (combined and alone) with high doses of HCQ as in the COVID-19 clinical trials.MethodsProarrhythmic effects of HCQ and AZM are quantified using optical mapping with voltage-sensitive dyes in ex vivo Langendorff-perfused guinea pig (GP) hearts and with numerical simulations of a GP Luo-Rudy and a human O’Hara-Virag-Varro-Rudy models, for Epi, Endo, and M cells, in cell and tissue, incorporating the drug’s effect on cell membrane ionic currents.ResultsExperimentally, HCQ alone and combined with AZM …"
