Rank,Title,Citations,Year,URL,Description
1,Accretion onto intermediate-mass black holes regulated by radiative feedback. I. Parametric study for spherically symmetric accretion,169,2011,https://scholar.google.com/citations?view_op=view_citation&hl=en&user=CpVsPWEAAAAJ&pagesize=50&citation_for_view=CpVsPWEAAAAJ:zYLM7Y9cAGgC,"We study the effect of radiative feedback on accretion onto intermediate-mass black holes (IMBHs) using the hydrodynamical code ZEUS-MP with a radiative transfer algorithm. In this paper, the first of a series, we assume accretion from a uniformly dense gas with zero angular momentum and extremely low metallicity. Our one-dimensional (1D) and 2D simulations explore how X-ray and UV radiation emitted near the black hole regulates the gas supply from large scales. Both 1D and 2D simulations show similar accretion rates and periods between peaks in accretion, meaning that the hydro-instabilities that develop in 2D simulations do not affect the mean flow properties. We present a suite of simulations exploring accretion across a large parameter space, including different radiative efficiencies and radiation spectra, black hole masses, density, and temperature, T∞, of the neighboring gas. In agreement with …"
2,Accretion onto black holes from large scales regulated by radiative feedback. II. Growth rate and duty cycle,144,2012,https://scholar.google.com/citations?view_op=view_citation&hl=en&user=CpVsPWEAAAAJ&pagesize=50&citation_for_view=CpVsPWEAAAAJ:Tyk-4Ss8FVUC,"This paper, the second in a series on radiation-regulated accretion onto black holes (BHs) from galactic scales, focuses on the effects of radiation pressure and angular momentum of the accreting gas. We simulate accretion onto intermediate-mass black holes, but we derive general scaling relationships that are solutions of the Bondi problem with radiation feedback valid for any mass of the BH Mbh. Thermal pressure of the ionized sphere around the BH regulates the accretion rate, producing periodic and short-lived luminosity bursts. We find that for ambient gas densities exceeding ncrH, ∞∝M−1bh, the period of the oscillations decreases rapidly and the duty cycle increases from 6%, in agreement with observations of the fraction of active galactic nuclei at z ∼ 3, to 50%. The mean accretion rate becomes Eddington limited for nH, ∞ > nEddH, ∞ ≃ ncrH, ∞T∞, 4−1 where T∞, 4 is the gas temperature in units of …"
3,Accretion onto black holes from large scales regulated by radiative feedback. III. Enhanced luminosity of intermediate-mass black holes moving at supersonic speeds,91,2013,https://scholar.google.com/citations?view_op=view_citation&hl=en&user=CpVsPWEAAAAJ&pagesize=50&citation_for_view=CpVsPWEAAAAJ:u5HHmVD_uO8C,"In this third paper of a series, we study the growth and luminosity of black holes (BHs) in motion with respect to their surrounding medium. We run a large set of two-dimensional axis-symmetric simulations to explore a large parameter space of initial conditions and formulate an analytical model for the accretion. Contrary to the case without radiation feedback, the accretion rate increases with increasing BH velocity vbh reaching a maximum value at vbh = 2cs, in ∼ 50 km s−1, where cs, in is the sound speed inside the “cometary-shaped” H ii region around the BH, before decreasing as when the ionization front (I-front) becomes R-type (rarefied) and the accretion rate approaches the classical Bondi–Hoyle–Lyttleton solution. The increase of the accretion rate with vbh is produced by the formation of a D-type (dense) I-front preceded by a standing bow shock that reduces the downstream gas velocity to transonic …"
4,Gaseous dynamical friction in presence of black hole radiative feedback,56,2017,https://scholar.google.com/citations?view_op=view_citation&hl=en&user=CpVsPWEAAAAJ&pagesize=50&citation_for_view=CpVsPWEAAAAJ:u-x6o8ySG0sC,"Dynamical friction is thought to be a principal mechanism responsible for orbital evolution of massive black holes (MBHs) in the aftermath of galactic mergers and an important channel for formation of gravitationally bound MBH binaries. We use 2D radiative hydrodynamic simulations to investigate the efficiency of dynamical friction in the presence of radiative feedback from an MBH moving through a uniform density gas. We find that ionizing radiation that emerges from the innermost parts of the MBH’s accretion flow strongly affects the dynamical friction wake and renders dynamical friction inefficient for a range of physical scenarios. MBHs in this regime tend to experience positive net acceleration, meaning that they speed up, contrary to the expectations for gaseous dynamical friction in absence of radiative feedback. The magnitude of this acceleration is however negligibly small and should not significantly alter the …"
5,Bulge-driven fueling of seed black holes,40,2016,https://scholar.google.com/citations?view_op=view_citation&hl=en&user=CpVsPWEAAAAJ&pagesize=50&citation_for_view=CpVsPWEAAAAJ:UeHWp8X0CEIC,"We examine radiation-regulated accretion onto intermediate-mass and massive black holes (BHs) embedded in a bulge component. Using spherically symmetric one-dimensional radiation-hydrodynamics simulations, we track the growth of BHs accreting from a cold, neutral gas reservoir with temperature <?MML T ∞ = 10 4 ?> K. We find that the accretion rate of BHs embedded in bulges is proportional to <?MML r B,eff / r B ?> , where rB,eff is the increased effective Bondi radius that includes the gravitational potential of the bulge, and rB is the Bondi radius of the BH. The radiative feedback from the BH suppresses the cold accretion rate to ∼1% of the Bondi rate when a bulge is not considered. However, we find that the BH fueling rate increases rapidly when the bulge mass Mbulge is greater than the critical value of ∼106 M☉ and is proportional to <?MML r B,eff / r B ≃ M bulge …"
6,The interplay of kinetic and radiative feedback in galaxy clusters,31,2019,https://scholar.google.com/citations?view_op=view_citation&hl=en&user=CpVsPWEAAAAJ&pagesize=50&citation_for_view=CpVsPWEAAAAJ:0EnyYjriUFMC,"Recent observations provide evidence that some cool-core clusters host quasars in their brightest cluster galaxies (BCGs). Motivated by these findings, we use 3D radiation-hydrodynamic simulations with the code Enzo to explore the joint role of kinetic and radiative feedback from supermassive black holes (SMBHs) in BCGs. We implement kinetic feedback as subrelativistic plasma outflows and model radiative feedback using ray-tracing radiative transfer or thermal energy injection. In our simulations, the central SMBH transitions between the radiatively efficient and radiatively inefficient states on timescales of a few gigayears, as a function of its accretion rate. The timescale for this transition depends primarily on the fraction of power allocated to each feedback mode, and to a lesser degree on the overall feedback luminosity of the active galactic nucleus (AGN). Specifically, we find that (a) kinetic feedback must be …"
7,Dusty Gas Accretion onto Massive Black Holes and Infrared Diagnosis of the Eddington Ratio,29,2017,https://scholar.google.com/citations?view_op=view_citation&hl=en&user=CpVsPWEAAAAJ&pagesize=50&citation_for_view=CpVsPWEAAAAJ:hqOjcs7Dif8C,"Evidence for dust around supermassive black holes (SMBHs) in the early universe is strongly suggested by recent observations. However, the accretion mechanism of SMBHs in dusty gas is not well understood yet. We investigate the growth of intermediate-mass black holes (IMBHs) of in dusty clouds by using one-dimensional radiative-hydrodynamics simulations. We find that the accretion of dusty gas onto IMBHs proceeds gently with small fluctuations of the accretion rate, whereas that of pristine gas causes more violent periodic bursts. At dust-to-gas mass ratios similar to the solar neighborhood, the time-averaged luminosity becomes smaller than that for primordial gas by one order of magnitude and the time-averaged Eddington ratio ranges from to in clouds with initial gas densities of . Our calculations show that the effect of dust opacity alone is secondary compared to the radiation pressure on …"
8,Radiation-driven turbulent accretion onto massive black holes,18,2017,https://scholar.google.com/citations?view_op=view_citation&hl=en&user=CpVsPWEAAAAJ&pagesize=50&citation_for_view=CpVsPWEAAAAJ:Se3iqnhoufwC,"Accretion of gas and interaction of matter and radiation are at the heart of many questions pertaining to black hole (BH) growth and coevolution of massive BHs and their host galaxies. To answer them, it is critical to quantify how the ionizing radiation that emanates from the innermost regions of the BH accretion flow couples to the surrounding medium and how it regulates the BH fueling. In this work, we use high-resolution three-dimensional (3D) radiation-hydrodynamic simulations with the code Enzo, equipped with adaptive ray-tracing module Moray, to investigate radiation-regulated BH accretion of cold gas. Our simulations reproduce findings from an earlier generation of 1D/2D simulations: the accretion-powered UV and X-ray radiation forms a highly ionized bubble, which leads to suppression of BH accretion rate characterized by quasi-periodic outbursts. A new feature revealed by the 3D simulations is the …"
9,Luminosity function of [O ii] emission-line galaxies in the MassiveBlack-II simulation,18,2015,https://scholar.google.com/citations?view_op=view_citation&hl=en&user=CpVsPWEAAAAJ&pagesize=50&citation_for_view=CpVsPWEAAAAJ:LkGwnXOMwfcC,"We examine the luminosity function (LF) of [O ii] emission-line galaxies in the high-resolution cosmological simulation MassiveBlack-II (MBII). From the spectral energy distribution of each galaxy, we select a sub-sample of star-forming galaxies at 0.06 ≤ z ≤ 3.0 using the [O ii] emission line luminosity L([O ii]). We confirm that the specific star formation rate matches that in the Galaxy And Mass Assembly survey. We show that the [O ii] LF at z = 1.0 from the MBII shows good agreement with the LFs from several surveys below L([O ii]) = 1043.0 erg s−1 while the low redshifts (z ≤ 0.3) show an excess in the prediction of bright [O ii] galaxies, but still displaying a good match with observations below L([O ii]) = 1041.6 erg s−1. Based on the validity in reproducing the properties of [O ii] galaxies at low redshift (z ≤ 1), we forecast the evolution of the [O ii] LF at high redshift (z ≤ 3), which can be tested by …"
10,Rayleigh–Taylor instability of ionization front around black holes,17,2014,https://scholar.google.com/citations?view_op=view_citation&hl=en&user=CpVsPWEAAAAJ&pagesize=50&citation_for_view=CpVsPWEAAAAJ:Y0pCki6q_DkC,"We examine the role of ionizing radiation emitted from black holes (BHs) in suppressing the growth of the Rayleigh–Taylor instability (RTI) across the ionization front (I-front) that forms when the gas fuelling the BH is neutral. We use radiation-hydrodynamic simulations to show that the RTI is suppressed for non-accelerating fronts on all scales resolved in our simulations. A necessary condition for the stability of the I-front is that the radius of the Strömgren sphere is larger than the Bondi radius. When this condition is violated, the I-front collapses producing an accretion luminosity burst. Transient growth of the RTI occurs only during the accretion burst when the effective acceleration in the frame of reference of the I-front increases significantly due to the rapid expansion of the Strömgren sphere."
11,Biconical-dominated accretion flow onto seed black holes in a hyperaccretion regime,11,2020,https://scholar.google.com/citations?view_op=view_citation&hl=en&user=CpVsPWEAAAAJ&pagesize=50&citation_for_view=CpVsPWEAAAAJ:kNdYIx-mwKoC,"Hyperaccretion occurs when the gas inflow rate onto a black hole (BH) is so high that the radiative feedback cannot reverse the accretion flow. This extreme process is a promising mechanism for the rapid growth of seed BHs in the early universe, which can explain high-redshift quasars powered by billion solar mass BHs. In theoretical models, spherical symmetry is commonly adopted for hyperaccretion flows; however, the sustainability of such structures on timescales corresponding to the BH growth has not been addressed yet. Here we show that stochastic interactions between the ionizing radiation from the BH and nonuniform accretion flow can lead to the formation of a rotating gas disk around the BH. Once the disk forms, the supply of gas to the BH preferentially occurs via biconical-dominated accretion flow perpendicular to the disk, avoiding the centrifugal barrier of the disk. Biconical dominated accretion …"
12,The role of Compton heating in radiation-regulated accretion on to black holes,10,2014,https://scholar.google.com/citations?view_op=view_citation&hl=en&user=CpVsPWEAAAAJ&pagesize=50&citation_for_view=CpVsPWEAAAAJ:9yKSN-GCB0IC,"We investigate the role of Compton heating in radiation-regulated accretion on to black holes (BHs) from a neutral dense medium using 1D radiation-hydrodynamic simulations. We focus on the relative effects of Compton-heating and photoheating as a function of the spectral slope α, assuming a power-law spectrum in the energy range of 13.6 eV–100 keV. While Compton heating is dominant only close to the BH, it can reduce the accretion rate to 0.1 ( model)–0.01 per cent ( model) of the Bondi accretion rate when the BH radiation is hard (α ∼ 1), where l and are the luminosity and accretion rate normalized by Eddington rates, respectively. The oscillatory behaviour otherwise typically seen in simulations with α > 1, become suppressed when α ∼ 1 only for the model. The relative importance of the Compton heating over photoheating decreases and the oscillatory behaviour becomes stronger as …"
13,Accelerated growth of seed black holes by dust in the early universe,6,2022,https://scholar.google.com/citations?view_op=view_citation&hl=en&user=CpVsPWEAAAAJ&pagesize=50&citation_for_view=CpVsPWEAAAAJ:ZeXyd9-uunAC,"We explore the effect of dust on the growth of seed black holes (BHs) in the early universe. Previous 1D radiation-hydrodynamic (RHD) simulations show that increased radiation pressure on dust further suppresses the accretion rate than the case for the chemically pristine gas. Using the Enzo+Moray code, we perform a suite of 3D RHD simulations of accreting BHs in a dusty interstellar medium (ISM). We use the modified Grackle cooling library to consider dust physics in its nonequilibrium chemistry. The BH goes through an early evolutionary phase, where ionizing BH radiation creates an oscillating H ii region as it cycles between accretion and feedback. As the simulations proceed, dense cold gas accumulates outside the ionized region where inflow from the neutral medium meets the outflow driven by radiation pressure. In the late phase, high-density gas streams develop and break the quasi-spherical …"
14,"Erratum:“Gaseous Dynamical Friction in Presence of Black Hole Radiative Feedback”(2017, ApJ, 838, 103)",6,2019,https://scholar.google.com/citations?view_op=view_citation&hl=en&user=CpVsPWEAAAAJ&pagesize=50&citation_for_view=CpVsPWEAAAAJ:IWHjjKOFINEC,"The fifth and sixth sentences should read:“The magnitude of this acceleration is∼ 60% of the classical value in the absence of radiative feedback, implying that MBHs in this regime may accelerate significantly over timescales that determine their motion and properties of their environment. Our results suggest that MBHs at the lower-mass end of the spectrum are more likely to find themselves in the negative dynamical friction regime, which, compounded with inefficiency of the gas drag for lower-mass objects in general, implies that< 10 7 M⊙ MBHs have fewer means to reach the centers of merged galaxies.”"
15,Feedback-regulated accretion onto the first black holes,4,2012,https://scholar.google.com/citations?view_op=view_citation&hl=en&user=CpVsPWEAAAAJ&pagesize=50&citation_for_view=CpVsPWEAAAAJ:W7OEmFMy1HYC,"We study radiation-regulated gas accretion onto black holes (BHs) from galactic scales emphasizing the role of thermal and radiation pressures in limiting gas supply to the BH. We explore how the gas accretion depends on free parameters such as radiative efficiency, BH mass, ambient gas density/temperature, and the spectrum of the emitted radiation assuming simple initial conditions, as in the Bondi-Hoyle-Lyttleton problem. Our numerical simulations show an oscillatory behavior of the accretion rate, and thus the luminosity from the BH. We present a model for the feedback loop and provide analytical relationships for the accretion rate and the period of the accretion bursts. For stationary BHs the mean accretion rate is always less than 1% of the Bondi rate, and the period of the luminosity bursts is proportional to the average size of the ionized hot bubble. We discover that there are two distinct modes of …"
16,Accretion onto black holes from large scales regulated by radiative feedback,2,2012,https://scholar.google.com/citations?view_op=view_citation&hl=en&user=CpVsPWEAAAAJ&pagesize=50&citation_for_view=CpVsPWEAAAAJ:d1gkVwhDpl0C,"This thesis focuses on radiation-regulated gas accretion onto black holes (BHs) from galactic scales emphasizing the role of thermal and radiation pressure in limiting gas supply to the BH. Assuming quasi-spherical symmetry, we explore how the gas accretion depends on free parameters such as radiative efficiency, BH mass, ambient gas density/temperature, and the spectral index of the radiation. Our numerical simulations show an oscillatory behavior of the accretion rate, and thus the luminosity from the BH. We present a model for the feedback loop and provide analytical relationships for the average/maximum accretion rate and the period of the accretion bursts. The thermal structure inside the Strömgren sphere is a key factor for the regulation process, while with increasing ambient gas density and mass of BHs eventually the accretion rate becomes limited by radiation pressure. The period of the luminosity …"
17,Accretion Onto Intermediate-mass Black Holes Regulated By Radiative Feedback,1,2010,https://scholar.google.com/citations?view_op=view_citation&hl=en&user=CpVsPWEAAAAJ&pagesize=50&citation_for_view=CpVsPWEAAAAJ:eQOLeE2rZwMC,"We study gas accretion onto intermediate mass black holes regulated by radiation feedback. We utilize the hydrodynamical code ZEUS-MP with the addition of a ray-tracing module. Our 1D and 2D simulations provide insight into how heating by X-ray and UV radiation influences the gas accretion rate. This allows us to determine how rapidly the first intermediate mass black holes can grow in the early Universe. We confirm the existence of an oscillatory behavior of the accretion rate and we parametrize the accretion duty cycle as a function of the black hole mass, radiative efficiency and interstellar gas properties. We also run simulations of moving intermediate mass black holes."
18,"Gaseous Dynamical Friction in Presence of Black Hole Radiative Feedback (vol 838, pg 103, 2019)",0,2019,https://scholar.google.com/citations?view_op=view_citation&hl=en&user=CpVsPWEAAAAJ&pagesize=50&citation_for_view=CpVsPWEAAAAJ:qUcmZB5y_30C,Description not available
19,AGN feedback in galaxy clusters driven by intermittent accretion of cold gas,0,2019,https://scholar.google.com/citations?view_op=view_citation&hl=en&user=CpVsPWEAAAAJ&pagesize=50&citation_for_view=CpVsPWEAAAAJ:8k81kl-MbHgC,"Recent observations of cool core clusters provide evidence that the presence of cold, atomic and molecular gas in their centers is more common than previously expected. This finding has important implications for the fueling of and feedback from the supermassive black holes (SMBHs) located in central cluster galaxies. Motivated by it, we run a suite of 2D and 3D hydrodynamic simulations to study the efficiency of radio-mode feedback driven by intermittent accretion of cold gas on the central SMBH. This type of fueling drives strong and recurrent AGN feedback episodes, whose duty cycle is determined by the presence of cold gas in the vicinity of the central SMBH. We find that intermittent AGN jets, with duty cycles shorter than the gas cooling time scale at the central region, are considerably more effective in suppressing the cooling flow than steady jets, the power of which does not significantly vary over time …"
20,The Interplay of Radiative and Kinetic Feedback in Galaxy Clusters,0,2019,https://scholar.google.com/citations?view_op=view_citation&hl=en&user=CpVsPWEAAAAJ&pagesize=50&citation_for_view=CpVsPWEAAAAJ:5nxA0vEk-isC,"Motivated by recent observational findings that some cool-core clusters (CCCs) host quasars in their brightest cluster galaxies (BCGs), we use 3D radiation-hydrodynamic simulations to explore the joint role of the radiative and kinetic feedback from supermassive black holes (SMBHs) in BCGs. In our simulations, the central SMBH transitions between the radiatively efficient and radiatively inefficient states on time scales of a few Gyr, as a function of its accretion rate. The time scale for this transition depends on the fraction of power allocated to each feedback mode, and the overall feedback luminosity of the active galactic nucleus (AGN). We find that (a) kinetic feedback must be present at both low and high accretion rates in order to prevent the cooling catastrophe, and (b) its contribution likely accounts for> 10% of the total AGN feedback power, since below this threshold simulated BCGs tend to host radio-loud …"
21,Accretion and feedback from supermassive black holes in galaxy clusters,0,2019,https://scholar.google.com/citations?view_op=view_citation&hl=en&user=CpVsPWEAAAAJ&pagesize=50&citation_for_view=CpVsPWEAAAAJ:WF5omc3nYNoC,"A significant fraction of galaxy clusters, namely the cool-core clusters (CCCs), exhibit a dip in their central temperature profiles, with radiative cooling times much shorter than the Hubble time. Unchecked, radiative cooling of this magnitude is expected to cause the accumulation of cold gas at the cluster center that leads to star formation rates 100-1000 times higher than those inferred by observations. This discrepancy suggests the existence of active heating mechanisms that counteract the overcooling in cluster centers. The dominant mechanism has now been widely recognized as the kinetic feedback from the radio-loud active galactic nuclei (AGNs). Recent observations however find substantial amounts of cold gas in a number of CCCs, as well as evidence that some clusters host quasars in their brightest cluster galaxies, raising questions about the significance of radiative feedback in such systems. In this work …"
22,Efficiency of Dynamical Friction in Presence of Black Hole Radiative Feedback,0,2017,https://scholar.google.com/citations?view_op=view_citation&hl=en&user=CpVsPWEAAAAJ&pagesize=50&citation_for_view=CpVsPWEAAAAJ:roLk4NBRz8UC,"Dynamical friction is a physical mechanism thought to be responsible for pairing of supermassive black holes (SMBHs) in the aftermath of galactic mergers. It arises when a massive perturber traveling through a background medium creates in it a density wake. The wake, which trails the perturber on its trajectory, causes it to slow down by gravitational interaction. In the case of gas rich galactic mergers, dynamical friction allows the SMBHs immersed in gas to shed orbital energy and angular momentum and to sink to the center of the newly formed galaxy where they can form gravitationally bound pairs. The SMBHs which are subject to gaseous dynamical friction inevitably accrete some of the surrounding gas, giving rise to the emission of ionizing radiation that emerges from the innermost parts of their accretion flows. This radiation can dramatically modify the thermodynamic properties of the surrounding gas …"
23,Model for coeval growth of bulges and their seed black holes in presence of radiative feedback,0,2017,https://scholar.google.com/citations?view_op=view_citation&hl=en&user=CpVsPWEAAAAJ&pagesize=50&citation_for_view=CpVsPWEAAAAJ:YsMSGLbcyi4C,"The discovery of billion solar mass accreting black holes at high redshift poses a great challenge for the modeling of the seed black hole (BH) formation and growth. Radiation-hydrodynamic simulations represent a crucial test of plausible scenarios by providing estimated growth rates for the seeds in the intermediate-mass black hole range. Previous works show that radiative feedback from black holes suppresses the cold gas accretion rate dramatically, making it difficult to explain the rapid growth of seed black holes. We however find that the fueling rate of black holes embedded in bulges can increase with the bulge-to-BH mass ratio when the bulge mass is greater than the critical value of∼ 10 6 M⊙. The critical bulge mass is independent of the central black hole mass, thus the growth rate of light seeds (< 10 2 M⊙) and heavy seed black holes (> 10 5 M⊙) exhibits distinct dependencies on the bulge-to-BH mass …"
