Rank,Title,Citations,Year,URL,Description
1,PRADA: A practical model for integrating computational thinking in K-12 education,154,2019,https://scholar.google.com/citations?view_op=view_citation&hl=en&user=U-Dk-1QAAAAJ&pagesize=50&citation_for_view=U-Dk-1QAAAAJ:UebtZRa9Y70C,"One way to increase access to education on computing is to integrate computational thinking (CT) into K12 disciplinary courses. However, this challenges teachers to both learn CT and decide how to best integrate CT into their classes. In this position paper, we present PRADA, an acronym for Pattern Recognition, Abstraction, Decomposition, and Algorithms, as a practical and understandable way of introducing the core ideas of CT to non-computing teachers. We piloted the PRADA model in two, separate, week-long professional development workshops designed for in-service middle and high school teachers and found that the PRADA model supported teachers in making connections between CT and their current course material. Initial findings, which emerged from the analysis of teacher-created learning materials, survey responses, and focus group interviews, indicate that the PRADA model supported core …"
2,"Use, modify, create: Comparing computational thinking lesson progressions for stem classes",143,2019,https://scholar.google.com/citations?view_op=view_citation&hl=en&user=U-Dk-1QAAAAJ&pagesize=50&citation_for_view=U-Dk-1QAAAAJ:0EnyYjriUFMC,"Computational Thinking (CT) is being infused into curricula in a variety of core K-12 STEM courses. As these topics are being introduced to students without prior programming experience and are potentially taught by instructors unfamiliar with programming and CT, appropriate lesson design might help support both students and teachers. ""Use-Modify-Create"" (UMC), a CT lesson progression, has students ease into CT topics by first ""Using"" a given artifact, ""Modifying"" an existing one, and then eventually ""Creating"" new ones. While studies have presented lessons adopting and adapting this progression and advocating for its use, few have focused on evaluating UMC's pedagogical effectiveness and claims. We present a comparison study between two CT lesson progressions for middle school science classes. Students participated in a 4-day activity focused on developing an agent-based simulation in a block …"
3,"Code, connect, create: The 3c professional development model to support computational thinking infusion",77,2020,https://scholar.google.com/citations?view_op=view_citation&hl=en&user=U-Dk-1QAAAAJ&pagesize=50&citation_for_view=U-Dk-1QAAAAJ:aqlVkmm33-oC,"Despite the increasing attention to infusing CT into middle and high school content area classrooms, there is a lack of information about the most effective practices and models to support teachers in their efforts to integrate disciplinary content and CT principles. To address this need, this paper proposes the Code, Connect and Create (3C) professional development (PD) model, which was designed to support middle and high school content area teachers in infusing computational thinking into their classrooms. To evaluate the model, we analyzed quantitative and qualitative data collected from Infusing Computing PD workshops designed for in-service science, math, English language arts, and social studies teachers located in two Southeastern states. Drawing on findings from our analysis of teacher-created learning segments, surveys, and interviews, we argue that the 3C professional development model …"
4,The impact of adding textual explanations to next-step hints in a novice programming environment,69,2019,https://scholar.google.com/citations?view_op=view_citation&hl=en&user=U-Dk-1QAAAAJ&pagesize=50&citation_for_view=U-Dk-1QAAAAJ:Zph67rFs4hoC,"Automated hints, a powerful feature of many programming environments, have been shown to improve students' performance and learning. New methods for generating these hints use historical data, allowing them to scale easily to new classrooms and contexts. These scalable methods often generate next-step, code hints that suggest a single edit for the student to make to their code. However, while these code hints tell the student what to do, they do not explain why, which can make these hints hard to interpret and decrease students' trust in their helpfulness. In this work, we augmented code hints by adding adaptive, textual explanations in a block-based, novice programming environment. We evaluated their impact in two controlled studies with novice learners to investigate how our results generalize to different populations. We measured the impact of textual explanations on novices' programming performance …"
5,A comparison of the quality of data-driven programming hint generation algorithms,66,2019,https://scholar.google.com/citations?view_op=view_citation&hl=en&user=U-Dk-1QAAAAJ&pagesize=50&citation_for_view=U-Dk-1QAAAAJ:YsMSGLbcyi4C,"In the domain of programming, a growing number of algorithms automatically generate data-driven, next-step hints that suggest how students should edit their code to resolve errors and make progress. While these hints have the potential to improve learning if done well, few evaluations have directly assessed or compared the quality of different hint generation approaches. In this work, we present the QualityScore procedure, a novel method for automatically evaluating and comparing the quality of next-step programming hints using expert ratings. We first demonstrate that the automated QualityScore ratings agree with experts’ manual ratings. We then use the QualityScore procedure to compare the quality of six data-driven, next-step hint generation algorithms using two distinct programming datasets in two different programming languages. Our results show that there are large and significant differences between …"
6,Infusing computational thinking into middle grade science classrooms: lessons learned,48,2018,https://scholar.google.com/citations?view_op=view_citation&hl=en&user=U-Dk-1QAAAAJ&pagesize=50&citation_for_view=U-Dk-1QAAAAJ:4DMP91E08xMC,"There is a growing need to present all students with an opportunity to learn computer science and computational thinking (CT) skills during their primary and secondary education. Traditionally, these opportunities are available outside of the core curriculum as stand-alone courses often taken by those with preparatory privilege. Researchers have identified the need to integrate CT into core classes to provide equitable access to these critical skills. We have worked in a research-practice partnership with two magnet middle schools focused on digital sciences to develop and implement computational thinking into life sciences classes. In this report, we present initial lessons learned while conducting our design-based implementation research on integrating computational thinking into middle school science classes. These case studies suggest that several factors including teacher engagement, teacher attitudes …"
7,Reducing the state space of programming problems through data-driven feature detection,41,2018,https://scholar.google.com/citations?view_op=view_citation&hl=en&user=U-Dk-1QAAAAJ&pagesize=50&citation_for_view=U-Dk-1QAAAAJ:2osOgNQ5qMEC,"The large state space of programming problems makes providing adaptive support in intelligent tutoring systems (ITSs) difficult. Reducing the state space size could allow for more interpretable analysis of student progress as well as easier integration of data-driven support. Using data collected from a CS0 course, we present a procedure for defining a small but meaningful programming state space based on the presence or absence of features of correct solution code. We present a procedure to create these features using a panel of human experts, as well as a data-driven method to derive them automatically. We compare the expert and data-driven features, the resulting state spaces, and how student progress through them. We show that both approaches dramatically reduce the state-space compared to traditional code-states and that the data-driven approach has high overlap with the expert features. We conclude by discussing how this feature-state space provides a useful platform for integrating data-driven support methods into ITSs."
8,Crescendo: Engaging students to self-paced programming practices,37,2020,https://scholar.google.com/citations?view_op=view_citation&hl=en&user=U-Dk-1QAAAAJ&pagesize=50&citation_for_view=U-Dk-1QAAAAJ:roLk4NBRz8UC,"This paper introduces Crescendo, a self-paced programming practice environment that combines the block-based and visual, interactive programming of Snap!, with the structured practices commonly found in Drill-and-Practice Environments. Crescendo supports students with Parsons problems to reduce problem complexity, Use-Modify-Create task progressions to gradually introduce new programming concepts, and automated feedback and assessment to support learning. In this work, we report on our experience deploying Crescendo in a programming camp for middle school students, as well as in an introductory university course for non-majors. Our initial results from field observations and log data suggest that the support features in Crescendo kept students engaged and allowed them to progress through programming concepts quickly. However, some students still struggled even with these highly-structured …"
9,Toward Data-Driven Example Feedback for Novice Programming.,33,2019,https://scholar.google.com/citations?view_op=view_citation&hl=en&user=U-Dk-1QAAAAJ&pagesize=50&citation_for_view=U-Dk-1QAAAAJ:4TOpqqG69KYC,"Viewing worked examples before problem solving has been shown to improve learning efficiency in novice programming. Example-based feedback seeks to present smaller, adaptive worked example steps during problem solving. We present a method for automatically generating and selecting adaptive, example-based programming feedback using historical student data. Our data-driven feature-based (DDF) example generation method automatically learns program features from data and selects example pairs based on when students complete each feature. We performed an experiment to compare three example generation methods: Student trace data, Data-Driven Features (DDF), and Expert examples. Two experts rated the quality of feedback for each generator, and they rated both the Expert and DDF example feedback as significantly more relevant to students' goals than the Student example feedback. However, there were no significant differences between the DDF and Expert examples. We compared these approaches"
10,The impact of data quantity and source on the quality of data-driven hints for programming,30,2018,https://scholar.google.com/citations?view_op=view_citation&hl=en&user=U-Dk-1QAAAAJ&pagesize=50&citation_for_view=U-Dk-1QAAAAJ:9yKSN-GCB0IC,"In the domain of programming, intelligent tutoring systems increasingly employ data-driven methods to automate hint generation. Evaluations of these systems have largely focused on whether they can reliably provide hints for most students, and how much data is needed to do so, rather than how useful the resulting hints are to students. We present a method for evaluating the quality of data-driven hints and how their quality is impacted by the data used to generate them. Using two datasets, we investigate how the quantity of data and the source of data (whether it comes from students or experts) impact one hint generation algorithm. We find that with student training data, hint quality stops improving after 15–20 training solutions and can decrease with additional data. We also find that student data outperforms a single expert solution but that a comprehensive set of expert solutions generally performs best."
11,Exploring instructional support design in an educational game for K-12 computing education,28,2018,https://scholar.google.com/citations?view_op=view_citation&hl=en&user=U-Dk-1QAAAAJ&pagesize=50&citation_for_view=U-Dk-1QAAAAJ:u-x6o8ySG0sC,"Instructional supports (Supports) help students learn more effectively in intelligent tutoring systems and gamified educational environments. However, the implementation and success of Supports vary by environment. We explored Support design in an educational programming game, BOTS, implementing three different strategies: instructional text (Text), worked examples (Examples) and buggy code (Bugs). These strategies are adapted from promising Supports in other domains and motivated by established educational theory. We evaluated our Supports through a pilot study with middle school students. Our results suggest Bugs may be a promising strategy, as demonstrated by the lower completion time and solution code length in assessment puzzles. We end reflecting on our design decisions providing recommendations for future iterations. Our motivations, design process, and study's results provide insight …"
12,"Extending the hint factory for the assistance dilemma: a novel, data-driven helpneed predictor for proactive problem-solving help",22,2020,https://scholar.google.com/citations?view_op=view_citation&hl=en&user=U-Dk-1QAAAAJ&pagesize=50&citation_for_view=U-Dk-1QAAAAJ:KlAtU1dfN6UC,"Determining when and whether to provide personalized support is a well-known challenge called the assistance dilemma. A core problem in solving the assistance dilemma is the need to discover when students are unproductive so that the tutor can intervene. Such a task is particularly challenging for open-ended domains, even those that are well-structured with defined principles and goals. In this paper, we present a set of data-driven methods to classify, predict, and prevent unproductive problem-solving steps in the well-structured open-ended domain of logic. This approach leverages and extends the Hint Factory, a set of methods that leverages prior student solution attempts to build data-driven intelligent tutors. We present a HelpNeed classification, that uses prior student data to determine when students are likely to be unproductive and need help learning optimal problem-solving strategies. We present a controlled study to determine the impact of an Adaptive pedagogical policy that provides proactive hints at the start of each step based on the outcomes of our HelpNeed predictor: productive vs. unproductive. Our results show that the students in the Adaptive condition exhibited better training behaviors, with lower help avoidance, and higher help appropriateness (a higher chance of receiving help when it was likely to be needed), as measured using the HelpNeed classifier, when compared to the Control. Furthermore, the results show that the students who received Adaptive hints based on HelpNeed predictions during training significantly outperform their Control peers on the posttest, with the former producing shorter, more optimal …"
13,Extending and evaluating the use-modify-create progression for engaging youth in computational thinking,19,2020,https://scholar.google.com/citations?view_op=view_citation&hl=en&user=U-Dk-1QAAAAJ&pagesize=50&citation_for_view=U-Dk-1QAAAAJ:kNdYIx-mwKoC,"The Use-Modify-Create progression (UMC) was conceptualized in 2011 after comparing the productive integration of computational thinking across National Science Foundation-funded Innovative Technology Experiences for Students and Teachers (NSF ITEST) programs. Since that time, UMC has been widely promoted as a means to scaffold student learning of computational thinking (CT) while enabling personalization and allowing for creative adaptations of pre-existing computational artifacts. In addition to UMC's continued application, it has recently been utilized to scaffold student learning in topics as diverse as machine learning, e-textiles, and computer programming. UMC has also been applied to instructional goals other than ""supporting students in becoming creators of computational artifacts."" This panel will re-examine the UMC progression and refine our understanding of when its use is suitable, and …"
14,Position: Scaffolded coding activities afforded by block-based environments,19,2019,https://scholar.google.com/citations?view_op=view_citation&hl=en&user=U-Dk-1QAAAAJ&pagesize=50&citation_for_view=U-Dk-1QAAAAJ:ufrVoPGSRksC,"Block-based programming environments (BBEs) help students first learning to program through reduced syntax errors and easier code construction. In setting up project files and designing activities, it is also possible to integrate within BBEs scaffolding for novice programmers. We outline and present examples for a set of Scaffold Activities developed for use in novice programming settings that we have found in practice to be successful in easing students into programming."
15,Investigating different assignment designs to promote collaboration in block-based environments,17,2020,https://scholar.google.com/citations?view_op=view_citation&hl=en&user=U-Dk-1QAAAAJ&pagesize=50&citation_for_view=U-Dk-1QAAAAJ:hqOjcs7Dif8C,"Pair Programming is often employed in educational settings as a means of promoting collaboration and scaffolding the assignment difficulty for teams. While much research supports its inclusion as a pedagogical practice at the university level, some research has demonstrated in K-12 contexts, it can potentially lead to inequitable learning enviroments and create dynamics between partners that might negatively effect novice learners. New block-based programming environments like Netsblox have attempted to address this by creating ways for both partners to program simultaneously, but this feature has yet to be examined in detail. In this paper, we introduce several modes of Collaboration afforded by Netsblox. This includes Pair-Separate, Pair-Together, and Partner Puzzles - a mode that Splits the necessary blocks to build the assignment between team members. From an initial pilot study involving 25 pairs of …"
16,Infusing computing: Analyzing teacher programming products in K-12 computational thinking professional development,17,2019,https://scholar.google.com/citations?view_op=view_citation&hl=en&user=U-Dk-1QAAAAJ&pagesize=50&citation_for_view=U-Dk-1QAAAAJ:UeHWp8X0CEIC,"In summer 2018, we conducted two week-long professional development workshops for 116 middle and high school teachers interested in infusing computational thinking (CT) into their classrooms. Teachers learned to program in Snap!, connect CT to their disciplines, and create infused CT learning segments for their classes. This paper investigates the extent to which teachers were able to successfully infuse CT skills of pattern recognition, abstraction, decomposition, and algorithms into their learning products. In this work, we analyzed 58 teacher-designed programming products to look for common characteristics, such as project type, intended coding requirements for their students, and code features/functionality. Teacher-created products were classified into five types: animation, interactive story, quiz, intended game, and simulation/exploration tools. Coding requirements varied from using and/or explaining …"
17,Pair programming in a pandemic: Understanding middle school students' remote collaboration experiences,13,2022,https://scholar.google.com/citations?view_op=view_citation&hl=en&user=U-Dk-1QAAAAJ&pagesize=50&citation_for_view=U-Dk-1QAAAAJ:QIV2ME_5wuYC,"The COVID-19 pandemic has demonstrated that learning remotely is a crucial skill for K-12 students. However, remote instruction and collaboration bring a new set of challenges for these students, especially in the context of pair programming. An important goal for the CS education community is to understand these younger learners' experiences during remote programming activities. This experience report describes a three-day learning experience in which 18 middle school students engaged in remote pair programming activities by modeling scientific processes in a block-based programming language. After three remote pair programming sessions, we conducted individual interviews to understand middle school students' experiences during remote pair programming activities as well as comparing these new experiences to their previous co-located pair programming experiences. The results from these …"
18,From'Use'to'Choose' Scaffolding CT Curricula and Exploring Student Choices while Programming (Practical Report),13,2019,https://scholar.google.com/citations?view_op=view_citation&hl=en&user=U-Dk-1QAAAAJ&pagesize=50&citation_for_view=U-Dk-1QAAAAJ:7PzlFSSx8tAC,"As computing skills become necessary for 21st-century students, infused computational thinking (CT) lessons must be created for core courses to truly provide computing education for all. This will bring challenges as students will have widely varying experience and programming ability. Additionally, STEM teachers might have little experience teaching CT and instructing using unfamiliar technology might create discomfort. We present a design pattern for infused CT assignments that scaffold students and teachers into block-based programming environments. Beginning with existing code, students and teachers work together 'Using' and comprehending code before 'Modifying' it together to fix their programs. The activity ends with students 'Choosing' their own extensions from a pre-set list. We present a comparison of two implementations of a simulation activity, one ending with student choosing how to extend their …"
19,The impact of looking further ahead: a comparison of two data-driven unsolicited hint types on performance in an intelligent data-driven logic tutor,10,2022,https://scholar.google.com/citations?view_op=view_citation&hl=en&user=U-Dk-1QAAAAJ&pagesize=50&citation_for_view=U-Dk-1QAAAAJ:_kc_bZDykSQC,"Research has shown assistance can provide many benefits to novices lacking the mental models needed for problem solving in a new domain. However, varying approaches to assistance, such as subgoals and next-step hints, have been implemented with mixed results. Next-Step hints are common in data-driven tutors due to their straightforward generation from historical student data, as well as research showing positive impacts on student learning. However, there is a lack of research exploring the possibility of extending data-driven methods to provide higher-level assistance. Therefore, we modified our data-driven Next-Step hint generator to provide Waypoints, hints that are a few steps ahead, representing problem-solving subgoals. We hypothesized that Waypoints would benefit students with high prior knowledge, and that Next-Step hints would most benefit students with lower prior knowledge. In this study …"
20,Ceo: A triangulated evaluation of a modeling-based ct-infused cs activity for non-cs middle grade students,10,2019,https://scholar.google.com/citations?view_op=view_citation&hl=en&user=U-Dk-1QAAAAJ&pagesize=50&citation_for_view=U-Dk-1QAAAAJ:LkGwnXOMwfcC,"With the increased demand for introducing computational thinking (CT) in K-12 classrooms, educational researchers are developing integrated lesson plans that can teach CT fundamentals in non-computing specific classrooms. Although these lessons reach more students through the core curriculum, proper evaluation methods are needed to ensure the quality of the design and integration. As part of a research practice partnership, we work to infuse research-backed curricula into science courses. We find a three-pronged approach of evaluation can help us make better decisions on how to improve experimental curricula for active classrooms. This CEO model uses three data sources (student code traces, exit ticket responses, and field observations) as a triangulated approach that can be used to identify programming behavior among novice developers, preferred task ordering for the assignment, and scaffolding …"
21,Effects of a pathfinding program visualization on algorithm development,10,2019,https://scholar.google.com/citations?view_op=view_citation&hl=en&user=U-Dk-1QAAAAJ&pagesize=50&citation_for_view=U-Dk-1QAAAAJ:dhFuZR0502QC,"Program Visualizations (PVs) have been used as educational tools to allow students to visually inspect the runtime behavior of their code. However, many of these systems act as low-level visual debuggers not high-level abstractions of program behavior. Additionally, evaluations of these systems tend to focus more on student engagement or opinion in using the system and not on artifacts produced using the system. This paper discusses the effectiveness of a PV developed to aide students in an undergraduate Artificial Intelligence class on a pathfinding homework assignment. Students in 4 semesters of the course were tasked to develop pathfinding algorithms for an agent to navigate worlds in cases of both certain and uncertain world information. Students in 2 semesters of the course were given access to a PV that allowed them to see a visual representation of their agent navigating the world in either information …"
