Rank,Title,Citations,Year,URL,Description
22,Creation and validation of low-stakes rubrics for k-12 computer science,9,2018,https://scholar.google.com/citations?view_op=view_citation&hl=en&user=U-Dk-1QAAAAJ&pagesize=50&citation_for_view=U-Dk-1QAAAAJ:u5HHmVD_uO8C,"With increased numbers of K-12 computing courses, we also see an increase in teachers new to the subject, making it difficult for them to properly assess student programming assignments. Many of these teachers require project-specific rubrics to help assess student learning. Researchers have attempted to create systematic, validated, and reliable rubrics for these courses with only minor success. In this research, we make an argument for the validity of our low-stakes computing rubrics. In doing so, we establish a validated method for creating a full-suite of project-based rubrics for K-12 computing courses, helping teachers, researchers, and practitioners make much-needed course materials. Evaluating these rubrics, we see grader consistency as well as heatmaps of where teachers are looking for computational thinking concepts in code."
23,Participatory design with teachers for block-based learning with SnapClass,7,2023,https://scholar.google.com/citations?view_op=view_citation&hl=en&user=U-Dk-1QAAAAJ&pagesize=50&citation_for_view=U-Dk-1QAAAAJ:M3ejUd6NZC8C,"As computer science is increasingly taught in secondary schools, tools need to integrate block-based environments into learning platforms. This way, teachers can more effectively lead lessons, help students, and assess students' programs in their classrooms. We conducted a participatory design process with three K-12 computing teachers to understand their struggle and needs for block coding within their classrooms. The teachers identified 14 needs that were not already addressed by our tool, SnapClass. SnapClass, a new web-based learning platform for Snap!, integrates assignments with starter code, executable student submissions, rubric-based assessment, and a gradebook into one platform. The teachers designed prototypes for three features important to their classrooms: assignment differentiation, help-requests, and peer and self-assessment. This paper begins by introducing SnapClass and the …"
24,Exploring Differences Between Student and Teacher Created Snap! Projects,6,2020,https://scholar.google.com/citations?view_op=view_citation&hl=en&user=U-Dk-1QAAAAJ&pagesize=50&citation_for_view=U-Dk-1QAAAAJ:L8Ckcad2t8MC,"This paper illustrates coding decisions by in-service teachers and high school interns working independently versus collaboratively to build computing activities for non-computing classrooms. We investigate code written in Snap! to gain insights on project type and subject matter. We also share case studies on how intern collaboration influences final product execution. Through our research, we found student-only teams often created tutorial projects whereas teachers-only teams create interactive narratives. We found students were able to reuse code across projects to replicate similar mechanics and that students specialize in different aspects of project creation. Overall, we find it beneficial to have collaborative teacher-student teams."
25,Resource rush: towards an open-ended programming game,6,2019,https://scholar.google.com/citations?view_op=view_citation&hl=en&user=U-Dk-1QAAAAJ&pagesize=50&citation_for_view=U-Dk-1QAAAAJ:qjMakFHDy7sC,"Programming games provide players opportunities to practice and learn the fundamentals of coding in engaging ways. Many games have players program in block-based languages similar to environments like Scratch and Snap! as a means to scaffold student learning and reduce syntax errors. Block-based environments (BBEs) have been praised for their open-ended, constructionist designs allowing students to develop what they wish, express themselves, and explore the possibilities of the system. However, programming games tend to be more linear, usually designed as a fixed series of puzzles. We present Resource Rush, a game designed to resemble BBEs and present users with a game world that allows users to learn the fundamentals of programming in an open-ended game environment."
26,A comparative analysis of student performance predictions in online courses using heterogeneous knowledge graphs,5,2024,https://scholar.google.com/citations?view_op=view_citation&hl=en&user=U-Dk-1QAAAAJ&pagesize=50&citation_for_view=U-Dk-1QAAAAJ:hC7cP41nSMkC,"As online courses become the norm in the higher-education landscape, investigations into student performance between students who take online vs on-campus versions of classes become necessary. While attention has been given to looking at differences in learning outcomes through comparisons of students' end performance, less attention has been given in comparing students' engagement patterns between different modalities. In this study, we analyze a heterogeneous knowledge graph consisting of students, course videos, formative assessments and their interactions to predict student performance via a Graph Convolutional Network (GCN). Using students' performance on the assessments, we attempt to determine a useful model for identifying at-risk students. We then compare the models generated between 5 on-campus and 2 fully-online MOOC-style instances of the same course. The model developed achieved a 70-90\% accuracy of predicting whether a student would pass a particular problem set based on content consumed, course instance, and modality."
27,Empowering students as leaders of co-design for block-based programming,5,2023,https://scholar.google.com/citations?view_op=view_citation&hl=en&user=U-Dk-1QAAAAJ&pagesize=50&citation_for_view=U-Dk-1QAAAAJ:zYLM7Y9cAGgC,"Educational software is rarely co-designed with teachers and students. We have created a novel co-design process that can help both teachers and students learn about human-computer interaction (HCI) and research methods while contributing to the design of educational systems that will benefit future students and teachers. We investigated the results of our process of mentoring two undergraduate students to lead participatory design (PD) sessions with three K-12 teachers. We found that this process exposed teachers and undergraduates to HCI research and design techniques, empowered undergraduates to lead design sessions, and encouraged knowledge transfer between the groups. Our lessons learned include ways to prepare students inexperienced with HCI to lead PD, with training in the participants’ domain, practice sessions, and predefined PD methods to adapt for their context. Our …"
28,"Experience, Experiment, Evaluate: A Framework for Assessing Experiential Games.",5,2017,https://scholar.google.com/citations?view_op=view_citation&hl=en&user=U-Dk-1QAAAAJ&pagesize=50&citation_for_view=U-Dk-1QAAAAJ:qxL8FJ1GzNcC,"The design of effective educational games has proven to be challenging for many years, leading to sparse and somewhat inconsistent insight into the principles governing such systems. While attempts at constructing frameworks for educational games certainly exist, their nature is often quite general (limiting the practical utility) or noticeably specific (limiting the scope of projects to which that framework might be applied). We present a design framework for a broad, but well-defined genre known as experiential games. We have named our framework the Experience, Experiment, Evaluate (EEE) framework and believe it to be an adequate lens to analyze such games. This article presents the EEE framework in detail and provides example analyses of three games (a US Civil War history game, a medical diagnosis game, and The Legend of Zelda: Ocarina of Time™). We present results from one game that predicted …"
29,Characterizing high school participants’ motivations and outcomes in a service-oriented summer internship,4,2022,https://scholar.google.com/citations?view_op=view_citation&hl=en&user=U-Dk-1QAAAAJ&pagesize=50&citation_for_view=U-Dk-1QAAAAJ:WF5omc3nYNoC,"In order to meet the increasing demand for a CS and STEM workforce, expanded CS educational opportunities are being introduced as early as K-12. While many programs exist inside a traditional school structure (e.g, standalone CS courses) out-of-school programs such as internships are also becoming a popular way for students to learn to program. Service-focused computing internships provide an opportunity for students to learn computer science while also giving back to their community in some way. While it is known that many marginalized groups in STEM (e.g., women, Black students, etc) are motivated by careers that are service oriented, little else is know about student motivations for participating in K-12 service-oriented internships. In this study, we interview 20 high school student interns to better understand why students elected to participate in an internship and the effect of participation in a service …"
30,Examining Student Interest and Motivations in Graduate Computer Science Research,2,2025,https://scholar.google.com/citations?view_op=view_citation&hl=en&user=U-Dk-1QAAAAJ&pagesize=50&citation_for_view=U-Dk-1QAAAAJ:TQgYirikUcIC,"The research focuses in academia are typically determined from the top down, with professors focusing on projects that align with their existing lab or can be readily supported by grants. This approach is pragmatic, but this focus may not align with the bottom-up interests of the available student body. As part of a broader effort to expand the available research opportunities in a graduate program in computer science, this work focuses on collecting data on what is motivating student interest in research and what specific fields students desire to study with the intention of using the results for decision-making about how to allocate resources to best match student interests. This work reports on the responses of 143 graduate students in computer science at a major research institution in the United States in a course-based program where access to research opportunities is not guaranteed. It examines both the fields of …"
31,Broadening CS Research Opportunities for Online Graduate Students,2,2025,https://scholar.google.com/citations?view_op=view_citation&hl=en&user=U-Dk-1QAAAAJ&pagesize=50&citation_for_view=U-Dk-1QAAAAJ:HDshCWvjkbEC,"Research opportunities offer students at the master's level a chance to apply their knowledge, create projects for their portfolio, and to gain an understanding of the research process in preparation for potential doctoral studies. The traditional structure of these opportunities, however, is not trivial to translate to online programs with asynchronous delivery. As online programs grow, it is important to examine ways that the traditional benefits of these opportunities can be extended to a broader range of students. In this poster, we discuss our experience building the infrastructure and running early efforts at reaching this goal. We discuss several dedicated courses and seminars developed to offer larger scale opportunities for students to pursue research. We also discuss efforts in active development to provide better infrastructure support to reduce the friction and complexity of pursuing research at scale."
32,Scaffolding novices: analyzing when and how parsons problems impact novice programming in an integrated science assignment,2,2024,https://scholar.google.com/citations?view_op=view_citation&hl=en&user=U-Dk-1QAAAAJ&pagesize=50&citation_for_view=U-Dk-1QAAAAJ:IWHjjKOFINEC,"Background and Context The importance of CS to 21st-century life and work has made it important to find ways to integrate learning CS and programming into the regular school day. However, learning CS is difficult, so teachers integrating programming need effective strategies to scaffold the learning. In this study, we analyze students’ log data and apply a novel technique to compare Parsons Problems with from-scratch programming in a middle school science class. Objectives Our research questions aimed to investigate whether, how, and when Parsons Problems improve learning efficiency for a programming exercise within science, utilizing log data analysis and an automated progress detector (SPD). Method We conducted a study on 199 students in a 6th-grade science course, divided into two groups: one engaged with Parsons problems, and the other, a control group, worked on the same programming task …"
33,Creating a school-wide cs/ct-focused STEM ecosystem to address access barriers,2,2020,https://scholar.google.com/citations?view_op=view_citation&hl=en&user=U-Dk-1QAAAAJ&pagesize=50&citation_for_view=U-Dk-1QAAAAJ:4JMBOYKVnBMC,"STEM ecosystem is an emerging model for identifying the barriers and support structures that students have in their learning trajectories in STEM. In this paper our university-based research team presents a CS/CT-focused STEM ecosystem strategy designed to address underrepresentation in computing fields. We describe our current and future work within our school-level research-practice partnership (RPP) with a local middle school, used to guide the creation of this ecosystem."
34,Fair-cs: Framework for interdisciplinary research collaborations in online computing programs,1,2025,https://scholar.google.com/citations?view_op=view_citation&hl=en&user=U-Dk-1QAAAAJ&pagesize=50&citation_for_view=U-Dk-1QAAAAJ:R3hNpaxXUhUC,"Research experience is crucial for computing master’s students pursuing academic and scientific careers, yet online students have traditionally been excluded from these opportunities due to the physical constraints of traditional research environments. This paper presents the Framework for Accelerating Interdisciplinary Research in Computer Science (FAIR-CS), a method for achieving research goals, developing research communities, and supporting high quality mentorship in an online research environment. This method advances virtual research operations by orchestrating dynamic partnerships between master’s- level researchers and academic mentors, resulting in interdisciplinary publications. We then discuss the implementation of FAIR-CS in the Human-Augmented Analytics Group (HAAG), with researchers from the Georgia Tech’s Online Master of Computer Science program. Through documented …"
35,Developing a research framework for online higher education in computer science: Implementing a marketplace model,1,2024,https://scholar.google.com/citations?view_op=view_citation&hl=en&user=U-Dk-1QAAAAJ&pagesize=50&citation_for_view=U-Dk-1QAAAAJ:hFOr9nPyWt4C,"The rapid expansion of online higher education, particularly in computer science, has highlighted a significant gap in research opportunities for online learners. There are students in online higher education who have the willingness, availability, and experience to make progress towards research publications but do not have easily accessible research opportunities. Institutions offering online education must address this gap to enhance educational experiences for online students. By creating a pilot study for the Georgia Institute of Technology’s Online Master of Science in Computer Science (OMSCS) program, a novel marketplace model for research in online higher education is proposed. Key components of the model include research contracts between external collaborators and student researchers - facilitated by a project manager, a procedure for assessments, a resource management system for volunteer …"
36,Intelligent Feedback and Evaluation for the Assessment and Improvement of Student Peer Reviews,1,2024,https://scholar.google.com/citations?view_op=view_citation&hl=en&user=U-Dk-1QAAAAJ&pagesize=50&citation_for_view=U-Dk-1QAAAAJ:-f6ydRqryjwC,"Research into peer evaluation shows positive effects on student achievement and attitudes. To foster authentic peer reviews, students need to know their peer reviews will be seen and graded. However, the time-consuming nature of assessing feedback makes it impractical for instructors to evaluate thousands of feedback items generated by students in massive online courses. This paper describes the development of a deep learning (DL) tool to help assess the quality of feedback written by students in a peer-review system. We report tool development progress built upon years of student meta-feedback data that consists of numeric scores and written evaluations of the feedback received. We describe: the underlying DL platform, the labeled data set with which the algorithm was trained, the supervised training process, and the performance evaluation of the resulting three-class multiclass classifier. The evaluation …"
37,Centering Environmental Justice in Computing Education.,1,2023,https://scholar.google.com/citations?view_op=view_citation&hl=en&user=U-Dk-1QAAAAJ&pagesize=50&citation_for_view=U-Dk-1QAAAAJ:8k81kl-MbHgC,"In this Birds of a Feather, we will discuss the roles of computing education in preparing students to understand and address the disparate impacts of climate change in local and global contexts. We intend to have open discussions on the challenges and opportunities related to connecting computing education with climate change and the injustices that climate change exacerbates. We will focus discussions around three questions:(1) How can we center justicebased perspectives on understanding and addressing climate change in computing education?(2) What are the relationships between computing, climate change, and overall environmental impacts? and (3) How should we reimagine traditional notions of “development” and “progress” in computing in ways that challenge how current framings within computing misunderstand or misteach computing’s environmental impacts? We invite all computing educators, researchers, administrators, practitioners and anyone else with any level of curiosity about climate change to join this discussion (because it affects all of us!). Expected outcomes for this Birds of a Feather include sharing resources and experiences to build a community for knowledge sharing and collaborations."
38,"What's Up, Doc? Building a Community of Computing Education Postdocs",1,2022,https://scholar.google.com/citations?view_op=view_citation&hl=en&user=U-Dk-1QAAAAJ&pagesize=50&citation_for_view=U-Dk-1QAAAAJ:3fE2CSJIrl8C,"There is a growing number of Ph.D. graduates whose research focuses on computing education, and they are significantly fueling the growth of the computing education research community. As more computing education Ph.D. graduates weigh their options on the job market, they are increasingly entering postdoctoral positions. For example, seven Computing Innovation Fellows positions over the last two years have been awarded to computing education researchers. Research shows that postdoctoral researchers have positive, cascading effects on research labs. However, despite the critical role they play in the research ecosystem, and the growing importance of postdoctoral positions in career development, there are no support structures for postdoctoral researchers in the computing education research community. This Birds-of-a-Feather session is an organized opportunity for postdoctoral researchers and …"
39,A block-based modeling curriculum for teaching middle grade science students about Covid-19,1,2020,https://scholar.google.com/citations?view_op=view_citation&hl=en&user=U-Dk-1QAAAAJ&pagesize=50&citation_for_view=U-Dk-1QAAAAJ:9ZlFYXVOiuMC,"While the scientific community is learning more about the novel Coronavirus and its associate disease, Covid-19, it is important to begin efforts to educate students on the disease, how it is transmitted, and the possible steps we as societies and individuals can take to combat the spread. To this end, we adapted an existing computational thinking curriculum originally designed to teach students about how infectious diseases are spread by having them build a model within the block-based programming environment, Cellular. This new curriculum introduces relevant scientific terms and tasks student to program an increasingly complex model ending the activity by choosing which risk-reduction strategy to employ."
40,Data-Driven Approaches for Exploring the Effects of Teacher Instruction on Student Programming Behaviors.,1,2020,https://scholar.google.com/citations?view_op=view_citation&hl=en&user=U-Dk-1QAAAAJ&pagesize=50&citation_for_view=U-Dk-1QAAAAJ:W7OEmFMy1HYC,"As programming activities become integrated into K-12 classrooms, teachers with minimal prior programming experience will instruct students of varying backgrounds. This usually takes the form of Live Coding, programming on a display in front of students while they follow along. While effective, Live Coding prohibits teachers from seeing students current progress. Though researchers can observe instruction and can tell teachers when students need the pace altered, this help will not always be available. To improve and scale insights and investigate how teacher instruction influences student programming behavior, we perform several analyses to visualize the influence of instruction on student assignment progression throughout the class period. We present case studies featuring teacher and student programming behaviors. We end on possible means our methodology can be extended to create dashboard and other data-driven tools."
41,Design patterns and automated support for block-based programming activities in non-computing classes,1,2019,https://scholar.google.com/citations?view_op=view_citation&hl=en&user=U-Dk-1QAAAAJ&pagesize=50&citation_for_view=U-Dk-1QAAAAJ:eQOLeE2rZwMC,"To provide K-12 computing education for all, programming cannot be regulated to only computer science classes. Instead, computing education must be infused into all other required courses reaching all students through curriculum-integrated computing activities. This will pose challenges as students in these settings have an increasingly wide range of programming backgrounds. Additionally, teachers must feel comfortable not only teaching programming, but doing so in a meaningful context that integrates coding into their course topics. To truly meet the scale of this challenge, teachers will need to be able to develop meaningful integrated programming lessons, and have the supports necessary to implement them in a wide-variety of classes with students of vastly different skill-levels. This research will investigate two major means of aiding the rapid development and deployment of integrated block-based …"
42,Infusing computing through professional development: Shifts in content area teachers’ understandings of computational thinking integration,1,2019,https://scholar.google.com/citations?view_op=view_citation&hl=en&user=U-Dk-1QAAAAJ&pagesize=50&citation_for_view=U-Dk-1QAAAAJ:d1gkVwhDpl0C,"The purpose of this session is to describe our implementation of a professional development model designed to support middle and secondary content area teachers in integrating computational thinking into their classrooms. Drawing on findings from our mixed methods analysis of interviews, surveys, and teacher-created products, we argue that the professional development supported shifts in teacher understandings of the role of computational thinking in content area classrooms, as well as their abilities to integrate computational thinking into their teaching. We conclude by offering implications for research and policy practices which can increase teacher and student access to computational thinking practices in P-12 schools."
43,Exploring Transitions of Graduates From an Online Master's in Computer Science Program to Doctoral Programs,0,2026,https://scholar.google.com/citations?view_op=view_citation&hl=en&user=U-Dk-1QAAAAJ&pagesize=50&citation_for_view=U-Dk-1QAAAAJ:j3f4tGmQtD8C,"The flexibility and affordability of online, asynchronous, at-scale degree programs have significantly increased the accessibility of a master's-level graduate education. While studies have been conducted on the general growth of such programs and the quality of the online courses compared to their on-campus counterparts, few (if any) have examined outcomes such as alumni career growth or admission into other graduate programs. This work examines how one large online graduate program in computer science prepared alumni for matriculation into STEM PhD programs. Enrollment data from the National Student Clearinghouse was analyzed to identify key trends in alumni PhD enrollment. Surveys and interviews with program alumni were also conducted to investigate the unique paths that these individuals took to beginning their PhD education. This study finds that the program positively impacted alumni PhD …"
44,SnapClass: An AI-Enhanced Classroom Management System for Block-Based Programming,0,2025,https://scholar.google.com/citations?view_op=view_citation&hl=en&user=U-Dk-1QAAAAJ&pagesize=50&citation_for_view=U-Dk-1QAAAAJ:e5wmG9Sq2KIC,"Block-Based Programming (BBP) platforms, such as Snap!, have become increasingly prominent in computer science education due to their ability to simplify programming concepts and foster computational thinking from an early age. While these platforms engage students through visual and gamified interfaces, teachers often face challenges in using them effectively and finding all the necessary features for classroom management. To address these challenges, we introduce SnapClass, a classroom management system integrated within the Snap! programming environment. SnapClass was iteratively developed drawing on established research about the pedagogical and logistical challenges teachers encounter in computing classrooms. Specifically, SnapClass allows educators to create and customize block-based coding assignments based on student skill levels, implement rubric-based auto-grading …"
