Rank,Title,Citations,Year,URL,Description
45,Exploring the Effects of Adaptive Testing Innovations on Distance STEM Education for Adult Learners: A Systematic Review,0,2025,https://scholar.google.com/citations?view_op=view_citation&hl=en&user=U-Dk-1QAAAAJ&pagesize=50&citation_for_view=U-Dk-1QAAAAJ:RHpTSmoSYBkC,"This systematic review examines the impact of recent advances in adaptive testing on distance learning in STEM (Science, Technology, Engineering, Mathematics) education for adult learners. Through an analysis of 20 relevant papers published between 2014 and 2024, selected from an initial pool of 297 studies, the research reveals how modern adaptive testing systems, enhanced by machine learning algorithms and artificial intelligence, are transforming distance STEM education. The findings demonstrate that technologies such as Computerized Adaptive Testing (CAT) and reinforcement learning algorithms significantly improve learning outcomes through personalized assessment paths and real-time feedback mechanisms. These systems have been shown to reduce test time while maintaining assessment accuracy and can effectively accommodate learners from diverse educational backgrounds. Adaptive …"
46,MENTOR-CS: Management Education for Navigating Transdisciplinary Online Research in Computer Science,0,2025,https://scholar.google.com/citations?view_op=view_citation&hl=en&user=U-Dk-1QAAAAJ&pagesize=50&citation_for_view=U-Dk-1QAAAAJ:_Qo2XoVZTnwC,"The unprecedented growth of online computer science graduate education in recent years has highlighted the need for high-quality remote research opportunities and effective virtual mentorship models. To address this challenge, we introduce MENTOR-CS, a comprehensive framework designed to equip early-career researchers with the skills necessary for managing research teams working across transdisciplinary computer science projects. This approach enhances the mentorship experience for online student researchers by providing foundational management training to technically skilled advisors who may lack formal leadership expertise. We detail the successful implementation of MENTOR-CS within the Human-Augmented Analytics Group (HAAG) where PhD and postdoctoral computational experts from global research institutions serve as our MENTOR-CS practitioners. We discuss expected outcomes in …"
47,Student Performance Pattern Analysis Across Modalities in an Introduction to Computing Course,0,2024,https://scholar.google.com/citations?view_op=view_citation&hl=en&user=U-Dk-1QAAAAJ&pagesize=50&citation_for_view=U-Dk-1QAAAAJ:qUcmZB5y_30C,"Interaction patterns between students in on-campus and MOOC-style online courses have been broadly studied for the last 11 years. However, there is very little analysis comparing the habits of students completing the same course offered in both a traditional on-campus and MOOC-style online formats. Analyzing the differences in student approach in a direct comparison across modalities will allow researchers to identify effective cross-modality interventions. This study looked at clickstream interaction patterns for students in an ’Introduction to Programming in Python’ edX course representing 7 traditional semester-cadence course instances offered to oncampus students and 4 large-scale MOOC-style course instances offered to all learners to determine what, if any, interaction and performance patterns exist between the two modalities. While significant research has been done to determine the difference between …"
48,Agile Curriculum Development: Computational Modeling COVID-19,0,2021,https://scholar.google.com/citations?view_op=view_citation&hl=en&user=U-Dk-1QAAAAJ&pagesize=50&citation_for_view=U-Dk-1QAAAAJ:Se3iqnhoufwC,"Computational modeling provides an excellent vehicle for raising scientific awareness of emergent and topical phenomena such as COVID-19. Now more than ever, it is crucial to provide students with factual information about how diseases spread and how their own actions can impact that spread. In order to both encourage computational thinking skills and build scientific knowledge of the COVID-19 pandemic, we have created a series of programming activities through which students construct their own computational models based on the emerging scientific consensus around COVID-19. Students are able to model everyday situations such as being in a crowded area or going to stores while unknowingly infected, and immediately see the consequences of those actions. By including accurate scientific variables such as the reproductive number of the virus, incubation period, and period of communicability …"
49,Bridge to Computing: An outreach program for at-risk young men,0,2020,https://scholar.google.com/citations?view_op=view_citation&hl=en&user=U-Dk-1QAAAAJ&pagesize=50&citation_for_view=U-Dk-1QAAAAJ:Wp0gIr-vW9MC,"In 2017, our police department and the Give Back Organization (GBO), a local non-profit, contacted our university about hosting a game development summer camp. The camp was proposed to keep boys ages 12-15 living in a community with high levels of gang enrollment off the streets while providing an opportunity to learn about college and computing careers. The police also wanted to improve officer-youth r elations. Our lab provided camp counselors, space, and content for the camp. Each camp supported a total of twelve African-American boys. Over three years, we refactored the curricula and organization of the camp and present our lessons learned from the experience."
50,"Supporting CS Students Living with Mental Illnesses: Sharing Experiences, Establishing Support, and Discussing Best Practices",0,2020,https://scholar.google.com/citations?view_op=view_citation&hl=en&user=U-Dk-1QAAAAJ&pagesize=50&citation_for_view=U-Dk-1QAAAAJ:mVmsd5A6BfQC,"Recent studies have demonstrated the prevalence of mental health issues and illnesses among students in higher education, especially in STEM degree programs like computing. While we work as a community towards solutions that benefit the mental health of all students, we must also take targeted action towards supporting students with diagnosed mental illnesses (e.g. major depression, bipolar disorder, schizophrenia). This should begin by allowing these often unheard students an opportunity to voice their invisible experiences in a safe space. This will start creating a shared understanding among faculty and students of how these illnesses can affect the educational experience, as well as how our common university practices can affect the lives of those living with these illnesses. This space will give students an understanding that their voices and experiences are valued and heard by the general academic …"
