Rank,Title,Citations,Year,URL,Description
24,Technology for working dogs,18,2018,https://scholar.google.com/citations?view_op=view_citation&hl=en&user=83SAwBsAAAAJ&pagesize=50&citation_for_view=83SAwBsAAAAJ:k_IJM867U9cC,"Working dogs can perform many tasks that improve the lives of humans. An explosion of new technologies in Animal-Computer Interaction enable dogs to assist in a variety of scenarios. Dogs can summon emergency services, report finding a lost child, determine what explosive they just detected, alert to a tornado siren, and much more. Giving working dogs the ability to clearly communicate could be life-saving. Related technologies can measure aspects of a dog's behavior to assess temperament, predict training success, and even monitor health. The Georgia Tech Animal-Computer Interaction lab has been researching dog-centered interfaces since 2012. Our studies have included instrumented vests, touchscreens, and devices that provide new ways for dogs to communicate what they perceive to people around them. We have also researched instrumented dog toys for temperament analysis and health …"
25,Current trends in brain–computer interface (bci) research and development,17,2010,https://scholar.google.com/citations?view_op=view_citation&hl=en&user=83SAwBsAAAAJ&pagesize=50&citation_for_view=83SAwBsAAAAJ:qjMakFHDy7sC,"A brain–computer interface (BCI), sometimes called a direct neural interface or a brain–machine interface, detects and interprets brain signals and uses the results to communicate a user’s intent (Wolpaw, Birbaumer, McFarland, Pfurtscheller, & Vaughan, 2002). Because these systems directly translate brain activity into action, without depending on peripheral nerves and muscles, a major goal of BCI research has been to establish BCI technology as an assistive device to be used by people with severe motor disabilities. BCIs have shown encouraging possibilities in providing people, including those who cannot use their muscles but are cognitively intact, with alternative methods for interacting with the outside world (Nam, Lee, & Johnson, 2010; Schalk, McFarland, Hinterberger, Birbaumer, & Wolpaw, 2004). Despite long interest in the possibility to control devices directly using brain signals (eg, Fetz & Finocchio …"
26,Neural control interfaces,17,2010,https://scholar.google.com/citations?view_op=view_citation&hl=en&user=83SAwBsAAAAJ&pagesize=50&citation_for_view=83SAwBsAAAAJ:W7OEmFMy1HYC,"The control interface is the primary component of a Brain-Computer Interface (BCI) system that provides user interaction. The control interface supplies cues for performing mental tasks, reports system status and task feedback, and often displays representations of the user’s brain signals. Control interfaces play a significant role in determining the usability of a BCI, and some of the traditional human-computer interaction design methods apply. However, the very specialized input methods and display paradigms of a BCI require consideration to create optimal usability for a BCI system. This chapter outlines some of the issues and challenges that make designing control interfaces for BCIs unique."
27,Continuous control paradigms for direct brain interfaces,16,2009,https://scholar.google.com/citations?view_op=view_citation&hl=en&user=83SAwBsAAAAJ&pagesize=50&citation_for_view=83SAwBsAAAAJ:UeHWp8X0CEIC,"Direct Brain Interfaces (DBIs) offer great possibilities for people with severe disabilities to communicate and control their environments. However, many DBI systems implement discrete selection, such as choosing a letter from an alphabet, which offers limited control over certain tasks. Continuous control is important for applications such as driving a wheelchair or drawing for creative expression. This paper describes two projects currently underway at the Georgia Tech BrainLab exploring continuous control interface paradigms for an EEG-based approach centered on responses from visual cortex, and functional near Infrared (fNIR) imaging of the language center of the brain."
28,An fNIR based BMI for letter construction using continuous control,15,2009,https://scholar.google.com/citations?view_op=view_citation&hl=en&user=83SAwBsAAAAJ&pagesize=50&citation_for_view=83SAwBsAAAAJ:9yKSN-GCB0IC,"A long term goal of assistive technology research is to build creative expression applications where subjects can extemporaneously express themselves. Sketch drawing is one form of creative expression. In this work, we demonstrate the usability of a brain-machine interface (BMI) for expression using a letter drawing task. We describe empirical results that represent a first step toward assistive applications for creative expression."
29,Wag’d: towards a wearable activity and gait detection monitor for sled dogs,14,2022,https://scholar.google.com/citations?view_op=view_citation&hl=en&user=83SAwBsAAAAJ&pagesize=50&citation_for_view=83SAwBsAAAAJ:ZHo1McVdvXMC,"Sled dogs have performed vital services to mankind throughout history, transporting people, goods, mail, food, and medicines. Today, sled dog teams still provide transportation as well as sport, such as the famous Iditarod race. Studies show that of the 38% of dogs which drop out of long distance sled races, 51% drop due to orthopedic injuries. Sled dog mushers have limited ways of quantifying their dog’s health while training and racing, mostly relying on visual observation. According to Iditarod mushers and veterinarians, the easiest way to detect injuries in sled dogs is through analysis of pull force and gait. We created a Wearable Activity and Gait Detection (WAG’D) monitor in an effort to identify early signs of gait and pull force changes, with the intent of reducing the number of injuries in sled dog racing. We sought to identify requirements for a wearable sled dog monitor and build a high-fidelity prototype to …"
30,Assessment of working dog suitability from quantimetric data,14,2014,https://scholar.google.com/citations?view_op=view_citation&hl=en&user=83SAwBsAAAAJ&pagesize=50&citation_for_view=83SAwBsAAAAJ:ULOm3_A8WrAC,We propose new approaches to assessing the suitability of potential working dogs for a given occupation. The main focus is placed on continuously-recording technology that does not rely on constant human observation. An example is provided in the form of a pilot study relying on activity and human-proximity data collected from dogs both prior to and during advanced training at Canine Companions for Independence. We conclude by noting other technologies that could also be used to achieve this purpose.
31,The challenges of wearable computing for working dogs,13,2015,https://scholar.google.com/citations?view_op=view_citation&hl=en&user=83SAwBsAAAAJ&pagesize=50&citation_for_view=83SAwBsAAAAJ:_kc_bZDykSQC,"We present two case studies on creating wearables for dogs and discuss them in terms of challenges of safety, space, weight and comfort, that motivated them. You can use these case studies and our design process as a practical primer for designing wearables for working dogs."
32,Canine reachability of snout-based wearable inputs,12,2014,https://scholar.google.com/citations?view_op=view_citation&hl=en&user=83SAwBsAAAAJ&pagesize=50&citation_for_view=83SAwBsAAAAJ:kNdYIx-mwKoC,"We designed an experiment with the goal of assessing wearable reachability for canines. We investigated the effect of placement on the ability of dogs to reach on-body interfaces with their snouts. In our pilot study, seven placements along the front legs, rib cage, hip and chest are tested with six dogs. The results showed that the front leg placements are reachable with the least amount of training and are also the most invariant to small changes in location. With training, the lower half of the rib cage area had the fastest access times across subjects. We hope that these results may be useful in mapping the constraint space of placements for snout interactions."
33,Non-invasive canine electroencephalography (EEG): a systematic review,10,2025,https://scholar.google.com/citations?view_op=view_citation&hl=en&user=83SAwBsAAAAJ&pagesize=50&citation_for_view=83SAwBsAAAAJ:rO6llkc54NcC,"The emerging field of canine cognitive neuroscience uses neuroimaging tools such as electroencephalography (EEG) and functional magnetic resonance imaging (fMRI) to map the cognitive processes of dogs to neural substrates in their brain. Within the past decade, the non-invasive use of EEG has provided real-time, accessible, and portable neuroimaging insight into canine cognitive processes. To promote systematization and create an overview of framings, methods and findings for future work, we provide a systematic review of non-invasive canine EEG studies (N=22), dissecting their study makeup, technical setup, and analysis frameworks and highlighting emerging trends. We further propose new directions of development, such as the standardization of data structures and integrating predictive modeling with descriptive statistical approaches. Our review ends by underscoring the advances and advantages …"
34,Designing pervasive brain-computer interfaces,10,2007,https://scholar.google.com/citations?view_op=view_citation&hl=en&user=83SAwBsAAAAJ&pagesize=50&citation_for_view=83SAwBsAAAAJ:2osOgNQ5qMEC,"The following paper reports on a prototype Brain-computer Interface designed for pervasive control by paralyzed users. Our study indicates that current control and communication devices for users with severe physical disabilities restrict control and independence, offer little articulation and communication capabilities. Integrating multiple devices and services, our application is based on the functional Near-Infrared Imaging technology. Based on the overarching Value-sensitive design framework, our solution is informed by the usage patterns of technology, living habits and daily activities of the disabled users. By designing the context-aware pervasive control solution, we create a venue for communication, environmental control, recreation, assistance and expression among physically disabled patients. The evaluations results of the prototype are also discussed."
35,Dog Driven Robot: Towards Quantifying Problem-Solving Abilities in Dogs,9,2019,https://scholar.google.com/citations?view_op=view_citation&hl=en&user=83SAwBsAAAAJ&pagesize=50&citation_for_view=83SAwBsAAAAJ:ns9cj8rnVeAC,"Training a working dog for a role such as bomb detection or search and rescue can take years, incurring a large cost. As detection work requires visual and odor-based problem-solving abilities, we have started to investigate how to quantify these abilities to assess a dog's potential. Towards this goal, we studied if and how a dog can remotely drive a robot through a simple maze. In our feasibility study, the dogs interact with an affordance mounted on a raised platform which triggers robot movement while also providing visual feedback from the robot. This study evaluated three affordances (tug, button press, and proximity) on two participants to drive the robot through a straight course. By identifying the best robot-canine interaction method, we show the potential for canines extending visual problem-solving abilities to an external device."
36,Recognizing sign language from brain imaging,9,2010,https://scholar.google.com/citations?view_op=view_citation&hl=en&user=83SAwBsAAAAJ&pagesize=50&citation_for_view=83SAwBsAAAAJ:5nxA0vEk-isC,"Classification of complex motor activities from brain imaging is relatively new in the fields of neuroscience and brain-computer interfaces (BCIs). We report sign language classification results for a set of three contrasting pairs of signs. Executed sign accuracy was 93.3%, and imagined sign accuracy was 76.7%. For a full multiclass problem, we used a decision directed acyclic graph of pairwise support vector machines, resulting in 63.3% accuracy for executed sign and 31.4% accuracy for imagined sign. Pairwise comparison of phrases composed of these signs yielded a mean accuracy of 73.4%. These results suggest the possibility of BCIs based on sign language."
37,Training collar-sensed gestures for canine communication,8,2016,https://scholar.google.com/citations?view_op=view_citation&hl=en&user=83SAwBsAAAAJ&pagesize=50&citation_for_view=83SAwBsAAAAJ:qUcmZB5y_30C,"We describe how we trained two dogs to perform precise gestures to be sensed from an inertial measurement unit worn on a dog's collar as part of a larger research effort. These gestures could then be used to relay specific alerts to humans through a companion smartphone application. For example, a guide dog could use a set of two gestures to alert between obstacles requiring a human to 'wait' or 'go around'."
38,Wearable alert system for mobility-assistance service dogs,8,2015,https://scholar.google.com/citations?view_op=view_citation&hl=en&user=83SAwBsAAAAJ&pagesize=50&citation_for_view=83SAwBsAAAAJ:aqlVkmm33-oC,"We present a study of a wearable alert system for mobility-assistance dogs. Our focus in this study is on assessing sensor and dog activation reliability for the purpose of understanding both system and dog training challenges. We improve on the results from previous work in each of four performance metrics and we present solutions to some practical issues necessary for achieving more reliable and consistent experimental results. We also interviewed active service dog users concerning technical, social and canine considerations, the results of which may inform future studies."
39,Optimal control strategies for an SSVEP-based brain-computer interface,8,2010,https://scholar.google.com/citations?view_op=view_citation&hl=en&user=83SAwBsAAAAJ&pagesize=50&citation_for_view=83SAwBsAAAAJ:Tyk-4Ss8FVUC,"We evaluate the performance of 18 healthy subjects on a steady-state visually evoked potential brain–computer interface (BCI) under variation of two general control parameters. The BCI is a simple game amenable to performance measures such as the bitrate, decision accuracy, and optimality ratios based on an ideal human–machine system. The two parameters studied are the electroencephalography recording history length used to form a decision and the number of consecutive identical decisions that must be recognized before feedback is provided. To maximize the bitrate, it appears optimal to minimize the number of consecutive identical decisions required for feedback. When the task of interest often requires making the same decision multiple times in a row, a larger history of data seems preferable. When good performance on a task demands that decisions change rapidly, a smaller history seems optimal …"
40,MoodLens: towards improving nonverbal emotional expression with an in-lens fiber optic display,7,2016,https://scholar.google.com/citations?view_op=view_citation&hl=en&user=83SAwBsAAAAJ&pagesize=50&citation_for_view=83SAwBsAAAAJ:dhFuZR0502QC,"Using an outward-facing display mounted on eyeglasses, MoodLens seeks to help individuals express emotion who have lost the ability to speak or use facial muscles. MoodLens looks like normal eyeglasses when not in use and allows the wearer to experience eye contact normally. We collected data from non-disabled participants (i.e., potential conversation partners for the wearer) who viewed smiling, neutral and frowning emoticons on MoodLens accompanied by computerized speech. The emoticons were recognizable at conversational distances and altered the perceived emotional content of the speech significantly."
41,Play That Trunky Music: Development of an Auditory Enrichment Device for Elephants in Zoos,6,2024,https://scholar.google.com/citations?view_op=view_citation&hl=en&user=83SAwBsAAAAJ&pagesize=50&citation_for_view=83SAwBsAAAAJ:a0OBvERweLwC,"Elephants are a quintessential animal for zoos and wildlife parks. These zoo-housed animals serve as ambassadors to educate the public about their respective species as well as wildlife more broadly. As with any zoo-housed animal, physical and cognitive engagement and exercise are crucially important to the well-being of zoo-housed elephants. A key component of cognitive stimulation for elephants is a complex and variable environment. We designed and deployed an instrumented enrichment device for African elephants (Loxodonta africana) at Zoo Atlanta, augmenting their existing food-based environmental enrichment with audio cognitive enrichment. To gauge elephant interest in our device, we compared usage of the existing food-based enrichment before and after augmentation with audio. The device was installed for 7 days and 10 hours and had a positive impact on frequency and retention time with …"
42,Quantifying canine interactions with smart toys assesses suitability for service dog work,6,2022,https://scholar.google.com/citations?view_op=view_citation&hl=en&user=83SAwBsAAAAJ&pagesize=50&citation_for_view=83SAwBsAAAAJ:SeFeTyx0c_EC,"There are approximately a half million active service dogs in the United States, providing life-changing assistance and independence to people with a wide range of disabilities. The tremendous value of service dogs creates significant demand, which service dog providers struggle to meet. Breeding, raising, and training service dogs is an expensive, time-consuming endeavor which is exacerbated by expending resources on dogs who ultimately will prove to be unsuitable for service dog work because of temperament issues. Quantifying behavior and temperament through sensor-instrumented dog toys can provide a way to predict which dogs will be suitable for service dog work, allowing resources to be focused on the dogs likely to succeed. In a 2-year study, we tested dogs in advanced training at Canine Companions for Independence with instrumented toys, and we discovered that a measure of average bite duration is significantly correlated with a dog's placement success as a service dog [Adjusted OR = 0.12, Pr(>|z|) = 0.00666]. Applying instrumented toy interactions to current behavioral assessments could yield more accurate measures for predicting successful placement of service dogs while reducing the workload of the trainers."
43,Wearable sensors for canine nosework sniffing interaction,6,2021,https://scholar.google.com/citations?view_op=view_citation&hl=en&user=83SAwBsAAAAJ&pagesize=50&citation_for_view=83SAwBsAAAAJ:2P1L_qKh6hAC,"Nosework dogs have important roles in our everyday safety and security, from search and rescue to bomb detection. However, it takes many years for a dog handler to learn to recognize and understand the subtle cues from their canine partner. In this pilot study, we try to bridge the communication gap between nosework dogs and their handlers by developing a wearable device for dogs that collects audio and IMU data fed into machine learning algorithms to classify and predict nosework behaviors. The wearable device we developed uses a cardioid mic and two IMU sensors with the following design goals in mind: (1) dog comfort (2) ease of use for the handler and (3) reducing noise and issues due to the environment. We collected and labeled 20 minutes of audio and IMU data from a nosework dog performing searches while wearing our sensors. In this preliminary phase of the study, we focused our analysis on …"
44,BioGauges: Toward more objective evaluation of biometrically-based interfaces,6,2007,https://scholar.google.com/citations?view_op=view_citation&hl=en&user=83SAwBsAAAAJ&pagesize=50&citation_for_view=83SAwBsAAAAJ:Y0pCki6q_DkC,"In an effort to better understand and fully characterize human interaction with biometrically-based interfaces, the BioGauges method and toolset are presented. BioGauges provide a mechanism for determining the range, reliability, and granularity of control possible for a user operating a biometrically-based interface. We first demonstrate the method with a study of ten able-bodied people characterizing two different continuous biometrically-based interfaces with a thresholded task. Then, we further demonstrate the method by assessing the spatial granularity of two continuous biometrically-based interfaces for five people with varying stages of paralysis due to amyotrophic lateral sclerosis (ALS)."
45,Pervasive direct brain interfaces,6,2006,https://scholar.google.com/citations?view_op=view_citation&hl=en&user=83SAwBsAAAAJ&pagesize=50&citation_for_view=83SAwBsAAAAJ:zYLM7Y9cAGgC,"Several areas of study could provide significant breakthroughs in making direct brain interface systems work. First, improving techniques for obtaining clear and artifact-free brain signals are difficult but critical to making DBIs feasible. Invasive techniques, such as implanted electrodes, could provide better control through clearer, more distinct signal acquisition. We can improve noninvasive techniques, such as scalp electrodes and functional near-infrared (fNIR) imaging, by reducing noise and incorporating more sophisticated filters. In addition, we need much more research on under standing how best to use DBIs in real-world applications"
46,KitBit: an instrumented collar for indoor pets,5,2023,https://scholar.google.com/citations?view_op=view_citation&hl=en&user=83SAwBsAAAAJ&pagesize=50&citation_for_view=83SAwBsAAAAJ:u_35RYKgDlwC,"This paper presents KitBit, a wearable activity tracker for cats, aiming to improve communication between domestic cats and their owners by monitoring feline behavior. We present a compact, lightweight, collar-mounted device with an onboard IMU (accelerometer/gyroscope) and wireless data transmission capabilities. This device was evaluated in a set of hour-long play sessions in the homes of 11 different domestic cats, where it showed good cat-ergonomics and a high degree of reliability while collecting IMU data. An LSTM model trained on the data achieved an overall accuracy of 80.13% in determining the cats’ level of activity compared to a manually-labeled ground-truth dataset. This result shows the feasibility of tracking domestic cats’ activities, and the potential for future developments in feline wearable technology."
47,Proprioceptively displayed interfaces: aiding non-visual on-body input through active and passive touch,5,2021,https://scholar.google.com/citations?view_op=view_citation&hl=en&user=83SAwBsAAAAJ&pagesize=50&citation_for_view=83SAwBsAAAAJ:RGFaLdJalmkC,"On-body input interfaces that can be used accurately without visual attention could have a wide range of applications where vision is needed for a primary task: emergency responders, pilots, astronauts, and people with vision impairments could benefit by making interfaces accessible. This paper describes a between-participant study (104 participants) to determine how well users can locate e-textile interface discrete target touch points on the forearm without visual attention. We examine whether the addition of active touch embroidery and passive touch nubs (metal snaps with vibro-tactile stimulation) helps in locating input touch points accurately. We found that touch points towards the middle of the interface on the forearm were more difficult to touch accurately than at the ends. We also found that the addition of vibro-tactile stimulation aids in the accuracy of touch interactions by over 9% on average, and by almost …"
48,BioGauges for characterizing biometric interface systems,5,2005,https://scholar.google.com/citations?view_op=view_citation&hl=en&user=83SAwBsAAAAJ&pagesize=50&citation_for_view=83SAwBsAAAAJ:hFOr9nPyWt4C,Description not available
49,Applying value sensitive design in pervasive brain-computer interfaces,4,2008,https://scholar.google.com/citations?view_op=view_citation&hl=en&user=83SAwBsAAAAJ&pagesize=50&citation_for_view=83SAwBsAAAAJ:YsMSGLbcyi4C,"Our paper investigates the values fostered and inhibited by current Brain-computer Interface systems for the physically disabled. We report on a study conducted among 12 physically disabled individuals by employing Value Sensitive Design, a tripartite methodology accounting for human values in the design process. Our study reveals that current systems restrict independence, articulation, recreation and customization. We also elicit values that we believe are important in designing Brain-computer Interfaces-family-centricity, a sense of community, altruism, intellectual involvement and autonomy. We discuss how Value Sensitive Design applies to the unexplored domain of Brain-computer Interfaces."
50,Towards Haptic Communication with Working Dogs in Distracting Environments,3,2024,https://scholar.google.com/citations?view_op=view_citation&hl=en&user=83SAwBsAAAAJ&pagesize=50&citation_for_view=83SAwBsAAAAJ:pyW8ca7W8N0C,"Working dogs and humans have collaborated to achieve tasks for thousands of years . Trained working dogs play an essential role in many fields such as search and rescue, explosives and organic materials detection, and medical alerting. As technology advances, the animal-computer interaction community can leverage state-of-the-art hardware and software to improve the ability of working dogs and their human counterparts to communicate. Haptic vests for working dogs have shown potential for communicating nonverbal instructions from human handlers to dogs over a distance. While previous works have examined ways in which dogs can learn to associate commands with various haptic cues, none have examined this technology for working dogs as it might be used in the real world: with distractions, movement, and multiple draws for attention. This paper outlines a number of experiments to examine the …"
