Rank,Title,Citations,Year,URL,Description
1,Towards an independent brain–computer interface using steady state visual evoked potentials,486,2008,https://scholar.google.com/citations?view_op=view_citation&hl=en&user=83SAwBsAAAAJ&pagesize=50&citation_for_view=83SAwBsAAAAJ:u5HHmVD_uO8C,"OBJECTIVE Brain–computer interface (BCI) systems using steady state visual evoked potentials (SSVEPs) have allowed healthy subjects to communicate. However, these systems may not work in severely disabled users because they may depend on gaze shifting. This study evaluates the hypothesis that overlapping stimuli can evoke changes in SSVEP activity sufficient to control a BCI. This would provide evidence that SSVEP BCIs could be used without shifting gaze. METHODS Subjects viewed a display containing two images that each oscillated at a different frequency. Different conditions used overlapping or non-overlapping images to explore dependence on gaze function. Subjects were asked to direct attention to one or the other of these images during each of 12 one-minute runs. RESULTS Half of the subjects produced differences in SSVEP activity elicited by overlapping stimuli that could support BCI …"
2,FIDO-facilitating interactions for dogs with occupations: wearable dog-activated interfaces,102,2013,https://scholar.google.com/citations?view_op=view_citation&hl=en&user=83SAwBsAAAAJ&pagesize=50&citation_for_view=83SAwBsAAAAJ:eQOLeE2rZwMC,"Working dogs have improved the lives of thousands of people. However, communication between human and canine partners is currently limited. The main goal of the FIDO project is to research fundamental aspects of wearable technologies to support communication between working dogs and their handlers. In this pilot study, the FIDO team investigated on-body interfaces for assistance dogs in the form of wearable technology integrated into assistance dog vests. We created four different sensors that dogs could activate (based on biting, tugging, and nose gestures) and tested them on-body with three assistance-trained dogs. We were able to demonstrate that it is possible to create wearable sensors that dogs can reliably activate on command."
3,Applications for brain-computer interfaces,82,2010,https://scholar.google.com/citations?view_op=view_citation&hl=en&user=83SAwBsAAAAJ&pagesize=50&citation_for_view=83SAwBsAAAAJ:r0BpntZqJG4C,"Brain-computer Interfaces (BCIs) have been studied for nearly thirty years, with the primary motivation of providing assistive technologies for people with very severe motor disabilities. The slow speeds, high error rate, susceptibility to artifact, and complexity of BCI systems have been challenges for implementing workable real-world systems. However, recent advances in computing and bio-sensing technologies have improved the outlook for BCI applications, making them promising not only as assistive technologies but also for mainstream applications. This chapter presents a survey of applications for BCI systems, both historical and recent, in order to characterize the broad range of possibilities for neural control."
4,A general framework for characterizing studies of brain interface technology,73,2005,https://scholar.google.com/citations?view_op=view_citation&hl=en&user=83SAwBsAAAAJ&pagesize=50&citation_for_view=83SAwBsAAAAJ:RHpTSmoSYBkC,"The development of brain interface (BI) technology continues to attract researchers with a wide range of backgrounds and expertise. Though the BI community is committed to accurate and objective evaluation of methods, systems, and technology, the very diversity of the methods and terminology used in the field hinders understanding and impairs technology cross-fertilization and cross-group validation of findings. Underlying this dilemma is a lack of common perspective and language. As seen in our previous works in this area, our approach to remedy this problem is to propose language in the form of taxonomy and functional models. Our intent is to document and validate our best thinking in this area and publish a perspective that will stimulate discussion. We encourage others to do the same with the belief that focused discussion on language issues will accelerate the inherently slow natural evolution of …"
5,Going to the dogs: towards an interactive touchscreen interface for working dogs,69,2014,https://scholar.google.com/citations?view_op=view_citation&hl=en&user=83SAwBsAAAAJ&pagesize=50&citation_for_view=83SAwBsAAAAJ:KlAtU1dfN6UC,"Computer-mediated interaction for working dogs is an important new domain for interaction research. In domestic settings, touchscreens could provide a way for dogs to communicate critical information to humans. In this paper we explore how a dog might interact with a touchscreen interface. We observe dogs' touchscreen interactions and record difficulties against what is expected of humans' touchscreen interactions. We also solve hardware issues through screen adaptations and projection styles to make a touchscreen usable for a canine's nose touch interactions. We also compare our canine touch data to humans' touch data on the same system. Our goal is to understand the affordances needed to make touchscreen interfaces usable for canines and help the future design of touchscreen interfaces for assistive dogs in the home."
6,FIDO—Facilitating interactions for dogs with occupations: wearable communication interfaces for working dogs,67,2015,https://scholar.google.com/citations?view_op=view_citation&hl=en&user=83SAwBsAAAAJ&pagesize=50&citation_for_view=83SAwBsAAAAJ:Zph67rFs4hoC,"Working dogs have improved the lives of thousands of people throughout history. However, communication between human and canine partners is currently limited. The main goal of the FIDO project is to research fundamental aspects of wearable technologies to support communication between working dogs and their handlers. In this study, the FIDO team investigated on-body interfaces for dogs in the form of wearable technology integrated into assistance dog vests. We created five different sensors that dogs could activate based on natural dog behaviors such as biting, tugging, and nose touches. We then tested the sensors on-body with eight dogs previously trained for a variety of occupations and compared their effectiveness in several dimensions. We were able to demonstrate that it is possible to create wearable sensors that dogs can reliably activate on command, and to determine cognitive and physical …"
7,Search and rescue: dog and handler collaboration through wearable and mobile interfaces,61,2016,https://scholar.google.com/citations?view_op=view_citation&hl=en&user=83SAwBsAAAAJ&pagesize=50&citation_for_view=83SAwBsAAAAJ:ZeXyd9-uunAC,"Search and Rescue (SAR) is a critical component of disaster recovery efforts. Every second saved in the search increases the chances of finding survivors and the majority of these teams prefer using canines [5]. Our goal is to help enable SAR dog and handler teams to work together more effectively. Using a semi-structured interviews and guidance from K9-SAR experts as we iterate through designs, we develop a two-part system consisting of a wearable computer interface for working SAR dogs that communicates with their handler via a mobile application. Additionally, we discuss the system around a heuristic framework that includes dogs as active participants. Finally, we show the viability of our tool by evaluating it with feedback from three SAR experts."
8,A method to evaluate haptic interfaces for working dogs,50,2017,https://scholar.google.com/citations?view_op=view_citation&hl=en&user=83SAwBsAAAAJ&pagesize=50&citation_for_view=83SAwBsAAAAJ:9ZlFYXVOiuMC,"Working dogs perform a variety of essential services for their human partners, from assisting people with disabilities, to Search and Rescue, police, and military work. Recent interest in the nascent field of Animal–Computer Interaction has prompted research in computer-mediated technology for communication between working dogs and their handlers. Haptic (touch) interfaces in the form of vibrating motors are a promising approach for handler-to-dog communication. Haptic interfaces can provide a silent, long-range method of sending commands to a dog, when voice or hand signals are inappropriate or impossible. However, evaluating haptic interfaces for dogs, who cannot self-report sensations, creates interesting challenges. This study draws on human–computer interaction concepts, such as Just Noticeable Difference, to explore methods and issues in evaluating haptic interfaces for working dogs. We created …"
9,Canine computer interaction: towards designing a touchscreen interface for working dogs,43,2016,https://scholar.google.com/citations?view_op=view_citation&hl=en&user=83SAwBsAAAAJ&pagesize=50&citation_for_view=83SAwBsAAAAJ:IWHjjKOFINEC,"Touchscreens can provide a way for service dogs to relay emergency information about their handlers from a home or office environment. In this paper, we build on work exploring the ability of canines to interact with touchscreen interfaces. We observe new requirements for training and explain best practices found in training techniques. Learning from previous work, we also begin to test new dog interaction techniques such as lift-off selection and sliding gestural motions. Our goal is to understand the affordances needed to make touchscreen interfaces usable for canines and help the future design of touchscreen interfaces for assistance dogs in the home."
10,Towards a canine-human communication system based on head gestures,38,2015,https://scholar.google.com/citations?view_op=view_citation&hl=en&user=83SAwBsAAAAJ&pagesize=50&citation_for_view=83SAwBsAAAAJ:Wp0gIr-vW9MC,"We explored symbolic canine-human communication for working dogs through the use of canine head gestures. We identified a set of seven criteria for selecting head gestures and identified the first four deserving further experimentation. We devised computationally inexpensive mechanisms to prototype the live system from a motion sensor on the dog's collar. Each detected gesture is paired with a predetermined message that is voiced to the humans by a smart phone. We examined the system and proposed gestures in two experiments, one indoors and one outdoors. Experiment A examined both gesture detection accuracy and a dog's ability to perform the gestures using a predetermined routine of cues. Experiment B examined the accuracy of this system on two outdoor working-dog scenarios. The detection mechanism we presented is sufficient to point to improvements into system design and provide valuable …"
11,Individual characteristics and their effect on predicting mu rhythm modulation,38,2010,https://scholar.google.com/citations?view_op=view_citation&hl=en&user=83SAwBsAAAAJ&pagesize=50&citation_for_view=83SAwBsAAAAJ:IjCSPb-OGe4C,"Brain–computer interfaces (BCIs) offer users with severe motor disabilities a nonmuscular input channel for communication and control but require that users achieve a level of literacy and be able to harness their appropriate electrophysiological responses for effective use of the interface. There is currently no formalized process for determining a user's aptitude for control of various BCIs without testing on an actual system. This study presents how basic information captured about users may be used to predict modulation of mu rhythms, electrical variations in the motor cortex region of the brain that may be used for control of a BCI. Based on data from 55 able-bodied users, we found that the interaction of age and daily average amount of hand-and-arm movement by individuals correlates to their ability to modulate mu rhythms induced by actual or imagined movements. This research may be expanded into a more …"
12,Canine-centered computing,34,2017,https://scholar.google.com/citations?view_op=view_citation&hl=en&user=83SAwBsAAAAJ&pagesize=50&citation_for_view=83SAwBsAAAAJ:HDshCWvjkbEC,"Canines and humans have lived together for many thousands of years, to our mutual benefit. In addition to providing companionship, dogs can perform critical roles, such as assisting humans with medical concerns, searching for lost individuals, and detecting substances by scent. Researching how technology might be designed for canines has the potential to significantly improve the lives of both dogs and humans. We draw upon the extensive foundations and literature in human-centered computing to identify and adapt models and methods that are relevant for canines. Our work surveys the landscape of canine-centered computing and canine psychophysics, and generates a framework and set of guidelines to help inform the requirements, design, and evaluation of systems for canines. Our principal aim is to invite and challenge human computer interaction (HCI) researchers to contribute to the field of canine …"
13,Leveraging mobile technology to increase the permanent adoption of shelter dogs,31,2015,https://scholar.google.com/citations?view_op=view_citation&hl=en&user=83SAwBsAAAAJ&pagesize=50&citation_for_view=83SAwBsAAAAJ:YOwf2qJgpHMC,"We present the results of an 8-week pilot study with 55 dogs investigating whether using quantimetric monitors and a companion smartphone application can reduce returns and increase the perceived strength of bonds between newly adopted dogs from the Humane Society of Silicon Valley and their adopters. Through this pilot study, we developed guidelines for future research and discovered promising results indicating that providing dog quantimetric data to adopters through the use of a smartphone application could yield reduced rates of re-relinquishment. Additionally, respondents indicated that they felt using the smartphone application helped them to better meet the activity needs of their dog and increased the bond between themselves and their newly adopted dog."
14,Assessing fit of nontraditional assistive technologies,30,2010,https://scholar.google.com/citations?view_op=view_citation&hl=en&user=83SAwBsAAAAJ&pagesize=50&citation_for_view=83SAwBsAAAAJ:mB3voiENLucC,"There is a variety of brain-based interface methods which depend on measuring small changes in brain signals or properties. These methods have typically been used for nontraditional assistive technology applications. Non-traditional assistive technology is generally targeted for users with severe motor disabilities which may last long-term due to illness or injury or short-term due to situational disabilities. Control of a nontraditional assistive technology can vary widely across users depending upon many factors ranging from health to experience. Unfortunately, there is no systematic method for assessing usability of nontraditional assistive technologies to achieve the best control. The current methods to accommodate users through trial-and-error result in the loss of valuable time and resources as users sometimes have diminishing abilities or suffer from terminal illnesses. This work describes a methodology for …"
15,Towards predicting control of a brain-computer interface,30,2006,https://scholar.google.com/citations?view_op=view_citation&hl=en&user=83SAwBsAAAAJ&pagesize=50&citation_for_view=83SAwBsAAAAJ:d1gkVwhDpl0C,"Individuals suffering from locked-in syndrome are completely paralyzed and unable to speak but otherwise cognitively intact. Traditional assistive technology is ineffective for this population of users due to the physical nature of input devices. Brain-computer and biometric interfaces offer users with severe motor disabilities a non-muscular input channel for communication and control, but require that users be able to harness their appropriate electrophysiological responses for effective use of the interface. There is currently no formalized process for determining a user’s aptitude for control of various biometric interfaces without testing on an actual system. This study presents how basic information captured about users may be used to predict their control of a brain-computer interface that is based on electrical variations in the motor cortex region of the brain. Based on data from 55 able-bodied users, we found that the interaction of age and daily average amount of hand-and-arm movement by individuals correlates to their ability in brain-computer interface control. This research may be expanded into a more robust model linking individual characteristics and control of various biometric interfaces."
16,Creating collar-sensed motion gestures for dog-human communication in service applications,29,2016,https://scholar.google.com/citations?view_op=view_citation&hl=en&user=83SAwBsAAAAJ&pagesize=50&citation_for_view=83SAwBsAAAAJ:7PzlFSSx8tAC,"Working dogs are dogs with one or more specific skills that enable them to perform essential tasks for humans. In this paper we examined motion gestures that working dogs could use to unambiguously communicate with their human companions. We analyzed these gestures in terms of true positives and propensity for false positives by comparing their dynamic time warping distances against a set of everyday gesture libraries (EGL) representing their daily movements. We found four gestures that could be concretely defined, trained, and recognized. These gestures were recognized with 75--100% accuracy, and their false positive rate averaged to less than one per hour."
17,Analyzing trends in brain interface technology: a method to compare studies,29,2006,https://scholar.google.com/citations?view_op=view_citation&hl=en&user=83SAwBsAAAAJ&pagesize=50&citation_for_view=83SAwBsAAAAJ:_Qo2XoVZTnwC,"Continued progress in the field of Brain Interface (BI) research has encouraged the rapid expansion of the BI community over the last two decades. As the number of BI researchers and organizations steadily increases, newer and more advanced technologies are constantly produced, evaluated, and reported. Though the BI community is committed to accurate and objective evaluation of methods, systems, and technology, the diversity of the field has hindered the development of objective methods of comparison. This paper introduces a new method for directly comparing studies of BI technology based on the theoretical models and taxonomy proposed by Mason, Moore, and Birch. The effectiveness of the proposed method was demonstrated by interpreting and comparing a representative set of 21 BI studies. The method allowed us to 1) identify the salient aspects of a specific BI study, 2) identify what has been …"
18,Predicting the suitability of service animals using instrumented dog toys,27,2018,https://scholar.google.com/citations?view_op=view_citation&hl=en&user=83SAwBsAAAAJ&pagesize=50&citation_for_view=83SAwBsAAAAJ:4JMBOYKVnBMC,"Working dogs1 are significantly beneficial to society; however, a substantial number of dogs are released from time consuming and expensive training programs because of unsuitability in behavior. Early prediction of successful service dog placement could save time, resources, and funding. Our research focus is to explore whether aspects of canine temperament can be detected from interactions with sensors, and to develop classifiers that correlate sensor data to predict the success (or failure) of assistance dogs in advanced training. In a 2-year longitudinal study, our team tested a cohort of dogs entering advanced training in the Canine Companions for Independence (CCI) Program with 2 instrumented dog toys: a silicone ball and a silicone tug sensor. We then create a logistic model tree classifier to predict service dog success using only 5 features derived from dog-toy interactions. During randomized 10-fold …"
19,Mobile collaboration for human and canine police explosive detection teams,26,2017,https://scholar.google.com/citations?view_op=view_citation&hl=en&user=83SAwBsAAAAJ&pagesize=50&citation_for_view=83SAwBsAAAAJ:hC7cP41nSMkC,"We designed a communication system for law enforcement officers to use when conducting explosive detection searches with multiple agencies. Dogs trained in explosive detection work alongside human handlers to form a K9 team, which are an integral part of these searches. Officers in K9 teams have a strong bond and communication with these dogs, but noisy locations, long distances, and crowded spaces present challenges. In addition, other officers assigned as backup often lack the experience to read the cues from the canine, which hinders the speed and effectiveness of the team. Coordinating a search with teams from different municipalities presents challenges due to a lack of standard collaboration tools. Getting the right information as quickly as possible saves lives, whether this information is about the areas that have been searched or the location of an explosive device. We hope that in addition to …"
20,Context‐aware user profiles to improve media synchronicity for individuals with severe motor disabilities,23,2022,https://scholar.google.com/citations?view_op=view_citation&hl=en&user=83SAwBsAAAAJ&pagesize=50&citation_for_view=83SAwBsAAAAJ:J_g5lzvAfSwC,"Losing the ability to communicate inhibits social contact, creates feelings of frustration and isolation and complicates personal comfort and medical care. Progressive diseases such as amyotrophic lateral sclerosis (ALS) and multiple sclerosis (MS) can cause severe motor disabilities that make communication through traditional means difficult, slow, and exhausting, even with the support of augmentative and alternative communication (AAC) systems. Using a design science research approach, we seek to improve the communication process for individuals with severe motor disabilities. We develop a series of design requirements to inform the creation and evaluation of an artefact, an AAC system that incorporates context‐aware user profiles to improve the communication process for individuals with severe motor disabilities. We derive prescriptive knowledge through the creation of design principles based on our …"
21,Two-way communication between working dogs and their handlers,21,2014,https://scholar.google.com/citations?view_op=view_citation&hl=en&user=83SAwBsAAAAJ&pagesize=50&citation_for_view=83SAwBsAAAAJ:3fE2CSJIrl8C,"The Facilitating Interactions for Dogs with Occupations (FIDO) project in the Animal Interaction Lab at Georgia Tech aims to facilitate communication between working dogs and their handlers. Here, the authors discuss their research on testing a working dog's ability to perform distinct tasks in response to vibrations at different points on their body."
22,A visual feedback design based on a brain-computer interface to assist users regulate their emotional state,21,2014,https://scholar.google.com/citations?view_op=view_citation&hl=en&user=83SAwBsAAAAJ&pagesize=50&citation_for_view=83SAwBsAAAAJ:MXK_kJrjxJIC,"In situations where there is a stressful workload or when unexpected things occur, people often find it difficult to regulate their emotions. To assist them in effective regulation, this design utilizes neurofeedback, providing users real-time emotion feedback to augment their emotional states through the use of a tangible interface. The visual feedback incorporates a series of colored LEDs that map an individual's affective state. This user study is structured to examine the effect of this training tool in a lab setting. The users are asked to watch several video clips to evoke an agitated state and then try to be calm by using this device. The results will be compared to the users ability to regulate their emotions without any visual tools. The longer term goal of this project is to develop a training tool, to teach people how to regulate their emotions more effectively in stressful situations."
23,Dogs using touchscreens in the home: a case study for assistance dogs operating emergency notification systems,19,2018,https://scholar.google.com/citations?view_op=view_citation&hl=en&user=83SAwBsAAAAJ&pagesize=50&citation_for_view=83SAwBsAAAAJ:NMxIlDl6LWMC,"Medical alert dogs can save lives by alerting their human partners of impending seizures, diabetic crises, the presence of allergens, and other medical emergencies. Recent research has shown that dogs can also alert emergency services or family members through body-worn sensors. In the home, however, service dogs do not typically wear their service dog vests. In this study we show that dogs can be trained to operate touchscreens mounted in the home to alert in emergencies. We performed a home-based field study, training three medical alert dogs to perform a specific pattern of interactions with virtual objects randomly throughout the day on a cue. We showed that it is feasible for a dog to understand the task of locating the touchscreen from anywhere in the home and performing the alert interaction. We also report our training methods and challenges in creating fluency for the touchscreen alert interaction skill."
