Rank,Title,Citations,Year,URL,Description
22,Understanding online job and housing search practices of neurodiverse young adults to support their independence,9,2024,https://scholar.google.com/citations?view_op=view_citation&hl=en&user=puNJcv0AAAAJ&pagesize=50&citation_for_view=puNJcv0AAAAJ:35N4QoGY0k4C,"Securing employment and housing are key aspects of pursuing independent living. As these activities are increasingly practiced online, web accessibility of related services becomes critical for a successful major life transition. Support for this transition is especially important for people with autism or intellectual disability, who often face issues of underemployment and social isolation. In this study, we conducted semi-structured interviews and contextual inquiries with neurotypical adults and adults with autism or intellectual disability to understand common and unique goals, strategies, and challenges of neurodiverse adults when searching for employment and housing resources online. Our findings revealed that current interfaces adequately support practical (e.g., finance) goals but lack information on social (e.g., inclusivity) goals. Furthermore, unexpected search results and inaccessible social and contextual …"
23,Patient Perspectives on AI-Driven Predictions of Schizophrenia Relapses: Understanding Concerns and Opportunities for Self-Care and Treatment,9,2024,https://scholar.google.com/citations?view_op=view_citation&hl=en&user=puNJcv0AAAAJ&pagesize=50&citation_for_view=puNJcv0AAAAJ:vV6vV6tmYwMC,"Early detection and intervention for relapse is important in the treatment of schizophrenia spectrum disorders. Researchers have developed AI models to predict relapse from patient-contributed data like social media. However, these models face challenges, including misalignment with practice and ethical issues related to transparency, accountability, and potential harm. Furthermore, how patients who have recovered from schizophrenia view these AI models has been underexplored. To address this gap, we first conducted semi-structured interviews with 28 patients and reflexive thematic analysis, which revealed a disconnect between AI predictions and patient experience, and the importance of the social aspect of relapse detection. In response, we developed a prototype that used patients’ Facebook data to predict relapse. Feedback from seven patients highlighted the potential for AI to foster collaboration …"
24,Visual analysis of relationships between behavioral and physiological sensor data,7,2015,https://scholar.google.com/citations?view_op=view_citation&hl=en&user=puNJcv0AAAAJ&pagesize=50&citation_for_view=puNJcv0AAAAJ:qjMakFHDy7sC,"More and more people are collecting, organizing, and interpreting health data through off-the-shelf products such as Apple's Health Kit. People use these systems to collect steps taken, calories ingested, etc. These ecosystems also support the collection of physiological data. For example, users collect heart rate data during exercise, and even electro dermal activity data to help detect the onset of seizures. Analyzing physiological data, however, and relating it to specific behaviors or events, is challenging. In this paper, we present an 11-week, multi-session, participatory design case study, identify challenges in analyzing physiological and behavior data, and present BEDA, an analytics tool we developed to mitigate the challenges. The two primary data analysis challenges include: (1) interfacing multiple software programs required for capturing and analyzing the different data sources, and (2) extending the limited …"
25,Education Partnerships: A Co-Design Classroom for College Students with Intellectual and Developmental Disabilities,6,2024,https://scholar.google.com/citations?view_op=view_citation&hl=en&user=puNJcv0AAAAJ&pagesize=50&citation_for_view=puNJcv0AAAAJ:3s1wT3WcHBgC,"Co-design of technology encourages participation and decision-making input of end-users. In the case of technologies for individuals with Intellectual and Developmental Disabilities (IDD), the end-users are historically left out of the design process. Further deepening the disconnect between this group and technology, they are also excluded from formal technology design knowledge sharing, such as college courses. To address this, our study investigates the efficacy of a formal classroom adaptation of co-design activities to encourage learning and participation. Through collaboration between educators and designers, we adopted user-centered co-design activities to facilitate knowledge and application of technological design methods within a class of 13 students with IDD. Findings uncovered factors contributing to co-teaching collaboration planning and reflection between educators and designers, and ways that …"
26,Developing scripts to teach social skills: can the crowd assist the author?,6,2011,https://scholar.google.com/citations?view_op=view_citation&hl=en&user=puNJcv0AAAAJ&pagesize=50&citation_for_view=puNJcv0AAAAJ:9yKSN-GCB0IC,"The social world that most of us navigate effortlessly can prove to be a perplexing and disconcerting place for individuals with autism. Currently there are no models to assist non-expert authors as they create customized social script-based instructional modules for a particular child. We describe an approach to using human computation to develop complex models of social scripts for a plethora of complex and interesting social scenarios, possible obstacles that may arise in those scenarios, and potential solutions to those obstacles. Human input is the natural way to build these models, and in so doing create valuable assistance for those trying to navigate the intricacies of a social life."
27,Working Together Toward Interdependence: Chatbot-Based Support for Balanced Social Interactions Between Neurodivergent and Neurotypical Individuals,5,2025,https://scholar.google.com/citations?view_op=view_citation&hl=en&user=puNJcv0AAAAJ&pagesize=50&citation_for_view=puNJcv0AAAAJ:rO6llkc54NcC,"While many technologies have been developed for facilitating interaction between neurodivergent and neurotypical people to bridge communication differences and reduce social exclusion, most focus on supporting and teaching neurodivergent people to adapt to neurotypical standards and norms. To promote a more balanced approach to bridging the social gap, we conducted a 5-day diary study and semi-structured interviews with 16 participants (8 neurotypical and 8 with intellectual disability) to examine the current factors and barriers to their social interactions and to explore the design of social support chatbot systems. Our findings revealed diverging views between the groups on factors they valued in their interaction, and identified social uncertainty and differing social expectations as the main barriers to successful interactions. Based on the results, we outline three pitfalls that social support chatbots can fall …"
28,Grow With Me: Exploring the Integration of Augmented Reality and Health Tracking Technologies to Promote Physical Activity,5,2024,https://scholar.google.com/citations?view_op=view_citation&hl=en&user=puNJcv0AAAAJ&pagesize=50&citation_for_view=puNJcv0AAAAJ:lSLTfruPkqcC,"Maintaining a healthy lifestyle requires ongoing and consistent effort. To address this challenge, a variety of technologies, such as wearable devices, have been investigated to encourage individuals to adopt healthy habits. We introduce Grow with Me that combines an Augmented Reality (AR) virtual pet with fitness tracking. In our application, the user’s goal achievement level is linked to the health and mood of the user’s virtual dog. As the user makes progress, their virtual dog learns new tricks and provides new interaction possibilities. To evaluate this solution, we conducted a mixed-methods within-subjects study with 21 participants who used both the 2D and AR versions of our application. Our results uncovered that the AR pet elicited stronger emotional responses, and participants expressed a greater willingness to use AR as a motivational tool. In this paper, we will present our study and its findings, as well as …"
29,It takes two to avoid pregnancy: Addressing conflicting perceptions of birth control pill responsibility in romantic relationships,5,2023,https://scholar.google.com/citations?view_op=view_citation&hl=en&user=puNJcv0AAAAJ&pagesize=50&citation_for_view=puNJcv0AAAAJ:blknAaTinKkC,"While birth control pills are one of the most common forms of contraception, their usage has several emotional and physical costs, such as taking the pill daily and experiencing hormonal side effects. The burden of these tasks in relationships generally falls on the pill user with minimal involvement from their partner. In this study, we conducted semi-structured interviews with pill users and their partners to investigate the differences between their perceived current and ideal divisions of birth control responsibility. During the interview, we presented a collaborative birth control tracking app prototype to examine how such technology can overcome these discrepancies. We found that pill users were unsatisfied with their partners' engagement in contraceptive tasks but did not communicate this well. Meanwhile, partners wanted to contribute more to pregnancy prevention but did not know how. When presented with our app …"
30,Supporting the contact tracing process with WiFi location data: opportunities and challenges,5,2022,https://scholar.google.com/citations?view_op=view_citation&hl=en&user=puNJcv0AAAAJ&pagesize=50&citation_for_view=puNJcv0AAAAJ:iH-uZ7U-co4C,"Contact tracers assist in containing the spread of highly infectious diseases such as COVID-19 by engaging community members who receive a positive test result in order to identify close contacts. Many contact tracers rely on community member’s recall for those identifications, and face limitations such as unreliable memory. To investigate how technology can alleviate this challenge, we developed a visualization tool using de-identified location data sensed from campus WiFi and provided it to contact tracers during mock contact tracing calls. While the visualization allowed contact tracers to find and address inconsistencies due to gaps in community member’s memory, it also introduced inconsistencies such as false-positive and false-negative reports due to imperfect data, and information sharing hesitancy. We suggest design implications for technologies that can better highlight and inform contact tracers of …"
31,Emotion-behavior interplay in human animal-robot interaction (hari),4,2024,https://scholar.google.com/citations?view_op=view_citation&hl=en&user=puNJcv0AAAAJ&pagesize=50&citation_for_view=puNJcv0AAAAJ:J_g5lzvAfSwC,"This preliminary study investigates the emotional and behavioral responses of neurotypical (NT) and neurodivergent (ND) individuals during interactions with a robotic dog. Previous research has demonstrated the advantages of using robots and animals in therapies for autistic individuals. However, specific behaviors that elicit positive responses are not well-documented. The aim of the study is to identify these behaviors. The study involves 9 participants (NT and ND) engaging with a robotic dog in individual sessions. Pre- and post-surveys, along with interviews, were conducted to assess the participants' perceptions. Both qualitative and quantitative analyses were conducted. Results indicate significant differences in the frequency and nature of positive responses between the two groups, highlighting distinctions in the robot behaviors that evoke positive reactions. This study contributes valuable insights into the …"
32,Labor saving and labor making of value in online congratulatory messages,4,2015,https://scholar.google.com/citations?view_op=view_citation&hl=en&user=puNJcv0AAAAJ&pagesize=50&citation_for_view=puNJcv0AAAAJ:UeHWp8X0CEIC,"Social reminder interfaces on social networking sites (SNSs), such as the Facebook birthday reminder, make sending a congratulatory message easier than ever. However, the lower cost in time and effort can also devalue a simple message, and one-click congratulations may be criticized as impersonal. Nevertheless, they are still widely used. In this paper, we investigate how people find value in short congratulatory birthday messages on Facebook despite the criticism. We conducted interviews with 17 participants with the aid of a reflective prompting tool developed to aggregate participants’ previous birthday posts. Participants found the most value in personalized birthday posts, posts for reconnecting with dormant ties, and in the presentation of public affirmation posts for their imagined audience. We use signaling theory to interpret our findings and explain how a social reminder interface that lowers the cost in …"
33,"The effects of a pressure vest on task engagement, challenging behavior, and a physiological measure of stress for a child with intellectual disability",3,2015,https://scholar.google.com/citations?view_op=view_citation&hl=en&user=puNJcv0AAAAJ&pagesize=50&citation_for_view=puNJcv0AAAAJ:zYLM7Y9cAGgC,"We examined the effect of wearing a pressurized vest, a commonly use sensory support, with one student who had disabilities and for whom this sensory support was indicated. Using single-case reversal design logic (ABCA), we measured effects on both observable behavior and a physiological measure of arousal, electrodermal activity (EDA). Behavioral results indicated that the interventionist’s instructional practices affected the frequency of behaviors observed, but the pressure vest did not. EDA results were inconclusive but offered no significant indications of the pressurized vest affecting levels of arousal. We present the results of this study, its limitations, and a discussion of the use of these two measures in evaluating sensory-based therapies."
34,Co-designing Robot Dogs with and for Neurodivergent Individuals: Opportunities and Challenges,2,2024,https://scholar.google.com/citations?view_op=view_citation&hl=en&user=puNJcv0AAAAJ&pagesize=50&citation_for_view=puNJcv0AAAAJ:SeFeTyx0c_EC,"Social robots have been demonstrated to support neurodivergent individuals in health and educational settings, but the roles and benefits of social robots in the everyday lives of neurodivergent people are underexplored. We investigated daily-life use cases of robot dogs for neurodivergent individuals through three co-design workshops over five weeks. The workshops included interactions between neurodivergent participants and robot dogs, followed by feedback sessions. Participants showed high acceptance levels towards robot dogs and envisioned use cases that fulfilled practical, emotional, and social needs. Some participants associated robotic failures with rejection, leading us to further explore the impacts and communication of failures. Results showed how robot dogs can provide opportunities for users to be in a caregiving role and engage in interpersonal interactions. We conclude by discussing how to …"
35,Understanding Human-AI Misalignment in LLM-Based Job-Seeking Support for Neurodivergent Users,1,2025,https://scholar.google.com/citations?view_op=view_citation&hl=en&user=puNJcv0AAAAJ&pagesize=50&citation_for_view=puNJcv0AAAAJ:4OULZ7Gr8RgC,"Large Language Models are often trained on data reflecting neurotypical norms, yet are increasingly deployed to support neurodivergent users in sensitive domains like job-seeking. We examine interactions between neurodivergent job-seekers and a GPT-4-powered career support chatbot through the lens of misalignment. Through analysis of over 300 chat logs and interviews with 15 neurodivergent participants, we found that the chatbot frequently misrepresented users’ skills, imposed neurotypical language and expectations, and provided generic or inappropriate advice– even when relevant user data was available. Participants expected the chatbot to interpret implicit insights from their data, however, they sometimes lacked the clarity or confidence to correct the system when it did not, revealing gaps in both AI design and user understanding of system function. Our findings underscore the need for bi-directional …"
36,Breaking Barriers in Remote Client-Therapist Interaction: Exploring Design Spaces of Sensing and Sharing Non-Verbal Cues in Remote Psychotherapy,1,2025,https://scholar.google.com/citations?view_op=view_citation&hl=en&user=puNJcv0AAAAJ&pagesize=50&citation_for_view=puNJcv0AAAAJ:zA6iFVUQeVQC,"In remote psychotherapy, challenges arising from remote client-therapist interactions can impact the therapeutic alliance and overall outcomes. HCI research has focused on leveraging sensing technology to bridge gaps in remote interactions. In this work, we investigate the values and risks of integrating sensing technology in remote psychotherapy, specifically to capture and interpret non-verbal cues, by conducting a speculative design study with both clients and therapists. Our findings reveal that sensing technology has the potential to facilitate self-reflection in therapy. The sharing of tracked non-verbal cues could also possibly foster mutual disclosure, supporting therapists' judgments and balancing power dynamics between clients and therapists. However, clients and therapists were concerned about the accuracy of sensing systems, potential privacy threats, and additional cognition burden. Our insights into …"
37,Designing a Generative AI-Assisted Music Psychotherapy Tool for Deaf and Hard-of-Hearing Individuals,0,2026,https://scholar.google.com/citations?view_op=view_citation&hl=en&user=puNJcv0AAAAJ&pagesize=50&citation_for_view=puNJcv0AAAAJ:cFHS6HbyZ2cC,"Songwriting has long served as a powerful medium for expressing unconscious emotions and fostering self-awareness in psychotherapy. Due to the auditory-centric nature of traditional approaches, Deaf and Hard-of-Hearing (DHH) individuals have often been excluded from music's therapeutic benefits. In response, this study presents a music psychotherapy tool co-designed with therapists, integrating conversational agents (CAs) and music generative AI as symbolic and therapeutic media. Through a usage study with 23 DHH individuals, we found that collaborative song writing with the CA enabled them to experience emotional release, reinterpretation, and deeper self-understanding. In particular, the CA's strategies -- supportive empathy, example response options, and visual-based metaphors -- were found to facilitate musical dialogue effectively for DHH individuals. These findings contribute to inclusive AI design by showing the potential of human-AI collaboration to bridge therapeutic artistic practices."
38,From Daily Song to Daily Self: Supporting Reflective Songwriting of Deaf and Hard-of-Hearing Individuals through Generative Music AI,0,2026,https://scholar.google.com/citations?view_op=view_citation&hl=en&user=puNJcv0AAAAJ&pagesize=50&citation_for_view=puNJcv0AAAAJ:dfsIfKJdRG4C,"The rapid advancement of generative AI (GenAI) is expanding access to songwriting, offering a new medium of self-expression for Deaf and Hard-of-Hearing (DHH) individuals. However, emerging technologies that support DHH individuals in expressing themselves through music have largely been evaluated in single-session settings and often fall short in helping users unfamiliar with songwriting convey personal narratives or sustain engagement over time. This paper explores songwriting as an extended, music-based journaling practice that supports sustained emotional reflection over multiple sessions. We introduce SoulNote, a GenAI system enabling DHH to engage in iterative songwriting. Grounded in user-centered design, including a design workshop, a preliminary study, and a multi-session diary study, our findings show that ongoing songwriting with \textit{SoulNote} facilitated emotional growth across three dimensions: self-insight, emotion regulation, and \revised{everyday attitudes toward emotions and self-care}. Overall, this work demonstrates how GenAI can support marginalized communities by transforming creative expression into a daily practice of self-discovery and reflection."
39,Collective Voice: Recovered-Peer Support Mediated by An LLM-Based Chatbot for Eating Disorder Recovery,0,2025,https://scholar.google.com/citations?view_op=view_citation&hl=en&user=puNJcv0AAAAJ&pagesize=50&citation_for_view=puNJcv0AAAAJ:fPk4N6BV_jEC,"Peer recovery narratives provide unique benefits beyond professional or lay mentoring by fostering hope and sustained recovery in eating disorder (ED) contexts. Yet, such support is limited by the scarcity of peer-involved programs and potential drawbacks on recovered peers, including relapse risk. To address this, we designed RecoveryTeller, a chatbot adopting a recovered-peer persona that portrays itself as someone recovered from an ED. We examined whether such a persona can reproduce the support affordances of peer recovery narratives. We compared RecoveryTeller with a lay-mentor persona chatbot offering similar guidance but without a recovery background. We conducted a 20-day cross-over deployment study with 26 ED participants, each using both chatbots for 10 days. RecoveryTeller elicited stronger emotional resonance than a lay-mentor chatbot, yet tensions between emotional and epistemic trust led participants to view the two personas as complementary rather than substitutes. We provide design implications for mental health chatbot persona design."
40,"Development, Evaluation, and Design Implications of Manipulation Robot Teaching Pendants Based on UI Design Principles",0,2025,https://scholar.google.com/citations?view_op=view_citation&hl=en&user=puNJcv0AAAAJ&pagesize=50&citation_for_view=puNJcv0AAAAJ:u_35RYKgDlwC,"A manipulator has great potential as a robotic companion designed to operate closely alongside humans. However, teaching a new capability to a robot is still a significant challenge for end-users due to the lack of proper expertise. This study investigates the usability of a teaching pendant designed for controlling a manipulator, with a specific focus on non-expert users. Recognizing the complexity of existing teaching devices, the research aims to create a user-friendly interface fostering intuitive human-robot interaction. Our teaching pendant utilizes HTC Vive VR controllers and a tablet application named “Wizard”. We employed a mixed-methods approach encompassing usability evaluation surveys and interviews involving 17 participants. Our findings reveal overall positive feedback, with notable strengths in intuitive mapping and responsive control. However, challenges related to control precision and interface …"
41,Supporting Transition Planning to Prepare Individuals with Autism Find Opportunities for Employment: Technological Design Challenges and Recommendations,0,2021,https://scholar.google.com/citations?view_op=view_citation&hl=en&user=puNJcv0AAAAJ&pagesize=50&citation_for_view=puNJcv0AAAAJ:k_IJM867U9cC,Description not available
42,"The power of collective endorsements: Promoting credibility, belonging, and participation in medical support communitiesThe power of collective endorsements: Promoting …",0,2019,https://scholar.google.com/citations?view_op=view_citation&hl=en&user=puNJcv0AAAAJ&pagesize=50&citation_for_view=puNJcv0AAAAJ:maZDTaKrznsC,"Medical costs are the leading cause of bankruptcy in the United States. Recently, crowdfunding sites such as GoFundMe have helped reduce medical bankruptcies across the United States by allowing people to easily create a personal campaign webpage and raise funds from a large number of people on the Internet. One notable GoFundMe campaign, created by a family with a son who needs stem cell treatment, raised over $250,000 in a week and has been shared over 4,000 times. How can an individuals medical story shared on the Internet attract such a large number of people–including strangers–to support the patient? My thesis addresses this issue through several different angles: credibility, social translucency, and community participation. Tying these three themes together is the concept of collective endorsements. I introduced the concept of collective endorsements while investigating the factors that influence the perceived credibility of medical crowdfunding campaigns. Establishing the credibility of medical crowdfunding campaigns is very important because many potential supporters often worry about participating in fraudulent campaigns. In particular, strangers who do not have any personal relationship with the patient often have difficulty evaluating the campaign’s credibility due to their limited ability to verify the patient’s medical situation. Collective endorsements offer an alternative way to assess the patient's medical situation through a collection of evidence: what many people say and do around the patient. In medical crowdfunding campaigns, however, most collective endorsements, such as campaign shares and offline …"
