Rank,Title,Citations,Year,URL,Description
1,Designing a social network to support the independence of young adults with autism,118,2012,https://scholar.google.com/citations?view_op=view_citation&hl=en&user=puNJcv0AAAAJ&pagesize=50&citation_for_view=puNJcv0AAAAJ:u-x6o8ySG0sC,"Independence is key to a successful transition to adulthood for individuals with autism. Social support is a crucial factor for achieving adaptive self-help life skills. In this paper we describe the results of a formative design exercise with young adults with autism and their caregivers to uncover opportunities for social networks to promote independence and facilitate coordination. We propose the concept of SocialMirror, a device connected to an online social network that allows the young adult to seek advice from a trusted and responsive network of family, friends and professionals. Focus group discussions reveal the potential for SocialMirror to increase motivation to learn everyday life skills among young adults with autism and to foster collaboration among a distributed care network. We present design considerations to leverage a small trusted network that balances quick response with safeguards for privacy and …"
2,The power of collective endorsements: credibility factors in medical crowdfunding campaigns,90,2016,https://scholar.google.com/citations?view_op=view_citation&hl=en&user=puNJcv0AAAAJ&pagesize=50&citation_for_view=puNJcv0AAAAJ:YsMSGLbcyi4C,"Traditional medical fundraising charities have been relying on third-party watchdogs and carefully crafting their reputation over time to signal their credibility to potential donors. As medical fundraising campaigns migrate to online platforms in the form of crowdfunding, potential donors can no longer rely on the organization's traditional methods for achieving credibility. Individual fundraisers must establish credibility on their own. Potential donors, therefore, seek new factors to assess the credibility of crowdfunding campaigns. In this paper, we investigate current practices in assessing the credibility of online medical crowdfunding campaigns. We report results from a mixed-methods study that analyzed data from social media and semi-structured interviews. We discovered eleven factors associated with the perceived credibility of medical crowdfunding. Of these, three communicative/emotional factors were unique to …"
3,Personalized academic research paper recommendation system,83,2013,https://scholar.google.com/citations?view_op=view_citation&hl=en&user=puNJcv0AAAAJ&pagesize=50&citation_for_view=puNJcv0AAAAJ:r0BpntZqJG4C,"A huge number of academic papers are coming out from a lot of conferences and journals these days. In these circumstances, most researchers rely on key-based search or browsing through proceedings of top conferences and journals to find their related work. To ease this difficulty, we propose a Personalized Academic Research Paper Recommendation System, which recommends related articles, for each researcher, that may be interesting to her/him. In this paper, we first introduce our web crawler to retrieve research papers from the web. Then, we define similarity between two research papers based on the text similarity between them. Finally, we propose our recommender system developed using collaborative filtering methods. Our evaluation results demonstrate that our system recommends good quality research papers."
4,Investigating the use of circles in social networks to support independence of individuals with autism,48,2013,https://scholar.google.com/citations?view_op=view_citation&hl=en&user=puNJcv0AAAAJ&pagesize=50&citation_for_view=puNJcv0AAAAJ:d1gkVwhDpl0C,"Building social support networks is crucial both for less-independent individuals with autism and for their primary caregivers. In this paper, we describe a four-week exploratory study of a social network service (SNS) that allows young adults with autism to garner support from their family and friends. We explore the unique benefits and challenges of using SNSs to mediate requests for help or advice. In particular, we examine the extent to which specialized features of an SNS can engage users in communicating with their network members to get advice in varied situations. Our findings indicate that technology-supported communication particularly strengthened the relationship between the individual and extended network members, mitigating concerns about over-reliance on primary caregivers. Our work identifies implications for the design of social networking services tailored to meet the needs of this special …"
5,Person-centered transition planning for youth on the autism spectrum: What are we still missing?,41,2022,https://scholar.google.com/citations?view_op=view_citation&hl=en&user=puNJcv0AAAAJ&pagesize=50&citation_for_view=puNJcv0AAAAJ:j3f4tGmQtD8C,"The person-centered individualized education program (IEP) transition planning has emerged as a primary indicator of quality services, and as a predictor for successful post-school outcomes for transition-age youth with autism spectrum disorders (ASD). However, these person-centered transition practices are not uniformly implemented across the United States. Using a combined Self-Determination Theory and Ecological Systems Theory, we examined the facilitators and barriers of implementing the person-centered transition practices for youth with ASD. We conducted interviews with 21 stakeholders including youth with ASD, parents, and professionals.The current findings indicated that person-centered transition planning practices for youth with ASD showed inconsistencies and areas of need for improvement. Four key factor levels were identified based on a theoretical framework: individual level, microsystem …"
6,Skin Conductance as an In Situ Marker for Emotional Arousal in Children with Neurodevelopmental Communication Impairments: Methodological Considerations …,40,2017,https://scholar.google.com/citations?view_op=view_citation&hl=en&user=puNJcv0AAAAJ&pagesize=50&citation_for_view=puNJcv0AAAAJ:mB3voiENLucC,"Even though electrodermal activity has been widely used in the study of psychological states and processes for over 130 years, the use of such technology in situ, within the context of daily activities, remains a major challenge. Recent technological advancements have led to the development of wearable biosensors that noninvasively measure electrical conductance across the skin. These biosensors represent a new approach for skin conductance assessment, as a proxy for emotional arousal, in children with neurodevelopmental communication impairments who are often described as having difficulties with emotional regulation, expressing thoughts and feelings, and present a higher prevalence of challenging behaviors. Here we provide an overview of skin conductance and explore the benefits of recent technological advancements for applied research and clinical practice. We draw on user experience from two …"
7,The Workplace Playbook VR: Exploring the Design Space of Virtual Reality to Foster Understanding of and Support for Autistic People,34,2022,https://scholar.google.com/citations?view_op=view_citation&hl=en&user=puNJcv0AAAAJ&pagesize=50&citation_for_view=puNJcv0AAAAJ:TFP_iSt0sucC,"A growing number of organizations are hiring autistic individuals as they start to recognize the value of a neurodiverse workforce. Despite this trend, the lack of support for autistic employees in workplaces complicates their employment. However, little is known about how people around autistic individuals can support them to create pleasant employment experiences. In this work, we develop the concept of the Workplace Playbook VR to investigate how virtual reality (VR) can help autistic people develop their work-related social communication skills in partnership with people in their support network. Using a video prototype to present the concept, we interviewed 28 participants, including 10 autistic people and 18 members of their support networks, which included family members and professionals. Our interviews revealed that the Workplace Playbook VR program can provide common ground for autistic people …"
8,""" Not by Money Alone"" Social Support Opportunities in Medical Crowdfunding Campaigns",34,2017,https://scholar.google.com/citations?view_op=view_citation&hl=en&user=puNJcv0AAAAJ&pagesize=50&citation_for_view=puNJcv0AAAAJ:ZeXyd9-uunAC,"Medical crowdfunding helps patients receive financial support from their distributed social networks online. However, little is known about who the patient's supporters are, what support they provide, and why. To address this, we interviewed fifteen people involved in medical crowdfunding, including both beneficiaries and supporters. We found that support networks were larger than beneficiaries expected, with strangers offering support. Supporters offered not only monetary but also volunteering contributions including campaign creation, promotion, and external support. However, the emphasis medical crowdfunding interfaces place on monetary contributions led to social issues. Beneficiaries' close friends felt pressured to donate money they could not afford to give. And beneficiaries promoting the campaign worried they would be judged for requesting money. To mitigate these concerns, we suggest making the …"
9,Designing for strengths: Opportunities to support neurodiversity in the workplace,31,2024,https://scholar.google.com/citations?view_op=view_citation&hl=en&user=puNJcv0AAAAJ&pagesize=50&citation_for_view=puNJcv0AAAAJ:70eg2SAEIzsC,"Supported employment programs have demonstrated the ability to enhance employment outcomes for neurodivergent individuals by offering personalized job coaching that aligns with the strengths of each individual. While various technological interventions have been designed to support these programs, technologies that hyperfocus on users’ assumed challenges through deficit-based design have been criticized due to their potential to undermine the agency of neurodivergent individuals. Therefore, we use strengths-based co-design to explore the opportunities for a technology that supports neurodivergent employees using their strengths. The co-design activities uncovered our participants’ current strategies to address workplace challenges, the strengths they employ, and the technology designs that our participants developed to operationalize those strengths in a supportive technology. We find that …"
10,Toward inclusive mindsets: Design opportunities to represent neurodivergent work experiences to neurotypical co-workers in virtual reality,31,2023,https://scholar.google.com/citations?view_op=view_citation&hl=en&user=puNJcv0AAAAJ&pagesize=50&citation_for_view=puNJcv0AAAAJ:ldfaerwXgEUC,"Inclusive workplaces require mutual efforts between neurotypical (NT) and neurodivergent (ND) employees to understand one another’s viewpoints and experiences. Currently, the majority of inclusivity training places the burden of change on NDs to conform to NT social-behavioral standards. Our research examines moving toward a more equal effort distribution by exploring virtual reality (VR) design opportunities to build NTs’ understanding of ND workplace experiences. Using participatory design, including generative toolkits and design meetings, we surfaced two main themes that could bridge gaps in understanding: (1) NTs’ recognition of NDs’ strengths and efforts at work, and (2) NTs’ understanding of NDs’ differences. We present a strengths-based assessment of ND traits in the workplace, focusing on how workplaces can support NDs’ success. Finally, we propose VR simulation designs that communicate …"
11,Understanding identity presentation in medical crowdfunding,23,2018,https://scholar.google.com/citations?view_op=view_citation&hl=en&user=puNJcv0AAAAJ&pagesize=50&citation_for_view=puNJcv0AAAAJ:R3hNpaxXUhUC,"People desire to present themselves favorably to others. However, medical crowdfunding beneficiaries are often expected to present their dire medical conditions and financial straits to solicit financial support. To investigate how beneficiaries convey their situation on medical crowdfunding pages and how contributors perceive the presented information, we interviewed both medical crowdfunding beneficiaries and contributors. While beneficiaries emphasized the serious of their medical situations to signal their deservedness of support, contributor participants gave less attention to that content. Rather, they focused on their impression of the beneficiary's character formed by various features of contributions such as the contributor's names, messages, and shared pictures. These contribution features further signaled common connections between the beneficiary and contributors and each contributor's unique …"
12,Personalized academic paper recommendation system,21,2015,https://scholar.google.com/citations?view_op=view_citation&hl=en&user=puNJcv0AAAAJ&pagesize=50&citation_for_view=puNJcv0AAAAJ:Tyk-4Ss8FVUC,"Recommendation systems can take advantage of social media in various ways. One common example is combining social relationship into neighborhood-based recommendation systems, under the assumption that social relationship affects individuals’ interest or preference. Although this assumption may not be always true, this paper presents a realistic application, personalized academic paper recommendation system, which social relationship can be closely related to taste. There is an increasing number of academic papers being published each year, but most researchers rely on keyword-based search or browsing through proceedings of top conferences and journals to find their related work. Personalized academic paper recommendation system is designed to reduce their workload. With a collaborative-filteringbased approach, it recommends potentially preferred articles for each researcher in personalized manner. Both computational evaluation and user study demonstrate that our system recommends a useful set of research papers."
13,Private yet social: How LLM chatbots support and challenge eating disorder recovery,20,2025,https://scholar.google.com/citations?view_op=view_citation&hl=en&user=puNJcv0AAAAJ&pagesize=50&citation_for_view=puNJcv0AAAAJ:ZHo1McVdvXMC,"Eating disorders (ED) are complex mental health conditions that require long-term management and support. Recent advancements in large language model (LLM)-based chatbots offer the potential to assist individuals in receiving immediate support. Yet, concerns remain about their reliability and safety in sensitive contexts such as ED. We explore the opportunities and potential harms of using LLM-based chatbots for ED recovery. We observe the interactions between 26 participants with ED and an LLM-based chatbot, WellnessBot, designed to support ED recovery, over 10 days. We discovered that our participants have felt empowered in recovery by discussing ED-related stories with the chatbot, which served as a personal yet social avenue. However, we also identified harmful chatbot responses, especially concerning individuals with ED, that went unnoticed partly due to participants’ unquestioning trust in the …"
14,Promoting self-efficacy of individuals with autism in practicing social skills in the workplace using virtual reality and physiological sensors: Mixed methods study,20,2024,https://scholar.google.com/citations?view_op=view_citation&hl=en&user=puNJcv0AAAAJ&pagesize=50&citation_for_view=puNJcv0AAAAJ:BqipwSGYUEgC,"Background Individuals with autism often experience heightened anxiety in workplace environments because of challenges in communication and sensory overload. As these experiences can result in negative self-image, promoting their self-efficacy in the workplace is crucial. Virtual reality (VR) systems have emerged as promising tools for enhancing the self-efficacy of individuals with autism in navigating social scenarios, aiding in the identification of anxiety-inducing situations, and preparing for real-world interactions. However, there is limited research exploring the potential of VR to enhance self-efficacy by facilitating an understanding of emotional and physiological states during social skills practice. Objective This study aims to develop and evaluate a VR system that enabled users to experience simulated work-related social scenarios and reflect on their behavioral and physiological data through data visualizations. We intended to investigate how these data, combined with the simulations, can support individuals with autism in building their self-efficacy in social skills. Methods We developed WorkplaceVR, a comprehensive VR system designed for engagement in simulated work-related social scenarios, supplemented with data-driven reflections of users’ behavioral and physiological responses. A within-subject deployment study was subsequently conducted with 14 young adults with autism to examine WorkplaceVR’s feasibility. A mixed methods approach was used, compassing pre- and postsystem use assessments of participants’ self-efficacy perceptions. Results …"
15,VISTA: User-centered VR training system for effectively deriving characteristics of people with autism spectrum disorder,16,2022,https://scholar.google.com/citations?view_op=view_citation&hl=en&user=puNJcv0AAAAJ&pagesize=50&citation_for_view=puNJcv0AAAAJ:M3NEmzRMIkIC,"Pervasive symptoms of people with autism spectrum disorder (ASD), such as a lack of social and communication skills, are major challenges to be embraced in the workplace. Although much research has proposed VR training programs, their effectiveness is somewhat unclear, since they provide limited, one-sided interactions through fixed scenarios or do not sufficiently reflect the characteristics of people with ASD (e.g., preference for predictable interfaces, sensory issues). In this paper, we present VISTA, a VR-based interactive social skill training system for people with ASD. We ran a user study with 10 people with ASD and 10 neurotypical people to evaluate user experience in VR training and to examine the characteristics of people with ASD based on their physical responses generated by sensor data. The results showed that ASD participants were highly engaged with VISTA and improved self-efficacy after …"
16,Enriched social translucence in medical crowdfunding,16,2020,https://scholar.google.com/citations?view_op=view_citation&hl=en&user=puNJcv0AAAAJ&pagesize=50&citation_for_view=puNJcv0AAAAJ:4JMBOYKVnBMC,"Social translucence theory argues that online collaboration systems should make contributors' activities visible to better achieve a common goal. Currently in medical crowdfunding sites, various non-monetary contributions integral to the success of a campaign, such as campaign promotions and offline support, are less visible than monetary contributions. Our work investigates ways to enrich social translucence in medical crowdfunding by aggregating and visualizing non-monetary contributions that reside outside of the current crowdfunding space. Three different styles of interactive visualizations were built and evaluated with medical crowdfunding beneficiaries and contributors. Our results reveal the perceived benefits and challenges of making the previously invisible non-monetary contributions visible using various design features in the visualizations. We discuss our findings based on the social translucence …"
17,BEDA: Visual analytics for behavioral and physiological data,16,2013,https://scholar.google.com/citations?view_op=view_citation&hl=en&user=puNJcv0AAAAJ&pagesize=50&citation_for_view=puNJcv0AAAAJ:W7OEmFMy1HYC,"We present BEDA, a tool to help researchers synchronize, visualize, and analyze data sources for single or multiple sessions of behavioral and physiological data. We developed this tool to assist in a study exploring the efficacy of sensory integration (SI) therapy in a school setting. The tool integrates human-coded behavioral data and sensor-generated physiological data from therapy sessions in a 12-week longitudinal study. SI, as a specialty area of occupational therapy, has been widely used to help individuals with developmental disabilities that have difficulties regulating sensory input and modulating arousal levels. There is a lack of research supporting the use of SI; we chose to explore SI further using physiological measures in addition to traditional measures. Conducting studies that rely on many modes of data (video, audio, human-coded behavioral data, physiological measures, etc.) becomes an organizational challenge, especially over a period of several months. Some of these challenges arise in the synchronization, visualization, and analysis of the multiple data sources. BEDA aims to facilitate easier data analysis. Early feedback suggests this tool has potential in clinical and research settings. To date, we have not found evidence that pressure vests increase engagement or decrease undesired behaviors in our school setting. We have also not found correlations between pressure vest use and our physiological measures."
18,V-DAT (virtual reality data analysis tool): Supporting self-awareness for autistic people from multimodal VR sensor data,15,2023,https://scholar.google.com/citations?view_op=view_citation&hl=en&user=puNJcv0AAAAJ&pagesize=50&citation_for_view=puNJcv0AAAAJ:NMxIlDl6LWMC,"Virtual reality (VR) has become a valuable tool for social and educational purposes for autistic people, as it provides flexible environmental support to create a variety of experiences. A growing body of recent research has examined the behaviors of autistic people using sensor-based data to better understand autistic people and investigate the effectiveness of VR. Comprehensive analysis of the various signals that can be easily collected in the VR environment can promote understanding of autistic people. While this quantitative evidence has the potential to help both autistic people and others (e.g., autism experts) to understand behaviors of autistic people, existing studies have focused on single signal analysis and have not determined the acceptability of signal analysis results from the autistic person’s point of view. To facilitate the use of multiple sensor signals in VR for autistic people and experts, we introduce …"
19,SocialMirror: motivating young adults with autism to practice life skills in a social world,15,2012,https://scholar.google.com/citations?view_op=view_citation&hl=en&user=puNJcv0AAAAJ&pagesize=50&citation_for_view=puNJcv0AAAAJ:2osOgNQ5qMEC,"In this video, we present SocialMirror [1], an interactive mirror connected to an online social network that allows young adults with autism to seek advice from a trusted and responsive network of family, friends and professionals. We depict three social scenarios that show the feasibility and applicability of SocialMirror."
20,Designing a Medical Crowdfunding Website from Sense of Community Theory,12,2022,https://scholar.google.com/citations?view_op=view_citation&hl=en&user=puNJcv0AAAAJ&pagesize=50&citation_for_view=puNJcv0AAAAJ:isC4tDSrTZIC,"A sense of community is important in encouraging people to contribute to a variety of causes and the communities that support them. Researchers have identified website design features that can engender a sense of community on sites to promote contributions. However, most findings about design features are based on observational empirical research testing single features at a time or on standard practice and rarely use integrated theories to provide rationale for their design suggestions. This work investigates ways to re-design an entire website---with a simulated medical crowdfunding interface entitled Community Journey---informed by Sense of Community Theory to increase site visitors' sense of community and contributions. A between-subjects experiment revealed that the Community Journey interface increased potential supporters' sense of community and their overall willingness to contribute via …"
21,Building causal agency in autistic students through iterative reflection in collaborative transition planning,10,2023,https://scholar.google.com/citations?view_op=view_citation&hl=en&user=puNJcv0AAAAJ&pagesize=50&citation_for_view=puNJcv0AAAAJ:hMod-77fHWUC,"Transition planning is a collaborative process to promote agency in students with disabilities by encouraging them to participate in setting their own goals with team members and learn ways to assess their progress towards the goals. For autistic young adults who experience a lower employment rate, less stability in employment, and lower community connections than those with other disabilities, successful transition planning is an important opportunity to develop agency towards preparing and attaining success in employment and other areas meaningful to them. However, a failure of consistent information sharing among team members and opportunities for agency in students has prevented successful transition planning for autistic students. Therefore, this work brings causal agency theory and the collaborative reflection framework together to uncover ways transition teams can develop students' agency by …"
