Rank,Title,Citations,Year,URL,Description
1,Physics-informed neural networks with hard constraints for inverse design,1033,2021,https://scholar.google.com/citations?view_op=view_citation&hl=en&user=Lxv3W74AAAAJ&pagesize=50&citation_for_view=Lxv3W74AAAAJ:Tyk-4Ss8FVUC,"Inverse design arises in a variety of areas in engineering such as acoustic, mechanics, thermal/electronic transport, electromagnetism, and optics. Topology optimization is an important form of inverse design, where one optimizes a designed geometry to achieve targeted properties parameterized by the materials at every point in a design region. This optimization is challenging, because it has a very high dimensionality and is usually constrained by partial differential equations (PDEs) and additional inequalities. Here, we propose a new deep learning method---physics-informed neural networks with hard constraints (hPINNs)---for solving topology optimization. hPINN leverages the recent development of PINNs for solving PDEs, and thus does not require a large dataset (generated by numerical PDE solvers) for training. However, all the constraints in PINNs are soft constraints, and hence we impose hard …"
2,Inverse design of large-area metasurfaces,337,2018,https://scholar.google.com/citations?view_op=view_citation&hl=en&user=Lxv3W74AAAAJ&pagesize=50&citation_for_view=Lxv3W74AAAAJ:d1gkVwhDpl0C,"We present a computational framework for efficient optimization-based “inverse design” of large-area “metasurfaces” (subwavelength-patterned surfaces) for applications such as multi-wavelength/multi-angle optimizations, and demultiplexers. To optimize surfaces that can be thousands of wavelengths in diameter, with thousands (or millions) of parameters, the key is a fast approximate solver for the scattered field. We employ a “locally periodic” approximation in which the scattering problem is approximated by a composition of periodic scattering problems from each unit cell of the surface, and validate it against brute-force Maxwell solutions. This is an extension of ideas in previous metasurface designs, but with greatly increased flexibility, e.g. to automatically balance tradeoffs between multiple frequencies or to optimize a photonic device given only partial information about the desired field. Our approach even …"
3,Inverse design enables large-scale high-performance meta-optics reshaping virtual reality,309,2022,https://scholar.google.com/citations?view_op=view_citation&hl=en&user=Lxv3W74AAAAJ&pagesize=50&citation_for_view=Lxv3W74AAAAJ:Y0pCki6q_DkC,"Meta-optics has achieved major breakthroughs in the past decade; however, conventional forward design faces challenges as functionality complexity and device size scale up. Inverse design aims at optimizing meta-optics design but has been currently limited by expensive brute-force numerical solvers to small devices, which are also difficult to realize experimentally. Here, we present a general inverse-design framework for aperiodic large-scale (20k × 20k λ2) complex meta-optics in three dimensions, which alleviates computational cost for both simulation and optimization via a fast approximate solver and an adjoint method, respectively. Our framework naturally accounts for fabrication constraints via a surrogate model. In experiments, we demonstrate aberration-corrected metalenses working in the visible with high numerical aperture, poly-chromatic focusing, and large diameter up to the centimeter scale. Such …"
4,Empowering metasurfaces with inverse design: principles and applications,256,2022,https://scholar.google.com/citations?view_op=view_citation&hl=en&user=Lxv3W74AAAAJ&pagesize=50&citation_for_view=Lxv3W74AAAAJ:5nxA0vEk-isC,"Conventional human-driven methods face limitations in designing complex functional metasurfaces. Inverse design is poised to empower metasurface research by embracing fast-growing artificial intelligence. In recent years, many research efforts have been devoted to enriching inverse design principles and applications. In this perspective, we review most commonly used metasurface inverse design strategies including topology optimization, evolutionary optimization, and machine learning techniques. We elaborate on their concepts and working principles, as well as examples of their implementations. We also discuss two emerging research trends: scaling up inverse design for large-area aperiodic metasurfaces and end-to-end inverse design that co-optimizes photonic hardware and post-image processing. Furthermore, recent demonstrations of inverse-designed metasurfaces showing great potential in real …"
5,Topology optimization of freeform large-area metasurfaces,212,2019,https://scholar.google.com/citations?view_op=view_citation&hl=en&user=Lxv3W74AAAAJ&pagesize=50&citation_for_view=Lxv3W74AAAAJ:u-x6o8ySG0sC,"We demonstrate optimization of optical metasurfaces over 10^5–10^6 degrees of freedom in two and three dimensions, 100–1000+ wavelengths (λ) in diameter, with 100+ parameters per λ^2. In particular, we show how topology optimization, with one degree of freedom per high-resolution “pixel,” can be extended to large areas with the help of a locally periodic approximation that was previously only used for a few parameters per λ^2. In this way, we can computationally discover completely unexpected metasurface designs for challenging multi-frequency, multi-angle problems, including designs for fully coupled multi-layer structures with arbitrary per-layer patterns. Unlike typical metasurface designs based on subwavelength unit cells, our approach can discover both sub- and supra-wavelength patterns and can obtain both the near and far fields."
6,Multifidelity deep neural operators for efficient learning of partial differential equations with application to fast inverse design of nanoscale heat transport,203,2022,https://scholar.google.com/citations?view_op=view_citation&hl=en&user=Lxv3W74AAAAJ&pagesize=50&citation_for_view=Lxv3W74AAAAJ:hqOjcs7Dif8C,"Deep neural operators can learn operators mapping between infinite-dimensional function spaces via deep neural networks and have become an emerging paradigm of scientific machine learning. However, training neural operators usually requires a large amount of high-fidelity data, which is often difficult to obtain in real engineering problems. Here we address this challenge by using multifidelity learning, i.e., learning from multifidelity data sets. We develop a multifidelity neural operator based on a deep operator network (DeepONet). A multifidelity DeepONet includes two standard DeepONets coupled by residual learning and input augmentation. Multifidelity DeepONet significantly reduces the required amount of high-fidelity data and achieves one order of magnitude smaller error when using the same amount of high-fidelity data. We apply a multifidelity DeepONet to learn the phonon Boltzmann transport …"
7,Inverse designed metalenses with extended depth of focus,127,2020,https://scholar.google.com/citations?view_op=view_citation&hl=en&user=Lxv3W74AAAAJ&pagesize=50&citation_for_view=Lxv3W74AAAAJ:2osOgNQ5qMEC,"Extended depth of focus (EDOF) lenses are important for various applications in computational imaging and microscopy. In addition to enabling novel functionalities, EDOF lenses can alleviate the need for stringent alignment requirements for imaging systems. Existing designs, however, are often inefficient or produce an asymmetric point spread function (PSF) that blurs images. Inverse design of nanophotonics, including metasurfaces, has generated strong interest in recent years owing to its potential for generating exotic and innovative optical elements, which are generally difficult to design based on intuition alone. Using adjoint optimization-based inverse electromagnetic design, in this paper, we designed a cylindrical metasurface lens operating at ∼625 nm with a depth of focus exceeding that of an ordinary lens. We validated our design by nanofabrication and optical characterization of silicon nitride …"
8,End-to-end nanophotonic inverse design for imaging and polarimetry,105,2021,https://scholar.google.com/citations?view_op=view_citation&hl=en&user=Lxv3W74AAAAJ&pagesize=50&citation_for_view=Lxv3W74AAAAJ:zYLM7Y9cAGgC,"By codesigning a metaoptical front end in conjunction with an image-processing back end, we demonstrate noise sensitivity and compactness substantially superior to either an optics-only or a computation-only approach, illustrated by two examples: subwavelength imaging and reconstruction of the full polarization coherence matrices of multiple light sources. Our end-to-end inverse designs couple the solution of the full Maxwell equations—exploiting all aspects of wave physics arising in subwavelength scatterers—with inverse-scattering algorithms in a single large-scale optimization involving degrees of freedom. The resulting structures scatter light in a way that is radically different from either a conventional lens or a random microstructure, and suppress the noise sensitivity of the inverse-scattering computation by several orders of magnitude. Incorporating the full wave physics is especially crucial for …"
9,Active learning of deep surrogates for PDEs: application to metasurface design,104,2020,https://scholar.google.com/citations?view_op=view_citation&hl=en&user=Lxv3W74AAAAJ&pagesize=50&citation_for_view=Lxv3W74AAAAJ:UeHWp8X0CEIC,"Surrogate models for partial differential equations are widely used in the design of metamaterials to rapidly evaluate the behavior of composable components. However, the training cost of accurate surrogates by machine learning can rapidly increase with the number of variables. For photonic-device models, we find that this training becomes especially challenging as design regions grow larger than the optical wavelength. We present an active-learning algorithm that reduces the number of simulations required by more than an order of magnitude for an NN surrogate model of optical-surface components compared to uniform random samples. Results show that the surrogate evaluation is over two orders of magnitude faster than a direct solve, and we demonstrate how this can be exploited to accelerate large-scale engineering optimization."
10,Inverse designed extended depth of focus meta-optics for broadband imaging in the visible,75,2022,https://scholar.google.com/citations?view_op=view_citation&hl=en&user=Lxv3W74AAAAJ&pagesize=50&citation_for_view=Lxv3W74AAAAJ:W7OEmFMy1HYC,"We report an inverse-designed, high numerical aperture (∼0.44), extended depth of focus (EDOF) meta-optic, which exhibits a lens-like point spread function (PSF). The EDOF meta-optic maintains a focusing efficiency comparable to that of a hyperboloid metalens throughout its depth of focus. Exploiting the extended depth of focus and computational post processing, we demonstrate broadband imaging across the full visible spectrum using a 1 mm, f/1 meta-optic. Unlike other canonical EDOF meta-optics, characterized by phase masks such as a log-asphere or cubic function, our design exhibits a highly invariant PSF across ∼290 nm optical bandwidth, which leads to significantly improved image quality, as quantified by structural similarity metrics."
11,End-to-end metasurface inverse design for single-shot multi-channel imaging,72,2022,https://scholar.google.com/citations?view_op=view_citation&hl=en&user=Lxv3W74AAAAJ&pagesize=50&citation_for_view=Lxv3W74AAAAJ:_FxGoFyzp5QC,"We introduce end-to-end inverse design for multi-channel imaging, in which a nanophotonic frontend is optimized in conjunction with an image-processing backend to extract depth, spectral and polarization channels from a single monochrome image. Unlike diffractive optics, we show that subwavelength-scale “metasurface” designs can easily distinguish similar wavelength and polarization inputs. The proposed technique integrates a single-layer metasurface frontend with an efficient Tikhonov reconstruction backend, without any additional optics except a grayscale sensor. Our method yields multi-channel imaging by spontaneous demultiplexing: the metaoptics front-end separates different channels into distinct spatial domains whose locations on the sensor are optimally discovered by the inverse-design algorithm. We present large-area metasurface designs, compatible with standard lithography, for multi …"
12,Physics-enhanced deep surrogates for partial differential equations,69,2023,https://scholar.google.com/citations?view_op=view_citation&hl=en&user=Lxv3W74AAAAJ&pagesize=50&citation_for_view=Lxv3W74AAAAJ:Zph67rFs4hoC,"Many physics and engineering applications demand partial differential equations (PDE) property evaluations that are traditionally computed with resource-intensive high-fidelity numerical solvers. Data-driven surrogate models provide an efficient alternative but come with a substantial cost of training. Emerging applications would benefit from surrogates with an improved accuracy–cost tradeoff when studied at scale. Here we present a ‘physics-enhanced deep-surrogate’ (PEDS) approach towards developing fast surrogate models for complex physical systems, which is described by PDEs. Specifically, a combination of a low-fidelity, explainable physics simulator and a neural network generator is proposed, which is trained end-to-end to globally match the output of an expensive high-fidelity numerical solver. Experiments on three exemplar test cases, diffusion, reaction–diffusion and electromagnetic scattering …"
13,Sideways adiabaticity: beyond ray optics for slowly varying metasurfaces,34,2018,https://scholar.google.com/citations?view_op=view_citation&hl=en&user=Lxv3W74AAAAJ&pagesize=50&citation_for_view=Lxv3W74AAAAJ:u5HHmVD_uO8C,"Optical metasurfaces (subwavelength-patterned surfaces typically described by variable effective surface impedances) are typically modeled by an approximation akin to ray optics: the reflection or transmission of an incident wave at each point of the surface is computed as if the surface were “locally uniform,” and then the total field is obtained by summing all of these local scattered fields via a Huygens principle. (Similar approximations are found in scalar diffraction theory and in ray optics for curved surfaces.) In this paper, we develop a precise theory of such approximations for variable-impedance surfaces. Not only do we obtain a type of adiabatic theorem showing that the “zeroth-order” locally uniform approximation converges in the limit as the surface varies more and more slowly, including a way to quantify the rate of convergence, but we also obtain an infinite series of higher-order corrections. These …"
14,Assume your neighbor is your equal: Inverse design in nanophotonics,15,2020,https://scholar.google.com/citations?view_op=view_citation&hl=en&user=Lxv3W74AAAAJ&pagesize=50&citation_for_view=Lxv3W74AAAAJ:IjCSPb-OGe4C,"Metasurfaces are optical devices designed for a range of wavelengths. They are subwavelength patterned surfaces with dimensions much larger than the wavelength. These two characteristic length scales are orders of magnitude apart, which makes simulations and optimization of metasurfaces a costly supercomputer scale problem with state-of-the-art solvers. Previously, the community has circumvented this problem by making a local periodic approximation and has simplified the problem into a phase matching problem for fully-known solutions of the Maxwell equations. In this dissertation, I reframe the metasurface design problem as an optimization problem. Based on the local periodic approximation—which I studied analytically, I derived an approximate hybrid solver for metasurfaces which solves orders of magnitude faster than the state of the art. This approximate solver relies on a surrogate model for the …"
15,Efficient inverse design of large-area metasurfaces for incoherent light,11,2022,https://scholar.google.com/citations?view_op=view_citation&hl=en&user=Lxv3W74AAAAJ&pagesize=50&citation_for_view=Lxv3W74AAAAJ:8k81kl-MbHgC,"Incoherent light is ubiquitous, yet designing optical devices that can handle its random nature is very challenging, since directly averaging over many incoherent incident beams can require a huge number of scattering calculations. We show how to instead solve this problem with a reciprocity technique that leads to 3 orders of magnitude speedup: one Maxwell solve (using any numerical technique) instead of thousands. This improvement enables us to perform efficient inverse design, large-scale optimization of metasurfaces for applications such as light collimators and concentrators. We show the impact of the angular distribution of incident light on the resulting performance and show especially promising designs for the case of “annular” beams distributed only over nonzero angles."
16,Inverse design in nanophotonics via representation learning,10,2026,https://scholar.google.com/citations?view_op=view_citation&hl=en&user=Lxv3W74AAAAJ&pagesize=50&citation_for_view=Lxv3W74AAAAJ:9ZlFYXVOiuMC,"Inverse design in nanophotonics, the computational discovery of structures achieving targeted electromagnetic (EM) responses, has become a key tool for recent optical advances. Traditional intuition‐driven or iterative optimization methods struggle with the inherently high‐dimensional, non‐convex design spaces and the substantial computational demands of EM simulations. Recently, machine learning (ML) has emerged to address these bottlenecks effectively. This review frames ML‐enhanced inverse design methodologies through the lens of representation learning, classifying them into two categories: output‐side and input‐side approaches. Output‐side methods use ML to learn a representation in the solution space to create a differentiable solver that accelerates optimization. Conversely, input‐side techniques employ ML to learn compact, latent‐space representations of feasible device geometries …"
17,HiLAB: A Hybrid Inverse‐Design Framework,9,2025,https://scholar.google.com/citations?view_op=view_citation&hl=en&user=Lxv3W74AAAAJ&pagesize=50&citation_for_view=Lxv3W74AAAAJ:Wp0gIr-vW9MC,"HiLAB (Hybrid inverse‐design with Latent‐space learning, Adjoint‐based partial optimizations, and Bayesian optimization), is a new paradigm for inverse design of nanophotonic structures. Combining early‐terminated topological optimization (TO) with a Vision Transformer–based variational autoencoder (VAE) and a Bayesian search, HiLAB addresses multifunctional device design by generating diverse freeform configurations at reduced simulation costs. Shortened adjoint‐driven TO runs, coupled with randomized physical parameters, produce robust initial structures. These structures are compressed into a compact latent space by the VAE, enabling Bayesian optimization to co‐optimize geometry and physical hyperparameters. Crucially, the trained VAE can be reused for alternative objectives or constraints by adjusting only the acquisition function. Compared to conventional TO pipelines prone to local optima …"
18,Inverse‐Designed Meta‐Optics with Spectral‐Spatial Engineered Response to Mimic Color Perception,9,2022,https://scholar.google.com/citations?view_op=view_citation&hl=en&user=Lxv3W74AAAAJ&pagesize=50&citation_for_view=Lxv3W74AAAAJ:0EnyYjriUFMC,"Meta‐optics have rapidly become a major research field within the optics and photonics community, strongly driven by the seemingly limitless opportunities made possible by controlling optical wavefronts through interaction with arrays of sub‐wavelength scatterers. As more and more modalities are explored, the design strategies to achieve desired functionalities become increasingly demanding, necessitating more advanced design techniques. Herein, the inverse design approach is utilized to create a set of single‐layer meta‐optics that simultaneously focus light and shape the spectra of focused light without using any filters. Thus, both spatial and spectral properties of the meta‐optics are optimized, resulting in spectra that mimic the color matching functions of the CIE 1931 XYZ color space, which links the spectral distribution of a light source to the color perception of a human eye. Experimental demonstrations …"
19,Time-reversal-symmetry bounds on electromagnetic fields,5,2025,https://scholar.google.com/citations?view_op=view_citation&hl=en&user=Lxv3W74AAAAJ&pagesize=50&citation_for_view=Lxv3W74AAAAJ:qxL8FJ1GzNcC,"For linear electromagnetic systems possessing time-reversal symmetry, we present an approach to bound ratios of internal fields excited from different ports, using only the scattering matrix ( matrix), improving upon previous related bounds by Sounas and Alù [D. L. Sounas and A. Alù, Phys. Rev. Lett. 118, 154302 (2017)0031-900710.1103/PhysRevLett.118.154302]. By reciprocity, emitted-wave amplitudes from internal dipole sources are bounded in a similar way. When applied to coupled-resonant systems, our method constrains ratios of resonant coupling and decay coefficients. We also obtain a relation for the relative phase of fields excited from the two ports and the ratio of field intensities in a two-port system. In addition, although lossy systems do not have time-reversal symmetry, we can still approximately bound loss-induced nonunitarity of the matrix using only the lossless matrix. We show numerical …"
20,Physics-enhanced deep surrogate,4,2024,https://scholar.google.com/citations?view_op=view_citation&hl=en&user=Lxv3W74AAAAJ&pagesize=50&citation_for_view=Lxv3W74AAAAJ:4TOpqqG69KYC,"2022-11-08 Assigned to MASSACHUSETTS INSTITUTE OF TECHNOLOGY reassignment MASSACHUSETTS INSTITUTE OF TECHNOLOGY ASSIGNMENT OF ASSIGNORS INTEREST (SEE DOCUMENT FOR DETAILS). Assignors: RACKAUCKAS, Christopher Vincent, JOHNSON, Steven Glenn, PESTOURIE, RAPHAEL"
21,Efficient perturbative framework for coupling of radiative and guided modes in nearly periodic surfaces,4,2022,https://scholar.google.com/citations?view_op=view_citation&hl=en&user=Lxv3W74AAAAJ&pagesize=50&citation_for_view=Lxv3W74AAAAJ:UebtZRa9Y70C,"We present a semianalytical framework for computing the coupling of radiative and guided waves in slowly varying (nearly uniform or nearly periodic) surfaces, which is especially relevant to the exploitation of nonlocal effects in large-area metasurfaces. Our framework bridges a gap in the theory of slowly varying surfaces: aside from brute-force numerical simulations, current approximate methods can model either guided radiative waves but cannot easily model their coupling. We solve this problem by combining two methods: the locally periodic approximation, which approximates radiative scattering by composing a set of periodic scattering problems, and spatial coupled-wave theory, which allows the perturbative modeling of guided waves using an eigenmode expansion. We derive our framework for both nearly uniform and nearly periodic surfaces, and we validate each case against brute-force finite …"
22,Fast Approximate Solvers: Metamaterials design in electromagnetism,2,2025,https://scholar.google.com/citations?view_op=view_citation&hl=en&user=Lxv3W74AAAAJ&pagesize=50&citation_for_view=Lxv3W74AAAAJ:4DMP91E08xMC,"In electromagnetism, the model of Maxwell’s equations yields accurate and trustworthy predictions. Numerical solvers can reach electromagnetic solutions far beyond the set of analytical closed-form solutions; this is crucial in metamaterials design where the goal is to find the geometry that generates an optimal electromagnetic solution for a desired property. Then why do we still need to create computational methodologies in metamaterials research? And why should we care about analytical models? The simulation and optimization bottlenecks limit the range of applications of the state of the art, hence the room for opportunities to create new computational methodologies. Semi-analytical methods that are customized for classes of applications enable simulation and optimization. We detail the state of the research in customized methodologies using the illustrative example of optical metasurfaces and suggest best …"
23,Inverse design for robust inference in integrated computational spectrometry,2,2025,https://scholar.google.com/citations?view_op=view_citation&hl=en&user=Lxv3W74AAAAJ&pagesize=50&citation_for_view=Lxv3W74AAAAJ:mVmsd5A6BfQC,"We propose an inverse-design approach for computational spectrometers in which the scattering media are topology-optimized to achieve better performance in inference of unknown spectra. Unlike traditional end-to-end approaches, our inverse design of the scattering media does not need a training set of spectra, a distribution of detector noise, or an inference algorithm. Our approach allows the selection of the inference algorithm to be decoupled from that of the scatterer. For smooth spectra, we additionally devise a regularized reconstruction algorithm based on Chebyshev interpolation, which yields higher accuracy compared with conventional methods in which the spectra are sampled at equally spaced frequencies or wavelengths with equal weights. Our approaches are numerically demonstrated via inverse design of integrated computational spectrometers and reconstruction of example spectra. The inverse-designed spectrometers exhibit significantly better performance in the presence of noise than their counterparts with random scatterers. Our method provides a useful complement to end-to-end co-design methods."
