Rank,Title,Citations,Year,URL,Description
24,A new homogenization-free boundary condition towards aperiodic metasurface design using full-wave surrogate models of printed circuits,2,2024,https://scholar.google.com/citations?view_op=view_citation&hl=en&user=Lxv3W74AAAAJ&pagesize=50&citation_for_view=Lxv3W74AAAAJ:YOwf2qJgpHMC,"A new homogenization-free boundary condition is introduced for the design of metasurfaces. The boundary condition, linking the tangential electric field to the induced surface current density within a unit cell, is described as a matrix equation containing a surrogate model of a printed circuit. Full-wave simulations are performed to construct the data needed to capture the physics of a printed circuit’s response to exciting fields in terms of its induced current density. The matrix equation takes the form of a boundary condition which can be included in design and optimization algorithms incorporating mutual coupling in the form of an impedance matrix. Modelling the metasurface in this manner allows for direct design of the realizable model avoiding any homogenization or locally periodic approximations leading to a paradigm shift in metasurface design approaches. The surrogate model’s construction is described and …"
25,Integrated photonic spectrometers: a critical review,1,2025,https://scholar.google.com/citations?view_op=view_citation&hl=en&user=Lxv3W74AAAAJ&pagesize=50&citation_for_view=Lxv3W74AAAAJ:ZeXyd9-uunAC,"Integrated photonics, where optical components are fabricated on a chip-scale platform leveraging standard microfabrication technologies, has transformed telecommunications and data communications, quantum optics, and molecular sensing. Optical spectrometry is yet another field that integrated photonics is poised to revolutionize. Unlike traditional bulky, costly benchtop spectrometers, integrated photonics promises miniaturized, rugged, and low-cost spectrometer-on-a-chip modules with broad application prospects ranging from communications to medical imaging. In this review, we survey the various designs of integrated photonic spectrometers through the lens of their underlying operating principles, aiming to reveal quantitative performance scaling laws that transcend specific implementations. This approach enables a general, physically grounded comparison of spectrometer capabilities without being …"
26,Multiplicative resonant enhancement of chemical detection,1,2024,https://scholar.google.com/citations?view_op=view_citation&hl=en&user=Lxv3W74AAAAJ&pagesize=50&citation_for_view=Lxv3W74AAAAJ:M3ejUd6NZC8C,"Optical resonances can increase the sensitivity of measurements to material perturbations and also accelerate photochemical reactions. Here, we show that these two effects can be combined multiplicatively, to enhance the detection via weak or low-concentration photochemical reactions far beyond what could previously be attained. For an optical resonance with quality factor , the sensitivity of our detection scheme is enhanced by (where denotes approximate proportionality), as demonstrated by both theoretical arguments and numerical simulations of a simple optical-grating resonance coupled with reaction-diffusion equations. Such an approach opens a door to further improvements by careful design of the resonance: even a three-parameter optimization of the grating resonance yields an additional times improvement."
27,Towards optimal spatiotemporal wavefront shaping for the cocktail party problem with inverse design of an acoustic reconfigurable metasurface in disordered media,1,2024,https://scholar.google.com/citations?view_op=view_citation&hl=en&user=Lxv3W74AAAAJ&pagesize=50&citation_for_view=Lxv3W74AAAAJ:_kc_bZDykSQC,"Multiple-user multiple-input multiple-output applications have recently gained a lot of attention. Here, we show an efficient optimization formulation for the design of all the temporal and spatial degrees of freedom of an acoustic reconfigurable metasurface for the cocktail party problem. In the frequency domain, the closed-form least square solution matches the optimal time reversal solution for multiple emitter-receiver pairs, optimizing for each frequency independently. This is more efficient than solving in the time domain where the time convolution mixes all the degrees of freedom into a resource-intensive optimization. We illustrate this methodology by optimizing the frequency response of a design for two pairs of emitters-receivers using the Green’s functions of disordered media that are measured experimentally. We report strong performance that will be put in perspective in future work, where we will analyze the …"
28,Extreme Optics: Inverse Design and Experimental Realizations of Ultra-Large-Area Complex Meta-Optics,1,2021,https://scholar.google.com/citations?view_op=view_citation&hl=en&user=Lxv3W74AAAAJ&pagesize=50&citation_for_view=Lxv3W74AAAAJ:ufrVoPGSRksC,"We present a design framework for metasurface that uses a hybrid approximate solver for Maxwell’s equations, which separates the computation for the metasurface’s nanoscale and macro-scale, and thus makes large-diameter inverse design tractable on a laptop. We further demonstrate experimental realizations of ultra-large-area metasurfaces designed using this framework: (1) a lens with extended depth of field with a millimeter diameter, and (2) polychromatic lenses with diameters of up to 1 cm."
29,Physics Enhanced Deep Surrogates for the Phonon Boltzmann Transport Equation,0,2025,https://scholar.google.com/citations?view_op=view_citation&hl=en&user=Lxv3W74AAAAJ&pagesize=50&citation_for_view=Lxv3W74AAAAJ:qUcmZB5y_30C,"Designing materials with controlled heat flow at the nano-scale is central to advances in microelectronics, thermoelectrics, and energy-conversion technologies. At these scales, phonon transport follows the Boltzmann Transport Equation (BTE), which captures non-diffusive (ballistic) effects but is too costly to solve repeatedly in inverse-design loops. Existing surrogate approaches trade speed for accuracy: fast macroscopic solvers can overestimate conductivities by hundreds of percent, while recent data-driven operator learners often require thousands of high-fidelity simulations. This creates a need for a fast, data-efficient surrogate that remains reliable across ballistic and diffusive regimes. We introduce a Physics-Enhanced Deep Surrogate (PEDS) that combines a differentiable Fourier solver with a neural generator and couples it with uncertainty-driven active learning. The Fourier solver acts as a physical inductive bias, while the network learns geometry-dependent corrections and a mixing coefficient that interpolates between macroscopic and nano-scale behavior. PEDS reduces training-data requirements by up to 70% compared with purely data-driven baselines, achieves roughly 5% fractional error with only 300 high-fidelity BTE simulations, and enables efficient design of porous geometries spanning 12-85 W m K with average design errors of 4%. The learned mixing parameter recovers the ballistic-diffusive transition and improves out of distribution robustness. These results show that embedding simple, differentiable low-fidelity physics can dramatically increase surrogate data-efficiency and interpretability, making repeated PDE …"
30,End-to-end optimization for hybrid photonic-electronic edge computing: metasurfaces and the locally periodic approximation,0,2025,https://scholar.google.com/citations?view_op=view_citation&hl=en&user=Lxv3W74AAAAJ&pagesize=50&citation_for_view=Lxv3W74AAAAJ:L8Ckcad2t8MC,"End-to-end optimization is a powerful framework for jointly designing metasurface photonic hardware and computational algorithms, particularly in hybrid photonic-electronic edge computing. However, many existing approaches rely on the Locally Periodic Approximation (LPA), which simplifies large-area metasurface design by assuming periodic boundary conditions. While LPA facilitates efficient design workflows, it introduces inaccuracies, particularly in non-periodic and strongly interacting structures. In this talk, we present some LPA’s failure modes in hybrid computing architectures, demonstrating cases where its assumptions break down and impact performance. By highlighting these limitations, we provide a clearer perspective on the trade-offs in solver selection and scalability, emphasizing the need to assess LPA for robust, high-performance photonic computing in real-world edge applications."
31,A Hybrid AI-Driven Framework for Designing Multifunctional Metaphotonic Devices,0,2025,https://scholar.google.com/citations?view_op=view_citation&hl=en&user=Lxv3W74AAAAJ&pagesize=50&citation_for_view=Lxv3W74AAAAJ:QIV2ME_5wuYC,"We introduce a novel hybrid computational framework for the inverse design of large-scale metaphotonic devices by integrating the unique features of topological optimization and advanced machine-learning algorithms. In contrast to conventional optimization methods that often constrain certain design parameters (e.g., thickness, periodicity, or material properties), this hybrid approach enables the complete design of the optimal nanostructures by simultaneously optimizing both structural properties (i.e., geometrical features) and physical parameters. This comprehensive inverse-design strategy enables a more thorough exploration of the entire design space, leading to superior device performance."
32,Polychromatic metalens in the NIR for CO2 detection,0,2025,https://scholar.google.com/citations?view_op=view_citation&hl=en&user=Lxv3W74AAAAJ&pagesize=50&citation_for_view=Lxv3W74AAAAJ:aqlVkmm33-oC,"To combat climate change, the world needs to reduce greenhouse gas emissions to net zero by 2050. To this end, we need accurate monitoring of greenhouse gases such as CO2. Currently, CO2 is monitored by satellites. While this provides a good global view of CO2 in the atmosphere, it is hard to get data in real-time and of a specific location. Therefore, a small optical system to monitor CO2 that can be put on a drone is desirable. In this work, we provide a first step to this optical system, creating a polychromatic metalens that focuses the light of wavelengths 0.76um, 1.61um, and 2.06um. The smallest wavelength of 0.76um is where O2 absorbs, and the wavelengths 1.61um and 2.06um are where CO2 absorbs."
33,Active learning of data models for scaled optimization,0,2023,https://scholar.google.com/citations?view_op=view_citation&hl=en&user=Lxv3W74AAAAJ&pagesize=50&citation_for_view=Lxv3W74AAAAJ:kNdYIx-mwKoC,a data model generally refers to an abstract model that organizes elements of data and can standardize how it relates to one another and to the properties of real-world entities.
34,End-to-end Nanophotonics Inverse Design for Computational Imaging,0,2022,https://scholar.google.com/citations?view_op=view_citation&hl=en&user=Lxv3W74AAAAJ&pagesize=50&citation_for_view=Lxv3W74AAAAJ:3fE2CSJIrl8C,"We introduce end-to-end inverse design in which a nanophotonics frontend is optimized in conjunction with a computational-imaging backend to minimize reconstruction errors. We present several nanophotonics designs for depth, spectral and polarization imaging."
35,Tristimulus Colorimetric Metasurface: Mimicking the Human Eye,0,2022,https://scholar.google.com/citations?view_op=view_citation&hl=en&user=Lxv3W74AAAAJ&pagesize=50&citation_for_view=Lxv3W74AAAAJ:MXK_kJrjxJIC,"Using local and nonlocal optimization, we design and fabricate a metasurface to mimic the color response and focusing functions of the human eye. Qualitative match between the theory and experiment have been measured."
36,Dispersion-engineered metasurfaces for ultrafast pulse compression and large-scale RGB-achromatic focusing,0,2022,https://scholar.google.com/citations?view_op=view_citation&hl=en&user=Lxv3W74AAAAJ&pagesize=50&citation_for_view=Lxv3W74AAAAJ:ULOm3_A8WrAC,"It has become possible to manipulate light spectrally and spatially on demand at wavelength scale in recent years. Manipulations of ultrashort laser pulses in the time domain and large-scale penetration of achromatic metasurface-based lens are current challenges. In this talk, I will report our recent developments and applications of dispersion-engineered metasurfaces in compression of ultrashort laser pulses, millimeter-scale diameter RGB-achromatic metalens, and its potential for future virtual-reality platforms."
37,Opening the black box for data efficiency and inverse design in photonics,0,2021,https://scholar.google.com/citations?view_op=view_citation&hl=en&user=Lxv3W74AAAAJ&pagesize=50&citation_for_view=Lxv3W74AAAAJ:YsMSGLbcyi4C,"Supervised neural networks are rising as an algorithm of choice for surrogate models in photonics, because they are versatile, fast to evaluate, easily differentiable, and perform well in high-dimensional problems. However, the drawback of this black box approach is that it requires a lot of data. Unfortunately in the context of photonics, data is generated through expensive full solves of Maxwell’s equations. This talk will present ways to open the black box for better data efficiency and performance of deep surrogate models. The first part of this talk will present how active learning can reduce the need for data by at least an order of magnitude by adapting the data generation to the model learning. The second part will present how information about the physics can be incorporated into the neural network for more efficiency."
38,Complex Design of Metasurfaces,0,2021,https://scholar.google.com/citations?view_op=view_citation&hl=en&user=Lxv3W74AAAAJ&pagesize=50&citation_for_view=Lxv3W74AAAAJ:eQOLeE2rZwMC,"We present an inverse design framework for metasurfaces, that finds optimal design parameters by balancing constraints from arbitrary scalar-and-differentiable functions of the vector field, which are evaluated at any set of points in the far-field."
39,Supplement: Inverse designed metalenses with extended depth of focus,0,,https://scholar.google.com/citations?view_op=view_citation&hl=en&user=Lxv3W74AAAAJ&pagesize=50&citation_for_view=Lxv3W74AAAAJ:KlAtU1dfN6UC,"Other potential EDOF alternatives (eg, axicons1, log-aspheres2, or cubic functions3) also exist for 1D lenses; however, different regions of these lenses focus at different depths, significantly limiting the focusing efficiency. We designed and simulated these EDOF cylindrical lenses via the forward design method4. The forward design method of these metalenses involves selecting the appropriate spatial phase profile (eg, axicons, log-aspheres, or cubic functions) for the specific optical component, arranging the scatterers on a subwavelength lattice, and spatially varying their dimensions. To make a fair comparison with one of our inverse-designed lenses, other 1D EDOF lenses are designed to have central focal spot at 100 μm and a depth of focus of 30 μm. The field intensity profiles of these EDOF lenses are simulated using 2D finite-difference time-domain (FDTD) simulation with an axial sampling resolution of 50 nm (Figure S1). The focusing efficiencies of 1D log-asphere, axicon, and cubic lens were 12.16%, 8.6% and 14.47%, respectively. Even though, these 1D EDOF lenses can also provide an EDOF, their efficiency is significantly lower than that of our design, which is 20.12%. In this paper, the focusing efficiency is defined as the power within a circle with a radius of three times the FWHM at the focal plane to the total power incident upon the metalens Since FWHM, however, is not well defined for cubic lenses, we also calculated the focusing efficiency for this EDOF lens by taking the ratio of the intensity integrated within the aperture area of the device at the focal plane to that at the plane of metalens instead of a circle with a radius of three …"
40,ACTIVE LEARNING OF DEEP SURROGATES FOR PDES,0,,https://scholar.google.com/citations?view_op=view_citation&hl=en&user=Lxv3W74AAAAJ&pagesize=50&citation_for_view=Lxv3W74AAAAJ:WF5omc3nYNoC,"Surrogate models for partial-differential equations are widely used in the design of metamaterials to rapidly evaluate the behavior of composable components. However, the training cost of accurate surrogates by machine learning can rapidly increase with the number of variables. We present an active learning algorithm and apply it to train deep surrogates of Helmholtz’s equation and linear elasticity in solid mechanics. For the two problems of interest, our algorithm reduces the number of simulations required compared to uniform random samples by more than an order of magnitude for a neural-network surrogate model and by four, respectively. Results show that the surrogate evaluation is faster than a direct solve by over two orders of magnitude and over five orders of magnitude, respectively."
